,tweet_id,text
0,862375572755939329,Tried to squeeze a bit more Pratt into that Starlord sketch. #guardiansofthegalaxy #chrispratt
1,862374733299548177,SuperWeenieHtJr its only a matter of time! #GuardiansoftheGalaxy Mission - Take out!
2,862374669156057098,davegandy What is #GuardiansOfTheGalaxy?
3,862373761391230985,Enter to win a #GuardiansOfTheGalaxy Vol.2 Prize Pack worth over $250!
4,862373584215441409,"Say no more, fam... #GuardiansOfTheGalaxy #thesovereign #donaldtrump #Trump #marvel #potus #Orange #gold #weird #J"
5,862372567897821189,We're All Ravagers Tonight! Here's our Guardians ... #Chris_Pratt #GuardiansOfTheGalaxy #Marvel_Studios  ...
6,862372526277767169,"Just got done seeing Guardians Vol. 2, loved it as much as the first! #guardiansofthegalaxyvol2"
7,862370513515151369,'I-am-Spidergroot' idea my daughter suggested to me #jamesgunn #guardiansofthegalaxy #vindiesel
8,862370479977496588,We're counting down to Middle School Movie Night on Friday! Here we come #GuardiansoftheGalaxy Volume 2. Don't...
9,862370019878948865,Having a look at telltalegames #GuardiansOfTheGalaxy demo. So far...pretty damn good. Visuals are lush! #PS4share
10,862369156431306753,Follow gb_reviews &amp; enter for your chance to WIN the #GuardiansoftheGalaxy Giveaway! #GotGVol2 Click here to enter:
11,862369102765191169,"Coloring in progress, #guardiansofthegalaxy #starlord #marvel #fanart #inkart #color"
12,862368169683337217,Don't be jealous.  #kurtrussell #guardiansofthegalaxy #jackburton #snakeplissken #captainron #wyattearp
13,862368062250643456,I am....Karen Summerton #iamgroot #losangeles #guardiansofthegalaxy
14,862366719129649154,"\""On the inside\"": my new design insipred by Drax of #GuardiansoftheGalaxy"
15,862366694790103044,Have you seen #GotG2 yet? Here is what we thought!
16,862366079343099912,The final #easteregg in #GuardiansOfTheGalaxy 1 has been found and what a doozy
17,862365457231347715,"Peter Quill: Sometimes, the thing you've been looking for your whole life is right there beside you all along."
18,862365342366138368,Have 'Hooked On a Feeling' by Blue Suede in my head right now....always reminds me of
19,862365219330437122,Retweeted Neil deGrasse Tyson (neiltyson):Must allow audible space explosions in #GuardiansOfTheGalaxy because...
20,862363799772418053,i m groot #GuardiansOfTheGalaxy watchable
21,862363135629561857,"Peter Quill: Hell yeah, he's cool.Yondu: I'm Mary Poppins, ya'll!"
22,862362974425681920,Are U
23,862362313604464640,"We review #guardiansofthegalaxy Check it out in itunes, stitcher or via youtube under \""Comics"
24,862362049095114752,Enter to win a #GuardiansOfTheGalaxy Vol.2 Prize Pack worth over $250!
25,862361892651749377,Drawing #Mantis from the mobile game #AvengersAcademy last night.
26,862361761667842051,Peter Quill: You look like Mary Poppins.Yondu: Is he cool?
27,862361613009117186,"Rodriguez: #GuardiansoftheGalaxy: Second verse, nearly as fun as the first"
28,862361534428839937,"If you could have #Deadpool partner with a #GuardiansOfTheGalaxy character(s) in a road/space trip, buddy movie, who'd you choose?"
29,862360506484633601,"In the comics, Iron_Man ran with the #GuardiansOfTheGalaxy for a while AND had a fling with"
30,862359294808903681,NEW POST: Have Fun and Save the Galaxy: 7 Lessons for Teachers From #GuardiansoftheGalaxy at
31,862358556858875906,Enter to win a #GuardiansOfTheGalaxy Vol.2 Prize Pack worth over $250!
32,862358363245379585,Car-Lord
33,862358313362530305,The #GuardiansoftheGalaxy kick all kinds of butt in the latest #BigDamnCast -
34,862357873363484678,It's almost that time!
35,862357574368215040,Giveaway Guardians  the Galaxy Minifigures! #GotGVol2Event Guardians #GuardiansoftheGalaxy #GotGVol2  via gaynycdad
36,862357208167833600,he is groot!!!!!! **WIP**
37,862357046338912256,"HowardKurtz As Rocket, aka Bradley Cooper, in #GuardiansOfTheGalaxy would say, \""ah boo hoo\"""
38,862356944090128385,"We're now taking pre-orders for the latest #GuardiansOfTheGalaxy movie, signed by the artists at Marvel!"
39,862356464249298945,MR_TRANSP0RTER OriginalFunko Well I got it for my son but im.just as interested in it now lol. I'm gonna work on
40,862356256593297408,"Funny, for some reason I picture Rocket the raccoon saying this...and I like it!"
41,862356193758633986,Enter to win a #GuardiansOfTheGalaxy Vol.2 Prize Pack worth over $250!
42,862355732615835648,Label/Sticker used on box of an orig. #GuardiansoftheGalaxy banner  #gotg #Marvel #starlord
43,862355386308984834,"#illustration Another #guardiansofthegalaxy Vol.1 piece, this time Rocket Raccoon  (trash panda) More coming soon"
44,862355310035562500,"If you've seen #guardiansofthegalaxy, this will make perfect sense to you! Enjoy your night guys"
45,862354855138140163,Sad Groot. :(
46,862354608198471680,Baby Groot has a new role model.#Art #Marvel #GuardiansOfTheGalaxyVol2 #GuardiansOfTheGalaxy #XMen #Wolverine
47,862354595233894400,We return to the #RoundTable and talk
48,862354418586587136,#GuardiansoftheGalaxy mixtape is simply out of this world
49,862354096702881792,#guardiansofthegalaxy the #telltalegames is just what I need to get me all pumped for #GuardiansoftheGalaxyVol2 ton
50,862353450440544258,Rocket Raccoon:
51,862352789355192320,#GuardiansoftheGalaxy quote used to remind people to buckle up.
52,862352462954377216,Hasbro: Guardians of the Galaxy Vol. 2 Legends Star-Lord (Long Coat)  #GuardiansoftheGalaxy
53,862351404517793792,Great guardiansofthegalaxy comic strip by flexcomics  #guardiansofthegalaxy #flexcomics
54,862350908432277507,Enter to win a #GuardiansOfTheGalaxy Vol.2 Prize Pack worth over $250!
55,862350429757120512,ophelialonline my friend and I cosplayed you and BenicioSource
56,862349183533056003,My dream in life is to go from the cuddly Andy Dwyer to the ripped Starlord.....
57,862348913688408065,Before leaving today I put #guardiansofthegalaxy on for my mom. Will she know how to turn off the TV when it finishes? Life's mysteries.
58,862348143429656577,joshgeorge777 It was #GuardiansoftheGalaxy that did it.
59,862347797042941954,Planted daisies in a Groot cup. Because I Am Groot.
60,862347293449519104,GotG Vol.2 review up on the Geeks Unmasked YouTube channel!
61,862347156992274432,Seeing #GuardiansOfTheGalaxy Vol 2 with Iam1979Kat!
62,862346923411427329,Star-Lord's father#davidhaselhoff #guardiansofthegalaxy #kitttalkingcar  The Record Centre
63,862345613907644416,Watch Chris Pratt and Dave Bautista's Audition for the Guardians Lead Role
64,862345477915779073,Why do the Sovereigns VR battle ships look like Mr. Garrison's bike?
65,862345137644589057,Motor City Comic Con Adds To Impressive Guest List
66,862345123845160961,Enter to win a #GuardiansOfTheGalaxy Vol.2 Prize Pack worth over $250!
67,862342850817732608,I just created my #GuardiansOfTheGalaxy character! Build your own Guardian here:
68,862342148158611456,#GuardiansOfTheGalaxy is now a part of the #Telltale universe. Here's our opinion:
69,862341727293722625,Now how much is this worth after
70,862341336657252353,Rocket Raccoon needs your help in Disneyland's #GuardiansOfTheGalaxy - Mission: Breakout ride trailer -
71,862340280862863360,Tag some you know who needs this super cool summer dressGet ...
72,862340120892067841,Chris Pratt Hires His Own Armpit Dryer: A REAL PERSON!
73,862339874631802880,Entertaining and funny
74,862339730385633280,"Coulda been editing Ep46 last night, but instead... #datenight. #guardiansofthegalaxy, my best"
75,862338659906977792,Original art (including my run on #GuardiansOfTheGalaxy) available at
76,862338413734875136,Our #comics critic reviews #Marvel's All-New #GuardiansOfTheGalaxy #1! Read the review:
77,862337290194038785,Galaxy guarded  #gamora #guardiansofthegalaxy #laylaspatchesBased on art by JScottCampbell
78,862337224423034880,#FilmFallout Podcast #62  We Are The #GuardiansoftheGalaxy Vol. 2
79,862337059800985606,Galaxy guarded  #gamora #guardiansofthegalaxy #laylaspatchesBased on art by jscottcampbellart
80,862336488826183681,Boy howdy! Telltale's #GuardiansOfTheGalaxy sure was a Telltale game! For better or for worse.
81,862334718339162118,"Look, this has #GuardiansOfTheGalaxy spoilers, so don't read unless you want more of my anti-#starwars hot takes."
82,862334454769094656,"\""I am Groot!\"" LOOK AT THIS BEAUTY! #guardiansofthegalaxy #marvel #diamondselect at the"
83,862334271557685248,I swear when I stretch all my bones crack so loud I sound like nebula from #GuardiansoftheGalaxy after an intense fight.
84,862333101468516353,"MAGNIFICENT.  REGRAM: alexa_nypostour may issue stars #guardiansofthegalaxy's karengillan,"
85,862332734345052160,Just how I like it... #movies #guardiansofthegalaxy #jerseycity #marvel  Edgewater Multiplex
86,862332178499346433,"If you haven't yet seen this, GO NOW! What a fun movie!"
87,862332059016200192,Enter to win a #GuardiansOfTheGalaxy Vol.2 Prize Pack worth over $250!
88,862332010576175105,CBR Hey if I meet #rocketraccoon maybe I might try to pet him or maybe show him my drawing of the #GuardiansOfTheGalaxy?
89,862331982411378690,The latest The Game News &amp; Reviews Daily!  Thanks to shacknews
90,862331912228089856,Enter to win a #GuardiansOfTheGalaxy Vol.2 Prize Pack worth over $250!
91,862331910412017665,#GuardiansoftheGalaxy Vol 2 still stellar as #ADogsPurpose sniffs out
92,862331433590894594,#Original #GuardiansOfTheGalaxy #screen test of #ChrisPratt &amp;
93,862330728280883200,Watch Chris prattprattpratt and DaveBautista in their #GuardiansOfTheGalaxy screen test
94,862330511443755008,#forsale #guardiansofthegalaxy #starlord #mask Raw #3dprinted with magnetic #detachable face. Pm
95,862330432578256897,Enter to win a #GuardiansOfTheGalaxy Vol.2 Prize Pack worth over $250!
96,862328994842247168,#MCU top 5:1. #GotGVol22. #CivilWar3. #WinterSoldier4. #DoctorStrange5. #GuardiansoftheGalaxy(Will change a
97,862327289220038656,Morning A-holes.
98,862326825145450496,"\""How are you?\""\r\""I am Goot. It's like Groot, but less tree.\""\r\r"
99,862326050788978688,Enter to win a #GuardiansOfTheGalaxy Vol.2 Prize Pack worth over $250!
100,862324364628426752,"#GuardiansOfTheGalaxy t-shirts are 2 for 20 right now! Can we get a \""Yeah baby!\"""
101,862324097321238529,Ep 142! We return to the #RoundTable and talk
102,862323305298227200,All-New Star-Lord #starlord #GuardiansoftheGalaxyVol2 #GuardiansOfTheGalaxy #peterquill #allnewguardiansofthegalaxy
103,862320751814352896,"\""IS HE COOL?!\"" #GuardiansoftheGalaxyVol2 #GuardiansOfTheGalaxy #Marvel #fanart #disney #MaryPoppins #iamgroot"
104,862320741970202625,Leave the bike alone...
105,862320435811299328,Jamming to Guardians of the Galaxy Soundtracks while I work on shirt layouts.
106,862319107169021953,Crochet Little Baby Groot
107,862318897164242944,Can we have this in #Singapore please!!!  doritos
108,862318818869342208,"\""Ancient Guardians\"" by Chucklenorris is $8 for a limited time  #guardiansofthegalaxy"
109,862316778088693760,Guardians of the Galaxy Vol 2 Review  via YouTube My #guardiansofthegalaxy vol 2 review
110,862315146168987654,Bar none the best joke about Scotch tape I've ever heard.
111,862314240908120065,Enter to win a #GuardiansOfTheGalaxy Vol.2 Prize Pack worth over $250!
112,862313825588170752,"\""I am Groot!\"""
113,862313778469367808,Follow gb_reviews &amp; enter for your chance to WIN the #GuardiansoftheGalaxy Giveaway! #GotGVol2 Click here to enter:
114,862313518632230912,Enter to win a #GuardiansOfTheGalaxy Vol.2 Prize Pack worth over $250!
115,862311708597133312,"In case you missed it, here's a link for the first #GuardiansOfTheGalaxy Trailer on youtube!"
116,862310663342833665,"#GUARDIANSOFTHEGALAXYVol2 Deleted Scenes, Missing Characters &amp; Vol 3"
117,862310545566965761,Our #TapeDeckShuffle series returns with a #GuardiansoftheGalaxy #AwesomeMix special
118,862310149301600257,Here's my spoiler free review of MarvelStudios &amp; JamesGunn 's #GuardiansOfTheGalaxy Vol.2 for cultjer
119,862310116573544448,Guardians of the Galaxy 2 was amaaaaaaazing!!!
120,862310008599572481,Enter to win a #GuardiansOfTheGalaxy Vol.2 Prize Pack worth over $250!
121,862309971786117122,Our #TapeDeckShuffle series returns with a #GuardiansoftheGalaxy #AwesomeMix special
122,862308765009412103,Guardians of the #Feels #guardiansofthegalaxy #wearegroot JamesGunn thank you sir
123,862308762362707968,"\""Guardian\"" by Luke Stiner is $7 for a limited time  #guardiansofthegalaxy"
124,862308571425275906,Check out #GuardiansoftheGalaxy Lot 3 #ComicBooks 4 #TradingCards #Ego #Gamora #Starlord   via eBay
125,862307858788077569,It's Today's Funny Funny Blah Blah!
126,862303924790874117,"Make sure to watch #GuardiansOfTheGalaxy, where i star az"
127,862302571804983296,Guardians of the Galaxy Vol 2 full movie  2017 download hd#GuardiansoftheGalaxyVol2 full mo
128,862302564251029504,#bestdayever met #babygroot and #starlord #guardiansofthegalaxy #meetandgreet #disney #awesome
129,862301160308449281,Baby Groot#lego #guardiansofthegalaxy #legominifigures #guardiansofthegalaxyvol2 #marvel
130,862299282975707136,Over 200 #Podcast listens so far - chuffed! Its #GhostInTheShell vs
131,862299198246572033,I saw this movie last night. #guardiansofthegalaxy #marvel
132,862299126515585026,The latest The  Ski Aspen Daily!
133,862299110216351744,Listen to 068 - Spoilers of the Galaxy #Marvel #GuardiansOfTheGalaxy #podcast by #GiftedPunksters on
134,862299024946339840,Listen to 068 - Spoilers of the Galaxy #Marvel #GuardiansOfTheGalaxy #podcast by #GiftedPunksters on
135,862298929299423232,Over 200 #Podcast listens so far - chuffed! Its #GhostInTheShell vs #GuardiansOfTheGalaxy from me -
136,862298865113944064,Every name Rocket gets called in #GuardiansoftheGalaxy...
137,862298424753967105,New Rocket Raccoon sketch card painting!#rocketraccoon #guardiansofthegalaxy #sketchcard #biancathompson...
138,862298123691053056,Parliament - Flash Light
139,862297943843405825,He WAS Groot
140,862297695716864000,Chaaaaain keep us together! Vol 2 video review tomorrow #guardiansofthegalaxy
141,862296609689919488,"It was a good day...#movie #guardiansofthegalaxy #fun #theflash  City Center, Silliguri"
142,862294979665952770,Looking Glass - Brandy
143,862294881808592896,NEW !!! All-New Guardians of the Galaxy n1 (03.05.2017) #allnewguardiansofthegalaxy  #guardiansofthegalaxy #marve
144,862293923540209664,What cute #guardiansofthegalaxy cakes they areby  JK Denim
145,862292500400271360,"Ep.42! Guests John Kindelan &amp; Chris Conti of \""Under the Hood\"" art group. #GuardiansOfTheGalaxy review. Contact us at"
146,862291720976953344,Is Guardians of the Galaxy Vol.2 the best movie the MCU has given us? We think so
147,862290613894393856,Watch Chris Pratt and Dave Bautistas audition for Guardians of the Galaxy #ChrisPratt #GuardiansOfTheGalaxy
148,862288383485390848,Enter to win a #GuardiansOfTheGalaxy Vol.2 Prize Pack worth over $250!
149,862288072838230018,Mike Rooker is Mary Poppins and the best Guardian
150,862287865635627008,Marvels Guardians of the Galaxy: Get To Know the Original Cosmic Team
151,862287372897202179,Hooked on a feeling.... #StarLord #GuardiansOfTheGalaxy #Drax #Gamora #Rocket #Groot
152,862287308887924736,Enter to win a #GuardiansOfTheGalaxy Vol.2 Prize Pack worth over $250!
153,862286438330748929,"Ah, I see the new FBI is to be run by the"
154,862286346689413121,"New episode of The Curly Nerd #podcast , discussing #GuardiansOfTheGalaxy and #HandmaidsTale ! Check it out -"
155,862285528242069505,The Guardians of the Opera  #guardiansofthegalaxy
156,862284659941662721,Enter to win a #GuardiansOfTheGalaxy Vol.2 Prize Pack worth over $250!
157,862283917663100933,The Coolest Space Nanny and Pirate #gotgvol2 #yondu #marypoppins #guardiansofthegalaxy #gotg2 #mashup #tshirt #sti
158,862283583398043648,JamesGunn can I PLEASE have a gif of the Baby Groot throw-up scene? I literally can't think about it without laugh
159,862281963201327104,FunkoEurope Star Lord came today so now he's joining the other Guardians. Thanks for the prize! He's awesome!
160,862281574355742720,#GuardiansoftheGalaxy was overrated and prattprattpratt is just a normal guy in a Hollywood world.
161,862278541894975488,Enter to win #GuardiansOfTheGalaxyVol.2 Prize Pack worth over $250!#TheHoppingBloggers#Giveaway#GotGVol2
162,862277867346030594,Nerdflash Reviews: Guardians of the Galaxy Vol.2  #marvel #guardiansofthegalaxy guardiansofthegalaxyvol2
163,862277819719614465,Also
164,862277598822445056,"#GuardiansoftheGalaxy Vol 2 is a fun romp through the universe built on a story of real substance,  jamesgunn"
165,862277503708086272,Watch #ChrisPratt and #DaveBautistas audition for #guardiansofthegalaxy
166,862277262942535680,#Hilarious #Marvel joke. Only those who have seen #GuardiansOfTheGalaxy Vol. 2 will understand this joke from
167,862276182427017217,Follow gb_reviews &amp; enter for your chance to WIN the #GuardiansoftheGalaxy Giveaway! #GotGVol2 Click here to enter:
168,862275808152375297,Saw #guardiansofthegalaxy vol 2 this weekend and loved it...mostly
169,862273850041663488,Our brand new ep features: #GuardiansOfTheGalaxy #sense8season2 South Asians on #TV &amp; #Film and more!
170,862273626397167617,Just read the All-New #GuardiansOfTheGalaxy by GerryDuggan &amp; AaronKuder ! A definite add to the pull list if you
171,862273570491072512,Guardians Of The Galaxy Vol. 2 - Final Battle Part 4 #GuardiansOfTheGalaxy qua YouTube
172,862273337728409600,What the hell did marvel do to #rocketraccoon ?
173,862272406529998848,prattprattpratt dude. I laughed so hard on a day I really needed that. Thanks for #GuardiansOfTheGalaxy and the fu
174,862271661831311360,"New #shirt, A-hole approved!#GuardiansOfTheGalaxy #GuardiansOfTheGalaxyVol2 #StarLord #PeterQuill #Marvel"
175,862271175812161537,The Daily Universe is out!
176,862269536963317760,Some thoughts about Guardians of the Galaxy Vol. 2
177,862260948014432256,"In #GuardiansOfTheGalaxy Vol. 2, who were those new Ravagers? An explainer:"
178,862259298121863168,Swiped because hilarity.
179,862257236319588352,Out Now 282: Guardians of the Galaxy Vol. 2  via audioBoom
180,862255902035980288,The latest UNIR1 Movie!  Thanks to HeyUGuys
181,862255680778104833,Still like the first soundtrack over this one
182,862255646669848577,#100daysofhappiness The existence of #neildegrassetyson and #guardiansofthegalaxy#science
183,862254699583557633,Zoe #Saldana: #Sexism 'Much More Aggressive' Than ... #BigHollywood #DonaldTrump #GuardiansOfTheGalaxy #news
184,862253759631699968,Guards of the #Samsung factories are called #GuardiansOfTheGalaxy  SamsungLV
185,862251382887378944,There is no-one else in this showing of #GuardiansOfTheGalaxy. PERFECTION.
186,862250638557802496,"Guardians of the Galaxy, Post Credit scenes explained."
187,862248496329609216,Child to me: 'You've always got your headphones on when you're walking. Like the Star-lord.' #aces
188,862246430941032448,Guardians of the Galaxy Celebrities &amp; Me! w/Linky! Guardians #GuardiansoftheGalaxy #GotGVol2  via gaynycdad
189,862246039331459073,"Wham Bam Shang-a-Lang! Coming this June, #guardiansofthegalaxy volume 2 Marvel Legends Wave 2! Order yours now at..."
190,862241589636325376,#GuardiansOfTheGalaxy What's the song that's played during the final battle please anyone?
191,862239280273469440,#movienight with the coworkers #guardiansofthegalaxy #guardiansofthegalaxyvol2 #marvel #mcu #smg
192,862238683436658688,The latest The  Ski Aspen Daily!  Thanks to TheAspenTimes
193,862235527642099712,Groot?
194,862231897598029824,If you know what I mean.... #iykwim #IYKWIM#Yondu#GuardiansOfTheGalaxy #guardiansofthegalaxyvol2
195,862229155554918400,"\""I am Groot!\""-Baby Groot.and have a groot day!.....#guardiansofthegalaxy"
196,862225012169854977,My birthday was great  #GuardiansOfTheGalaxy sequel was pretty damn good  #Cinergy has strong ass daiquiris lol
197,862224762910765056,Enter to win a #GuardiansOfTheGalaxy Vol.2 Prize Pack worth over $250!
198,862224602398949376,My mom texted me to ask me to move back to Canada.... because she had no one to go watch the new #guardiansofthegalaxy movie with
199,862224395317542913,"Yep....#guardiansofthegalaxy movie night #FUNTIMES \""Mikey is back for a short time\"""
200,862223340483883008,"I'm distracting you, you big turd blossom."
201,862223009079152640,LOL Chris Pratt is definitely more buff in the second #GuardiansoftheGalaxy.
202,862222926883442688,GOTG Vol.2#guardiansofthegalaxy #guardiansofthegalaxyvol2 #starlord #peterquill #rocket
203,862222483889500160,The latest Max Cisotti Photography!
204,862219857533730817,Chris Pratt is so cool
205,862219035295064064,#GuardiansOfTheGalaxy OriginalFunko now in stock trademygame they're great collectables #barnsleyisbrill
206,862218164473667588,Guardians Of Galaxy Mother Entropy #3 (of 5) #Comics #NCBD #GuardiansoftheGalaxy (
207,862217492814598146,"\""Never doubt a raccoon.\"" #rocketraccoon #freehand #guardiansofthegalaxy #drawing #penonpaper"
208,862217333921783808,Just chillin with the crew. #richinhealth #healthiswealth #guardiansofthegalaxy
209,862215653125697536,ingoroemling: we went to the cinema last weekend - loved #guardiansofthegalaxy vol.2!  and got...
210,862215513040080896,Rewatching #guardiansofthegalaxy vol 1 to cry over Yondu. XD
211,862214727778357249,New toy arrived !
212,862212957173927936,Come and get your love
213,862209284305821696,Follow gb_reviews &amp; enter for your chance to WIN the #GuardiansoftheGalaxy Giveaway #GotGVol2 Click here to enter:
214,862208856969142273,My Guardians of the Galaxy Guardians MarvelFR Marvel TheRealStanLee prattprattpratt zoesaldana vindiesel
215,862207218380406784,Could you imagine going through this... everyday of filming?
216,862204172795609089,I am Groot
217,862203575006486529,Playing the VOL 2 mix while doing homework
218,862201189047259136,prattprattpratt you are sexy so i drew you can filmed it xx
219,862200206632333312,Enter to win a #GuardiansOfTheGalaxy Vol.2 Prize Pack worth over $250!
220,862199509119619072,Movie time
221,862198214434402305,"Well done, Marvel #guardiansofthegalaxy #vol2 #movie"
222,862198108477837312,Baby. Groot.
223,862197443328229376,Looking forward to this opening
224,862195566108954624,The latest UNIR1 Movie!
225,862195493291442176,Baby GROOT!mmartinsart.....#art #marvel #groot #babygroot #GuardiansOfTheGalaxy
226,862193915402739712,GUARDIANS OF THE GALAXY VOL. 2: Baby Groot Gets a New Concept Art  via matiuadex
227,862191137045356544,Video will be posted tomorrow! #GuardiansoftheGalaxy MISSION:BREAKOUT! looked amazing without the walls around i
228,862191049799852036,Why on earth did it take me so long to watch #GuardiansoftheGalaxy! I am really enjoying it. karengillan looks fantastic.  her!
229,862187242596556800,"No matter how much #GuardiansoftheGalaxy spends on CGI, Chris Pratt is the movie's biggest asset. prattprattpratt"
230,862187032470183936,"I drew prattprattpratt Love his face and his movies and his jokes, what a guy #chrispratt #guardiansofthegalaxy"
231,862185790289321984,#GuardiansoftheGalaxyVol2 movie was OK...but #guardiansofthegalaxy Spotify #playlist for the win!
232,862184987491258368,FOX5ATLANTA reports RT PageSix: Dave Bautista spent over an hour every day becoming Drax for #GuardiansOfTheGalaxy
233,862184791134711808,Saw #GuardiansoftheGalaxy we  WERE looking forward to chicken tenders at #lazydog but they took them off menu. Not cool LazyDogHQ
234,862183125182554112,"No new track tonight. Went to go see #GuardiansofTheGalaxy, shit was dope..."
235,862182182298697728,"No matter how much #GuardiansoftheGalaxy spends on CGI, Chris Pratt is the movie's biggest asset. prattprattpratt"
236,862181815393685504,Follow gb_reviews &amp; enter for your chance to WIN the #GuardiansoftheGalaxy Giveaway! #GotGVol2 Click here to enter:
237,862181019918716928,I just created my #GuardiansOfTheGalaxy character! Build your own Guardian here:
238,862180947080482816,I just created my #GuardiansOfTheGalaxy character! Build your own Guardian here:
239,862180912544481280,I just created my #GuardiansOfTheGalaxy character! Build your own Guardian here:
240,862180541734322177,BiIIMurray needs to be in the next #guardiansofthegalaxy movie. This is not open for debate.
241,862179695168806912,"Excerpt from Yondu's Creed :P\""He who makes the arrow fly with his head has forgotten the face of his daddy, boy.\""#GuardiansoftheGalaxy 2"
242,862179648893054976,"PomKlementieff Mrs. Klementieff, what do you think about this draw of the #GuardiansOfTheGalaxy (Vol. 1 version)?"
243,862176288374759424,I  #GuardiansOfTheGalaxy #GuardiansoftheGalaxyVol2 not so much.
244,862172745055870976,6. And...that's really all I've got. Just something I noticed when the first #GuardiansoftheGalaxy came out &amp; something I've noticed now.
245,862172629326848000,Starlord
246,862172625048551424,Can we agree that the best thing to come out of the #guardiansofthegalaxy movies is James Gunn's music taste?
247,862172046939369473,It was GROOT! #guardiansofthegalaxy #iamgroot  Regency Granada Hills 9
248,862170387181740032,Baby groot why is that your so adorable?
249,862169290266599424,Just went and saw this movie  guardians of the galaxy guardiansofthegalaxyvol2 #guardiansofthegalaxy2
250,862168710165000192,Groot!! #guardiansofthegalaxy #tezaftab #tezaftabproduction #TAP #mixedmedia #instaphoto
251,862168681585012736,Meh#guardiansofthegalaxy #babygroot  SilverCity
252,862166941523476481,Enter to win a #GuardiansOfTheGalaxy Vol.2 Prize Pack worth over $250!
253,862166635712585728,The latest The Melionsden Daily!  Thanks to thebookslut Xandralexa WMutunga
254,862165630522445824,This is on my husband's Father's Day wish list!
