,tweet_id,text
0,862298718812479488,Stream Blazing Saddles (1974) on GeekerMovies\nWatch Now:
1,862219893285859328,Mongo only pawn...in game of life.
2,862211647993151488,Watch Blazing Saddles (1974) on Flixano\nStart Free Trial:
3,862120366386237440,I hear #HillaryClinton was the inspiration for the fart scene in #BlazingSaddles .
4,862120015285432320,Theory: Sheriff Bart was actually an incarnation of Aunt Nancy in the Old West.
5,862104787776557056,"Hello? With all of this talk about #SheriffDavidClarke, where's the #BlazingSaddles GIF? Let's go Twitter"
6,862066279175380992,RT TheLastOvation: #MadelineKahn receives her #LastOvation! #Broadway #Opera #BlazingSaddles #ReTweet #PodernFamily #Podmosphere\n
7,862065023715229697,RT haydenorpheum: Some Mel Brooks shenanigans to cap off your weekend! This Sunday night... #BlazingSaddles #RobinHoodMenInTights #MelBroo\u2026
8,862064947026644993,Some Mel Brooks shenanigans to cap off your weekend! This Sunday night... #BlazingSaddles #RobinHoodMenInTights\u2026
9,862055614075224065,RT TheLastOvation: #MadelineKahn receives her #LastOvation! #Broadway #Opera #BlazingSaddles #ReTweet #PodernFamily #Podmosphere\n
10,862051496321585153,Not laughed at a movie so much in a long time. #amillionwaystodieinthewest. A modern day #blazingsaddles. Massive cast.
11,862046732552728577,Let's Ride!
12,862040340420632576,"Days like 2day am reminded of the inspirational words of Olson Johnson when he said \""Nevermind that shit. Here comes Mongo!\"""
13,861926622940868608,"RT BurgerTapShake: Saddle up with the #botm! #BlazingSaddles - White &amp; Black #Bean Burger w/ #Guacamole, Pepper Jack Cheese &amp; Chipotle Bla\u2026"
14,861926376865222656,"RT BurgerTapShake: Saddle up with the #botm! #BlazingSaddles - White &amp; Black #Bean Burger w/ #Guacamole, Pepper Jack Cheese &amp; Chipotle Bla\u2026"
15,861923794591600641,"Saddle up with the #botm! #BlazingSaddles - White &amp; Black #Bean Burger w/ #Guacamole, Pepper Jack Cheese &amp; Chipotle\u2026"
16,861872587483172868,Mongo only pawn...in game of life.
17,861729466279768065,"Helloooo Fiber Optics! \ud83e\udd13\ud83d\udcaa\ud83c\udffb\u26a1\ufe0f #gameon #blazingsaddles  St. Johns County, Florida"
18,861727226181672965,RT BatTales: A girl at work named her cute baby girl Hadley and all I can think of is Hedley Lamarr--&gt;
19,861717724489289729,RT TheLastOvation: #MadelineKahn receives her #LastOvation! #Broadway #Opera #BlazingSaddles #ReTweet #PodernFamily #Podmosphere\n
20,861710572274036737,"#BlazingSaddles is on netflix. I encourage all of you #snowflakes to watch it, so I can see the next big #boycott of a company unfold."
21,861709008230592514,"RT BurgerTapShake: Have you blazed yet? #BlazingSaddles #BOTM - White &amp; Black #Bean Burger w/ #Guacamole, Pepper Jack Cheese &amp; Chipotle Bl\u2026"
22,861701044459405313,"Have you blazed yet? #BlazingSaddles #BOTM - White &amp; Black #Bean Burger w/ #Guacamole, Pepper Jack Cheese &amp; Chipotl\u2026"
23,861698466547945472,Gorgeous day at Santa Monica State Beach. #blazingsaddles perryscafeandbeachrentals
24,861694204518555649,"charles_consult You know, morons.\n\n"
25,861683501455863808,Watching what is probably my favourite comedy...
26,861651804702085120,Happy 91 Mr DonRickles I'm dedicating this eve 2 you by watching #BlazingSaddles &amp; #Spaceballs I think you were gr\u2026
27,861611360219803652,"If #Hollywood remakes #BlazingSaddles, I'm declaring war on"
28,861596528028332032,LadyBellatrix It's called doing the French Mistake lol
29,861578538104877061,cassandra17lina the #BlazingSaddles paddle is a nice touch.
30,861525292455559168,Mongo only pawn...in game of life.
31,861438471524589569,"Some classic lines.. \""where da white women at?\"" \""Badges? We don't need no stinking badges\"""
32,861356636392177664,"This may be the allergy meds talking, but I've always wondered what a theatre production of #BlazingSaddles would b\u2026"
33,861321388862439426,Blazing Saddles (1974) Download Full Movie HD\nDownload Link:
34,861211359375130624,"Yankee bean soup, cole slaw, and tuna surprise.\n\n"
35,861210789167996928,Why Lili Schtupp singing in the corner with some Nazi's???\n\n
36,861209996381630465,I love this movie lmao
37,861208955799957504,"Oh lord! Do we have the strength to carry this off one night, or are we just jerking off?\n\n"
38,861208202825879552,"\""And for my next impression, Jesse Owens\"" \n"
39,861207664327524356,"\""Hey, where all the white women at?\""\n\n"
40,861207284646637569,"\""Just gimme 24 hours, thats all I ask.\""\n\""NO!!\""\n\""You'd do it for Randolph Scott.\""\n*everyone removes hat, stands and sings*\n\n"
41,861196518325444608,"\""Well raise my rent, you are the kid!\""\n\n#blazingsaddles #wacokid #huh?"
42,861196034575409153,"\""Well Jim, what do you like to do?\""\n\""Um...play chess. And have sex.\""\n\""Well let's play chess.\""\n\n"
43,861195244502732801,"\""WE, THE WHITE GOD FEARING CITIZENS  of Rock Ridge.....\""\n\n"
44,861194697481605120,This man IS HOLDING HISSELF HOSTAGE!! \n\nI FUCKING CAN'T\n\n#blazingsaddles lmao
45,861194326424125440,"\""The sheriff is a NI...!!\""\n\n\""Excuse me while I whip this out. *women scream*\""\n\n"
46,861193672825733121,"The new sheriff rolled up IN A SUEDE SUIT, WITH A GUCCI BAG!! Lmfao\n\n"
47,861193259833491457,WHY DOES THE GOVERNOR HAVE GOV EMBLAZONED ACROSS THE BACK IF HIS SUIT!! \n\n
48,861192477037953024,"RT shamroxmysox: Hedley Lamar. Lmao \""what are you worried about, its 1874. You'll be able to sue her!\""\n\n#BlazingSaddles #hedylamaar ,#wtf\u2026"
49,861192405911044097,"Hedley Lamar. Lmao \""what are you worried about, its 1874. You'll be able to sue her!\""\n\n#BlazingSaddles #hedylamaar ,"
50,861185400358002689,RT TheLastOvation: #MadelineKahn receives her #LastOvation! #Broadway #Opera #BlazingSaddles #ReTweet #PodernFamily #Podmosphere\n
51,861184485555146752,RT TheLastOvation: #MadelineKahn receives her #LastOvation! #Broadway #Opera #BlazingSaddles #ReTweet #PodernFamily #Podmosphere\n
52,861178019750137856,Mongo only pawn...in game of life.
53,861078470595620864,Watching #BlazingSaddles man I love this
54,861064477516627972,"Any time someone says \""They could never remake #BlazingSaddles\"", it's like \""Bruh:"
55,861052107734081536,wildweezle RawStory My homage to Harvey Korman in
56,861046566618112000,"Not saying it's the best way to spend a much needed Sat night off, but watching #BlazingSaddles ranks pretty high up there"
57,861039988351262720,Watching #BlazingSaddles and feeling nostalgic. It's so damn fun.
58,861034326548504576,On this blustery cold May night enjoying the mad brilliance of MelBrooks masterpiece #BlazingSaddles.\u2026
59,860997454384308224,#mongo is just #pawn in game of #life lostabbey #craftbeer #daydrinking #blazingsaddles  Fig\u2026
60,860925616547409920,RT TheLastOvation: #MadelineKahn receives her #LastOvation! #Broadway #Opera #BlazingSaddles #ReTweet #PodernFamily #Podmosphere\n
61,860915461294178304,RT TheLastOvation: #MadelineKahn receives her #LastOvation! #Broadway #Opera #BlazingSaddles #ReTweet #PodernFamily #Podmosphere\n
62,860911136086077441,RT TheLastOvation: #MadelineKahn receives her #LastOvation! #Broadway #Opera #BlazingSaddles #ReTweet #PodernFamily #Podmosphere\n
63,860911131078119425,RT TheLastOvation: #MadelineKahn receives her #LastOvation! #Broadway #Opera #BlazingSaddles #ReTweet #PodernFamily #Podmosphere\n
64,860903909342236674,RT TheLastOvation: #MadelineKahn receives her #LastOvation! #Broadway #Opera #BlazingSaddles #ReTweet #PodernFamily #Podmosphere\n
65,860894230897623041,RT TheLastOvation: #MadelineKahn receives her #LastOvation! #Broadway #Opera #BlazingSaddles #ReTweet #PodernFamily #Podmosphere\n
66,860887268692643841,#MadelineKahn receives her #LastOvation! #Broadway #Opera #BlazingSaddles #ReTweet #PodernFamily #Podmosphere\n
67,860872468977917952,"Nietzche says, \""From chaos comes order!\"" \""Oh blow it out your ass, Howard!\"" #Ivanka?"
68,860830739314515968,Mongo only pawn...in game of life.
69,860807085130473472,Blazing Saddles (1974) Full Movie Streaming\nWatch Now:
70,860787593495035905,"POTUS THEDONALD realDonaldTrump pot could this have something to do with { \""railroading\"" || tar &amp; feathers || \""\u2026"
71,860773418521812993,#randomfilmfact Mel Brooks wanted Richard Pryor to play Sheriff Bart but Warner execs thought he was too much of a\u2026
72,860700753203269632,Always label your #podcast tracks. And check for lumps twice a week.
73,860669739684823040,The magnificence that is Madeline Kahn.
74,860669532163239938,#IfYouVoteForTrumpcare:\nMelBrooks will make #BlazingSaddles part 2.
75,860663304359997440,"Heh, forgot about Count Basie"
76,860600223231614977,"jakequery Schultz975 chrispychicken3 a daughter named Hadley u call haddy? She'll grow up saying \""no, it's HADLEY!\"""
77,860496998998220800,Source:  &gt;&gt;
78,860494566071447555,"RT BurgerTapShake: May #BOTM: #BlazingSaddles - White &amp; Black #Bean Burger w/ #Guacamole, Pepper Jack Cheese &amp; Chipotle Black Bean Corn Sa\u2026"
79,860483412880048128,Mongo only pawn...in game of life.
80,860481077831512064,"RT BurgerTapShake: May #BOTM: #BlazingSaddles - White &amp; Black #Bean Burger w/ #Guacamole, Pepper Jack Cheese &amp; Chipotle Black Bean Corn Sa\u2026"
81,860480689304723456,"RT BurgerTapShake: May #BOTM: #BlazingSaddles - White &amp; Black #Bean Burger w/ #Guacamole, Pepper Jack Cheese &amp; Chipotle Black Bean Corn Sa\u2026"
82,860472960234160129,"May #BOTM: #BlazingSaddles - White &amp; Black #Bean Burger w/ #Guacamole, Pepper Jack Cheese &amp; Chipotle Black Bean Cor\u2026"
83,860252638344040448,Dock that dog a days pay for nappin' on the job.
84,860166035395280896,"RT BurgerTapShake: NEW #BOTM: #BlazingSaddles - White &amp; Black #Bean Burger w/ #Guacamole, Pepper Jack Cheese &amp; Chipotle Black Bean Corn Sa\u2026"
85,860165837688377344,"RT BurgerTapShake: NEW #BOTM: #BlazingSaddles - White &amp; Black #Bean Burger w/ #Guacamole, Pepper Jack Cheese &amp; Chipotle Black Bean Corn Sa\u2026"
86,860163497086386176,"NEW #BOTM: #BlazingSaddles - White &amp; Black #Bean Burger w/ #Guacamole, Pepper Jack Cheese &amp; Chipotle Black Bean Cor\u2026"
87,860136140111659012,Mongo only pawn...in game of life.
88,860003948597567488,No one told me it takes 30 minutes before Gene Wilder appears in #BlazingSaddles. Still great tho.
89,859993822138429441,Blazing Saddles (1974) Download Full Movie HD\nDownload Link:
90,859959097927585795,"Maybe so but Mel Brooks was one helluva guvnah in #BlazingSaddles. \""Work, work, work, work, hello boys.\"" jsegaul"
91,859855461809623041,Why does every chicagobulls presser seem broadcast from the Guv's manse in #BlazingSaddles?\n\ndan_bernstein\u2026
92,859788788788215808,Mongo only pawn...in game of life.
93,859780433009139712,Evolving #evolve #profile pic #FaceSwap #redhead #JennaElfman #yesteryear #swap #MadelineKahn #dancehallgirl\u2026
94,859714634814820352,RT tweetermf: Sometimes I get the campfire scene in #StarTrek V confused with the campfire scene in #BlazingSaddles and keep waiting for S\u2026
95,859615165779759104,Mongo only pawn...in game of life.
96,859614516769902592,Watch Blazing Saddles (1974) on Flixano\nStart Free Trial:
97,859597024882302976,"OK! Re-cast #BlazingSaddles - DaveChappelle as Sheriff Bart, Jeff_Daniels as The Waco Kid, and ActuallyNPH as Hedley Lamarr!"
98,859587553476739072,Cycling &amp; sunburn - a regular North American combo #MrsVeeTee #blazingsaddles #goldengatebridge\u2026
99,859586326307291138,"RT DailyFlickNY: #BlazingSaddles *3.75 Mel Brooks' Send-Up Of Classic HollywoodWesterns, Pols Try Land Grab\n#SaddleUpSaturdaysEternal\n"
100,859558818707066880,That's HEADleeeeeeey!
101,859521725561786370,I don't even know the context but wtf?
102,859475592999313409,"So wait, does Kendrick Lamarr have anything to do with Hedley Lamarr?"
103,859470091817283584,Stream Blazing Saddles (1974) on GeekerMovies\nWatch Now:
104,859456616567115779,Work Work Work T-shirt inspired by Mel Brooks' character in Blazing Saddles  via Etsy
105,859441507501092864,Mongo only pawn...in game of life.
106,859435053755101185,"RT DailyFlickNY: #BlazingSaddles *3.75 Mel Brooks' Send-Up Of Classic HollywoodWesterns, Pols Try Land Grab\n#SaddleUpSaturdaysEternal\n"
107,859429841569026052,"RT BurgerTapShake: NEW #BOTM: #BlazingSaddles - White &amp; Black #Bean Burger w/ #Guacamole, Pepper Jack Cheese &amp; Chipotle Black Bean Corn Sa\u2026"
108,859429673331294208,"RT BurgerTapShake: NEW #BOTM: #BlazingSaddles - White &amp; Black #Bean Burger w/ #Guacamole, Pepper Jack Cheese &amp; Chipotle Black Bean Corn Sa\u2026"
109,859416070825824256,"RT DailyFlickNY: #BlazingSaddles *3.75 Mel Brooks' Send-Up Of Classic HollywoodWesterns, Pols Try Land Grab\n#SaddleUpSaturdaysEternal\n"
110,859399771525722113,"NEW #BOTM: #BlazingSaddles - White &amp; Black #Bean Burger w/ #Guacamole, Pepper Jack Cheese &amp; Chipotle Black Bean Cor\u2026"
111,859367654938656769,"RT DailyFlickNY: #BlazingSaddles *3.75 Mel Brooks' Send-Up Of Classic HollywoodWesterns, Pols Try Land Grab\n#SaddleUpSaturdaysEternal\n"
112,859360179359559680,"#BlazingSaddles *3.75 Mel Brooks' Send-Up Of Classic HollywoodWesterns, Pols Try Land Grab\u2026"
113,859304060301713408,"scottEweinberg \""I didn't get a harrumph out of that guy!\"""
114,859279381428043776,RT mollyringle: Reelect Governor William J. Lepetamane. Lol!\n#blazingsaddles\n#melbrooks\n
115,859240519011926016,Reelect Governor William J. Lepetamane. Lol!\n#blazingsaddles\n#melbrooks\n
116,859236226955710466,realDonaldTrump This is #purefrontierjibberish from #blazingsaddles. We need to build us a new Rock Ridge.
117,859230474568433665,bobkevoian One of the best movies #ever. #BlazingSaddles is a classic. #ExcuseMeWhileIWhipThisOut \ud83d\ude02\ud83d\ude02
118,859214670325927936,"Thanks, Mrs_KatyFord! Keep an eye out for my next article about the link between #BlazingSaddles &amp; sponsor activation #sportsbiz (sorta...)"
119,859184406241492992,#BlazingSaddles and the #Sheriff which is a #nigger. Lower
120,859165402655490048,Also don't get all the hype about Lilly Von Schtuk.  Just not impressive.  Pretty terrible.
121,859164011665010688,Man that candy gram for Mongo was genius by the sheriff.
122,859159114147962880,xeni At least Mongo came to his senses in the movie!
123,859158728418971648,The #BlazingSaddles for today. What's not to love?
124,859094225035579392,Mongo only pawn...in game of life.
125,859093607353135104,"\""We'll give some land to the niggers and the chinks, but we don't want the Irish!\"""
126,859076936479330304,Current state of mind and body....
