,tweet_id,text
244,860283741205221376,#DidYouKnow During the chariot scene in 'Ben Hur' a small red car can be seen in the distance.
245,860261161291350017,"Jesus' message on love your enemies being the central theme.Which was also the theme of the movie, Ben Hur."
246,860260271063011328,For King and Country - Ceasefire.Heard this song in Ben Hur.
247,860260246874456064,"Single Family,$649000 3 beds 2.0 Baths,77055  Greenwood King Properties - Kirby Office"
248,860251110463987712,"On Monday we're with HullIndieCinema at MidHallHull with BEN HUR - a massive, unforgettable epic!"
249,860242353205936128,Day 2. Personagem favoritoCasuality - Tony Open grave - NathanBen hur - Judah TVD/TO - Klaus Mikaelson
250,860242157034237953,Roubaram a blusa do Ben Hurjkkkkkkkkkkkk
251,860238588914548736,Goobergunch instructions unclear; now imagining the ben hur chariot race but with wizards instead of horses
252,860238149389365248,New at the Lew: Book Club Cancelled May 4 - What's New at the Lew: Our Hoosier Authors Book Club meeting for Th...
253,860232202881204225,1950s MGM Movie Prop - Roman Soldier's Cornu Horn War Trumpet Ben Hur Quo Vadis
254,860227720898281472,Just finished watching the bastardization that was last year's remake of my all time favorite movie; Ben Hur. It...
255,860226306641973249,Book Club is CANCELLED for tonight (May 4) due to weather.
256,860204604352495616,This was exactly what I was thinking when saw #Bahubali 1st time.. gng soon to watch 2nd time... India's answer to
257,860188619327328258,anantha They were showing IMAX shows of Jurassic world and Interstellar because nobody was interested in IMAX of Ben Hur
258,860184429674733568,RGVzoomin No need of bb also you can get from Ben hur and Tenn commendements also.
259,860178580030017536,Join us at 7pm tonight to discuss Jessamyn West's novel THE FRIENDLY PERSUASION.  for more info.
260,860174491355369472,Check out RARE ORIGINAL BITCH MAGNET LP BEN HUR PRIVATE USA PSYCH POWER POP GRUNGE PUNK   via eBay
261,860172815751757824,Ben-Hur; a tale of the Christ - Lewis Wallace | History...
262,860167408975093765,Ben-Hur; a tale of the Christ - Lewis Wallace | History...
263,860165978373730305,"BEN HUR - 11\""x17\"" Original Promo Movie Poster 2016 Jack Huston"
264,860162313759883264,"Notification: 5th Annual Day of Tango Festival, Ben Hur Shrine Hall 781...  Thu May 4 12pm - Fri May 5, 2017 1am"
265,860134701817880576,"\""Wage Slaves who refuse to take-up( like:Ben Hur) Chariot racing.Will be refused:Tory/Madbullingdonsts sh*t&amp; vomited on \""Benefits\""."
266,860131991752028160,"To fight the good fight, to finish the race, to keep the faith  NW: Ben Hur."
267,860130170149249025,Regarder Ben-Hur (2016) Gratuit en Ligne Link:
268,860127268936593409,They should have pretended it was Christmas and stuck Gone with the Wind and Ben Hur on...
269,860124915684343808,Ben-Hur; a tale of the Christ - Lewis Wallace | History...
270,860118435958837251,ReadersGazette: Latest Book News... Hollywood's Last Icon: The inner demons of Ben Hur star Charlton Heston  #books
271,860117236308160512,Ben Hur has no hidden fees. Get your upfront moving quote here:
272,860116807860051968,Latest Book News... Hollywood's Last Icon: The inner demons of Ben Hur star Charlton Heston
273,860103569529286656,"Join us Friday night, May 5 for Pizza and the movie Ben Hur at 7pm. Short discussion to follow and 5-week bible study on begins Monday May 8"
274,860101042804973568,"najamsethi Sir, I want to say Thank You for betterment of Cricket in Pakistan... Ben Hur = Najam Sethi... :) Proud of You"
275,860099090394173441,"thepunter80 It is always wise to remember when having a bet, that the last good horseman of Mediterranean heritage, was Ben Hur."
276,860094327598526464,Ben-Hur; a tale of the Christ - Lewis Wallace | #History...
277,860076334361358336,TheCinegogue #7favfilmsofthe50sBen HurStreetcar Named DesireHigh NoonSeven SamuraiRear WindowThe LadykillersSome like it Hot
278,860064535805390849,"Ben-Hur Official Trailer #1 (2016)  Morgan Freeman, Jack Huston film HD by"
279,860029173653491712,- #Serien.sale | Der #FAN #ShopBen Hur - Steelbook [Blu-ray] [Limited Edition] -  -
280,860016855255318529,Watch Ben-Hur (2016) Online on #FlixanoStart Free Trial:
281,860013649804636160,The Movie Preview Review Eps 222 - Ben - Hur
282,860013649057939456,The Movie Preview Review Eps 222 - Ben - Hur
283,860013319419301888,I added a video to a YouTube playlist  Ben Hur (2016)-Full Movie Hindi Dubbed
284,860012736381693952,Ben Hur (2016)-Full Movie Hindi Dubbed:  via YouTube
285,859963112744603648,"Old, but awesome, NSW policemen recreate Ben Hur on bikes"
286,859945993168723969,AllbrightNFL A New Hope and Rogue One are the same film to me now. Like Ben Hur without the long break lol
287,859939051905961986,"I'm listening to \""If We're Honest\"" by francescamusic on PandoraMusic."
288,859935608843640832,Hollywood Studios Sued for Allegedly Failing to Pay Ben Hur Musicians StarlightPR1
289,859923340227747840,ReadersGazette: Latest Book News... Hollywood's Last Icon: The inner demons of Ben Hur star Charlton Heston  #books
290,859920513216413697,Latest Book News... Hollywood's Last Icon: The inner demons of Ben Hur star Charlton Heston
