,tweet_id,text
0,862345629384749056,"RT KDG_HD: Jumaji, The Untouchables, Ghostbusters, Memento, Ben Hur, Scarface, all getting remade, really?! Just...fuck off. #ChildhoodRui\u2026"
1,862345302514204672,Lew Wallace and Boston Corbett--two very different life paths
2,862336920373919744,"Notification: 5th Annual Day of Tango Festival, Ben Hur Shrine Hall 781...  Wed May 10 12pm - Thu May 11, 2017 1a\u2026"
3,862325431625588736,Ben Hur Plug Up: Goldman Sachs says U.S. border tax would 'blow out' Brent/WTI crude spread
4,862325324771606528,"Ben Hur Plug Up: Travel Advisory \u2013 Jakarta,Indonesia \u2013Avoid travel to Jakarta if want to avoid jail for casual talk"
5,862325229388836866,Ben Hur Plug Up: Teen Girl Raped By Mother\u2019s Boyfriend Who Happens To Be A Father Of Nine!!
6,862325175160668160,RT BenHurplugup123: Ben Hur Plug Up: The writing on the wall - Sabah and Sarawak voters start rebelling against BN-UMNO
7,862325139618136065,Ben Hur Plug Up: The Demise of religious base parties in Malysia
8,862325033430949888,Ben Hur Plug Up: The writing on the wall - Sabah and Sarawak voters start rebelling against BN-UMNO
9,862324937675087872,Ben Hur Plug Up: Selangor Exco - Amanah State assemblymen to replace PAS in Selangor state government line up soon
10,862324824667955200,Ben Hur Plug Up: Sounds very familiar \u2013 Politicians sheltering another Jlow in the making.
11,862324670137106433,Ben Hur Plug Up: CAUGHT ON VIDEO: KAJANG BOSS SLAPS &amp; PUNCHES HIS RESTAURANT WORKERS INCLUDING A WOMAN WITHOUT MERCY
12,862324532006199296,Ben Hur Plug Up: FATAL SUPPER: SINGAPOREAN JUMPS FROM HIS HOTEL ROOM AFTER EATING \u2018MAGIC MUSHROOMS\u2019 IN BALI
13,862324322228092928,Ben Hur Plug Up: Due for eye check up
14,862324227239694336,Ben Hur Plug Up: Saudi Arabia ridding into the sunset as a nation
15,862324004132069376,Ben Hur Plug Up: Why is the South China Sea unquiet?
16,862323907595862020,Ben Hur Plug Up: Big-spending Aussie Budget is supported by hefty taxes
17,862323793364099073,Ben Hur Plug Up: Singaporean man and woman killed in NZ car crash
18,862323689605316608,Ben Hur Plug Up: Violence erupts at a Florida airport after Spirit Airlines cancellations
19,862319009361833984,NBN_Australia DNS means DO NOT SUBSCRIBE. NBN is bigger than Ben Hur
20,862314076965400576,"Day 10- William Wyler\nBen Hur, Funny Girl, Roman Holiday, Best Years of Our Lives, etc. etc. etc.\nWhat's not to love?\n"
21,862310666652315648,RT otsfestival: Enjoyed 1925 Ben Hur at Yorkshire Silent Film Festival yesterday brilliant film great venue YorkshireSilent Abbeydale_PH\u2026
22,862310607734939649,RT YorkshireSilent: Percussion dept is ready for Ben Hur! HullIndieCinema
23,862293961418788864,RT vickygarch: Where's justice in Ben Hur's case vs Napoles? Clearly she wanted him shut up bec he knew too much of her shenanigans. Shame\u2026
24,862263094357217282,Regarder Ben-Hur (2016) Gratuit en Ligne \nLink:  \n
25,862260811833593856,Ben Hur Plug Up: Is a new PAS emerging? Or Recycled from the 1980\u2019s
26,862260684905512960,Ben Hur Plug Up: FINANCIAL CRASH WARNING: China\u2019s debt could cause economic disaster \u2018worse than 2008\u2019
27,862260564214521856,Ben Hur Plug Up: The man had failed a breathalyser test and recorded the video to tarnish the image of the police.
28,862260433570340864,Ben Hur Plug Up: JOHOR: Chinese Man Honks Continuously During The Friday Prayers Causes Ruckus In Broad Daylight!!!
29,862259932447391744,Ben Hur Plug Up: Kim Kardashian caught is plain Kim with an unairbrushed bottom - Yuks Ugly bottom
30,862255361801068547,Ben Hur Plug Up: School In India Made Students Remove Clothing With Metal Over Exam Cheats Fear!!
31,862255251998490626,Ben Hur Plug Up: The circling of the wagons has started
32,862255151154741248,Ben Hur Plug Up: SINGAPORE: Ang Moh Got Caught About To Have Foursome With Customers!
33,862254880756453376,"Ben Hur Plug Up: A great reply by a young Indian girl, Sarala Poobalan, to the mufti."
34,862254712531296256,Ben Hur Plug Up: Why The BN ruling party in Malaysia afraid of Non-Malays high achieving and role model students
35,862245413251727360,Ben Hur Plug Up: Study Finds Link Between Brain Damage and Religious Fundamentalism
36,862245118505500672,"Ben Hur Plug Up: SNATCH THIEVES, BEWARE! MALAYSIAN FIRM HAS CREATED WORLD\u2019S FIRST DEVICE TO CATCH YOU"
37,862244994328821760,"Ben Hur Plug Up: US tipped France to Russian election hacking, says Cyber Command chief"
38,862244910619017216,"Ben Hur Plug Up: Army, DRS Set To Integrate New Bridging System on Tanks"
39,862244818574917632,Ben Hur Plug Up: Malaysia reportedly asks Japan for Lockheed-made P-3 Orion aircraft
40,862244704586309633,Ben Hur Plug Up: SHOWDOWN IN BEIJING OVER BANDAR MALAYSIA FIASCO
41,862244613846728704,Ben Hur Plug Up: The ghost towns left behind by Cuba's shuttered sugar mills
42,862244524797566978,Ben Hur Plug Up: Letter: Grenada's police officers need ethics and discipline
43,862244432459857921,Ben Hur Plug Up: Colombian executed on drugs charges
44,862244333696671744,Ben Hur Plug Up: EXPOSED \u2013 MAHATHIR\u2019S \u2018CLANDESTINE COLLABORATION\u2019 IN SABAH
45,862244238611763200,Ben Hur Plug Up: F.B.I. Director James Comey Is Fired by Trump
46,862244146815188994,"Ben Hur Plug Up: How corrupted is our PM , is he or is he not"
47,862244024857485313,Ben Hur Plug Up: 10 Countries That May Soon Disappear
48,862243919492284416,Ben Hur Plug Up: SHOCK SEIZURE is he or is he not a friend of Ex-PM Mahathir
49,862240495203897344,vanbadham theage he is a dictator... this will be bigger than Ben Hur or Watergate.
50,862237987777552385,RT vickygarch: Where's justice in Ben Hur's case vs Napoles? Clearly she wanted him shut up bec he knew too much of her shenanigans. Shame\u2026
51,862237945675296768,RT niklausmylord: Damn ella is blessing us with joseph gifs from ben hur \ud83d\ude31\ud83d\ude31
52,862236557654204417,RT vickygarch: Where's justice in Ben Hur's case vs Napoles? Clearly she wanted him shut up bec he knew too much of her shenanigans. Shame\u2026
53,862235915728687104,RT vickygarch: Where's justice in Ben Hur's case vs Napoles? Clearly she wanted him shut up bec he knew too much of her shenanigans. Shame\u2026
54,862235119314010113,RT vickygarch: Where's justice in Ben Hur's case vs Napoles? Clearly she wanted him shut up bec he knew too much of her shenanigans. Shame\u2026
55,862232766506782725,Ben Hur - Friends Always feat Jocelyn Brown (Paolo Madzone Zampetti and Steve Paradise Soulful Club Mix)
56,862230122321063936,The Best Selection:\nBen Hur Featuring Jocelyn Brown - Friends Always\nRT &amp; Follow #House #Music\n
57,862214315847278592,Never seen anything like this before. They were comparing it to Ben Hur.. What??? \u2014 watching Baahubali 2 - The...
58,862208162476077056,RT vickygarch: Where's justice in Ben Hur's case vs Napoles? Clearly she wanted him shut up bec he knew too much of her shenanigans. Shame\u2026
59,862196865529516032,ReadersGazette: Latest Book News... Hollywood's Last Icon: The inner demons of Ben Hur star Charlton Heston  #books\u2026
60,862195504322670592,Latest Book News... Hollywood's Last Icon: The inner demons of Ben Hur star Charlton Heston
61,862187968630587392,The Movie Preview Review Eps 222 - Ben - Hur
62,862187967288356864,The Movie Preview Review Eps 222 - Ben - Hur
63,862185695091228672,The incompitence is Epic. Its a week of Ben Hur on replay. Ferkin Epic.
64,862184938816192512,RT vickygarch: Where's justice in Ben Hur's case vs Napoles? Clearly she wanted him shut up bec he knew too much of her shenanigans. Shame\u2026
65,862183963464409088,RT vickygarch: Where's justice in Ben Hur's case vs Napoles? Clearly she wanted him shut up bec he knew too much of her shenanigans. Shame\u2026
66,862182409801940992,RT vickygarch: Where's justice in Ben Hur's case vs Napoles? Clearly she wanted him shut up bec he knew too much of her shenanigans. Shame\u2026
67,862174964010500096,RT jjairobuitrago: #7FavFilmScores\nLawrence of Arabia\nEl Cid\nStar Wars\nThe good the bad &amp; the ugly\nBen Hur\nKagemusha\nAssasinationofJesseJa\u2026
68,862167708137336833,RT vickygarch: Where's justice in Ben Hur's case vs Napoles? Clearly she wanted him shut up bec he knew too much of her shenanigans. Shame\u2026
69,862166992475873280,RT_com Ben Hur for ever.
70,862151980050808832,RT vickygarch: Where's justice in Ben Hur's case vs Napoles? Clearly she wanted him shut up bec he knew too much of her shenanigans. Shame\u2026
71,862149789869195264,RT vickygarch: Where's justice in Ben Hur's case vs Napoles? Clearly she wanted him shut up bec he knew too much of her shenanigans. Shame\u2026
72,862149581366149120,"JUDA BEN HUR BLACK STONES\n30/04/17\nThe National 2017 - Especializada Bulldog Frances\n1er. Lugar Cachorro\u00a0 \""B\""\u00a0\u00a0 Mac\u2026"
73,862147487091511296,RT vickygarch: Where's justice in Ben Hur's case vs Napoles? Clearly she wanted him shut up bec he knew too much of her shenanigans. Shame\u2026
74,862145554964283392,"stockswami The concept is bigger than Ben Hur, bugs will take months/year/s to fix per integration... Probably too\u2026"
75,862145313309564928,RT vickygarch: Where's justice in Ben Hur's case vs Napoles? Clearly she wanted him shut up bec he knew too much of her shenanigans. Shame\u2026
76,862144912996749312,RT vickygarch: Where's justice in Ben Hur's case vs Napoles? Clearly she wanted him shut up bec he knew too much of her shenanigans. Shame\u2026
77,862141242485817345,EarlMontclair Oh and you better believe it would sell. Spotted this tank a while back. Ben Hur wheels on it!
78,862138950424698884,RT vickygarch: Where's justice in Ben Hur's case vs Napoles? Clearly she wanted him shut up bec he knew too much of her shenanigans. Shame\u2026
79,862119702994313216,#7FavFilmScores\nLawrence of Arabia\nEl Cid\nStar Wars\nThe good the bad &amp; the ugly\nBen Hur\nKagemusha\nAssasinationofJesseJames\nTheCinegogue
80,862107395257843712,RT vickygarch: Where's justice in Ben Hur's case vs Napoles? Clearly she wanted him shut up bec he knew too much of her shenanigans. Shame\u2026
81,862103664940400640,RT vickygarch: Where's justice in Ben Hur's case vs Napoles? Clearly she wanted him shut up bec he knew too much of her shenanigans. Shame\u2026
82,862097673897132032,RT vickygarch: Where's justice in Ben Hur's case vs Napoles? Clearly she wanted him shut up bec he knew too much of her shenanigans. Shame\u2026
83,862096038613716992,RT PBoegly: Ben Hur \n         \u271c \neverything is fine \n  \u22b9
84,862094364817977346,Ben Hur \n         \u271c \neverything is fine \n  \u22b9
85,862094092188082176,RT vickygarch: Where's justice in Ben Hur's case vs Napoles? Clearly she wanted him shut up bec he knew too much of her shenanigans. Shame\u2026
86,862093337716695041,RT vickygarch: Where's justice in Ben Hur's case vs Napoles? Clearly she wanted him shut up bec he knew too much of her shenanigans. Shame\u2026
87,862091614713516033,RT vickygarch: Where's justice in Ben Hur's case vs Napoles? Clearly she wanted him shut up bec he knew too much of her shenanigans. Shame\u2026
88,862091598410072064,RT vickygarch: Where's justice in Ben Hur's case vs Napoles? Clearly she wanted him shut up bec he knew too much of her shenanigans. Shame\u2026
89,862090884405379072,RT vickygarch: Where's justice in Ben Hur's case vs Napoles? Clearly she wanted him shut up bec he knew too much of her shenanigans. Shame\u2026
90,862090082177515521,RT vickygarch: Where's justice in Ben Hur's case vs Napoles? Clearly she wanted him shut up bec he knew too much of her shenanigans. Shame\u2026
91,862085585615323138,RT vickygarch: Where's justice in Ben Hur's case vs Napoles? Clearly she wanted him shut up bec he knew too much of her shenanigans. Shame\u2026
92,862084358198370304,Where's justice in Ben Hur's case vs Napoles? Clearly she wanted him shut up bec he knew too much of her shenanigans. Shame on CA justices!
93,862062977901617152,awardtour I've got a hunch i'd recently watched the Ten Commandments or Ben Hur or something and wanted to epic it up a bit
94,862054225269936131,Powdy88 when it's the speed vans doing it I get the urge to Ben Hur them the fuck off the road.
95,862044137364660225,RT janinebucks: Ben-Hur; a tale of the Christ - Lewis Wallace | History |500436402
96,862040869343559680,LSUCheckpoint Jackasses spinning out and racing at Burbank and Ben Hur
97,862040764104097793,Ben-Hur; a tale of the Christ - Lewis Wallace | History |500436402
98,862038926583844864,"RT CMovieTreasures: Ben-Hur (1959) Starring Charlton Heston, Jack Hawkins, and Haya Harareet"
99,862038585482129409,"Ben-Hur (1959) Starring Charlton Heston, Jack Hawkins, and Haya Harareet"
100,862031375859408896,WTF is a Ben Hur day?
101,862019875178516480,"Shopping with Ben Hur | Tim and Eric Awesome Show, Great Job! | Adult Swim  via YouTube"
102,862012003954679809,We have an Amazon Affiliate account linked to our online gift shop -- check it out!
103,862003008829345792,ReadersGazette: Latest Book News... Hollywood's Last Icon: The inner demons of Ben Hur star Charlton Heston  #books\u2026
104,861999213722427392,Latest Book News... Hollywood's Last Icon: The inner demons of Ben Hur star Charlton Heston
105,861997707132628993,"Ben-Hur Official Trailer #1 (2016) Jack Huston, Morgan Freeman Biblical Movie HD\nWatch:"
106,861990746957783041,daniellloyd1 badencooke And lasers mounted to the handlebars. Why not spikes leaving the rear hub like Ben Hur ch\u2026
107,861990683980312576,RT quis_hocuspocus: BohnetGage now Ben Hur! Lmfao
108,861990207473811456,"Is This a Chariot or a Mini Cooper? No, It's The Ben Hur Armchair"
109,861982476008280064,SFerguson1024 Psycho_Infidel Thats how we all have migrants and are world widely made to use the same light globe\u2026
110,861975078938058752,"Notification: 5th Annual Day of Tango Festival, Ben Hur Shrine Hall 781...  Tue May 9 12pm - Wed May 10, 2017 1am\u2026"
111,861972965335891968,Some days my commute to work feels like a scene from Ben Hur
112,861965137829408768,Watch Ben-Hur (2016) on Flixano\nStart Free Trial:
113,861946978929868803,"MxJackMonroe Ben Hur, Jesus of Nazareth, Argo, Lawrence Olivier in Orthello ... \ud83d\ude33"
114,861932495104872449,I liked a YouTube video  Ben Hur | Roma Downey Star Ceremony [Soundbite] Della Reese
115,861921044776595456,dominican_t It also sounds like Ben Hur's long lost brother.
116,861894636209528833,"RT tlgmusiconline: MGM, Paramount Sued for Allegedly Failing to Pay 'Ben Hur' Musicians | Hollywood Reporter"
117,861883738208313344,stevep44 TripleS_kid SkepticNikki Hence the popularity of the two Ben Hur films. Jesus did try a Donkey Derby en\u2026
118,861850127992057856,"RT PhotoshopTruth: \""But how does Rome crush an invisible God?\"" Titus smirks menacing: \""With a visible Roman God?\"" ht\u2026"
119,861835574440865792,"Hollywood is at fault... Men kissing is not \""manly\"" enough and so a solid arm or handshake is what can be seen in B\u2026"
120,861825583730356224,The Movie Preview Review Eps 222 - Ben - Hur
121,861825583717785600,The Movie Preview Review Eps 222 - Ben - Hur
122,861818033798619136,favperioddrama The Eagle (2011) and Ben Hur (2010 miniseries)
123,861803001580855297,ReadersGazette: Latest Book News... Hollywood's Last Icon: The inner demons of Ben Hur star Charlton Heston  #books\u2026
124,861802917367615491,Latest Book News... Hollywood's Last Icon: The inner demons of Ben Hur star Charlton Heston
125,861801911518932993,Ben-Hur on letterboxd:
126,861798193868288000,RT SarahEBond: TheAlexKnapp Hear me out: What if the next Fast and the Furious movie was a crossover with Ben Hur and was chariots versus\u2026
127,861793087659683840,1950s MGM Movie Prop - Roman Soldier's Cornu Horn War Trumpet Ben Hur Quo Vadis
128,861791099731550208,Regarder Ben-Hur (2016) Gratuit en Ligne \nLink:  \n
129,861787411994619904,RT SarahEBond: TheAlexKnapp Hear me out: What if the next Fast and the Furious movie was a crossover with Ben Hur and was chariots versus\u2026
130,861778764153442304,"Ben-Hur Official Trailer #2 (2016) - Morgan Freeman, Jack Huston Movie HD\nWatch:"
131,861778265236701184,TheAlexKnapp Hear me out: What if the next Fast and the Furious movie was a crossover with Ben Hur and was chariot\u2026
132,861744132515139585,RT jimmykorderas: WOW! Nothing gets by you. Did you see the guy in Ben Hur wearing a watch?
133,861744041981071361,WOW! Nothing gets by you. Did you see the guy in Ben Hur wearing a watch?
134,861718961532043266,#RETWEET #TFB #news Video - Ben-Hur (6/10) Movie CLIP - The Valley of the Lepers (1959) HD
135,861717068906975232,Pan Macmillan totally just did a Ben Hur at the \n#Nibbies! Very proud of everyone there \ud83d\udc4a\ud83c\udffb
136,861697429124632576,Reminds me of Charlton Heston's horses in the chariot race in Ben Hur :)
137,861678862744387584,"Is This a Chariot or a Mini Cooper? No, Its The Ben Hur Armchair!"
138,861670452296650752,Ben Hur must have been excruciating.
139,861648154248306689,"Is This a Chariot or a Mini Cooper? No, Its The Ben Hur Armchair!  #furniture #design\u2026"
140,861644064659296256,RT YorkshireSilent: Percussion dept is ready for Ben Hur! HullIndieCinema
141,861643941686509569,Percussion dept is ready for Ben Hur! HullIndieCinema
142,861631062379827204,Ben Hur - Paradise (feat. Daniel Thomas)
143,861621190158278656,Ben Hur and Ten Commandments for all centuries.
144,861617803182387202,"watched the 1925 \""Silent\"" Ben-Hur recently - the score by CarlDavisMusic is magnificent"
145,861612142851764227,"Notification: 5th Annual Day of Tango Festival, Ben Hur Shrine Hall 781...  Mon May 8 12pm - Tue May 9, 2017 1am \u2026"
146,861607687330639873,ReadersGazette: Latest Book News... Hollywood's Last Icon: The inner demons of Ben Hur star Charlton Heston  #books\u2026
147,861606624418562048,Latest Book News... Hollywood's Last Icon: The inner demons of Ben Hur star Charlton Heston
148,861606084963946496,RT newgrounds30142: MESSALA AND BEN HUR REUNITE   via YouTube
149,861606046472839171,MESSALA AND BEN HUR REUNITE   via YouTube
150,861603976411832320,RT newgrounds30142: MESSALA'S ARRIVAL in BEN HUR  via YouTube
151,861603945537576960,MESSALA'S ARRIVAL in BEN HUR  via YouTube
152,861602461806723072,"BEN HUR'S SURPRISE RETURN SHOCKS MESSALA, via YouTube"
153,861602316675411968,"BEN HUR'S SURPRISE RETURN SHOCKS MESSALA, BEN HUR 1959 Stephen Boyd  via YouTube"
154,861595661896167424,"justinsocial LOL!\n\nBen Hur being the best. The LOTR, then Green Mile.\n\nScrew Titanic forever. I enjoyed Wolf though."
155,861586111734444035,LOTR\nGreen Mile\nBen Hur (59)\nTitanic\nWolf of Wall Street\n\nWriter might spontaneously combust having to sit through those 3+ hr movies \ud83e\udd37\ud83c\udffe\u200d\u2642\ufe0f
156,861584563608465408,goddersbloom Capitals! Outrage. Questioning your driving. You're a latter day Ben Hur. The world will recognise your greatness in time
157,861569777474588676,Worried sila bec of the effect of the acquital sa credibility ni ben hur sa plunder cases.
158,861554925947498497,- If you like Ben Hur you'll like it. I won't tell you - spoil the picture!
159,861550637854732288,"RT HullIndieCinema: TMRW NIGHT! YorkshireSilent are back with the epic BEN-HUR w/live score. Mon 8 May, 7:30pm MidHallHull. Book now: ht\u2026"
160,861543987995262976,'Titus favored destroying the Jerusalem Temple to uproot and demolish both the Jewish and Christian sects' - Tacitus
161,861539446168186880,"RT HullIndieCinema: TMRW NIGHT! YorkshireSilent are back with the epic BEN-HUR w/live score. Mon 8 May, 7:30pm MidHallHull. Book now: ht\u2026"
162,861537813967360001,"RT HullIndieCinema: TMRW NIGHT! YorkshireSilent are back with the epic BEN-HUR w/live score. Mon 8 May, 7:30pm MidHallHull. Book now: ht\u2026"
163,861524027298521088,The Best Selection:\nBen Hur Featuring Jocelyn Brown - Friends Always\nRT &amp; Follow #House #Music\n
164,861503507811233792,RT otsfestival: Enjoyed 1925 Ben Hur at Yorkshire Silent Film Festival yesterday brilliant film great venue YorkshireSilent Abbeydale_PH\u2026
165,861498668062527488,RT otsfestival: Enjoyed 1925 Ben Hur at Yorkshire Silent Film Festival yesterday brilliant film great venue YorkshireSilent Abbeydale_PH\u2026
166,861497775023955969,Enjoyed 1925 Ben Hur at Yorkshire Silent Film Festival yesterday brilliant film great venue YorkshireSilent Abbeydale_PH professorvaness
167,861494532520775680,"During the chariot scene in \""Ben Hur,\"" a small red car can be seen in the distance."
168,861483213113491456,Double Feature: Ben Hur / Ten Commandments
169,861472442312605696,cnnphilippines Joyceilas blame the Ben Hur's defense lawyers for doing a lousy job on Napoles illegal detention case!
170,861440909719683072,During the chariot scene in \u2018Ben Hur\u2019 a small red car can be seen in the distance.
171,861426825045704705,1950s MGM Movie Prop - Roman Soldier's Cornu Horn War Trumpet Ben Hur Quo Vadis
172,861425195860594689,Retweeted BEN HUR (jecatatus):\n\nAlexNavarra10 subeida1 lobaoeletrico STF_oficial rosemetal222...
173,861425083641769984,Retweeted BEN HUR (jecatatus):\n\nAlexNavarra10 subeida1 lobaoeletrico STF_oficial rosemetal222...
174,861422994266103809,"The 2016 remake of Ben Hur was painful - none of the spectacle, grandeur or storytelling excellence of the..."
175,861416676151238656,"Is your mom a Civil War buff? She doesn't want diamonds, she wants a book for #MothersDay - check out our gift shop!"
176,861411470373990403,ReadersGazette: Latest Book News... Hollywood's Last Icon: The inner demons of Ben Hur star Charlton Heston  #books\u2026
177,861410332060811264,Latest Book News... Hollywood's Last Icon: The inner demons of Ben Hur star Charlton Heston
178,861394743921487872,The new Ben Hur film isn't actually very long.
179,861388672834338816,Ben Hur 2016 Trailer Dublado:  via YouTube
180,861340712092258305,Heading to bed to watch the remake of Ben Hur. Good night world xXx
181,861339953804046336,Ben Hur also provides installation services for your appliances and electronics.  Just helped some great people to\u2026
182,861319728207470592,"I trust Guy Ritchie on that one, this Ben Hur is just terrible"
183,861317966058504192,Southeast Division responding to '46A - CIT w/Ambulance' at Silver Brook Rd / Ben Hur St | Beat 356 |  | 15:29
184,861317961826676736,EvanOsherow ramming speed! (btw it wasn't the best strategy as only Ben Hur and the captain survived)
185,861316267411742721,"travisfazekas Lol yeah but then the movie dies (fantastic four, Ben Hur)"
186,861315783162572801,"RT HullIndieCinema: TMRW NIGHT! YorkshireSilent are back with the epic BEN-HUR w/live score. Mon 8 May, 7:30pm MidHallHull. Book now: ht\u2026"
187,861313260439691264,ReadersGazette: Latest Book News... Hollywood's Last Icon: The inner demons of Ben Hur star Charlton Heston  #books\u2026
188,861313000422219777,can't get over how \ud83d\udca9the remake of Ben hur is \ud83d\ude24 it's rubbish
189,861312186005639168,Latest Book News... Hollywood's Last Icon: The inner demons of Ben Hur star Charlton Heston
190,861303502383046657,watching Ben Hur 2016
191,861302487105638402,"RT divadharmie: Please who has seen Ben Hur, it's a 2016 movie?"
192,861287931830554624,"tonyblackburn Just watched the Ben Hur  2016 version and discover the guy \""Chicken Masala\""."
193,861282790939164673,"RT TheMovingFingr: TrumpDefined Ben Hur finds his mother in a leper colony and sings \""To life, to life, le-chaim.\"" \n"
194,861272816154488834,Superb afternoon at Abbeydale_PH watching the 1925 Ben Hur - part of YorkshireSilent. Outstanding work by the mus\u2026
195,861270180504186885,"New post (Ben-Hur Official Trailer #1 (2016) - Morgan Freeman, Jack Huston Movie HD) has been published on Vri ...\u2026"
196,861262225943801856,Autosports_Diva Ben Hur Moment!
197,861256189283323906,"Please who has seen Ben Hur, it's a 2016 movie?"
198,861255294483038210,IamSamSanyal raminisriharsha iamMahipal Pankaj80193397 samidsiddiqi91 Talaash_Within No bollywood movie comes\u2026
199,861249695368310784,"Notification: 5th Annual Day of Tango Festival, Ben Hur Shrine Hall 781...  Sun May 7 12pm - Mon May 8, 2017 1am \u2026"
200,861247162956607488,"TMRW NIGHT! YorkshireSilent are back with the epic BEN-HUR w/live score. Mon 8 May, 7:30pm MidHallHull. Book now:\u2026"
201,861229866829697026,The Best Selection:\nBen Hur Featuring Jocelyn Brown - Friends Always\nRT &amp; Follow #House #Music\n
202,861225456942669824,1950s MGM Movie Prop - Roman Soldier's Cornu Horn War Trumpet Ben Hur Quo Vadis
203,861210292734238720,AllNewSux Ben Hur's boat battle is a tense masterpiece.
204,861200380952236036,Eminem WESTSIDEGUNN WHOISCONWAY GriseldaRecords Phenomenal: black &amp; yellow Beatrice kill bills Uma is efforts i\u2026
205,861185411766517760,They should have never remade Ben Hur
206,861179209288474624,In scale comparable to Ben Hur or The 10 Commandments. My only comment is that with such beautiful sets and huge budgets maybe a time
207,861150277818351617,RT YorkshireSilent: Tickets available on the door for Ben Hur at Abbeydale_PH 3pm today. \u00a39
208,861148433784156160,RT YorkshireSilent: Tickets available on the door for Ben Hur at Abbeydale_PH 3pm today. \u00a39
209,861148308617797632,Tickets available on the door for Ben Hur at Abbeydale_PH 3pm today. \u00a39
210,861147384625102848,richardkhornsey thetoogood91 Ben Hur is an amazing film - hope to see you there!
211,861116744487849984,"With the amount of parts ive already promised away to mates we will have a cast the size of ben hur. (Actually, is\u2026"
212,861114327180468224,RT ReadersGazette: Latest Book News... Hollywood's Last Icon: The inner demons of Ben Hur star Charlton Heston  #bo\u2026
