,tweet_id,text
0,862358938137894912,18-22 yrs old? Middle Eastern? Can Sing and Dance? #GuyRitchie is looking for his #Aladdin &amp; there's an open auditi
1,862351788422434819,When you talk with bae
2,862350033017896960,Live-action ALADDIN will be a musical |  via gmanews
3,862350028232208384,Live-action ALADDIN will be a musical |  via gmanews
4,862347500535021569,young sex porn videos #aladdin porn cartoon
5,862346788493250560,realguyritchie have you ever considered ActuallyNPH for Genie's role in #Aladdin? He did great in
6,862341474863677440,"The genie is free!#Aladdin starts at 7:30/6:30c, followed by an encore of #DisneyWeddings at 9:30/8:30c."
7,862341457021108224,"AdewumiGokeDSJ what's strong wif you mahn? I'd make a wish that Gene makes you addicted to #Aladdin oh. Seriously, it's evergreen!"
8,862341360950550528,One of the best Genie moments
9,862340953738235906,"DisneyWeddings: RT FreeformTV: TONIGHT, dont miss an encore of #DisneyWeddings at 9:30/8:30c, following #Aladdin at 7:30/6:30c."
10,862338948902907906,A whole new world awaits you...  casting for Guy Ritchie's #Aladdin get involved!!!!
11,862336465652592644,"TONIGHT, dont miss an encore of #DisneyWeddings at 9:30/8:30c, following #Aladdin at 7:30/6:30c."
12,862336457993854977,"TONIGHT, its a special like none youve seen before. Dont miss an encore of the #DisneyWeddings special at 9:30/8"
13,862332682533036034,"Its a magical ride you wont wanna miss! (No carpet required.) #DisneyWeddings is TONIGHT at 9:30/8:30c, followin"
14,862332286922108929,New music video from XryspaOfficial #aladdin
15,862323183126433793,Thanks John Gullidge for this very nice shot of my Disney's #Aladdin #cosplay during #AMGchan!
16,862319594563919872,"Guy Ritchie talks Aladdin and rumoured Will Smith casting; remake will be a musical for sure, however... #Aladdin"
17,862316388802854914,"How niche is a crush as Brad, that guy who did #Aladdins voice in 1992?"
18,862313279804329984,#aladdin fucking naked gurl pics
19,862302706823823360,Not like #Aladdin - U.S. military encounters with #Jinn in Middle East
20,862290291625209857,Aladdin: Diamond Edition (Blu-ray/DVD/Digital HD)
21,862284839038443521,These were definitely great finds. #HarvestMoon #donkeykong #aladdin #mario  #gaming #gamer #retrogaming
22,862282488542093312,#TheOfficialKairi #Disney #aladdin  #Meme #Relatable #Graduation #2017 iFunny
23,862273854760255488,#aladdin toon porn youngleaf porn
24,862268272695181312,#aladdin toon porn nude business women
25,862268254043164672,The office has been casting our ideal #Aladdin live action actors. LISTEN UP GUY RITCHIE.
26,862266744269938689,Suspicions about the #Aladdin live-action movie have been confirmed!  via ComicBook
27,862265038735847424,"From Empire Magazine &lt;&gt;&gt; \""Do you think you look like #Aladdin? Can you sing? Dance a little? Does the idea of..."
28,862258890762858497,Curveball suggestion for Genie in live action #Aladdin - Richard Ayoade!
29,862255315294707712,"#WillSmith will play the role of Genie in the #Aladdin remake, #jumanji is now a sweet old #videogame:CineSardar"
30,862254662547845120,#aladdin hentai porn tamil stories sex
31,862254366748704768,"#GuyRitchie is directing a live-action #Aladdin, &amp; it'll be a musical. Will the Sultan say \""Paise Allah\"" though?"
32,862252482600329217,Just heard that ticket sales are already WAY up on last year's Panto for #Aladdin prestguildhall which is nice!
33,862248754799415296,Got something to ask the brand new #Aladdin?Tweet using #AskMatthewCroke by 2pm on 10/5 &amp; #win 2 tickets for the show of your choice!
34,862248219513831424,"Even thru I'm not at uni/school anymore, I still find this relevant!"
35,862245835203112960,Everything you must learn about life can be found in Sega's #Aladdin game.PRL 75: I Think We Got It! #PodernFamily
36,862245435003596801,#Aladdin with my fave people on earth   Her Majesty's Theatre Melbourne
37,862244868793421824,Check out our AWESOME Disney Aladdin Genie Toy Box Review !#Aladdin #genie  #Disney #Robinwilliams
38,862241076798738432,First Love #aladdin #jasmine #disney #disneymovie #disneygirl #firstlove #loser
39,862229788337025026,Should be interesting
40,862225876922060800,What a Dream role it would be to play   #Aladdin in the new #Disney film    realguyritchie
41,862223754541375488,Want to try out for the lead in Guy Ritchies #Aladdin? There is an open audition this Sunday in London:
42,862223187731468288,Want to try out for the lead in Guy Ritchies #Aladdin? There is an open audition this Sunday in London:
43,862218695782928385,Disney Aladdin Genie Toy Box Review !
44,862213037561847809,"Great matinee show today guys n girls. Beautiful sets, amazing music, fantastic performances #Aladdin Hibstah iamMJScott ainsley_melham"
45,862210834998607872,"impossible_cut Hibstah iamMJScott ainsley_melham Great matinee show today guys n girls. Beautiful sets, amazing"
46,862202436559097856,Watching Aladdin for the first time since Robin Williams past. I wonder how epic the recording sessions were with him!
47,862197178244222976,throwbackk
48,862175107770449920,Any #Aladdin lookalikes out there? #RT #GuyRitchie #movie
49,862174721428926464,Also hope they cast Brown actors and not white wash #Aladdin and am more worried about the casting of Genie than anything else
50,862174181395492864,I just hope they don't cast #DevPatel as #Aladdin for the nee live action #Disney movie
51,862166757238231042,Just finished this Magi fan art :D I think it came out pretty good.#anime #manga #fanart #magi #popart #aladdin
52,862157051387981825,Guy Ritchie's 'Aladdin' Live-Action Remake Will Be a Musical
53,862152222620221440,"Guy Ritchie macht aus \""Aladdin\"" ein Filmmusical #Aladdin #GuyRitchie"
54,862151372975861760,relationship goals since 1992
55,862147300117884928,Thank you Aladdin#like4like #follow4follow #foodheaven #chocolate #lovers #aladdin
56,862140873970040832,Disney's live action adaptation of #Aladdin will indeed be a musical according to director Guy Ritchie.
57,862140341331173377,Will Smith is rumoured to play Genie in the live-action remake of #Aladdin.
58,862139228137943045,realguyritchie Hi. Have you thought about ActuallyNPH for Genie's role in #Aladdin movie? He did great in A Series of Unfortunate Events.
59,862137817241190401,Birthday fun is so fun. #birthdaysforever #loveher #aladdin #musicals #nosingingdoctorsorders
60,862133621972508672,The way they look at each other.
61,862132179505221633,"realguyritchie if you really are in charge of #Aladdin remake, consider tinadesai07 from #Sense8 to play"
62,862131986483302400,New commission I'm working on
63,862129609906827264,"I suppose there could be another \""#Aladdin\"" out there, but I don't believe in this many coincidences for one day. We're reached our -&gt;"
64,862116665437368320,#Aladdin Live-Action Remake Will Be A Musical
65,862113982001315840,Guy Ritchie: Disney's #Aladdin Remake Will Be A Musical
66,862110124520951809,New tickets to Disney s #ALADDIN- The Hit Broadway Musical! Get tickets through this #Visa Entertainment pre-sale
67,862102843309916160,"Gonna see Aladdin tomorrow! I cannot wait!  \""riff raff, street rat, I don't buy that\"""
68,862099565545238528,Disney's Aladdin Live-Action Remake Will Be a Musical
69,862098946939912192,Disney's Aladdin Live-Action Remake Will Be a Musical
70,862098746833686528,Disney's Aladdin Live-Action Remake Will Be a Musical
71,862098678827196416,Disney's Aladdin Live-Action Remake Will Be a Musical
72,862093060716453888,"#RichardSimmons, #AbbyLeeMiller &amp; #Aladdin news coming up in the Showbiz File with annakooiman!"
73,862086454792654848,#Aladdin kinda day
74,862084221296357376,TitussBurgess omg he beat you out for #Aladdin?! NOOOOO!!!!!!
75,862070745731608577,Here's everything you need to know about #Disney's live-action #Aladdin adaptation
76,862066229175091201,"lucapasqualino are you in? Sunday, Old College Building, Holborn, 10:00 am"
77,862064709364629506,#Disney's Live-Action #Aladdin Will Be A Musical
78,862064422960992257,I know it is wrong to directly pitch #GuyRitchie to cast lucapasqualino - for #Aladdin - but it would be casting perfection
79,862063243346546689,Anybody think they got what it takes  ALADDIN!!? #GuyRitchie is doing an OPEN CASTING CALL D
80,862061899193745414,Brush up on the Friend Like Me lyrics as Guy Ritchies #Aladdin WILL be a musical
81,862059818923831298,Director realguyritchie gives a few details on the upcoming #Aladdin remake.
82,862053617448218624,"Saw #Aladdin by chance again earlier, still got me like when I used to watch it a 100 x a day years ago. Wish I had a VHS to play my tape."
83,862052231356526593,&lt;would be such a good casting&gt; lucapasqualino
84,862051004698820609,empiremagazine lucapasqualino ... go for it
85,862048500573499393,APPLAUSI
86,862046120314142721,#Aladdin Live-Action Remake Will Be A Musical
87,862044143249375232,Here s What Guy Ritchie Has to Say About Will Smith Playing Genie in the
88,862039074655305731,Pebeo Vitrial on Glass in Frame &amp;#034;Cave of Wonders&amp;#034;  via eBay_UK
89,862035406845427712,I tried
90,862034666722906113,Guy Ritchie has confirmed that his live-action adaption of #Aladdin WILL be a musical.
91,862031467261702149,"\""Must be able to sing at high level\""...well if that means high level volume i.e LOUD then y'all auditioning best wa"
92,862029963972706304,Aladdin  #aladdin #disneylandparis25  Disneyland Paris
93,862029854157524992,I mean...middle eastern Looks Street savvyVERY physically fit Highly Values animal companionship...consi
94,862022045969784833,"Genie: \""WHOA ! Your a lot smaller than my last master.\"" Biscuit: \""woof woof I'm a dog !\"" NEW toy-box review coming"
95,862021368115802112,Want to be the lead in #Disney's live-adaptation of #Aladdin? #GuyRitchie &amp; the Mouse House are having an open
96,862019863342174208,Guy Ritchie &amp; Disney are holding an open casting call for the lead in the new #Aladdin this weekend
97,862019345643257856,Guy Ritchie &amp; Disney are holding an open casting call for the lead in the new #Aladdin this weekend
98,862017780597628932,"- From way up here , it's crystal clear that now I'm in a whole new world with you."
99,862003812743213056,50 of our Lower School #Aladdin cast trip to AladdinLondon
100,862003336823930880,Aladdin: Diamond Edition (Blu-ray/DVD/Digital HD)
101,861998919995228160,"\""gotta eat to live, gotta steal to eat... otherwise we'd get along\""\""wrong!\"""
102,861997379322609665,"Aladdin Remake Will Be A Musical, Director Confirms"
103,861990386054688768,#whirlyball was a huge success! Can't wait to go again!
104,861988572282449920,"Sometimes when I put my contacts in, I start to sing \""A Whole New World.\"""
105,861977409003892736,"Sipping Disney MadTea Party Tea from my fav mug!! #disneytea , #tiggertuesday,"
106,861974811240792064,Fancy making it in a #WholeNewWorld of Celebrity &amp; Disney? realguyritchie could be your magic genie &amp; calls open
107,861970697417089024,Guy Ritchie's Live-Action #Aladdin ... the musical ...
108,861944922630496256,#aladdin sex pics anal youngest
109,861943881524543488,Disney's live-action Aladdin will contain the movie's famous songs!
110,861932836298919936,This is pretty lit tho
111,861929046971748352,Can you bring a little magic to stjohns_sussex disabled learners by donating to their #Aladdin Theatre Trip?
112,861920772985585665,Because white washing Aladdin and Mulan is okay... thanks
113,861919936914051072,Meet the new London #Aladdin! Matthew Croke will lead the West End cast from June 5!
114,861919755984351232,My god if the cast the live action Aladdin without one middle eastern or Arab..
115,861914705098661892,So which young white actors will be getting a tan for these roles? Guy Ritchie's #AladdinWill Be a Musical  via io9
116,861898563772723200,#Aladdin Pants with Floral Design overprint- orange
117,861897636584062977,#aladdin porn videos pictures of poeple having sex
118,861877226467360768,It's totally down to you. Which facts video would you like to see first? #individualvideo #disney #RemakeDays #aladdin #thelionking
119,861868434803617792,Guy Ritchie has confirmed that his live-action adaption of #Aladdin WILL be a musical.
120,861850965321928704,I hear Guy Ritchie is holding open auditions for the role of #Aladdin in the live-action remake. See you there geezer
121,861847777348915200,#aladdin hentai porn 24 hour sex
122,861845823029518336,When Worlds Collide
123,861839888185995264,A new design perfect for any #princess or #aladdin fan
124,861830051834216453,"#Disney Live-Action #Aladdin Will Have Authentic Voice, Guy Ritchie Says"
125,861826992093618176,stfoodcinema has rescheduled #aladdin to May 20th in Griffith Park and featuring scottweinger the voice of...
126,861826834140463104,Disney lovers  #daily #instagram #love #disney #aladdin #like4like #music #itunes #moana
127,861824788494508032,"#Aladdin Remake Will Be A Musical, Director Confirms"
128,861788340886147073,You're not in trouble unless you get caught!
129,861785529360289792,Watch Aladdin (1992) on #AmazonPrime (30-Day Free Trial)Watch it here:
130,861785311445168130,#KingArthur Director #GuyRitchie Says His #Aladdin Will Be a Musical!!
131,861782396118724608,#aladdin sex sex with pretty girl
132,861775192942452736,#Genie is life.
133,861760535603183616,Loved this at Deaf performance night!!!
134,861760066805940225,"#Aladdin Remake Will Be A Musical, Director Confirms"
135,861759850832945152,Watching #Aladdin and realizing I still know every song by heart..it's refreshing to know how Disney brain washed I am.
136,861758945135919104,"#Aladdin Remake Will Be A Musical, Director Confirms"
137,861758087882997761,Really interesting rings on my #Aladdin lamp chimney that I've never noticed before
138,861754077625147396,"\""10,000 years can give you such a crick in the neck!\"" #Aladdin #legos ( The LEGO Store)"
139,861752816758472704,undeux is telling no lies here.
140,861751051082317824,Disney SuperCute Pen Toppers are coming in this Summer. #disney #aladdin #aurora #maleficent
141,861731854617128964,Guy Richie is directing the live-action Aladdin? I can literally think of 50 directors better suited. #Aladdin Disney
142,861731400218705920,"Of Course, Guy Ritchie's Live-Action #Aladdin Will Be a"
143,861730228594286593,I've never met anybody named Aladdin. Just a sad thought.
144,861729464807456770,Is it sense for realguyritchie to make#Aladdin #movie a musicalbecause we had it everyother way? Ealing_FFF
145,861716492244721664,Aladdin: Diamond Edition (Blu-ray/DVD/Digital HD)
146,861711878011187200,Lovely to meet theamzi tonight!
147,861709809229365248,#KingArthur director realguyritchie says his #Aladdin movie will be a musical:  (Exclusive)
148,861709568639995904,Lovely to see you tonight DeanJohnWilson! See you on June 3rd!
149,861709016040316928,"Had an absolute blast chatting #KingArthur, #Aladdin, and MAN FROM U.N.C.L.E. 2 with realguyritchie. Watch here:"
150,861708490825383936,Three HotTopic's later and all 3 stores say employees bought the entire #Disney box of Pint Size Heroes. No
151,861699030967091204,Battlefield who's the flying man
152,861698432632750081,"\"" I Wish You Were Here \""#lego #legofan #lego_hub #legophotography #aladdin #genio"
153,861687481305104384,We are talking to realguyritchie about #KingArthur &amp; #Aladdin right now:
154,861683881162002434,Here is a new clip and trailer for #TheNewAdventuresofAladdin.
155,861674441712873472,Playback: Guy Ritchie on His #KingArthur Vision and Tackling #Disneys #Aladdin  via variety
156,861673929882173440,Frustrating when 'stars' are principle Musical roles rather than trained MT professionals. You're just a name. (And you can't sing)
157,861662068595986432,It's that time again! Getting stuck into the writing for this years Pantomime! Script Writer Edwards is back!!!
158,861658290492760064,Little cutie  #mermay #mermaid #wip #princess #princessjasmine #aladdin #disneyart #disney
159,861650225982828544,#AMAZING seats from azz2206 and amberdavis41 for rroeymai's Birthday treat to #Aladdin. He has
160,861638990553853953,New #Disney #Funko Pens coming soon - #maleficent #aladdin #sleepingbeauty #princessjasmine  PREORDER/ORDER LINK I
161,861637186151735296,How cute!! What do you think?
162,861636926050148352,#Aladdin and his Magic Lamp - a Short Play by Lara Bergmann -
163,861636816704876544,"I love her expression, with the Genie from #Aladdin the #musical #musicaltheatre"
164,861626141093875713,#aladdin and jasmine sex sophie monk nude scenes
165,861622804403376128,#JamesMonroeIglehart went from playing Genie in #aladdin to Jefferson in #Hamilton. Talk about magic wishes!
166,861621131597492230,"de_cNile Surely in Egypt, it's just a weird remake of #Aladdin :D"
167,861589890659749890,"BlazingMinds Interesting choice for #Aladdin, but at least Guy Ritchie has a fairly consistent track record so far"
168,861586512395227136,[ 21% di Sconto ]  #Aladdin Disney Gift Box with 6 Figures Heroes Bumper Bullyland
169,861580520014139393,Got a question for the new #Aladdin?Tweet using #AskMatthewCroke by Wed-2pm &amp; #win 2tickets for the show of your ch
170,861579808748294145,Our First Look at an Important New Ship in Star Wars: ...
171,861566468890218497,Can you bring a little magic to stjohns_sussex disabled learners by donating to their #Aladdin Theatre Trip?
172,861552552458027008,Got something to ask the brand new #Aladdin?Tweet using #AskMatthewCroke by 2pm on 10/5 &amp; #win 2 tickets for the show of your choice!
173,861552447692648448,Got something to ask the brand new #Aladdin?Tweet using #AskMatthewCroke by 2pm on 10/5 &amp; #win 2 tickets for the sh
174,861541727848415232,When you realize how beautiful the #Aladdin cast are: iamMJScott Troy_Sussman Hibstah ainsley_melham
175,861540833077600256,#Throwback a gif that describes seeing #Aladdin a 2nd time. Magical. Wanna fly the magic carpet with my cat .
176,861537865465036804,"3 hours, 3 coffees - I have my opening and an amazing twist #aladdin #embassytheatre #writer"
177,861536196899602432,#Aladdin pants cotton-mix - green
178,861530273233678341,Guy Ritchie: da Lock &amp; Stock a King Arthur
179,861522353737670656,Guy Ritchie: Live-Action Aladdin Will Have Authentic Voice
180,861521062189727744,I'm watching Aladdn and getting rewarded for it! #aladdn
181,861521032317997062,"Im using GetPerk, the app that gives you real rewards for watching TV. You should too! #aladdn"
182,861520957797806080,I'm earning rewards for watching TV with GetPerk! #aladdn
183,861510581500694529,sharatazrai shared byron_wulf_rai's post with you. See it at  Disney msdanifernandez ctcasting1234 #Aladdin
184,861500168528568320,Opening night is 3 weeks away -get your tickets soon!
185,861486484712337408,A Whole New World for Perth  via W3LiveNews
186,861461533318139904,After watching #Aladdin Follow me on insta: 1_sinoFollow me on Twitter: kasinomoanyawnFollow me on Snapchat: sin
187,861438393070342144,#Update by the time we got to A Whole New World there were not harmonies. All is ok with the world!
188,861435459905490944,May he forever #RestInPeace #robinwilliams
189,861435053087305729,Jafar Jafar he's are man if he can't do it GREAT
190,861434578858389504,Last one of the night. I'm wiped.
191,861429596574670848,Aladdin: Diamond Edition (Blu-ray/DVD/Digital HD)
192,861428225473433601,#Aladdin Live-Action's Guy Ritchie Talks Tone And The PC Army
193,861423961275551744,Ten thousand years will give you such a crick in the neck
194,861423669897252864,That two faced son of a jackal
195,861400412506796032,New tickets to Disney s #ALADDIN- The Hit Broadway Musical! Get tickets through this #Visa Entertainment pre-sale
196,861398585203716096,"If there is going to be a live action #aladdin, I vote CostaJames as the #genie !"
197,861373616365031426,"Year is going pretty great! Going to see #straightouttaoz , #kooza and #Aladdin  and many more to come (hopefully)"
198,861369510808494080,Watching #aladdin! I know this Disney classic word for word lol
199,861366509523927043,Bros fa sho! Thank you for the love! bheese #aladdin #awholenewworld #dope #whisky #whiskey
200,861363668738605056,Better than the SNES version?
201,861360474344091649,List of best 5 #Aladdin songs:1. One Jump Ahead2. Forget About Love3. You're Only Second Rate4. A Whole New World5. Arabian Nights
202,861358750992674816,#aladdin sex stories boolywood nude actress
203,861358556305645568,Obligatory pre-show selfie. #teachersofinstagram #theatrenerd #aladdin  Cadillac Palace Theatre
204,861350117714018304,#Aladdin #broadwayinchicago aladdin We LOVED the show!  Cadillac Palace Theatre
205,861349404380409856,JUST GET 83 QUALITY FRIENDS   #praisintheasian #DDW17 #Aladdin NathanielErvins JUXTAmusicUK
206,861348895976247298,Great movies this weekend on FreeformTV
207,861346403683098625,#aladdin hentai porn pornstars pooping
208,861343102325465088,#aladdin hentai porn sexy paris hilton pics
209,861333304036995072,FINALLY ordered the #DiamondintheRough Flannel from cakeworthystore! (hopefully the medium fits since the small wa
210,861331470589337606,Amazing weekend in London with my hubby
211,861330771440803840,Incredible #Aladdin performance by Grove Park students Beacon_Academy choreographed by MrsThomasBeacon #inspired
212,861330053832990720,"\""Girl you know I want your Love. Your Love was handmade for somebody like me.\"" -#EdSheeran #Aladdin #ShapeOfYou"
213,861328607167172608,"Rainy Sunday, laying by the fire and watching one of my favorites"
214,861319144163201024,sharatazrai shared byron_wulf_rai's post with you. See it at  DisneyCastingCA msdanifernandez #Aladdin
215,861319142447738885,sharatazrai shared byron_wulf_rai's post with you. See it at  msdanifernandez
216,861318619916976128,"I haven't given up the dream of being princess jasmine, except I would do it with Jafar--did you see his body as a genie? Damn, son"
217,861315004766842882,Aladdin (1992) Download Full Movie HDDownload Link:
218,861313753677053952,Watching #Aladdin without sleeping like yesterday. #FairyTaleWeddingsWeekend Disney FreeformTV
219,861308682369368064,How to transform a dreary Sunday? Watching Disney love stories! #Aladdin #Tangled #Frozen
220,861308582972637184,Watching #Aladdin rn. I'm so happy
221,861308429142327297,Praying AvanJogia plays #Aladdin
222,861307769579851776,.realguyritchie Obviously u have 2 choices for Genie in #Aladdin: rickygervais or Jambi from Pee Wee's Play House
223,861306165266849792,"\""I can show you the world\"" #Aladdin \""I found your lost shoe\"" #Cinderella\""Guess that makes me beauty\"""
224,861302463143579649,FreeformTV's Disney movie lineup is making my day
225,861298277085478913,Why is the Sultan a British man?
226,861297389780553728,#Aladdin b2b #Tangled b2b #Frozen.Shouts to #ABCFamily.
227,861296694234886144,Jafar is totally Stephen Amell
228,861294498378391554,I want djkhaled to play the #sultan or the genie in #aladdin live. Disney
229,861292575520681984,Watching #Aladdin makes me sad that #RobinWilliams  is no longer with us.
230,861290812759568385,"Let it go at #Disney Movie #Trivia Monday May 15, 8pm m15lounge;"
231,861290552611962881,How about a live action #Aladdin and HaileeSteinfeld to play Princess Jasmine...... I meaaaaaan perfection.
232,861290365130854401,"In love with FreeformTV playing #Disney movies back to back, especially #Aladdin which I'm now watching for the 2nd time!"
233,861290029137702912,haven't seen this movie in years
234,861285360357310464,"now, one of my favourite Disney movies, has turned into one of my least"
235,861285256263081987,Make way for Prince Ali!
236,861284695123910656,"\""Make way for Prince Aliiiiiiiiiiiiii!\"""
237,861284260707217410,Aladdin is on and I'm literally thinking of the boys! #Aladdin
238,861283157777281024,i never realized how light Jafars neck is in comparison to his face and hands.
239,861280572118904837,"\""You ain't never had a friend like me\"""
240,861280172221366273,"Go home, description. You're drunk."
241,861279992138870785,#aladdin toon porn barely legal boy porn
242,861277334346846211,Is it bad if I've never seen #Aladdin in English before now?
243,861276989935812610,Disney movie marathons on FreeformTV are my favorite
244,861276942846373888,My favorite movie of all time
245,861276439685074946,I miss robin williams one of my favorite movies of all time
246,861276288069357572,.theeSameer #aladdin is on and you aren't here
247,861276219500843008,Watching #aladdin with my baby
248,861271543288139776,Only way to recover from a wild weekend...
249,861270301686026240,"\""I think I'm gonna have a heart attack and die from not surprise!\"""
250,861269011656527872,When the afternoon movie lineup on FreeformTV is on point
251,861268915011428352,aladdin is on FreeformTV!
252,861266657288769537,ColliderVideo do you think  #JimCarrey could play the new #genie in the live action #Aladdin movie? johncampea markellislive Kristian
253,861259547599663104,"Yesterday was perfect. #SleepIn #Spongebob #Workout Lunch w. Sebastian, Dinner w. AndrewJerdonek started watching #GoT  &amp; watched"
254,861259546584649729,Check out Deonte who plays the genie in #aladdin on #broadway singing at #tunesintimessquare
255,861258310644887553,Book your tickets now! #aladdin Starts 29th May. #kidzrus #stives #cornwall philkidz Fun for all the family!
256,861242954706563074,I just love my #genie print from Camden Market.
257,861239184622837761,Have you voted yet? We don't want to influence you but... #Falsettos #ABronxTale #WarPaint #HolidayInn #Aladdin
258,861237301107712001,#Aladdin already sounds like a racist f**k fest
259,861234319045558277,#aladdin porn videos free naked amateur gang bang fucking
