,tweet_id,text
0,862353388201287680,#ToryElectoralFraud The nose on that #Muppet #TheresaMay must have outgrown #Pinocchio's
1,862331173929922560,RT shwanpai: \u300e\uff30\u300f is for the #Pinocchio\n#\u7d75\u63cf\u304d\u3055\u3093\u3068\u7e4b\u304c\u308a\u305f\u3044 #\u3044\u3044\u306d\u3057\u3066\u304f\u308c\u305f\u4eba\u5168\u54e1\u30d5\u30a9\u30ed\u30fc\u3059\u308b\u3000#\u5275\u4f5c\u30af\u30e9\u30b9\u30bf\u3068\u7e4b\u304c\u308a\u305f\u3044\u3000 #illustration #characterdesign \n#AnimalAlphabets An\u2026
2,862319843198021633,I love this scene #Pinocchio \ud83d\udcfa\ud83d\udc4c
3,862308252326821894,realDonaldTrump The investigations getting too close to the truth Mr. Trump? LOCK HIM UP! #UNAmerican #UNethical\u2026
4,862307035270057984,binge watching \ud83d\udc41\ud83d\udc41\u2763\ud83d\udcbb\n#pinocchio #kdrama #leejongsuk #parkshinhye #\ud53c\ub178\ud0a4\uc624 #\uc774\uc885\uc11d #\ubc15\uc2e0\ud61c
5,862307026206162944,"Vtg #Disneyland  #pinocchio  12\"" Plush Stuffed Animal from Disney in the 80's  eBay"
6,862306073860075520,"RT Viki: If #ParkShinHye isn't a goddess, who is?  Mamonde Korea\n\n#Doctors #Pinocchio #Heirs #FlowerBoyNextDoo\u2026"
7,862305002643234817,realDonaldTrump CNN Hmm? These fake news lies are a direct attack upon your character and credibility.  Shouldn't\u2026
8,862294964524462081,\ud83c\udfb2#LAC2017 #Pinocchio #Tournament\n#BlackDiamond #Casino\n\ud83c\udfc51st Prize $10000\n\ud83c\udf962nd Prize $7500\n\ud83c\udf963rd Prize $5000\n\ud83c\udf10\u2026
9,862284363358142464,This isn't at all scary.\nNot one bit.\n
10,862279721064828928,BREAKING NEWS: #TRUMP RUSHED 2 GW HOSPITAL W/ SERIOUS BURNS ON POSTERIOR. PANTS ON FIRE
11,862263571006095360,RT DarlingCouple_: Beautiful in White~ \ud83d\udc98\n\n
12,862245859316072448,Top #acting opportunities coming up for actors in #Aylesbury - we're casting Ibsen's #ADollsHouse and our #panto\u2026
13,862235563688120320,Expert's review on graphical strategy #Pinocchio Let's talk about Pinocchio principle of binary options \u00a0
14,862213566614519808,RT DarlingCouple_: Beautiful in White~ \ud83d\udc98\n\n
15,862212832770768897,RT DarlingCouple_: lol dal po \ud83d\ude02\n\n
16,862212303864741888,RT DarlingCouple_: Beautiful in White~ \ud83d\udc98\n\n
17,862207453743661056,Beautiful in White~ \ud83d\udc98\n\n
18,862190786284208129,RT shwanpai: \u300e\uff30\u300f is for the #Pinocchio\n#\u7d75\u63cf\u304d\u3055\u3093\u3068\u7e4b\u304c\u308a\u305f\u3044 #\u3044\u3044\u306d\u3057\u3066\u304f\u308c\u305f\u4eba\u5168\u54e1\u30d5\u30a9\u30ed\u30fc\u3059\u308b\u3000#\u5275\u4f5c\u30af\u30e9\u30b9\u30bf\u3068\u7e4b\u304c\u308a\u305f\u3044\u3000 #illustration #characterdesign \n#AnimalAlphabets An\u2026
19,862189389882966016,RT shwanpai: \u300e\uff30\u300f is for the #Pinocchio\n#\u7d75\u63cf\u304d\u3055\u3093\u3068\u7e4b\u304c\u308a\u305f\u3044 #\u3044\u3044\u306d\u3057\u3066\u304f\u308c\u305f\u4eba\u5168\u54e1\u30d5\u30a9\u30ed\u30fc\u3059\u308b\u3000#\u5275\u4f5c\u30af\u30e9\u30b9\u30bf\u3068\u7e4b\u304c\u308a\u305f\u3044\u3000 #illustration #characterdesign \n#AnimalAlphabets An\u2026
20,862185641362116609,RT DarlingCouple_: A Perfect Match~\ud83d\udc95\n\n
21,862184668350873600,Can we please give MalloryJansen ALL the Orphan Black awards?
22,862177663502471168,RT shwanpai: \u300e\uff30\u300f is for the #Pinocchio\n#\u7d75\u63cf\u304d\u3055\u3093\u3068\u7e4b\u304c\u308a\u305f\u3044 #\u3044\u3044\u306d\u3057\u3066\u304f\u308c\u305f\u4eba\u5168\u54e1\u30d5\u30a9\u30ed\u30fc\u3059\u308b\u3000#\u5275\u4f5c\u30af\u30e9\u30b9\u30bf\u3068\u7e4b\u304c\u308a\u305f\u3044\u3000 #illustration #characterdesign \n#AnimalAlphabets An\u2026
23,862174336542793729,RT shwanpai: \u300e\uff30\u300f is for the #Pinocchio\n#\u7d75\u63cf\u304d\u3055\u3093\u3068\u7e4b\u304c\u308a\u305f\u3044 #\u3044\u3044\u306d\u3057\u3066\u304f\u308c\u305f\u4eba\u5168\u54e1\u30d5\u30a9\u30ed\u30fc\u3059\u308b\u3000#\u5275\u4f5c\u30af\u30e9\u30b9\u30bf\u3068\u7e4b\u304c\u308a\u305f\u3044\u3000 #illustration #characterdesign \n#AnimalAlphabets An\u2026
24,862173594536824832,RT shwanpai: \u300e\uff30\u300f is for the #Pinocchio\n#\u7d75\u63cf\u304d\u3055\u3093\u3068\u7e4b\u304c\u308a\u305f\u3044 #\u3044\u3044\u306d\u3057\u3066\u304f\u308c\u305f\u4eba\u5168\u54e1\u30d5\u30a9\u30ed\u30fc\u3059\u308b\u3000#\u5275\u4f5c\u30af\u30e9\u30b9\u30bf\u3068\u7e4b\u304c\u308a\u305f\u3044\u3000 #illustration #characterdesign \n#AnimalAlphabets An\u2026
25,862169588968038400,RT DarlingCouple_: A Perfect Match~\ud83d\udc95\n\n
26,862161975488512001,RT DarlingCouple_: they are so adorable in this picture~\ud83d\udc98\n\n
27,862161930450075648,RT DarlingCouple_: THE WAY THAT HE SMILES!!! OMG!\ud83d\ude0d\n\n
28,862161889110970368,RT goblins_wifey: Let me do it baby \ud83d\ude0d cute cute!
29,862161851970355200,RT DarlingCouple_: A Perfect Match~\ud83d\udc95\n\n
30,862151124744151040,RT shwanpai: \u300e\uff30\u300f is for the #Pinocchio\n#\u7d75\u63cf\u304d\u3055\u3093\u3068\u7e4b\u304c\u308a\u305f\u3044 #\u3044\u3044\u306d\u3057\u3066\u304f\u308c\u305f\u4eba\u5168\u54e1\u30d5\u30a9\u30ed\u30fc\u3059\u308b\u3000#\u5275\u4f5c\u30af\u30e9\u30b9\u30bf\u3068\u7e4b\u304c\u308a\u305f\u3044\u3000 #illustration #characterdesign \n#AnimalAlphabets An\u2026
31,862136376350957569,"When You Wish Upon a #Star (from #DISNEY's \"" #Pinocchio \"") ( #Piano Cover)"
32,862133808350375938,#rhot KaraAlloway is dillusional and stuck Up! #teamroxy #teamjoan her nickname should be
33,862131658027409408,Oh #pinocchio PressSec you're a mess out here kiddo
34,862110265617383424,#KellyanneConway slithers out of seclusion #boldfacelying to AC360 #pinocchio go back to where you have been hiding.
35,862083735717466112,"thehill I stopped reading after author called Obamacare \""the most popular insurance plan ever\""."
36,862082563887644672,RT shwanpai: \u300e\uff30\u300f is for the #Pinocchio\n#\u7d75\u63cf\u304d\u3055\u3093\u3068\u7e4b\u304c\u308a\u305f\u3044 #\u3044\u3044\u306d\u3057\u3066\u304f\u308c\u305f\u4eba\u5168\u54e1\u30d5\u30a9\u30ed\u30fc\u3059\u308b\u3000#\u5275\u4f5c\u30af\u30e9\u30b9\u30bf\u3068\u7e4b\u304c\u308a\u305f\u3044\u3000 #illustration #characterdesign \n#AnimalAlphabets An\u2026
37,862077869287030784,RT shwanpai: \u300e\uff30\u300f is for the #Pinocchio\n#\u7d75\u63cf\u304d\u3055\u3093\u3068\u7e4b\u304c\u308a\u305f\u3044 #\u3044\u3044\u306d\u3057\u3066\u304f\u308c\u305f\u4eba\u5168\u54e1\u30d5\u30a9\u30ed\u30fc\u3059\u308b\u3000#\u5275\u4f5c\u30af\u30e9\u30b9\u30bf\u3068\u7e4b\u304c\u308a\u305f\u3044\u3000 #illustration #characterdesign \n#AnimalAlphabets An\u2026
38,862077075548545024,RT shwanpai: \u300e\uff30\u300f is for the #Pinocchio\n#\u7d75\u63cf\u304d\u3055\u3093\u3068\u7e4b\u304c\u308a\u305f\u3044 #\u3044\u3044\u306d\u3057\u3066\u304f\u308c\u305f\u4eba\u5168\u54e1\u30d5\u30a9\u30ed\u30fc\u3059\u308b\u3000#\u5275\u4f5c\u30af\u30e9\u30b9\u30bf\u3068\u7e4b\u304c\u308a\u305f\u3044\u3000 #illustration #characterdesign \n#AnimalAlphabets An\u2026
39,862075699842007040,A Perfect Match~\ud83d\udc95\n\n
40,862053796632854528,realDonaldTrump I dont believe you.  Prove it!  Show your taxes!   Any lawyer can prepare a letter and send it cer\u2026
41,862040123646541828,RT shwanpai: \u300e\uff30\u300f is for the #Pinocchio\n#\u7d75\u63cf\u304d\u3055\u3093\u3068\u7e4b\u304c\u308a\u305f\u3044 #\u3044\u3044\u306d\u3057\u3066\u304f\u308c\u305f\u4eba\u5168\u54e1\u30d5\u30a9\u30ed\u30fc\u3059\u308b\u3000#\u5275\u4f5c\u30af\u30e9\u30b9\u30bf\u3068\u7e4b\u304c\u308a\u305f\u3044\u3000 #illustration #characterdesign \n#AnimalAlphabets An\u2026
42,862038330506043392,\u300e\uff30\u300f is for the #Pinocchio\n#\u7d75\u63cf\u304d\u3055\u3093\u3068\u7e4b\u304c\u308a\u305f\u3044 #\u3044\u3044\u306d\u3057\u3066\u304f\u308c\u305f\u4eba\u5168\u54e1\u30d5\u30a9\u30ed\u30fc\u3059\u308b\u3000#\u5275\u4f5c\u30af\u30e9\u30b9\u30bf\u3068\u7e4b\u304c\u308a\u305f\u3044\u3000 #illustration #characterdesign\u2026
43,862021122094751744,RT mfloriocampisi: #PressBriefing the propaganda is desperate. #SallyYates = #integrity #spicer #trump #GOP =  #selfServing #pinocchio Get\u2026
44,862019862251667457,#PressBriefing the propaganda is desperate. #SallyYates = #integrity #spicer #trump #GOP =  #selfServing #pinocchio Get OUT of WH
45,862017741313765377,Got a new one... 8) #Loading #angry #Pinocchio #nose :\u2013( \ud83e\udd25More:  #screenshot bbcnews\u2026
46,861995810128621569,Got a new one... 8) #Loading #angry #Pinocchio #nose :\u2013( \ud83e\udd25More:  #screenshot bbcnews
47,861993387636908032,Me and my buddy Pinocchio chilling in Roma #Rome #pinocchio #italy #travel #holidays #disney \u2026
48,861989500993642496,"I'm sorry, but the visual of Rodney Davis meeting with constituents (kinda) with a swollen red nose is hilarious."
49,861953719499456514,Morning Star interview with #PINOCCHIO Dir. Jasmin Vardimon - 'Manipulative marionette intent'
50,861952380568469505,Winnie vous salut
51,861920650260303872,RT Sarabethbug: 15 #movies you grew up with that are inappropriate for kids  #Gremlins #Pinocchio #PeterPan #Waters\u2026
52,861919234519175168,#Pinocchio Tuesday
53,861919044869529600,#Pinocchio Tuesday
54,861918686378168320,"WHEN YOU WISH UPON A STAR ... \u2b50\ufe0f \n\nNEW TATTOO, NOT DONE YET \u2728\n\n"
55,861906532882972673,RT DarlingCouple_: THE WAY THAT HE SMILES!!! OMG!\ud83d\ude0d\n\n
56,861904619043254272,RT wearenonsuch: We've got no strings to hold us down and we've got our tickets for JVCompany's #Pinocchio tomorrow NottmPlayhouse! Have\u2026
57,861875372715114496,"#Pinocchio, #misogyny, and the 'lies' of #Trump and #Brexit: #Scotland unveils dramatic show at Venice Biennale"
58,861875260781502464,With the super lovely internetchav at umaexpo \ntelling porkie pies \ud83d\ude02\ud83d\udc95\n#internetchav #umae #Paintopia #pinocchio...
59,861847063797039104,RT rizheleli: these lines \ud83d\ude2d\ud83d\ude2d\ud83d\ude2d\ud83d\udc95 #pinocchio  jongsuksarchive LJS_society TeamLeeJongSuk
60,861831737780957184,"DavidCornDC PressSec Lies, lies and more lies. Their noses should be dragging the floor by now"
61,861817417265287168,How my friends and I sleep at night.
62,861814846467301379,Another #Zuma classic \ud83d\ude02\ud83d\ude02\ud83d\ude02\ud83d\ude02 \u2026 even poor old #Pinocchio cried!
63,861810366732410880,"Because of Pinocchio, my perception on reporters changed."
64,861789333275250689,BobbyPick2 Petchary annmarievazja You're fibbing
65,861786177103306752,RT DarlingCouple_: THE WAY THAT HE SMILES!!! OMG!\ud83d\ude0d\n\n
66,861784111404470274,Can't wait to see how PressSec /#pinocchio spins the #Flynn story tomorrow
67,861776990189174784,RT Chillaworldcom: When You Wish Upon a Star...
68,861773993191362561,"When You Wish Upon a #Star (from #DISNEY's \"" #Pinocchio \"") ( #Piano Cover)"
69,861769097436123136,PressSec your nose is growing. The new
70,861758954782826497,"Theresa (#Pinocchio) May, #Voters, the awkward lie &amp; inconvenient truth  &gt;.MidWalesMike\n#VoteLabour #JC4PM="
71,861709892582854658,"Cruz looks like a cross btw #Nixon and #Pinocchio \ud83e\udd25, but he's all around Texan bull \ud83d\udca9"
72,861705523229597701,Holy s*** youre right i cant take one minute of #Pinocchio and #eyepops only Maya's beauty and dialogues kept me aw\u2026
73,861690107744702465,realDonaldTrump POTUS Of course u do.
74,861687208016793601,EmmanuelMacron take a look to this man. Our #pinocchio named matteorenzi. Has he a good QI?
75,861680484518162432,luisaloffredo28 Hi Mr President realDonaldTrump. This is Mr Obama with our #pinocchio named matteorenzi.
76,861653238940143621,Lame ass niggaz always Lying
77,861629399468195840,"RT Viki: If #ParkShinHye isn't a goddess, who is?  Mamonde Korea\n\n#Doctors #Pinocchio #Heirs #FlowerBoyNextDoo\u2026"
78,861617240902221824,One of my favorite drama is #Pinocchio and I miss this drama so bad \ud83d\ude2d\ud83d\ude2d\n#LeeJongSuk \u2764\ufe0f
79,861587615752966144,AynRandPaulRyan realDonaldTrump You are such a PATHETIC CRYBABY! GROW UP! #UNPOPULAR #UNETHICAL #LIAR #PATHETIC\u2026
80,861579026619674633,We've got no strings to hold us down and we've got our tickets for JVCompany's #Pinocchio tomorrow NottmPlayhouse\u2026
81,861570224885297152,\ud83c\udfb2#LAC2017 #Pinocchio #Tournament\n#BlackDiamond #Casino\n\ud83c\udfc51st Prize $10000\n\ud83c\udf962nd Prize $7500\n\ud83c\udf963rd Prize $5000\n\ud83c\udf10\u2026
82,861563726247456773,SachaDratwa We r in a world that can clone human I don't think it's hard to fake a video \ud83e\udd14 and it's know israel is\u2026
83,861563621448581121,StandWithUs We r in a world that can clone human I don't think it's hard to fake a video \ud83e\udd14 and it's know israel is\u2026
84,861563503508934656,Uncle_Jimbo We r in a world that can clone human I don't think it's hard to fake a video \ud83e\udd14 and it's know israel is\u2026
85,861563384092917762,SussexFriends We r in a world that can clone human I don't think it's hard to fake a video \ud83e\udd14 and it's know israel\u2026
86,861563309795028994,AviMayer We r in a world that can clone human I don't think it's hard to fake a video \ud83e\udd14 and it's know israel is bu\u2026
87,861551202047111168,"\""Okay, fine.\""\n\""Let's just end this.\"" \nhahahaha is this a sign? \ud83d\ude05"
88,861549417433661440,Let me do it baby \ud83d\ude0d cute cute!
89,861537854664605696,RT DarlingCouple_: THE WAY THAT HE SMILES!!! OMG!\ud83d\ude0d\n\n
90,861529697657774080,#RADIO #90s #juice Now Playing #Pinocchio #Pin-Occhio #APPS Apple  Google
91,861527445308030976,RT akoremnaej: Final episode\n#peterpan\n
92,861518626871885824,Final episode\n#peterpan\n
93,861517354555109378,I've just watched episode S01E19 of Pinocchio!
94,861516276098879490,Out for a walk and met this fellow #sweden\ud83c\uddf8\ud83c\uddea #pinocchio  Pinocchiostatyn Bor\u00e5s
95,861513845784928256,"\u2766\u00a4 #Disney #Pinocchio Ghepetto Musical Snow Globe Plays \""When You Wish Upon... Collectible"
96,861506479110721536,RT DLP_Rides: Attraction Les Voyages de Pinocchio is back open and has a current queue time of 15 minutes.
97,861499680915689472,Attraction Les Voyages de Pinocchio is back open and has a current queue time of 15 minutes.
98,861492135954198529,"Attraction Les Voyages de Pinocchio just opened, but is temporarily closed. (queue time of 5 minutes)."
99,861476766858092544,LawyerRogelio shelleyb5191 That is so true 90%believe the same so inpeach right now before it's too late very dan\u2026
100,861466851901136896,RT cineworld: From #Pinocchio to #PiratesOfTheCaribbean - 5 times Disney took a darker turn than expected &gt;&gt;
101,861451129674235907,RT jessica20176208: Enter for chance to #WIN Pinocchio on Blu-ray! CAN only. Ends 2/16 #GIVEAWAY via yeewittlethings #Pinocchio #Disney h\u2026
102,861422531625992192,All this tea! Phaedra been lying since day 1! She lied about her due date \ud83e\udd25
103,861411597880786953,"When You Wish Upon a #Star (from #DISNEY's \"" #Pinocchio \"") ( #Piano Cover)"
104,861406190781079552,RT DarlingCouple_: THE WAY THAT HE SMILES!!! OMG!\ud83d\ude0d\n\n
105,861400162270191616,RT DarlingCouple_: THE WAY THAT HE SMILES!!! OMG!\ud83d\ude0d\n\n
106,861379041265422337,PhaedraParks #Pinocchio Noticed you had nothing to say for yourself. You're so phony.
107,861372618926153730,PhaedraParks is speechless
108,861367975030468609,I've just watched episode S01E18 of Pinocchio!
109,861367809867231233,#pinocchio sex sister and mom porn
110,861334522637496324,RT cineworld: From #Pinocchio to #PiratesOfTheCaribbean - 5 times Disney took a darker turn than expected &gt;&gt;
111,861296495856943104,RugbySaleSharks SaleSharksRugby Is it that diamondgenuis nose is now being used as the new Barton crossing?
112,861294492422459394,A Real Boy! #pinocchio #puppet #Geppetto #disney #jiminey #crichet #conscience #craft #pattern #crossstitch #knit\u2026
113,861283987628507137,RT vb_bandera: Thi is my #Pinocchio #illo as #sketchbooksunday theme! Enjoy your #sundayfun! DISNEY_DOODLE
114,861263277413642244,RT DarlingCouple_: THE WAY THAT HE SMILES!!! OMG!\ud83d\ude0d\n\n
115,861245515832467456,Attraction Les Voyages de Pinocchio is back open and has a current queue time of 15 minutes.
116,861240474027380736,Attraction Les Voyages de Pinocchio is temporarily closed while there is a current queue time of 15 minutes.
117,861235948448694272,RT DarlingCouple_: THE WAY THAT HE SMILES!!! OMG!\ud83d\ude0d\n\n
118,861230838037360640,THE WAY THAT HE SMILES!!! OMG!\ud83d\ude0d\n\n
119,861225146664853504,RT TheHappyKipper: MitchellGoldie Nick_Boro1 'I did not have sex with that woman...' \ud83d\ude02\ud83d\ude02\ud83d\ude02
120,861224905509130240,MitchellGoldie Nick_Boro1 'I did not have sex with that woman...' \ud83d\ude02\ud83d\ude02\ud83d\ude02
121,861222910337351680,.realDonaldTrump MariaBartiromo SundayFutures HouseDemocrats \u2192So why didn\u2019t #Pinocchio Steve Scalise and Republ\u2026
122,861220187705683968,RT irvingact3: The brilliant #Disney #pinocchio was the first #movie I saw as a young kid! Still love it!
123,861219895630942208,RT DarlingCouple_: they are so adorable in this picture~\ud83d\udc98\n\n
124,861201530371809280,Rewatching #Pinocchio bcs i suddenly missed being a comm student \ud83d\ude02
125,861174545864159232,StevenTDennis alllibertynews byrdinator justinamash Yes I keep reading many of the flippers... they justify the\u2026
126,861171262579773442,RT vb_bandera: Thi is my #Pinocchio #illo as #sketchbooksunday theme! Enjoy your #sundayfun! DISNEY_DOODLE
127,861169170381246464,Not nervous at all.
128,861168644990042113,"The #Pinocchio Chronicles \""Reality isn't made out of matter, but what matters.\"" jordanbpeterson"
129,861166171160166401,I'm watching it again. \ud83d\ude0d
130,861164939162959872,I'm watching it again. \ud83d\ude0d
131,861160156234747904,RT cineworld: From #Pinocchio to #PiratesOfTheCaribbean - 5 times Disney took a darker turn than expected &gt;&gt;
132,861156801403912192,RT cineworld: From #Pinocchio to #PiratesOfTheCaribbean - 5 times Disney took a darker turn than expected &gt;&gt;
133,861155622611550208,RT cineworld: From #Pinocchio to #PiratesOfTheCaribbean - 5 times Disney took a darker turn than expected &gt;&gt;
134,861155303735402497,silicone male sex doll demonstrations and text videos by women #pinocchio sex
135,861149059037483008,RT cineworld: From #Pinocchio to #PiratesOfTheCaribbean - 5 times Disney took a darker turn than expected &gt;&gt;
136,861143595901886464,From #Pinocchio to #PiratesOfTheCaribbean - 5 times Disney took a darker turn than expected &gt;&gt;\u2026
137,861130955003539457,"Lee Jong Suk-ing, I mean I'm watching his dramas not referring to his sucking though. LoL!\n"
138,861113965920866304,"Papa___Rico Just a shame they don't make 'Jackanory' anymore!, they're marvellous storytellers, don't always stick\u2026"
139,861100785215602688,RT vb_bandera: Thi is my #Pinocchio #illo as #sketchbooksunday theme! Enjoy your #sundayfun! DISNEY_DOODLE
140,861099347265507330,"It's PutinRF_Eng as #Stromboli.\nAnd RealDonaldTrump as #Pinocchio.\n\nExcept when #Donocchio lies, #JamesComey's FBI just watches the show."
141,861090088733880320,Thi is my #Pinocchio #illo as #sketchbooksunday theme! Enjoy your #sundayfun! DISNEY_DOODLE
142,861050881491566592,RT EdnaMaan1: I Miss Them A lot I Feel So Because I saw this Drama To late. #DarlingCouple #Pinocchio #IhHa #DalPo I love #ParkShinHye &amp; #\u2026
143,861050825183039488,"RT burajiru: Scratching my head, \""Where have I seen this kid?\"" It came to me: young #DalPo from #Pinocchio. #NanDaReum is a good looking k\u2026"
144,861049209730027520,"When You Wish Upon a #Star (from #DISNEY's \"" #Pinocchio \"") ( #Piano Cover)"
145,861033951606972416,"We see you, pryan AshLeeStrong . Hope rhinoplasty goes smoothly!"
146,860986450518650880,Walt Disney Pinocchio 8 piece 1981 Gift wrap 2nd Proof Verification Sheet set
147,860985876540780544,Walt Disney Pinocchio 1981 Gift Wrap Transparency Animation Cell 8x10 #Disney  eBay
148,860984642509438977,Walt Disney Pinocchio 7 piec 1981 Gift wrap Proof Verification Sheet set &amp; notes
149,860957809701257216,lemontwittor that nose lol!!! #pinocchio got nothing on you haha.
150,860942503075336192,RT OVFLanguages: Susanna reading #Pinocchio in #italian at the #language fair!
151,860919759734362112,AshLeeStrong Serious Question. How long is your nose right now? Do you have trouble going through doors?\u2026
152,860904682637717504,RT Zappyscloset: Disney Spice Jars  #MickeyMouse #pinocchio #Collectibles #shopping #forsale #Collectors ht\u2026
153,860902309554946048,#nowplaying #pinocchio ~ Pinocchio | DJ Pinocchio ||| Radio TEDDY - That's fun - makes clever!
154,860894452793171968,Attraction Les Voyages de Pinocchio is back open and has a current queue time of 15 minutes.
155,860890161395183617,#pinocchio sex naked babes masterbating
156,860886902941069314,Attraction Les Voyages de Pinocchio is temporarily closed while there is a current queue time of 15 minutes.
157,860871513343500291,#Repost labloggastorie with repostapp\n\u30fb\u30fb\u30fb\nRomaSlowTour RomaVerso\u00a0 #invadiSMariadellaPiet\u00e0 #invasionidigitali\u2026
158,860860140442058754,hoseian_21 hannahgraff15 Current pic of ian right now \ud83e\udd25
159,860845417730367488,\ud83c\udfb2#LAC2017 #Pinocchio #Tournament\n#BlackDiamond #Casino\n\ud83c\udfc51st Prize $10000\n\ud83c\udf962nd Prize $7500\n\ud83c\udf963rd Prize $5000\n\ud83c\udf10\u2026
160,860838031028142080,"Just finished watching #Pinocchio! Ah, I loved it. Thanks for the memories. \ud83d\udc95"
161,860835107338424320,I've just watched episode S01E03 of Pinocchio!
162,860835010366058499,Woiw! We're loving this beautiful new collection by MarkDaviesArt avail to order now 01260 299143 #NormaJeane\u2026
163,860822761127727104,harryetcraig Her nose got bigger - must be all the lying.
164,860819877237583873,Susanna reading #Pinocchio in #italian at the #language fair!
165,860814041735942144,"\u263a\u275e Disney #Pinocchio Ghepetto Musical Snow Globe #Plays \""When You Wish #Upon... Collectible"
166,860808596401004545,Watching #pinocchio. Again bc #LeeKongSuk is \ud83d\ude0d\ud83d\ude0d\ud83d\ude0d.
167,860794943953969152,Cutie!!! \ud83d\ude0d\n#LeeJongSuk \n#ParkShinHye \n
168,860792989110550528,RT DarlingCouple_: they're so cute!!~\ud83d\udc96\n\n
169,860792963508600833,#pinocchio sex happy nudes girls
170,860772933899362304,RepDougCollins is this true? GOP justinamash HouseGOP SenateGOP How many of U know the details of the bill?\u2026
171,860758671311163392,Jeremy_Hunt Is your nose growing? No one in the NHS is happy with anything you're doing!
172,860757706415759360,realDonaldTrump GOP HouseGOP SenateGOP HouseGOP #pinocchio as your nose grows be careful! Caught in more #lies\u2026
173,860754778317619201,"Uber driver tells me he's related to Wasim Akram, Mohammad Yousuf and Saqlain Mushtaq. I smell a rat"
174,860722439705174017,"\""The Adventures of Pinocchio\"" (1996) is a live-action gem of the Disney treasure."
175,860704860932538369,Fuck th #AlfredHitchcock profile ya show th world #Pinocchio brain that's ur #AlteredStates origin journey black hole hungern 4 a conscience
176,860694304494202880,#Pinocchio\n#LeeJongSuk\n#ParkShinHye\n#AbemaTV\n\n downloaded from an upper link!!\nA dr\u2026
177,860692918994128896,I've just watched episode S01E20 of Pinocchio!
178,860686817519165440,"When You Wish Upon a #Star (from #DISNEY's \"" #Pinocchio \"") ( #Piano Cover)"
179,860681750934167552,#Figaro #Disney Plush Tote A Tail Cat #Pinocchio #stuffedanimals #ebaystore #Disney  via eBay
180,860673434652692480,I've just watched episode S01E19 of Pinocchio!
181,860660463075418112,RT TobiWanDOTA: The International 7 Battle Pass released a new hero called
182,860655346599157760,POLITICOMag johnsalmond Of course. What a perfect #pinocchio for the maestro.
183,860655281415389185,RT TobiWanDOTA: The International 7 Battle Pass released a new hero called
184,860627630151696384,CNNPolitics You are surprised! The man is BLATANT LIAR who lies to fill his own pockets with the AMERICAN taxpayer\u2026
185,860611618958450688,"Well I survived the dance audition, now to watch Disney #pinocchio on"
186,860594136306634757,"Visual feast, a sensory delight &amp; teasingly dark, we were delighted to play host to #PINOCCHIO this eve - now onto the post-show! JVCompany"
187,860576772231798784,He's still waiting to become a Real Boy tho
188,860570379814920194,"\u263c\u275d Disney #Pinocchio #Ghepetto Musical Snow Globe Plays \""When You #Wish Upon... Take a look"
189,860556433548386304,RT saihimanshu11: #Beyhadh\n#EyePops &amp; #Pinocchio playing Spy\nThey don't know #Maya is the #JamesBond\nA Kite dancing in the Hurricane accor\u2026
190,860552374485757953,RT saihimanshu11: #Beyhadh\n#EyePops &amp; #Pinocchio playing Spy\nThey don't know #Maya is the #JamesBond\nA Kite dancing in the Hurricane accor\u2026
191,860524402164846592,\ud83e\udd14\ud83d\ude44#Pinocchio is at it again.\n\n Size matters: Donald Trump's penthouse is much smaller than we thought
192,860517697238573056,gavreilly A liar needs a good memory. Not so #Pinocchio Kenny!
193,860514106335535106,That markymarket reckons he only had two pints in two hours today at his #Soho office
194,860508150750998528,Attraction Les Voyages de Pinocchio is back open and has a current queue time of 30 minutes.
195,860506170762690560,RT saihimanshu11: #Beyhadh\n#EyePops &amp; #Pinocchio playing Spy\nThey don't know #Maya is the #JamesBond\nA Kite dancing in the Hurricane accor\u2026
196,860506101716054017,#Beyhadh\n#EyePops &amp; #Pinocchio playing Spy\nThey don't know #Maya is the #JamesBond\nA Kite dancing in the Hurricane\u2026
197,860499336337272832,Attraction Les Voyages de Pinocchio is temporarily closed while there is a current queue time of 30 minutes.
