,tweet_id,text
0,862345302514204672,Lew Wallace and Boston Corbett--two very different life paths
1,862336920373919744,"Notification: 5th Annual Day of Tango Festival, Ben Hur Shrine Hall 781...  Wed May 10 12pm - Thu May 11, 2017 1a"
2,862325431625588736,Ben Hur Plug Up: Goldman Sachs says U.S. border tax would 'blow out' Brent/WTI crude spread
3,862325324771606528,"Ben Hur Plug Up: Travel Advisory  Jakarta,Indonesia Avoid travel to Jakarta if want to avoid jail for casual talk"
4,862325229388836866,Ben Hur Plug Up: Teen Girl Raped By Mothers Boyfriend Who Happens To Be A Father Of Nine!!
5,862325139618136065,Ben Hur Plug Up: The Demise of religious base parties in Malysia
6,862325033430949888,Ben Hur Plug Up: The writing on the wall - Sabah and Sarawak voters start rebelling against BN-UMNO
7,862324937675087872,Ben Hur Plug Up: Selangor Exco - Amanah State assemblymen to replace PAS in Selangor state government line up soon
8,862324824667955200,Ben Hur Plug Up: Sounds very familiar  Politicians sheltering another Jlow in the making.
9,862324670137106433,Ben Hur Plug Up: CAUGHT ON VIDEO: KAJANG BOSS SLAPS &amp; PUNCHES HIS RESTAURANT WORKERS INCLUDING A WOMAN WITHOUT MERCY
10,862324532006199296,Ben Hur Plug Up: FATAL SUPPER: SINGAPOREAN JUMPS FROM HIS HOTEL ROOM AFTER EATING MAGIC MUSHROOMS IN BALI
11,862324322228092928,Ben Hur Plug Up: Due for eye check up
12,862324227239694336,Ben Hur Plug Up: Saudi Arabia ridding into the sunset as a nation
13,862324004132069376,Ben Hur Plug Up: Why is the South China Sea unquiet?
14,862323907595862020,Ben Hur Plug Up: Big-spending Aussie Budget is supported by hefty taxes
15,862323793364099073,Ben Hur Plug Up: Singaporean man and woman killed in NZ car crash
16,862323689605316608,Ben Hur Plug Up: Violence erupts at a Florida airport after Spirit Airlines cancellations
17,862319009361833984,NBN_Australia DNS means DO NOT SUBSCRIBE. NBN is bigger than Ben Hur
18,862314076965400576,"Day 10- William WylerBen Hur, Funny Girl, Roman Holiday, Best Years of Our Lives, etc. etc. etc.What's not to love?"
19,862263094357217282,Regarder Ben-Hur (2016) Gratuit en Ligne Link:
20,862260811833593856,Ben Hur Plug Up: Is a new PAS emerging? Or Recycled from the 1980s
21,862260684905512960,Ben Hur Plug Up: FINANCIAL CRASH WARNING: Chinas debt could cause economic disaster worse than 2008
22,862260564214521856,Ben Hur Plug Up: The man had failed a breathalyser test and recorded the video to tarnish the image of the police.
23,862260433570340864,Ben Hur Plug Up: JOHOR: Chinese Man Honks Continuously During The Friday Prayers Causes Ruckus In Broad Daylight!!!
24,862259932447391744,Ben Hur Plug Up: Kim Kardashian caught is plain Kim with an unairbrushed bottom - Yuks Ugly bottom
25,862255361801068547,Ben Hur Plug Up: School In India Made Students Remove Clothing With Metal Over Exam Cheats Fear!!
26,862255251998490626,Ben Hur Plug Up: The circling of the wagons has started
27,862255151154741248,Ben Hur Plug Up: SINGAPORE: Ang Moh Got Caught About To Have Foursome With Customers!
28,862254880756453376,"Ben Hur Plug Up: A great reply by a young Indian girl, Sarala Poobalan, to the mufti."
29,862254712531296256,Ben Hur Plug Up: Why The BN ruling party in Malaysia afraid of Non-Malays high achieving and role model students
30,862245413251727360,Ben Hur Plug Up: Study Finds Link Between Brain Damage and Religious Fundamentalism
31,862245118505500672,"Ben Hur Plug Up: SNATCH THIEVES, BEWARE! MALAYSIAN FIRM HAS CREATED WORLDS FIRST DEVICE TO CATCH YOU"
32,862244994328821760,"Ben Hur Plug Up: US tipped France to Russian election hacking, says Cyber Command chief"
33,862244910619017216,"Ben Hur Plug Up: Army, DRS Set To Integrate New Bridging System on Tanks"
34,862244818574917632,Ben Hur Plug Up: Malaysia reportedly asks Japan for Lockheed-made P-3 Orion aircraft
35,862244704586309633,Ben Hur Plug Up: SHOWDOWN IN BEIJING OVER BANDAR MALAYSIA FIASCO
36,862244613846728704,Ben Hur Plug Up: The ghost towns left behind by Cuba's shuttered sugar mills
37,862244524797566978,Ben Hur Plug Up: Letter: Grenada's police officers need ethics and discipline
38,862244432459857921,Ben Hur Plug Up: Colombian executed on drugs charges
39,862244333696671744,Ben Hur Plug Up: EXPOSED  MAHATHIRS CLANDESTINE COLLABORATION IN SABAH
40,862244238611763200,Ben Hur Plug Up: F.B.I. Director James Comey Is Fired by Trump
41,862244146815188994,"Ben Hur Plug Up: How corrupted is our PM , is he or is he not"
42,862244024857485313,Ben Hur Plug Up: 10 Countries That May Soon Disappear
43,862243919492284416,Ben Hur Plug Up: SHOCK SEIZURE is he or is he not a friend of Ex-PM Mahathir
44,862240495203897344,vanbadham theage he is a dictator... this will be bigger than Ben Hur or Watergate.
45,862232766506782725,Ben Hur - Friends Always feat Jocelyn Brown (Paolo Madzone Zampetti and Steve Paradise Soulful Club Mix)
46,862230122321063936,The Best Selection:Ben Hur Featuring Jocelyn Brown - Friends AlwaysRT &amp; Follow #House #Music
47,862214315847278592,Never seen anything like this before. They were comparing it to Ben Hur.. What???  watching Baahubali 2 - The...
48,862196865529516032,ReadersGazette: Latest Book News... Hollywood's Last Icon: The inner demons of Ben Hur star Charlton Heston  #books
49,862195504322670592,Latest Book News... Hollywood's Last Icon: The inner demons of Ben Hur star Charlton Heston
50,862187968630587392,The Movie Preview Review Eps 222 - Ben - Hur
51,862187967288356864,The Movie Preview Review Eps 222 - Ben - Hur
52,862185695091228672,The incompitence is Epic. Its a week of Ben Hur on replay. Ferkin Epic.
53,862166992475873280,RT_com Ben Hur for ever.
54,862149581366149120,"JUDA BEN HUR BLACK STONES30/04/17The National 2017 - Especializada Bulldog Frances1er. Lugar Cachorro \""B\"" Mac"
55,862145554964283392,"stockswami The concept is bigger than Ben Hur, bugs will take months/year/s to fix per integration... Probably too"
56,862141242485817345,EarlMontclair Oh and you better believe it would sell. Spotted this tank a while back. Ben Hur wheels on it!
57,862119702994313216,#7FavFilmScoresLawrence of ArabiaEl CidStar WarsThe good the bad &amp; the uglyBen HurKagemushaAssasinationofJesseJamesTheCinegogue
58,862094364817977346,Ben Hur           everything is fine
59,862084358198370304,Where's justice in Ben Hur's case vs Napoles? Clearly she wanted him shut up bec he knew too much of her shenanigans. Shame on CA justices!
60,862062977901617152,awardtour I've got a hunch i'd recently watched the Ten Commandments or Ben Hur or something and wanted to epic it up a bit
61,862054225269936131,Powdy88 when it's the speed vans doing it I get the urge to Ben Hur them the fuck off the road.
62,862040869343559680,LSUCheckpoint Jackasses spinning out and racing at Burbank and Ben Hur
63,862040764104097793,Ben-Hur; a tale of the Christ - Lewis Wallace | History |500436402
64,862038585482129409,"Ben-Hur (1959) Starring Charlton Heston, Jack Hawkins, and Haya Harareet"
65,862031375859408896,WTF is a Ben Hur day?
66,862019875178516480,"Shopping with Ben Hur | Tim and Eric Awesome Show, Great Job! | Adult Swim  via YouTube"
67,862012003954679809,We have an Amazon Affiliate account linked to our online gift shop -- check it out!
68,862003008829345792,ReadersGazette: Latest Book News... Hollywood's Last Icon: The inner demons of Ben Hur star Charlton Heston  #books
69,861999213722427392,Latest Book News... Hollywood's Last Icon: The inner demons of Ben Hur star Charlton Heston
70,861997707132628993,"Ben-Hur Official Trailer #1 (2016) Jack Huston, Morgan Freeman Biblical Movie HDWatch:"
71,861990746957783041,daniellloyd1 badencooke And lasers mounted to the handlebars. Why not spikes leaving the rear hub like Ben Hur ch
72,861990207473811456,"Is This a Chariot or a Mini Cooper? No, It's The Ben Hur Armchair"
73,861982476008280064,SFerguson1024 Psycho_Infidel Thats how we all have migrants and are world widely made to use the same light globe
74,861975078938058752,"Notification: 5th Annual Day of Tango Festival, Ben Hur Shrine Hall 781...  Tue May 9 12pm - Wed May 10, 2017 1am"
75,861972965335891968,Some days my commute to work feels like a scene from Ben Hur
76,861965137829408768,Watch Ben-Hur (2016) on FlixanoStart Free Trial:
77,861946978929868803,"MxJackMonroe Ben Hur, Jesus of Nazareth, Argo, Lawrence Olivier in Orthello ..."
78,861932495104872449,I liked a YouTube video  Ben Hur | Roma Downey Star Ceremony [Soundbite] Della Reese
79,861921044776595456,dominican_t It also sounds like Ben Hur's long lost brother.
80,861883738208313344,stevep44 TripleS_kid SkepticNikki Hence the popularity of the two Ben Hur films. Jesus did try a Donkey Derby en
81,861835574440865792,"Hollywood is at fault... Men kissing is not \""manly\"" enough and so a solid arm or handshake is what can be seen in B"
82,861825583730356224,The Movie Preview Review Eps 222 - Ben - Hur
83,861825583717785600,The Movie Preview Review Eps 222 - Ben - Hur
84,861818033798619136,favperioddrama The Eagle (2011) and Ben Hur (2010 miniseries)
85,861803001580855297,ReadersGazette: Latest Book News... Hollywood's Last Icon: The inner demons of Ben Hur star Charlton Heston  #books
86,861802917367615491,Latest Book News... Hollywood's Last Icon: The inner demons of Ben Hur star Charlton Heston
87,861801911518932993,Ben-Hur on letterboxd:
88,861793087659683840,1950s MGM Movie Prop - Roman Soldier's Cornu Horn War Trumpet Ben Hur Quo Vadis
89,861791099731550208,Regarder Ben-Hur (2016) Gratuit en Ligne Link:
90,861778764153442304,"Ben-Hur Official Trailer #2 (2016) - Morgan Freeman, Jack Huston Movie HDWatch:"
91,861778265236701184,TheAlexKnapp Hear me out: What if the next Fast and the Furious movie was a crossover with Ben Hur and was chariot
92,861744041981071361,WOW! Nothing gets by you. Did you see the guy in Ben Hur wearing a watch?
93,861718961532043266,#RETWEET #TFB #news Video - Ben-Hur (6/10) Movie CLIP - The Valley of the Lepers (1959) HD
94,861717068906975232,Pan Macmillan totally just did a Ben Hur at the #Nibbies! Very proud of everyone there
95,861697429124632576,Reminds me of Charlton Heston's horses in the chariot race in Ben Hur :)
96,861678862744387584,"Is This a Chariot or a Mini Cooper? No, Its The Ben Hur Armchair!"
97,861670452296650752,Ben Hur must have been excruciating.
98,861648154248306689,"Is This a Chariot or a Mini Cooper? No, Its The Ben Hur Armchair!  #furniture #design"
99,861643941686509569,Percussion dept is ready for Ben Hur! HullIndieCinema
100,861631062379827204,Ben Hur - Paradise (feat. Daniel Thomas)
101,861621190158278656,Ben Hur and Ten Commandments for all centuries.
102,861617803182387202,"watched the 1925 \""Silent\"" Ben-Hur recently - the score by CarlDavisMusic is magnificent"
103,861612142851764227,"Notification: 5th Annual Day of Tango Festival, Ben Hur Shrine Hall 781...  Mon May 8 12pm - Tue May 9, 2017 1am"
104,861607687330639873,ReadersGazette: Latest Book News... Hollywood's Last Icon: The inner demons of Ben Hur star Charlton Heston  #books
105,861606624418562048,Latest Book News... Hollywood's Last Icon: The inner demons of Ben Hur star Charlton Heston
106,861606046472839171,MESSALA AND BEN HUR REUNITE   via YouTube
107,861603945537576960,MESSALA'S ARRIVAL in BEN HUR  via YouTube
108,861602461806723072,"BEN HUR'S SURPRISE RETURN SHOCKS MESSALA, via YouTube"
109,861602316675411968,"BEN HUR'S SURPRISE RETURN SHOCKS MESSALA, BEN HUR 1959 Stephen Boyd  via YouTube"
110,861595661896167424,"justinsocial LOL!Ben Hur being the best. The LOTR, then Green Mile.Screw Titanic forever. I enjoyed Wolf though."
111,861586111734444035,LOTRGreen MileBen Hur (59)TitanicWolf of Wall StreetWriter might spontaneously combust having to sit through those 3+ hr movies
112,861584563608465408,goddersbloom Capitals! Outrage. Questioning your driving. You're a latter day Ben Hur. The world will recognise your greatness in time
113,861569777474588676,Worried sila bec of the effect of the acquital sa credibility ni ben hur sa plunder cases.
114,861554925947498497,- If you like Ben Hur you'll like it. I won't tell you - spoil the picture!
115,861543987995262976,'Titus favored destroying the Jerusalem Temple to uproot and demolish both the Jewish and Christian sects' - Tacitus
116,861524027298521088,The Best Selection:Ben Hur Featuring Jocelyn Brown - Friends AlwaysRT &amp; Follow #House #Music
117,861497775023955969,Enjoyed 1925 Ben Hur at Yorkshire Silent Film Festival yesterday brilliant film great venue YorkshireSilent Abbeydale_PH professorvaness
118,861494532520775680,"During the chariot scene in \""Ben Hur,\"" a small red car can be seen in the distance."
119,861483213113491456,Double Feature: Ben Hur / Ten Commandments
120,861472442312605696,cnnphilippines Joyceilas blame the Ben Hur's defense lawyers for doing a lousy job on Napoles illegal detention case!
121,861440909719683072,During the chariot scene in Ben Hur a small red car can be seen in the distance.
122,861426825045704705,1950s MGM Movie Prop - Roman Soldier's Cornu Horn War Trumpet Ben Hur Quo Vadis
123,861425195860594689,Retweeted BEN HUR (jecatatus):AlexNavarra10 subeida1 lobaoeletrico STF_oficial rosemetal222...
124,861425083641769984,Retweeted BEN HUR (jecatatus):AlexNavarra10 subeida1 lobaoeletrico STF_oficial rosemetal222...
125,861422994266103809,"The 2016 remake of Ben Hur was painful - none of the spectacle, grandeur or storytelling excellence of the..."
126,861416676151238656,"Is your mom a Civil War buff? She doesn't want diamonds, she wants a book for #MothersDay - check out our gift shop!"
127,861411470373990403,ReadersGazette: Latest Book News... Hollywood's Last Icon: The inner demons of Ben Hur star Charlton Heston  #books
128,861410332060811264,Latest Book News... Hollywood's Last Icon: The inner demons of Ben Hur star Charlton Heston
129,861394743921487872,The new Ben Hur film isn't actually very long.
130,861388672834338816,Ben Hur 2016 Trailer Dublado:  via YouTube
131,861340712092258305,Heading to bed to watch the remake of Ben Hur. Good night world xXx
132,861339953804046336,Ben Hur also provides installation services for your appliances and electronics.  Just helped some great people to
133,861319728207470592,"I trust Guy Ritchie on that one, this Ben Hur is just terrible"
134,861317966058504192,Southeast Division responding to '46A - CIT w/Ambulance' at Silver Brook Rd / Ben Hur St | Beat 356 |  | 15:29
135,861317961826676736,EvanOsherow ramming speed! (btw it wasn't the best strategy as only Ben Hur and the captain survived)
136,861316267411742721,"travisfazekas Lol yeah but then the movie dies (fantastic four, Ben Hur)"
137,861313260439691264,ReadersGazette: Latest Book News... Hollywood's Last Icon: The inner demons of Ben Hur star Charlton Heston  #books
138,861313000422219777,can't get over how the remake of Ben hur is  it's rubbish
139,861312186005639168,Latest Book News... Hollywood's Last Icon: The inner demons of Ben Hur star Charlton Heston
140,861303502383046657,watching Ben Hur 2016
141,861287931830554624,"tonyblackburn Just watched the Ben Hur  2016 version and discover the guy \""Chicken Masala\""."
142,861272816154488834,Superb afternoon at Abbeydale_PH watching the 1925 Ben Hur - part of YorkshireSilent. Outstanding work by the mus
143,861270180504186885,"New post (Ben-Hur Official Trailer #1 (2016) - Morgan Freeman, Jack Huston Movie HD) has been published on Vri ..."
144,861262225943801856,Autosports_Diva Ben Hur Moment!
145,861256189283323906,"Please who has seen Ben Hur, it's a 2016 movie?"
146,861255294483038210,IamSamSanyal raminisriharsha iamMahipal Pankaj80193397 samidsiddiqi91 Talaash_Within No bollywood movie comes
147,861249695368310784,"Notification: 5th Annual Day of Tango Festival, Ben Hur Shrine Hall 781...  Sun May 7 12pm - Mon May 8, 2017 1am"
148,861247162956607488,"TMRW NIGHT! YorkshireSilent are back with the epic BEN-HUR w/live score. Mon 8 May, 7:30pm MidHallHull. Book now:"
149,861229866829697026,The Best Selection:Ben Hur Featuring Jocelyn Brown - Friends AlwaysRT &amp; Follow #House #Music
150,861225456942669824,1950s MGM Movie Prop - Roman Soldier's Cornu Horn War Trumpet Ben Hur Quo Vadis
151,861210292734238720,AllNewSux Ben Hur's boat battle is a tense masterpiece.
152,861200380952236036,Eminem WESTSIDEGUNN WHOISCONWAY GriseldaRecords Phenomenal: black &amp; yellow Beatrice kill bills Uma is efforts i
153,861185411766517760,They should have never remade Ben Hur
154,861179209288474624,In scale comparable to Ben Hur or The 10 Commandments. My only comment is that with such beautiful sets and huge budgets maybe a time
155,861148308617797632,Tickets available on the door for Ben Hur at Abbeydale_PH 3pm today. 9
156,861147384625102848,richardkhornsey thetoogood91 Ben Hur is an amazing film - hope to see you there!
157,861116744487849984,"With the amount of parts ive already promised away to mates we will have a cast the size of ben hur. (Actually, is"
158,861113455587323904,ReadersGazette: Latest Book News... Hollywood's Last Icon: The inner demons of Ben Hur star Charlton Heston  #books
159,861113377099304960,Latest Book News... Hollywood's Last Icon: The inner demons of Ben Hur star Charlton Heston
160,861100805360844800,The Movie Preview Review Eps 222 - Ben - Hur
161,861100803951603713,The Movie Preview Review Eps 222 - Ben - Hur
162,861100101393154048,Ben-Hur; a tale of the Christ - Lewis Wallace | #History |500436402
163,861047297769062400,Achievement unlocked #3  Ben Hur free game  via YouTube
164,861042984703471616,1950s MGM Movie Prop - Roman Soldier's Cornu Horn War Trumpet Ben Hur Quo Vadis
165,861039837805248516,Review | Ben-Hur (2016)
166,861038597356617729,SnoopDogg come to 910 ben Hur road in Baton Rouge for a lit party #worththedrive
167,861018337844842498,"Is This a Chariot or a Mini Cooper? No, Its The Ben Hur Armchair!"
168,861015299151331328,Outstanding teachers in Indiana history  Samuel K. Hoshour
169,861002979289309185,Ben Hur 2016 Hindi Dubbed Full Movie Watchonline
170,861000132573241344,"peliculita Oooo, Ben Hur is on my list."
171,860997410960441346,"SkiBum79 The English Patient, Atonement, Ben Hur, Braveheart, Julius Caesar (with Brando)..."
172,860993212973961217,"WBPicturesCan More public domain effects driven shit guaranteed to flop like Pan, Ben Hur, Gods of Egypt, Hansel&amp;G"
173,860989571554848768,TezLocke Ben Hur was the biggest disappointment! Absolute trash!
174,860979688025579520,"TrumpDefined Ben Hur finds his mother in a leper colony and sings \""To life, to life, le-chaim.\"""
175,860970525534732289,Bigger than Ben Hur and more intriguing than
176,860965766765494276,"#ThingsJesusNeverSaid\""Ten dollars on Ben Hur to Win\"""
177,860964403751137280,Watch BEN-HUR Official Trailer (2016) Jack Huston Biblical Movie RemakeHD
178,860929378670317572,Join us Tuesday for a #CivilWarLecture about Quakers in the Civil War!  Book discussion at 5
179,860928626421882882,"#RadioGame #SmartMindz now live on WazobiaFMPH Answer 3 Ques, get 5k, (30sec/Que)Ques 1. Author of 'Ben Hur'"
180,860928530707865600,"#RadioGame #SmartMindz now live on WazobiaFMPH Answer 3 Ques, get 5k, (30sec/Que)Ques 1. Author of 'Ben Hur'"
181,860927346626396160,paulmac708 Day 28 - Ben HurDay 29 - Interview With The Vampire (I did not believe Tom Cruise could play Lestat)
182,860921573351489536,I just published AFI Number 100: Ben-Hur
183,860915662356697092,ReadersGazette: Latest Book News... Hollywood's Last Icon: The inner demons of Ben Hur star Charlton Heston  #books
184,860914562530500608,Latest Book News... Hollywood's Last Icon: The inner demons of Ben Hur star Charlton Heston
185,860913061351346176,"Ben-Hur Official Trailer #1 (2016) Jack Huston, Morgan Freeman Biblical Movie HDWatch:"
186,860902765601730561,The lady who drives Purple route has made her round the second time on campus and the Ben Hur bus still ain't here!
187,860902622320046086,These guys at the bus stop are getting on my nerves. Where is the Ben Hur bus at?
188,860902181502930944,Ben Hur bus be the last bus to get here!
189,860902026229764097,"Every fucking bus but the Ben Hur bus! Hurry the fuck up im trying to get high af! I have a weekend fill with pills, booze and weed!"
190,860887079877791745,"Notification: 5th Annual Day of Tango Festival, Ben Hur Shrine Hall 781...  Sat May 6 12pm - Sun May 7, 2017 1am"
191,860874924952608769,The Brexit Ben Hur
192,860774238311116800,#Deals #Movies #DVD #Bluray #Deal #ebay #Bargain The Last of the Mohicans + All Dogs Go to Heaven + Ben Hur (DVDs
193,860738414848749568,The Movie Preview Review Eps 222 - Ben - Hur
194,860738414739681281,The Movie Preview Review Eps 222 - Ben - Hur
195,860736458038149121,I added a video to a YouTube playlist  SCTV - Ben Hur
196,860716787662553088,ReadersGazette: Latest Book News... Hollywood's Last Icon: The inner demons of Ben Hur star Charlton Heston  #books
197,860715757524709376,Latest Book News... Hollywood's Last Icon: The inner demons of Ben Hur star Charlton Heston
198,860711469293248514,Nw: Ben Hur
199,860693177359101953,"Ben Hur - Trailer 2, Dublado:  via YouTube"
200,860681780327837696,"bryce554 Ben Hur I have watched over and over- 10 commandments not so much, couldn't listen to Mr De Mille doing his thing narrating..."
201,860674569908232193,"Ben-Hur [Blu-ray] Jack Huston, Toby Kebbell  |  Rated: PG-13  |  Format: Blu-ray"
202,860665439566909442,# Ben Hur Lobby Card Movie Poster Charlton Heston
203,860665341105496064,Ben Hur/Him/It/They/Z
204,860665261694660609,# Ben Hur Lobby Card Movie Poster Charlton Heston
205,860659201147797504,The Best Selection:Ben Hur Featuring Jocelyn Brown - Friends AlwaysRT &amp; Follow #House #Music
206,860620006366883840,I saw Ben Hur the remake this evening and it hit me.. The Romans also taught us NASCAR and Formula One racing!
207,860619097440219136,I added a video to a YouTube playlist  Andr Rieu - Parade Of The Charioteers (Ben Hur)
208,860619061226602498,I liked a YouTube video  Andr Rieu - Parade Of The Charioteers (Ben Hur)
209,860604362908893185,My  review of Ben-Hur (2016) on letterboxd:
210,860598499582386176,Fantastic opening night for YorkshireSilent Abbeydale_PH still lots to see tomorrow and the epic Ben Hur on Sunda
211,860595341548277760,Top 10 Box...  #ben-hur #IT #Mechanic:Resurrection #Ratchet&amp;amp;Clanck
212,860585383272345601,Just finished watching 2016 remake of 'Ben Hur' not sure if old Epic with Charlton Heston was better or not?
213,860581820441796608,"StephenDixonTV ChrisMasonBBC We keep you alive to serve this ship. Row well, and live.Quintus Arrius, Ben Hur."
214,860579995651104768,"As if the Cheetahs weren't bad enuff, I'm now watching the remake of Ben Hur."
215,860577677446717441,Ben Hur really was the worst
216,860572364601536513,Friday Night Movie at Living Water Church - Ben-Hur - 7:30pm -
217,860571172651642884,Do you have a Civil War buff for a mom? Check out our online gift shop here!
218,860561809278894082,Ben Hur...t  himself
219,860560149978677250,there's a guy in a pair of jeans in Ben Hur
220,860553344967876608,"Is This a Chariot or a Mini Cooper? No, Its The Ben Hur Armchair!"
221,860543441440317441,"erinefraser If I remember, Ben hur was remake of silent movie. New one completely bombed."
222,860542467380199424,iPGandhi Also it's a remake....I was about to ask if a remake has ever won big at the Oscars but then remembered BEN HUR.
223,860524993947545603,"Notification: 5th Annual Day of Tango Festival, Ben Hur Shrine Hall 781...  Fri May 5 12pm - Sat May 6, 2017 1am"
224,860519846336974848,ReadersGazette: Latest Book News... Hollywood's Last Icon: The inner demons of Ben Hur star Charlton Heston  #books
225,860519462172336128,Latest Book News... Hollywood's Last Icon: The inner demons of Ben Hur star Charlton Heston
226,860485262131867648,Just saw a short scene from the 1920s Ben Hur in this French movie that's on tv omfg
227,860480312006115330,"Ben-Hur (2016) on #VidimovieTrailers, Clips &amp; Reviews:"
228,860479591068164096,"MissMovies Glad this list is growing in the Schmoeville Facebook page. I haven't seen Seven Samurai, Ben Hur, Spar"
229,860466325289934852,1950s MGM Movie Prop - Roman Soldier's Cornu Horn War Trumpet Ben Hur Quo Vadis
230,860458819582918656,MikePDaTruth Crackdown 3 on Scorpio. I was lucky &amp; got an early console &amp; game. Might also play Ben Hur in true 4k
231,860443966562594816,The Best Selection:Ben Hur Featuring Jocelyn Brown - Friends AlwaysRT &amp; Follow #House #Music
232,860439659935014914,"1034 Ben Hur Dr, Houston, TX 77055, $649,000 3 beds, 2 baths"
233,860439541970124800,"1034 Ben Hur Dr, Houston, TX 77055, $649,000 3 beds, 2 baths"
234,860422162368405504,1950s MGM Movie Prop - Roman Soldier's Cornu Horn War Trumpet Ben Hur Quo Vadis
235,860418318670467072,"Yes please. Plus flamethrower, rear mounted grenade launcher and Ben Hur style hubcap spikes"
236,860399221765177345,hull_libraries OssettObserver It was a lovely night! Do come to our next HullIndieCinema show - BEN HUR on Mon 8
237,860376039003967488,The Movie Preview Review Eps 222 - Ben - Hur
238,860376038915932162,The Movie Preview Review Eps 222 - Ben - Hur
239,860347075183214592,On How to train your dragon you can ask people questions about Ben Hur.
240,860329522230636545,"MissMovies Casablanca, gone with the wind, Ben Hur,  Chinatown, every fast and the furious movie after the second one."
241,860318479924293632,ReadersGazette: Latest Book News... Hollywood's Last Icon: The inner demons of Ben Hur star Charlton Heston  #books
242,860318133747404801,Latest Book News... Hollywood's Last Icon: The inner demons of Ben Hur star Charlton Heston
243,860291613427470337,Ben-Hur (DVD 2016)
