,tweet_id,text
754,861983956744273920,I urgently need to see this still!!!  #movies #guardiansofthegalaxy #marvel  #chrisprattmarryme
755,861983432812896256,What We Loved (And Didn't Love) About Guardians Of The Galaxy Vol. 2  #vgchat
756,861983394086793216,What We Loved (And Didn't Love) About Guardians Of The Galaxy Vol. 2  #vgchat
757,861983177744801792,JavierGarron #Starlord #originalart for sale
758,861982063322443776,#guardiansofthegalaxyWhy post-credits scenes are slowly ruining blockbusters
759,861981846808166400,Listen to our explosive discussion of #GuardiansoftheGalaxy Vol 2. on the FilmStageShow:
760,861981805930565632,Catch the all-new 2018 #Ford EcoSport in #GuardiansoftheGalaxy Vol. 2 &amp; get a chance to win one:
761,861981779732959234,[#Review]  Guardians Of The Galaxy Vol. 2 -   - Written by KieranRae95 - #Film
762,861981696836726784,It's showtime!!
763,861981602922065922,Enter to win a #GuardiansOfTheGalaxy Vol.2 Prize Pack worth over $250!
764,861981147651334144,#guardiansofthegalaxyHow Guardians of the Galaxy Vol 2 heralds Marvel's weird new world
765,861980962632204292,Jaclynhill Gamora out here starting trends
766,861979945484070912,GotG-Style #CassettePlayer Prices Skyrocketing on #eBay
767,861979659981934592,Can't wait to go!!
768,861979462329610240,#GuardiansoftheGalaxy Celebrities &amp; Me! w/Linky! #GotGVol2Event Guardians #GotGVol2  gaynycdad
769,861979316304973825,The latest The CombierUSA Daily!  Thanks to jdocwill CUESA ToddAppel
770,861979177767104512,The latest The Vampire Rules Daily!  Thanks to DEmeryTaylor
771,861978955116683266,NEW VIDEO! Leave a like and a comment for MORE!
772,861978643626508288,"\""Ain't no thing like me, 'cept me.\"" ~ Rock'catDebuting our Rocket Raccoon (with Baby Groot) from"
773,861978223034466304,The latest aljonrocks Pop-culture Daily!
774,861977878531100672,Vol. 2 didn't push the boundary of Marvel the way the first #GuardiansOfTheGalaxy did. What were your thoughts?
775,861977035337605121,What would be YOUR dream coffee table? #batman #lego #legostarwars #hansolo #starwars #GotGVol2
776,861976870073634816,The latest The Daily Reid!  Thanks to SamanthaPreis RealDeanCain freedomlineent
777,861976203846012929,#VinDiesel is #Groot is
778,861975341807566848,"#GuardiansOfTheGalaxy t-shirts are 2 for 20 right now! Can we get a \""Yeah baby!\"""
779,861974338953728000,How #GuardiansoftheGalaxy Vol. 2' raises the stakes of the #Marvel Cinematic Universe
780,861974233278271488,I said it months ago -- #GuardiansoftheGalaxy perfectly represents the Marvel Formula. Latest article here -&gt;
781,861974039061045248,The DAUGHTER OF THANOS slays a new episode of GHLpodcast!#guardiansofthegalaxy
782,861973014350516224,Guardians of the Galaxy macarons!
783,861972988526288897,DaveBautista watched u get your make up done for Drax. You must have a the patience of a saint
784,861972952337788929,Enter to win a #GuardiansOfTheGalaxy Vol.2 Prize Pack worth over $250!
785,861972586414067713,Have you seen it yet?
786,861971721506635776,"Make sure to watch #GuardiansOfTheGalaxy, where i star az"
787,861971611603357697,This #Doritos Bag Can Play The Guardians Soundtrack
788,861970569268482048,Enter to win a #GuardiansOfTheGalaxy Vol.2 Prize Pack worth over $250!
789,861969598039674883,Shanda is so talented.
790,861967834234195973,#GuardiansoftheGalaxy Rickmobile
791,861967681125179393,"Working on #GuardiansOfTheGalaxy Easter Eggs and new #TheFlash today, posting in a little while!"
792,861967422273630208,"Badass #planks for the #GuardiansoftheGalaxy advanced athletes:  #karnellthesuperhero #fitness, #badassplanks,"
793,861967086679150592,Is Mary Poppins cool?  #damnstraight #guardiansofthegalaxy #guardiansofthegalaxy2 #yondu #marypoppins #marvel
794,861967039585550337,A Doritos bag with an audio jack? Sure! Why not?#GuardiansOfTheGalaxy #GotG2
795,861965024419487744,"I live for the simple things, like how much this is going to hurt."
796,861964939568836612,The latest The Jean Grey School News!
797,861964840071573504,Was #GuardiansOfTheGalaxy 2 good??
798,861964398881112064,The latest The reeceecup Daily!  Thanks to SabrinaAnnLynn cagesideseats UPROXXSports
799,861964218626691073,Whos your fave Guardian?... #guardiansofthegalaxy #guardiansofthegalaxyvol2 #gamora #groot
800,861964003764981760,#GuardiansOfTheGalaxy is set to open May 27 at #DisneylandResort #DisneyCaliforniaAdventure #Disney #TVCommercial :
801,861963303303737345,Just watched #GuardiansOfTheGalaxy  prattprattpratt so amazing one more time  So in love with #Groot and
802,861961725427449856,Episode 142! We return to the #RoundTable and talk
803,861961619894657024,Groot enjoying the window.
804,861960920452542464,Should still be seen at least once a day. Until I find some other Groot clip that tops it...
805,861960290321092608,Retweeted FamilyAroundTheTable (FamTable):Galaxy bark perfect for #GuardiansOfTheGalaxy...
806,861959762384007168,Best The_Proclaimers Reference -- All-New #GuardiansOfTheGalaxy #1 #BestStuffInComics
807,861959591122403328,Marvel : Gamora gets the spotlight upcoming in All-New #GuardiansoftheGalaxy from GerryDuggan:
808,861959142755495936,Thank you to everyone who participated in my #guardiansofthegalaxy #artgiveaway! The Awesome Winner is steven_francis1!! Congrats!
809,861959063504125952,Enter to win a #GuardiansOfTheGalaxy Vol.2 Prize Pack worth over $250!
810,861959043056717824,The latest The Hell Daily!  Thanks to ColeMarieMcKinn LegitWiseOwl madelinereow
811,861959024446758912,"If you have seen #GotGVol2, where does it rank amongst the other #MCU films? Do you like it better or worse than"
812,861958942888521728,Gamora gets the spotlight upcoming in All-New #GuardiansoftheGalaxy from GerryDuggan:
813,861958930372583424,#doodle\r#guardiansofthegalaxy \rYes you are :)
814,861958638860206080,6 essential #GuardiansOfTheGalaxy who will never make it into the
815,861958375785025537,#GuardiansOfTheGalaxy #awesomemixvol2 carrying me through my morning.  Why do I always forget how much I love ELO?
816,861958215382306817,Been listening to both guardians of the galaxy awesome mixes for the past week with no plans of stopping.
817,861958024440799236,Enter to win a #GuardiansOfTheGalaxy Vol.2 Prize Pack worth over $250!
818,861957909550333953,The latest The buzzReport!  Thanks to BrookingsInst whitneyfishman JulieFoudy
819,861957357345046528,HA HA! I need this game! #Lego #GuardiansOfTheGalaxy Make it so!!
820,861957198217445376,Happy #waybackwednesday with SD Boba Tea #groot from #guardiansofthegalaxy! Come in today and
821,861956976187764741,"Director JamesGunn to Marvel fans: \""See #GuardiansOfTheGalaxy Vol. 2 in 3D\""  Currently showing"
822,861956862421237764,The #GuardiansoftheGalaxy playlist on Spotify is highly recommended to start your day. I've never smiled so much on my way to class.
823,861954846919843841,Thanks for the new 5 of #The602Club Julesverne1492! Follow their lead &amp; you could win #GuardiansOfTheGalaxy gear!
824,861954667902881794,The second book in our #GuardiansoftheGalaxy inspired series starring #RocketandGroot is out now!
825,861954394375557121,Look at this cutie
826,861953612720873472,The real reason Baby Groot is the key to #GuardiansOfTheGalaxy's success   via VanityFair
827,861952601348296704,The real reason Baby Groot is the key to #GuardiansOfTheGalaxy's success
828,861952321642577921,Fun fact:  I have seen #Spaceballs #BillyMadison and #guardiansofthegalaxy over 20 times each in my lifetime.
829,861952280245002241,Enter to win a #GuardiansOfTheGalaxy Vol.2 Prize Pack worth over $250!
830,861952067820302336,Yondu Poppins#art #marypoppins  #yondu #guardiansofthegalaxy  #marvel  #comics  #digitalart
831,861951685123608577,Can You Name These #Marvel Extraterrestrial Superheroes And Villains? via CBR
832,861951234026156033,Is #guardiansofthegalaxyvol2 just as awesome?
833,861950624191180801,#GuardiansOfTheGalaxy fans! Which #AwesomeMix did you prefer? #GOTG or #GOTGVol2?
834,861949967656681472,"I'm totally jamming out all day to the #guardiansofthegalaxy #awesomemixvol2  San Pablo,"
835,861949831509573632,Movie time
836,861948947220365313,"#GuardiansoftheGalaxy Volume 2 felt kind of slow to get going, but I cried like a baby at the end."
837,861948627241009153,Baby Groot is the Messiah the Galaxy Needs in the Age of Donald Trump
838,861948589437833217,What did you think of #GuardiansoftheGalaxyVol2?
839,861948213120708608,TheEllenShow Beware of the Freaking #GuardiansOfTheGalaxy's #Selfie !!
840,861947856625819649,Enter to win a #GuardiansOfTheGalaxy Vol.2 Prize Pack worth over $250!
841,861947796051472384,Guardians of the galaxy 2 review. #guardiansofthegalaxy #guardiansofthegalaxy2 #marvel #mcu #jamesgunn #gotg
842,861947238821527552,Rocket Raccoon teaser for Guardians of the Galaxy - Mission: BREAKOUT!
843,861947221557772288,"Everything you need to know about \""Adam\"" in #GuardiansOfTheGalaxy Vol. 2   via VanityFair"
844,861946537571753985,"Everything you need to know about \""Adam\"" in #GuardiansOfTheGalaxy Vol. 2"
845,861946499802025987,Rocket Raccoon teaser for Guardians of the Galaxy - Mission: BREAKOUT!
846,861946363269054465,The indyindians will wear Rocket Raccoon-style #GuardiansoftheGalaxy Jerseys Saturday:
847,861944841252593665,The way the Ravagers/Taserface were portrayed as brutal space pirates who are also deranged man-babies was brilliant.
848,861944399747567616,"If you liked the music in #GuardiansOfTheGalaxy, get to know the composer, tyler_bates!"
849,861943875060940800,Guardians Of Your #Classroom Tech
850,861943458449281024,Just watched #GuardiansoftheGalaxyVol2 . Soo COOOL!
851,861943075962331136,You know what would make #GuardiansoftheGalaxy risky?It AIN'T TALKING ANIMALS.  by TheRLKing
852,861942336829485056,screenjunkies What character in #GuardiansOfTheGalaxy do you think was the most well done in terms of character de
853,861941961770643456,Disney Infinity Yondu Marvel Super Heros 2.0 Edition Guardians Of Galaxy  #Marvel  via eBay
854,861940929573384193,I got #Rocket #Racoon Make The #Ultimate #80s #Mixtape And We'll Reveal Which #GuardiansOfTheGalaxy  via buzzfeeders
855,861940889672921088,Trouble With Truffles wins Milkshake of the Month! May's milkshake madness features #GuardiansOfTheGalaxy shakes!
856,861940472239071232,.Guardians I got a feeling...
857,861939941256843265,James Gunn Confirms #Ayesha's Role In #GuardiansOfTheGalaxy Vol. 3
858,861939867462254596,Rocket and Groot
859,861939735136043008,Check out #GuardiansoftheGalaxy Lot 3 #ComicBooks 4 #TradingCards #Ego #Gamora #Starlord   via eBay
860,861939430508044288,Photo Alert: #VarunDhawan hangs out with the #GuardiansOfTheGalaxy  #GotGVol2 Varun_dvn
861,861939430000558080,The votes are in! #robot #rocketraccoon and #groot won from my #guardiansofthegalaxy twitch livestream earlier. I'
862,861939384664309760,Rocket with Groot #funkopops #funkopop #funko #pops #pop #rocket #groot #guardiansofthegalaxy
863,861939375973711873,Photo Alert: #VarunDhawan hangs out with the #GuardiansOfTheGalaxy  #GotGVol2 Varun_dvn
864,861939170419384320,#SciFiTVRatings: #GuardiansOfTheGalaxy had a 0.5 rating w/230k tot viewers for the three eps it aired Sat morning.
865,861938869385744384,I'm Mary Poppins Y'all!
866,861938849735479296,"\""Alexa, am I a disgusting pet?\"" \""A disgusting pet has been added to your shopping list.\"""
867,861938593773879298,"\""Fox On The Run\"" - \""Guardians of the Galaxy Vol. 2\"" Movie Review"
868,861938193880449028,Enter to win a #GuardiansOfTheGalaxy Vol.2 Prize Pack worth over $250!
869,861936389855883264,I AM GROOT - Groot 2017
870,861935816788017152,Try and convince me that there's a better mix of songs than a shuffled playlist of #GuardiansOfTheGalaxy Awesome Mix 1 and 2.I DARE YOU.
871,861934436102918145,Meet Baby Groot  aww he's so cuteeee
872,861934386664669184,"[SPOILER]Was \""I'm Not In Love\"" by 10cc in #GuardiansoftheGalaxy foreshadowing?"
873,861934238563741696,"My reaction during #GotGVol2  9 years now, but still relevant..."
874,861931001492242432,Rocket Raccoon #1 by Bill Mantlo and artofmmignola (1985)#Marvel #Comics #80s #1980s #GotG #RocketRacoon
875,861930414285484033,Enter to win a #GuardiansOfTheGalaxy Vol.2 Prize Pack worth over $250!
876,861930288104034306,Rocket Raccoon #lego #guardiansofthegalaxy #legominifigures #guardiansofthegalaxyvol2 #marvel
877,861930058977595393,I predict that the next #GuardiansOfTheGalaxy movie will be 10 minutes long with 2 hours of credits scenes and still make 7 billion dollars
878,861929480763387904,I freakin roared
879,861928823381782528,"this week, delving into #GuardiansOfTheGalaxy#science from plant regeneration to cassette tapes"
880,861928822056390659,Aussie Marketer lost in New York is out!
881,861928744541331456,#GuardiansOfTheGalaxy Cutting Board for the kitchen? Yes please!
882,861928633660620800,The #GuardiansOfTheGalaxy are trapped at Disneyland and NEED your help!
883,861928508318199808,"For 26 years old, these #GuardiansOfTheGalaxy comics are amazing!!!"
884,861928112766038016,Follow gb_reviews &amp; enter for your chance to WIN the #GuardiansoftheGalaxy Giveaway! #GotGVol2 Click here to enter:
885,861928078083280900,"Wow, Drax and Gamora had some awkward teenage years."
886,861927185120100357,#Drax art. Will post this one for sale so you can own it!
887,861927014575603713,"Finally getting to see Vol. 2 tomorrow, so we are watching the first to get ready! #guardiansofthegalaxy #vol2"
888,861926051378860032,Getting hyped for
889,861925750873538561,Groot is ready to see GotG2!
890,861924984633143299,We have everything you need to know about Guardians 2
891,861924392720314369,My completed weekly Yondu inspired page!
892,861923592677838848,"this week, delving into #GuardiansOfTheGalaxy#science from plant regeneration to cassette tapesmp3:"
893,861921454492876802,i'm groot... I love you groot... so groot bikin ngakak... #guardiansofthegalaxy
894,861921304991150080,Just got #GuardiansoftheGalaxy telltalegames.
895,861920785488850946,You all ready to read about the GuardiansOfTheGalaxy Vol 2  Easter Eggs?
896,861920614357053440,I'm obsessed with these soundtracks!
897,861919775949238272,Enter to win #GuardiansOfTheGalaxyVol.2 Prize Pack worth over $250!#TheHoppingBloggers#Giveaway#GotGVol2
898,861919033255448577,"Cover of the Day: Rocket #1, out tomorrow! #RocketRaccoon #GuardiansOfTheGalaxy Marvel"
899,861917702310506497,I'll rather be a follower of believers than become a bellieber
900,861917453261123586,Guardians Of The Galaxy Genuine Leather Jacket on SALE &amp; FREE Shipping
901,861913869110923264,What is your favorite song from the #GuardiansoftheGalaxyVol2 soundtrack?
902,861912961694281728,"This going to be really good, and these promos are great."
903,861910611067899904,#GuardiansOfTheGalaxy  prattprattpratt Repeat THIS.
904,861909894387126272,"If you're heading to the ODEONCinemas to see #GuardiansOfTheGalaxy, show us your ticket and we'll give you 25% off"
905,861908876253319168,Guardians of the Galaxy Celebrities &amp; Me! w/Linky! #GotGVol2Event Guardians #GuardiansoftheGalaxy  via gaynycdad
906,861908440326651904,- 'I am Ego' GOTG Vol. 2
907,861908302925516800,Caroline and I really like #GuardiansOfTheGalaxy.
908,861907016163393536,Totes enjoyed #GuardiansOfTheGalaxy.
909,861906180674899968,Galaxy bark is fun not only for #StarWars but also
910,861905395136299009,We break down every major character and cameo from #Marvel's jam-packed #GuardiansoftheGalaxy sequel.
911,861904984308424704,"\""When I touch someone I can feel their feelings.\""- Mantis......#guardiansofthegalaxy"
912,861902687113228289,WELCOME TO THE 'FRIKIN' GUARDIANS OF THE GALAXY!........#guardiansofthegalaxy
913,861902667005792256,Galaxy bark perfect for
914,861901730560303104,The Chain
915,861901380897918978,Photo Alert: #VarunDhawan hangs out with the #GuardiansOfTheGalaxy  #GotGVol2 Varun_dvn
916,861900058563891201,screenjunkies Pick one Guardian and one Avenger to swap teams! #MovieFights #GuardiansoftheGalaxy andysignore MurrellDan
917,861898991671418880,I've just watched new #GuardiansOfTheGalaxy. Full of emotions.
918,861893708874223616,Meet
919,861892330227458050,Enter to win a #GuardiansOfTheGalaxy Vol.2 Prize Pack worth over $250!
920,861891215620550656,Im live streaming drawing #Robot #rocketraccoon and #groot from #GuardiansOfTheGalaxy - come talk to me
921,861889632736346112,A new member in the gang ...#guardiansofthegalaxy #chapter2 #newmember #picoftheday
922,861888214050590721,Hey ArcLightCinemas is there any chance you happen to sell this poster somewhere? #guardiansofthegalaxy #GOTGV2
923,861884179109335040,The latest Papa Reads!  Thanks to mentalexotica thevirdas schmmuck
924,861881344644661248,Thus far all the space kind of films didn't satisfy much #GuardiansoftheGalaxy did that too extent so lets see the volume 2
925,861877157571809280,#Rocket gives first look at storyline for new #Disney ride #GuardiansoftheGalaxy #MissionBreakout  #Disneyland
926,861876667215687680,Guardians of the Galaxy: How Today's Students Can Preserve American Liberty  #TheDeepState
927,861873878360088576,Current jam! Anyone wanna go for round 3 of guardians 2 with me? #guardiansofthegalaxy
928,861873525510025217,#guardiansofthegalaxy #guardiansofthegalaxyvol2 #gotg #gotgvol2 Scan and save the universe
929,861872946066972672,My #four new #shirts i #bought today! I #love them!!! #rocketraccoon #guardiansofthegalaxy
930,861870581100183553,JamesGunn is one of the revengers from GOTG vol 1 a cone head?  Like from SNL?
931,861869576166019072,#GuardiansOfTheGalaxy director talks about #Brandy and his own life
932,861869149093548032,On the docket today: #LEGO #GuardiansOfTheGalaxy! Gonna get building &amp; shooting once I've had my coffee. Norton_PR
933,861868572326465536,Aww how cute is this!? You can now meet Star Lord and Baby Groot from #GuardiansOfTheGalaxy at Disney's HollywoodSt
934,861868365761138688,#GuardiansOfTheGalaxy #Vol2 coming soon to unravel the mystery of Peter Quill's true parentage!Booking going on...
935,861868027574456321,Can't wait to meet star lord and GROOT again!!!#guardiansofthegalaxy #groot #starlord #disney
936,861866863646695424,Marvel's Guardians of the Galaxy: Get To Know the Original Cosmic Team - CBR
937,861866243963453444,#GuardiansOfTheGalaxy is the most fun oriented series in marvel's line of comics. Like vol. 1 enjoyed vol.2 a lot. Entertained!!
938,861865821605441536,JamesGunn will we see some editions to the #GuardiansOfTheGalaxy in Vol. 3Like Nova or even Howard the Duck
939,861865020354953216,Done ! colorfabb_official
940,861862816793456640,JamesGunn has done a great job. Kudos.
941,861862344195952640,Rocket Raccoon enlists Disneyland guests in a mission to rescue the #GuardiansoftheGalaxy in new ride ad:
942,861861878380756994,#IAmGroot (we are all #Groot)#GuardiansOfTheGalaxy Check out the Groot biscuits by kjlamb_art!
943,861857809691844608,I want a Baby Groot. #GotGVol2 #GuardiansOfTheGalaxy
944,861857019396997120,"prattprattpratt just saw GOTGV2 with my family, loved it!"
945,861856787955412992,Ever wonder what a dick looks like? #Spoiler alert from a guy who didn't like when a girl made fun of him.
946,861855960486117376,I'm Mary Poppins Y'all! - Yondu#guardiansofthegalaxy #mrbray #animate #illustration #animation #nerd
947,861855627429253120,The latest The arts &amp; new media Weekly!  Thanks to snurb_dot_info
948,861854573761310720,James Gunn Hints at Guardians of the Galaxy 3 Release Date
949,861852010479591424,Just watched by the billionth time #GuardiansOfTheGalaxy w/ JamesGunn as tour guide. Can't get tired of this space
950,861851903528980485,"Guardians of the Galaxy Star Lord Music Mix Figure,Discount Price of 19.99 #guardiansofthegalaxy #mindstormtoys"
951,861851862248472576,"#guardiansofthegalaxy y'all...it has so much heart. I laughed, cried and then laughed again. JamesGunn, you killed it."
952,861851224634646530,sleepy head even after coffe#soundtrip na lang#guardiansofthegalaxy soundtrack
953,861850922430865408,"In case you missed it, here's a link for the first #GuardiansOfTheGalaxy Trailer on youtube!"
954,861849911511457793,Yondu - sketch on the tube #yondu #guardiansofthegalaxy #illustration #sketch #londonart #lilliu
955,861849129449697280,"\""We are Groot.\"""
956,861848584370745344,It is ALL about new T-shirt excitement this morning!!!! #GuardiansOfTheGalaxy *eeeek*
957,861847587342647296,#GuardiansOfTheGalaxy : Awesome Mix Vol. 2  via YouTube
958,861846674544758784,Chris Pratt Apologizes t
959,861843401871835137,Watching #GUARDIANSOFTHEGALAXY while enjoying a #Hanalei #IslandIPA from KonaBrewingCo.  Good way to end the night.
960,861842514323456000,Watching #guardiansofthegalaxy. So much hype with the 2nd movie I had to finally watch the 1st.
961,861840735548649472,"#GuardiansOfTheGalaxy Volume 2 Review; A Good, not Great Sequel"
962,861837693692645376,I'm Groot JamesGunn prattprattpratt vindiesel DaveBautista zoesaldana #HookedonHorror #Groot #IamGroot
963,861837237096513536,"\""You're beautiful... on the inside.\""  #GuardiansOfTheGalaxy Vol 2 review with victor_kwon. #SoCalEdition..."
964,861837092149538816,Rocket needs you! will you help the #guardiansofthegalaxy mission breakout opening may 27th at
965,861837082729234432,No reason for this tweet... juat to see the awesomeness of
966,861836135676469248,Pelvic sorcery
967,861836071478464512,#GuardiansOfTheGalaxy Vol. 2  Upto 160 Cashback
968,861834162562519040,#GuardiansoftheGalaxy: 15 Biggest Changes From The #Comics To The Movies
969,861834047215083520,My level of maturity #GuardiansOfTheGalaxy #GotG #GuardiansOfTheGalaxyVol2 #Marvel #Groot
970,861833159196987392,Check out this highlight from my most recent stream!
971,861832898017542144,Seeing all the Trash Pandas again. This time in Dolby Vision HDR
972,861832622888148992,"#GuardiansOfTheGalaxy used RED Weapon 8K Vistavision cameras, watch why"
973,861832576926965761,I'm gonna died surrounded by the biggest idiots in the galaxy.
974,861830545348718592,"Asleep for the danger, awake for the money as per freakin usual!"
975,861830534346924032,Just finished 1st half of our ep.1 run through of guardians of the galaxy telltale series! up on YouTube tomorrow!
976,861829835345219584,"JamesGunn thank you so much for making #GuardiansoftheGalaxy such an incredible franchise. It has made a bad month better, again."
977,861829527663783936,screenjunkies #moviefights Pitch a #GuardiansoftheGalaxy ride at disneyland!
978,861828514714181634,Hooked On A Feeling Blue Swede 1973 That song belongs to me!
979,861828501892194304,"redbox Thanks #RedboxMondays for the free movie, I &lt;3 it!"
980,861828085766909952,Hey if it isn't Starprince!
981,861827820263272448,"You look like #MaryPoppins, Whos that? Is he cool?"
982,861827507703754752,'Guardians
983,861826731744821248,When Peter met Gamora!
984,861826330580701184,"It's not cool to get help, walk by yourself, you little gargoyle!"
985,861825416344064000,They wanted to eat you!
986,861824512744013824,"\""It's so beautiful!\"" \""It is. And so are you! On the inside\"""
987,861823806599561216,Every name Rocket gets called in #GuardiansoftheGalaxy...
988,861823683261849600,So pretty!
989,861823208286179328,"Some of #guardiansofthegalaxy #missionbreakout, this has been one of the most demanding issues I ever draw, think..."
990,861822529727414274,"Some of #guardiansofthegalaxy #missionbreakout, this has been one of the most demanding issues I ever draw, think..."
991,861821947897884676,May 4th  May 8th  2017 #AmericanGraffiti #guardiansofthegalaxy #ticketstuboftheday
992,861821874023444481,People of Earth: #GuardiansoftheGalaxyVol2 was better than #guardiansofthegalaxy.
993,861820844351213568,Physics friends...is a Quantum Asteroid Field like in #GuardiansOfTheGalaxy 2 possible or just an attempt to show...
994,861818575882944513,"Saw #GuardiansoftheGalaxyVol2 yesterday, twice! Time for #GuardiansOfTheGalaxy again!!"
995,861818448053252101,Episodio 620 de ComicGeekos: Guardians of The Galaxy Vol. 2  #podcast #cmics
996,861818420731531264,Crazy....#GuardiansOfTheGalaxy#Makeup #Drax #SciFi
997,861817492808900608,Such an amazing Guardians of the Galaxy 2 illustration done by andyparkart #guardiansofthegalaxy #guardiansoftheg
998,861817348482838528,last Thursday kicked off my 4 day wknd with the #GuardiansOfTheGalaxy #3D double feature. Got to
999,861817036938199040,Chris Pratt Guardians Of The Galaxy Premiere Suit #Movie #Premiere
1000,861816341690552320,Follow gb_reviews &amp; enter for your chance to WIN the #GuardiansoftheGalaxy Giveaway! #GotGVol2 Click here to enter:
1001,861815717305270272,"Disneyland debuts new commercial for #GuardiansoftheGalaxy  Mission: BREAKOUT!, opening May 27."
1002,861815250781216768,Guardians of the Galaxy: Watch the Evolution of the Star Characters
1003,861814326826606592,Not sure why we're not getting the upgrade in WaltDisneyWorld ... Bring the #GuardiansOfTheGalaxy to Orlando
1004,861814248497750016,Seeing all the Trash Pandas again. This time in Dolby Vision HDR
1005,861812775315812352,Guardians of the galaxy- Yondu cosplay. --#guatemala #comicon #comics #guardiansofthegalaxy
1006,861812134530793472,Nebula from #GuardiansOfTheGalaxy looks like the #Moonlight movie poster.
1007,861811370165231616,Twitter Likes and followers hack #montral#GuardiansOfTheGalaxyMiddlesbrough
1008,861811332831625216,Guardians of the Galaxy 3: Ayeshas Role Confirmed by James Gunn  #hollywood  #movie  t
1009,861808410626584576,Enter to win a #GuardiansOfTheGalaxy Vol.2 Prize Pack worth over $250!
1010,861808272285806592,"NEW SHOW! #NBAPlayoffs, #NASCAR issues? #MLB #MattHarvey #ZO2 #GuardiansOfTheGalaxy quick review, #RedSox..."
