,tweet_id,text
0,862346967820750848,Some peoples in india don't know the difference between #republicday &amp; #independenceday still they are showing #Patriotism\n
1,862342222641016832,Stars stripes heart bedazzled t-shirt July 4th $35 #sale #dmv #va #independenceDay SMS4013249374 _
2,862339918873362432,RT laitman: Independence Means Independence From Mutual Hatred haaretzcom
3,862337208778448900,"Mix &amp; Match Red, White, Blue! Rustic wood US flag decor blends with vintage milk glass"
4,862336281396875264,4th of #July Confetti eggs dozen Cascarones
5,862334852498169858,RT EladRatson: #Israel\ud83c\uddee\ud83c\uddf1 celebrates its 69\u1d57\u02b0 #IndependenceDay\ud83c\udf89 No #movie\ud83d\udcfd\ufe0f captures the true significance of this day like Exodus with Pau\u2026
6,862334221406412800,RT laitman: Independence Means Independence From Mutual Hatred haaretzcom
7,862333614922452992,RT laitman: Independence Means Independence From Mutual Hatred haaretzcom
8,862325816079863808,Stars stripes heart bedazzled t-shirt July 4th $35 #sale #dmv #va #independenceDay SMS4013249374 _
9,862313609795313664,RT Ghersi_Angel: I was waiting for this day since 20 years ago...\ud83d\udc7d\ud83d\udc7d\ud83d\udc7d  #IndependenceDay IndependenceDay
10,862309491953598466,Stars stripes heart bedazzled t-shirt July 4th $35 #sale #dmv #va #independenceDay SMS4013249374 _
11,862308350595346432,"RT Marshall_Center: Happy #IndependenceDay to our 546 #alumni from #Romania, a strong partner in our network AmbasadaSUA MAERomania USA\u2026"
12,862307877125373954,RT Froim: This colorful spread does justice 2the high spirit of #Israel69 #IndependenceDay party in #Delhi (even if it doesn't 2my name :)\u2026
13,862305855403827200,"RT siwon407: \"" Happy Independence Day Indonesia :^) \""\n"
14,862305753654190080,"RT Marshall_Center: Happy #IndependenceDay to our 546 #alumni from #Romania, a strong partner in our network AmbasadaSUA MAERomania USA\u2026"
15,862301587435397122,"RT AlisonDesigns: Red, White &amp; Blue Cotton Yarns available at Truslow Marketplace!  #independenceday #4thofjuly  ht\u2026"
16,862296470573154304,Independence Means Independence From Mutual Hatred haaretzcom
17,862293108821819392,RT artbyasch: 4th of #July Confetti eggs dozen Cascarones  #Etsy #independenceday #4thofjuly #memorialday #party #e\u2026
18,862293100684857344,Stars stripes heart bedazzled t-shirt July 4th $35 #sale #dmv #va #independenceDay SMS4013249374 _
19,862288189372776448,RT ThisIsMaldives: Celebrating Golden Jubilee of
20,862283213519147008,"RT Marshall_Center: Happy #IndependenceDay to our 546 #alumni from #Romania, a strong partner in our network AmbasadaSUA MAERomania USA\u2026"
21,862281788953067520,RT artbyasch: 4th of #July Confetti eggs dozen Cascarones  #Etsy #independenceday #4thofjuly #memorialday #party #e\u2026
22,862281788911226880,RT artbyasch: 4th of #July Confetti eggs dozen Cascarones  #Etsy #independenceday #4thofjuly #memorialday #party #e\u2026
23,862281788860846080,RT artbyasch: 4th of #July Confetti eggs dozen Cascarones  #Etsy #independenceday #4thofjuly #memorialday #party #e\u2026
24,862279936907849730,4th of #July Confetti eggs dozen Cascarones
25,862278060955119616,RT homedoctor_kol: We wish you and your family a happy
26,862261173412089856,Check out this gallery of awesome behind the scenes photos from the making of #IndependenceDay (1996).\u2026
27,862243947896242176,"If they'd played #TheCarpenters 'Interplanetary Craft' song to aliens on #IndependenceDay, it may have avoided this"
28,862239157065834496,"RT Marshall_Center: Happy #IndependenceDay to our 546 #alumni from #Romania, a strong partner in our network AmbasadaSUA MAERomania USA\u2026"
29,862238886797479936,Maybe it's time to storm the #Capitol like the #French did at the #Bastille. Time for another
30,862237192667660292,RT Jonbuckhouse: I wish I was home so i could watch some amazing fireworks today :)
31,862233626620157952,RT michaeldickson: Israeli Air Force Fly-by for
32,862226375998140416,Happy #IndependenceDay #Romania from Al Seef Resort &amp; Spa by Andalus.
33,862222134818492417,"RT ChildofKekistan: A nation can't stand on it's own, jk_rowling? Yeah. I think it can. I'll see you on"
34,862216261014614016,RT Celux01: HAPPY BIRTHDAY #ROMANIA! Happy #independenceday \nBeautyful Country! Very Kind People!\n#Timisoara first horse-car - first light\u2026
35,862214902936686592,RT Celux01: HAPPY BIRTHDAY #ROMANIA! Happy #independenceday \nBeautyful Country! Very Kind People!\n#Timisoara first horse-car - first light\u2026
36,862213771875553281,"RT ChildofKekistan: A nation can't stand on it's own, jk_rowling? Yeah. I think it can. I'll see you on"
37,862212916736610304,"A nation can't stand on it's own, jk_rowling? Yeah. I think it can. I'll see you on"
38,862212195341520898,"Happy #IndependenceDay to our 546 #alumni from #Romania, a strong partner in our network AmbasadaSUA MAERomania\u2026"
39,862204088854999041,HAPPY BIRTHDAY #ROMANIA! Happy #independenceday \nBeautyful Country! Very Kind People!\n#Timisoara first horse-car -\u2026
40,862201802841890816,This Friday! Come &amp; meet us! Explore ONEm services and WIN prizes! #IndependenceDay #Philippines #filippines #Dubai\u2026
41,862185986272485377,Happy Romanian Independence Day \ud83c\uddf7\ud83c\uddf4
42,862184640664264704,RT Spencer_Fearon: Massive big up to stephenggoodwin keeping the life in small hall shows #IndependenceDay #YorkHall BiolaKudus \ud83d\udc4a\ud83c\udffe
43,862160865126215681,mysteriousuniv Funny scene from #IndependenceDay clip-&gt;  #UFO #sex #alien #BlueAvians\u2026
44,862158590639058944,Thank you authorbencoes. I just finished #IndependenceDay. Another amazing book. I highly recommend the entire #DeweyAndreas series.
45,862121382217437184,Celebrating #memorialday &amp; #independenceday a little early with this special mountaindew.\u2026
46,862120092666011648,RT Froim: This colorful spread does justice 2the high spirit of #Israel69 #IndependenceDay party in #Delhi (even if it doesn't 2my name :)\u2026
47,862098233836937217,RT Kattitude1211: Break out the tiaras! #MrBar23 and #MsLovesBeardedMen are coming to Chi-town July 4th! #yes #IndependenceDay madatmytea\u2026
48,862098131579797504,Break out the tiaras! #MrBar23 and #MsLovesBeardedMen are coming to Chi-town July 4th! #yes #IndependenceDay\u2026
49,862095620013555712,I wanna see that. #ImpeachTrump on
50,862091062793326592,Not sure about this... but I guess it works for
51,862064840747175937,Come be Americans w/ us on July 3 at fairsaintlouis - it\u2019s free! W/ 3doorsdown sisterhazelband &amp; more.\u2026
52,862044996542881797,RT AuthenticRabbis: Jews in Jerusalem and around the world mourn the tragic day. the #Zionist so-called #IndependenceDay. #YomHaZikaron #M\u2026
53,862043542579011585,RT EladRatson: #Israel\ud83c\uddee\ud83c\uddf1 celebrates its 69\u1d57\u02b0 #IndependenceDay\ud83c\udf89 No #movie\ud83d\udcfd\ufe0f captures the true significance of this day like Exodus with Pau\u2026
54,862025722872778752,This colorful spread does justice 2the high spirit of #Israel69 #IndependenceDay party in #Delhi (even if it doesn'\u2026
55,862016047590846466,RT WoodfordReserve: What's the right way to drink Woodford Reserve? Any way you want to. Happy #IndependenceDay.
56,862002217892630531,RT AGareev: Why #IndependenceDay is a major national holiday in the USA? - \nto commemorate and celebrate self-declaration as a new nation.
57,861968740832993281,Why #IndependenceDay is a major national holiday in the USA? - \nto commemorate and celebrate self-declaration as a new nation.
58,861966417050181633,Fourth Of July Wishes and Messages\n\n
59,861954688622743553,RT IndependenceDay: We knew they would return. #IndependenceDay: Resurgence is now on Blu-ray.
60,861943980141019137,Check out our 2017 Patriotic Holidays Catalog &amp; get your #MemorialDay and #IndependenceDay #floralsupplies needs
61,861921141278990337,RT PearlJam: Happy Fourth of July!
62,861918329979666432,"RT DanielJHannan: Exactly six months since #IndependenceDay. Where are we? Unemployment down, growth up, stocks rising, states queuing for\u2026"
63,861916168235487232,"RT DanielJHannan: Exactly six months since #IndependenceDay. Where are we? Unemployment down, growth up, stocks rising, states queuing for\u2026"
64,861914346842140672,"RT DanielJHannan: Exactly six months since #IndependenceDay. Where are we? Unemployment down, growth up, stocks rising, states queuing for\u2026"
65,861909595106664448,RT erinvholland: When you meet Mr #JurassicPark / #IndependenceDay himself \ud83d\ude4c\ud83c\udffb\ud83d\ude4c\ud83c\udffb
66,861905878802411520,"#Romania celebrates State #IndependenceDay, World War II Victory Day and #EuropeDay/ A country project needs..."
67,861896277252071425,Today is my
68,861893260230500353,"RT Hilajes81: 4M sorrow into joy, this is how we roll...a proud nation....happy #IndependenceDay #Israel #yomhaatzmaut  #happybirthdayisra\u2026"
69,861888385635450880,RT GoArmy: Start training for the future today. \n\nVisit  to take the challenge.\n\n
70,861884577102663681,"RT jewelrymandave: Patriotic American Flag Bead, Red, White and Blue Flag Bead, Patriot\u2026  #Etsy #IndependenceDay ht\u2026"
71,861883276771938304,"RT jewelrymandave: Patriotic American Flag Bead, Red, White and Blue Flag Bead, Patriot\u2026  #Etsy #IndependenceDay ht\u2026"
72,861874315737915392,"RT jewelrymandave: Patriotic American Flag Bead, Red, White and Blue Flag Bead, Patriot\u2026  #Etsy #IndependenceDay ht\u2026"
73,861850844844756993,RT yoosufmaaniu: Happy #IndependenceDay to all. The most awesome celebration yet. May Allah Bless you all.
74,861848498517487616,RT EladRatson: #Israel\ud83c\uddee\ud83c\uddf1 celebrates its 69\u1d57\u02b0 #IndependenceDay\ud83c\udf89 No #movie\ud83d\udcfd\ufe0f captures the true significance of this day like Exodus with Pau\u2026
75,861844759387586560,RT MohamedNasheed: Pleased to be here in #SriLanka on your 69th #IndependenceDay. Sri Lanka offers us Maldivians hope for a democratic fut\u2026
76,861844181739642881,RT CrossFit: Happy fourth
77,861837059513880576,"RT jewelrymandave: Patriotic American Flag Bead, Red, White and Blue Flag Bead, Patriot\u2026  #Etsy #IndependenceDay ht\u2026"
78,861833442039869441,"RT jewelrymandave: Patriotic American Flag Bead, Red, White and Blue Flag Bead, Patriot\u2026  #Etsy #IndependenceDay ht\u2026"
79,861832739795939328,"Ah, yes, the 9th of may. Can't wait to see all those pretentious Russians to be proud of something they didn't achieve!"
80,861831140155555840,"RT jewelrymandave: Patriotic American Flag Bead, Red, White and Blue Flag Bead, Patriot\u2026  #Etsy #IndependenceDay ht\u2026"
81,861826437438984192,"RT jewelrymandave: Patriotic American Flag Bead, Red, White and Blue Flag Bead, Patriot\u2026  #Etsy #IndependenceDay ht\u2026"
82,861820353408061440,"RT jewelrymandave: Patriotic American Flag Bead, Red, White and Blue Flag Bead, Patriot\u2026  #Etsy #IndependenceDay ht\u2026"
83,861815494676021248,"RT jewelrymandave: Patriotic American Flag Bead, Red, White and Blue Flag Bead, Patriot\u2026  #Etsy #IndependenceDay ht\u2026"
84,861809743551094785,"RT jewelrymandave: Patriotic American Flag Bead, Red, White and Blue Flag Bead, Patriot\u2026  #Etsy #IndependenceDay ht\u2026"
85,861809298283823104,RT rajcheerfull: Celebrating the spirit of our #IndependenceDay ! \n\n#ShowYourColors #JhalakDikhhlaJaa ColorsTV
86,861809241216233472,"RT jewelrymandave: Patriotic American Flag Bead, Red, White and Blue Flag Bead, Patriot\u2026  #Etsy #IndependenceDay ht\u2026"
87,861809224002752512,"RT jewelrymandave: Patriotic American Flag Bead, Red, White and Blue Flag Bead, Patriot\u2026  #Etsy #IndependenceDay ht\u2026"
88,861809072357724160,"Patriotic American Flag Bead, Red, White and Blue Flag Bead, Patriot\u2026"
89,861782851074838529,Because it's true \ud83c\uddfa\ud83c\uddf8 #happy4th #independenceday #tshirtdesign \n
90,861751787920994308,is what we need for Trump for 7/4/17
91,861747637002919937,Tell me 9/11 wasn't an inside job
92,861743682323701760,BlackQueenLara SputnikInt #France isn't over #IndependenceDay of their EX-#colonies; it played a major contributi\u2026
93,861732329072537604,4th of July Confetti eggs 1/2 doz Cascarones
94,861729734228561920,RT Apolo1373: #IndependenceDay \ud83c\uddee\ud83c\uddf1\ud83c\uddee\ud83c\uddf1\ud83c\uddee\ud83c\uddf1 #IStandWithIsrael From a french Christian  with love. \ud83c\uddeb\ud83c\uddf7\ud83c\uddeb\ud83c\uddf7 israelpaix GWGoldnadel IsraelenFrance\u2026
95,861728336057434112,RT artbyasch: 4th of July Confetti eggs 1/2 doz Cascarones   #Etsy #4thofjuly #memorialday #independenceday #party\u2026
96,861727428632346626,RT RodgoldMD: Happy #Jerusalem50 sings and swings on #Israel69 #IndependenceDay. #Dance along these #Beautiful sites
97,861725885703098368,RT artbyasch: 4th of July Confetti eggs 1/2 doz Cascarones   #Etsy #4thofjuly #memorialday #independenceday #party\u2026
98,861722766067814400,realDonaldTrump It'll end when your taxpayer funded charades end. Hopefully very soon. Fingers crossed we take bac\u2026
99,861722503399579653,4th of July Confetti eggs 1/2 doz Cascarones
100,861713967303020544,RT E_Atomic:  for #travel #reading for #IndependenceDay check out my
101,861711555603423233,"I've been having a shitty couple of months, but then I remembered that Randy Quaid still exists."
102,861703233219301376,RT EladRatson: #Israel\ud83c\uddee\ud83c\uddf1 celebrates its 69\u1d57\u02b0 #IndependenceDay\ud83c\udf89 No #movie\ud83d\udcfd\ufe0f captures the true significance of this day like Exodus with Pau\u2026
103,861700932660338688,"RT Hilajes81: 4M sorrow into joy, this is how we roll...a proud nation....happy #IndependenceDay #Israel #yomhaatzmaut  #happybirthdayisra\u2026"
104,861697719248834560,Just in time for #IndependenceDay \ud83c\uddfa\ud83c\uddf8
105,861697689121173504,"RT AssafMoran: Making my way home, at the last part of #MemorialDay,  on the verge of #IndependenceDay, proud more than ever to be working\u2026"
106,861697664601206789,RT zeque66: #YomHaatzmaut #IndependenceDay #HappyBirthday #Israel\nI Stand with You Israel \nI love You Israel \nGod Bless You Israel \n\ud83d\udd4e\ud83c\uddee\ud83c\uddf1 ht\u2026
107,861697613078441984,RT IAFsite: #IndependenceDay has officially begun!
108,861697597056192512,RT sassysassyred: British &amp; Jews celebrating Israel's #IndependenceDay.\n\ud83c\uddee\ud83c\uddf1\ud83c\uddec\ud83c\udde7\ud83c\udfb6\ud83c\udf89\ud83c\udfb6\ud83c\uddec\ud83c\udde7\ud83c\uddee\ud83c\uddf1
109,861697549492768768,"RT IAFsite: A few of the amazing photos we received of the #IndependenceDay Flyover! Credit: Israeli Navy, Roey Reshef, Patricia Benezra,\u2026"
110,861696345685590017,RT ambassadorlion: Happy
111,861690190825500672,RT AmbRedaMansour: Happy #Israel #IndependenceDay .Many years of #peace and security and prosperity \ud83d\udc99\ud83c\uddee\ud83c\uddf1\ud83d\udc906\u20e39\u20e3\u2721\ufe0f\u262e\ufe0f #yomhaatzmaut #Israel69 h\u2026
112,861689969487880194,"#yomhaatzmaut #IsraelIndependenceDay #Israel69 last week Tuesday was Israeli national day, Israel is nearly 70. #independenceday \ud83c\uddee\ud83c\uddf1"
113,861682186902134784,RT gluegumdrops: 18 Fun 4th of July Traditions to Start with Your Family
114,861677342581825537,OMG you guys. It's over!
115,861676091068604419,"RT DrMarkBratton: The movie #IndependenceDay, but #WillSmith and #JeffGoldblum's roles are reversed. ...I'd watch that."
116,861665621536276480,RT UniteWithIsrael: Live footage of the IAF Aerobatic Team from the #IndependenceDay Flyover
117,861663690172633089,"RT AlisonDesigns: Red, White &amp; Blue Cotton Yarns available at Truslow Marketplace!  #independenceday #4thofjuly  ht\u2026"
118,861663476141481984,New #Erotica on #sale: Losing My Virginity on #IndependenceDay  #RT pls!
119,861662368861835268,"The movie #IndependenceDay, but #WillSmith and #JeffGoldblum's roles are reversed. ...I'd watch that."
120,861660414643458048,"RT AlisonDesigns: Red, White &amp; Blue Cotton Yarns available at Truslow Marketplace!  #independenceday #4thofjuly  ht\u2026"
121,861646584378826754,RT ArtsVintage: Handpainted Stars &amp; Stripes wood serving tray for back-yard BBQ's &amp; summer Picnics
122,861645882898427905,Handpainted Stars &amp; Stripes wood serving tray for back-yard BBQ's &amp; summer Picnics #MemorialDay #IndependenceDay\u2026
123,861639557871267841,RT NOWTV: London weather really is unpredictable...\n\n#IndependenceDay is coming soon
124,861635786692755456,RT NOWTV: London weather really is unpredictable...\n\n#IndependenceDay is coming soon
125,861633561555873797,London weather really is unpredictable...\n\n#IndependenceDay is coming soon
126,861630035056365571,RT cafreeland: Delighted to join Ambassador Barkan at last night's reception to celebrate Israel\u2019s #IndependenceDay. Canada stands firmly\u2026
127,861627177225375744,"\""Independence Day\"" by Mia Doi Todd  #IndependenceDay #MiaDoiTodd Lyr"
128,861620016470536192,Scouring #MapOfTheDay posts and came across this #IndependenceDay #map. Sharing for those looking to blow things up
129,861614825352437760,18 Fun 4th of July Traditions to Start with Your Family
130,861613687551008768,"Round palette wood painted Stars &amp; Stripes, wall hanging or table centerpiece  #MemorialDay\u2026"
131,861597827637628928,#Decorate Patriotically Affordably -  #4thofjuly #Dollartree #Holidays #Independenceday\u2026
132,861594327323103232,RT vote_leave: RETWEET if you voted leave today!
133,861577572055998464,In the #occasion of the #independenceday #Jordan this photo from #zain #celebration  of the\u2026
134,861571823615434752,"RT RealG_Savage: I can't celebrate #CincodeMayo? Alright you fucks, on #IndependenceDay I'm going to be shooting mortars at houses that ha\u2026"
135,861558181318713344,THATLL PUT HER DOWN AND FRENCH MAN.
136,861557960538898432,RT MikeyAceStudios: #IndependenceDay Retweet if you remember July 4 1993: Lex Luger's patriotic body slam to Yokozuna on the USS Intrepid\u2026
137,861553276600373248,realDonaldTrump Today we take another step closer to your exit from the White house!
138,861550738799022080,"RT CNN: Russian President Putin sent President Obama an #IndependenceDay message, the Kremlin says"
139,861547362640158720,"As sponsors of the #event, ONEm is pleased to invite you to meet us at our stand and enter the #prize draw!\u2026"
140,861545350452170753,Stars stripes heart bedazzled t-shirt July 4th $35 #sale #dmv #va #independenceDay SMS4013249374 (
141,861529101533839360,Stars stripes heart bedazzled t-shirt July 4th $35 #sale #dmv #va #independenceDay SMS4013249374 (
142,861522096400322565,RT ditmirbushati: Happy 9th Anniversary of Independence #Kosovo! #IndependenceDay #G\u00ebzuarDit\u00eblindjenKosov\u00eb
143,861513344964079616,RT cafreeland: Delighted to join Ambassador Barkan at last night's reception to celebrate Israel\u2019s #IndependenceDay. Canada stands firmly\u2026
144,861512853869735936,Stars stripes heart bedazzled t-shirt July 4th $35 #sale #dmv #va #independenceDay SMS4013249374 (
145,861496622311772160,Stars stripes heart bedazzled t-shirt July 4th $35 #sale #dmv #va #independenceDay SMS4013249374 (
146,861490376368148480,RT LondonEconomic: Is this the best marketing ploy ever?
147,861480370117771265,Stars stripes heart bedazzled t-shirt July 4th $35 #sale #dmv #va #independenceDay SMS4013249374 (
148,861464779008999424,RT GualErey: #Eritrea 26: No other country\u2019s #IndependenceDay is more powerful than Eritrea\u2019s.#EritreaAt26 #HandsOffEritrea \ud83c\uddea\ud83c\uddf7\u270a\ud83c\udffe
149,861464578789658625,RT cafreeland: Delighted to join Ambassador Barkan at last night's reception to celebrate Israel\u2019s #IndependenceDay. Canada stands firmly\u2026
150,861464142414315520,Stars stripes heart bedazzled t-shirt July 4th $35 #sale #dmv #va #independenceDay SMS4013249374 (
151,861461626733703168,"RT ZelmanPartisans: Yom Ha\u2019Atzmaut Then and Now, has much changed in #Israel?  #2a #2ndAmendment #IndependenceDay #\u2026"
152,861456160708341761,Independence Day (1996) Watch Online in HD\nWatch Now:
153,861447852610007040,Stars stripes heart bedazzled t-shirt July 4th $35 #sale #dmv #va #independenceDay SMS4013249374 (
154,861431593679892480,Stars stripes heart bedazzled t-shirt July 4th $35 #sale #dmv #va #independenceDay SMS4013249374 (
155,861429733392887809,"Stars &amp; Stripes US Flag sign, handpainted on reclaimed palette wood, ready to ship for #MemorialDay\u2026"
156,861415337895579648,Stars stripes heart bedazzled t-shirt July 4th $35 #sale #dmv #va #independenceDay SMS4013249374 (
157,861408690884235264,RT LiorHaiat: When #StarWarsDay and #Israel #IndependenceDay are on the same week
158,861402687610523648,RT EladRatson: #Israel\ud83c\uddee\ud83c\uddf1 celebrates its 69\u1d57\u02b0 #IndependenceDay\ud83c\udf89 No #movie\ud83d\udcfd\ufe0f captures the true significance of this day like Exodus with Pau\u2026
159,861400023921250304,RT artbyasch: 4th of July Confetti eggs 1/2 doz Cascarones   #Etsy #4thofjuly #memorialday #independenceday #party\u2026
160,861399829473370112,RT artbyasch: 4th of July Confetti eggs 1/2 doz Cascarones   #Etsy #4thofjuly #memorialday #independenceday #party\u2026
161,861399107507769348,4th of July Confetti eggs 1/2 doz Cascarones
162,861377420020023298,4th of #July Confetti eggs dozen Cascarones
163,861365778549014534,RT GualErey: #Eritrea 26: No other country\u2019s #IndependenceDay is more powerful than Eritrea\u2019s.#EritreaAt26 #HandsOffEritrea \ud83c\uddea\ud83c\uddf7\u270a\ud83c\udffe
164,861352525315936256,Stream Independence Day (1996) on GeekerMovies\nWatch Now:
165,861352448878940163,RT GualErey: #Eritrea 26: No other country\u2019s #IndependenceDay is more powerful than Eritrea\u2019s.#EritreaAt26 #HandsOffEritrea \ud83c\uddea\ud83c\uddf7\u270a\ud83c\udffe
166,861352171291455488,RT GualErey: #Eritrea 26: No other country\u2019s #IndependenceDay is more powerful than Eritrea\u2019s.#EritreaAt26 #HandsOffEritrea \ud83c\uddea\ud83c\uddf7\u270a\ud83c\udffe
167,861351593953853441,#Eritrea 26: No other country\u2019s #IndependenceDay is more powerful than Eritrea\u2019s.#EritreaAt26 #HandsOffEritrea \ud83c\uddea\ud83c\uddf7\u270a\u2026
168,861349930732072960,15th August is on Tuesday.  Celebrate #IndependenceDay in #India and #Pakistan by planning a trip to #Wagah over the weekend.
169,861340229659226112,Did you know...
170,861337047503699968,RT Fab_Bikini: CHECK THESE OUT!
171,861329276876017665,Ver Independence Day (1996) Online Gratis \nLink:  \n
172,861329137675448324,Regarder Independence Day (1996) Gratuit en Ligne \nLink:  \n
173,861329101193437184,Watch Independence Day (1996) Free Online \nLink:  \n
174,861324845325443072,RT Nigel_Farage: We've got our country back. Thanks to all of you.
175,861323850411155458,RT Nigel_Farage: We've got our country back. Thanks to all of you.
176,861322984178536448,I'm watching Independence Day #TelfieApp #IndependenceDay Going back 20 years with my 10-yo. It's too bad...
177,861322049645576192,RT Nigel_Farage: We've got our country back. Thanks to all of you.
178,861322006259740673,RT Nigel_Farage: We have done it! #IndependenceDay\n
179,861276763615350784,RT IsraelHatzolah: Happy 69th
180,861265689859903488,RT DLee475: I hear you...like #Willsmith in #independenceday!\ud83c\udf0f Independent02 elzjrenee
181,861261806831976448,"RT AlisonDesigns: Red, White &amp; Blue Cotton Yarns available at Truslow Marketplace!  #independenceday #4thofjuly  ht\u2026"
182,861257852190576640,GoldenBoyBoxing not taking huge #Mexican #IndependenceDay #boxing event to #UK &amp; make Canelo have to fight at 5am
183,861255623605985281,Independence Day Flag Heart in Needlepoint  Heart Ornament  via Etsy
184,861249784975425536,RT North_Pole_City: Christmas In July  #anticlaus #christmasstories #demiangels #holidays #independenceday #santacl\u2026
185,861246382073671688,Happy Independence Day to our beloved Israel \ud83c\uddee\ud83c\uddf1\ud83d\udc99\ud83c\udf88\ud83c\udf77\ud83d\ude0d\ud83d\udc90\ud83c\udf89\ud83c\udf82
186,861219041985351680,"Red, White &amp; Blue Cotton Yarns available at Truslow Marketplace!  #independenceday #4thofjuly\u2026"
187,861210730720309249,RT sassysassyred: British &amp; Jews celebrating Israel's #IndependenceDay.\n\ud83c\uddee\ud83c\uddf1\ud83c\uddec\ud83c\udde7\ud83c\udfb6\ud83c\udf89\ud83c\udfb6\ud83c\uddec\ud83c\udde7\ud83c\uddee\ud83c\uddf1
188,861199901840953344,"We watched the #IndependenceDay sequel. God it was awful, zero relating to the first film. #movies. Turned it off\n\nAre we angry and harsh?"
189,861193815536939008,I hear you...like #Willsmith in #independenceday!\ud83c\udf0f Independent02 elzjrenee
190,861183309585547264,RT PollaGarmiany: Happy #IndependenceDay to all friends and followers from #Israel. \u2600\ufe0f\u2721\ufe0f
191,861181408588558336,Did you notice the #Apple #productplacement in the #IndependenceDay #movie? I mean the aliens are using
192,861177657198825472,#IndependenceDay in #FranceElections2017. This is your chance. Vote
193,861176745982136321,#Filipinos in #UAE to mark #Philippine #IndependenceDay on May 12\n#news #society #expo #event\u2026
194,861169453308014592,Wine and fireworks #blue wine
195,861157521674743808,Christmas In July
196,861152820476694528,Independence Day (1996) Download Full Movie HD\nDownload Link:
197,861137122253819904,In the #occasion of the #independenceday #Jordan this photo from #zain #celebration n of the\u2026
198,861133874901995520,RT Stan_Fischer: #Poland = #BastionOfEurope real #ChristianEurope #IndependenceDay = #MarszNiepodleg\u0142o\u015bci 2016 (ENG SUB)
199,861125407382413312,It's time to start planning the next big
200,861112666147999745,RT IsraelBreaking: Israel at 69.
