,tweet_id,text
250,861376825213190144,itsruthb laVoixTVA Bonsoir Ruth welcome to Montreal
251,861376127390101504,Fantastic show! #BFS #buckinghamfriendsschool #peterpan  Buckingham Friends School
252,861370292677074944,"Every parent wants their littles to stay small. Never grow up, please! #PeterPan #NeverGrowUp #PSWeddingsAndEvents"
253,861367797502287872,Mermaid Print:    via Etsy
254,861350456643260416,Want to catch an L? #funrun2 #PETERPAN #OMAR35X #MissGermany loooooool 2&amp;1
255,861340507137617925,The smallest
256,861316110091784194,Second star to the right and straight on 'til morning! #peterpan
257,861311149689769989,"#ScareADisneyCharacterYou're an adult now, #PETERPAN.You have dwarfism, now get a job, and stop molesting children."
258,861309905071996928,I. Love. This. Ride. #magickingdom #waltdisneyworld #win #wdw #peterpan #peterpansflight
259,861309824159666177,"Every parent wants their littles to stay small. Never grow up, please! #PeterPan #NeverGrowUp #PSWeddingsAndEvents"
260,861304722954866688,Definitely watching
261,861295664931536896,Large Mermaid and Oyster Comb  via Etsy
262,861293881794719746,Had a raunchy dream about #PeterPan. I'm pretty sure I've crossed off everyone on my list...now what do I do?
263,861285288706011136,coinniss BelmontStakes ChurchillDowns Nope #PeterPan is in 6 days this Saturday
264,861283295518183424,ABD Productions present: 'Peter Pan' Thurs 3rd Aug - Sat 5th Aug 2017Read more...
265,861282267536216064,"coinniss BelmontStakes Yeah MASTER PLAN worked a bullet this morning ChurchillDowns, going up against TIMELINE in #PeterPan will be fun!"
266,861272555637821442,DisneylandToday Playing hide &amp; go seek w/Peter.
267,861269098159894528,"My #illustration for the atcsg Project #Neverland #ArtShow \""Poor Tootles: Who Shot Wendy Bird?\"". #Lostboys"
268,861264633038077952,"\""Second star to the right, and straight on till morning\"" - Peter Pan#prettykitty #author #kidslit #qotd #quote"
269,861254844824272897,#PeterPan playing hide-and-seek in
270,861253207112261632,Isn't he such a cutie???  #godsonlove #godmother #peterpan #lostboy  Victory Christian Center
271,861245976677429248,"The original #peterpan is the sadest, most beautiful, funiest story. Instant favorite."
272,861245513785638912,Attraction Peter Pan's Flight is back open and has a current queue time of 10 minutes.
273,861235222469373952,Friday movie night #hook #
274,861230133088182272,"Well, you did Tink, but I guess that's changed now ^_^;;"
275,861223062322253825,"We had a wonderful time at Peter Pan!!! Great Job, everyone!!!! #PeterPan #play #friends"
276,861220343213699073,Attraction Peter Pan's Flight is temporarily closed while there is a current queue time of 50 minutes.
277,861214128727261184,Guess who's going to Disney #wdw#magickingdom #waltdisneyworld #disneyworld #peterpan #happy
278,861211583741034496,I didn't realize Peter Pan had a new queue.
279,861211064985423873,Very early speculation: BUT IF #AlwaysDreaming wins PreaknessStakes &amp; TIMELINE wins #PeterPan then that will be the BelmontStakes match-up
280,861204257629851649,My coffee has an extra helping of pixie dust! #coffee #dapscaf2017 #radio #radiolife #PeterPan
281,861179365819908097,Peter  #disneylandparis #disneyshow #peterpan #mickeypresentshappybirthdaydisneylandparis#disneylandparis25
282,861159646312181761,You can be anything if you just believe!! #DramaMusical #PETERPAN
283,861137337299992577,Happy (could be any number as still looks the same as a 15yr old) birthday claireallan13 #peterpan
284,861134814220611584,"All children, except one, grow up NTLive host an encore screening of JM Barries beloved #PeterPan, 10 Jun"
285,861131877087928320,Love this  #peterpan #thinkhappy #youcanfly #inspiration #quote #quotes #quoteoftheday
286,861126603522293760,"Just think an Happy Thought, then you will fly whereever you wanted"
287,861115733736120321,#peterpan porn you forno korea girls xxx
288,861104122799456256,"Interesting #shadow tonight, came to rest upon my wall.. #peterpan #ninja #bw #shadowhunter"
289,861103134990618624,"Interesting #shadow tonight, came to rest upom my wall.."
290,861092690909442048,I love how excited staceys_story gets at the prospect of being in the same room as the person she dedicates her life to!
291,861083509443657728,"On EncoreRadioUK now, I've news of Cate Blanchett's return to the West End + another #DisneyDouble  with"
292,861070354952986624,B_G_M_W_Fans willfriedle I love this Movie!!!..#PeterPan is one of My Favorites Movies and I Saw This Game on Dis
293,861059123240214529,"Peter! ENQUIRY, especially on the chest. MARRIAGE 244 CHAPTER XIX.- Peter Pan in Etiquette"
294,861053524645249026,I would like to go back to that time when I left my window open for you #Peterpan When I used to believe in happy things.
295,861047902403211264,KelseaBallerini awesome job!
296,861047565827158016,We love KelseaBallerini !#peterpan #iheartcountry #iheartradio #bullpartyplane KristenRadio angiewardonline
297,861046385143160832,.KelseaBallerini giving us all the feels singing about her first heartbreak
298,861046307569319937,Can we relive this moment over and over again? #iHeartCountry KelseaBallerini
299,861046271330725888,I have met way too many guys who could be #PeterPan and will never grow up regardless of their age. KelseaBallerini
300,861046065520406528,"Always gonna find a way, just because you know you can! KelseaBallerini"
301,861045681645072384,KelseaBallerini got the lights at our #iHeartCountry Festival with ATT  #PeterPan  1037CKY   Listen at
302,861045681632489472,KelseaBallerini got the lights at our #iHeartCountry Festival with ATT  #PeterPan  1037CKY   Listen at
303,861045447640723456,Hey alabamaradio put up your other middle finger!! KelseaBallerini is on stage!
304,861045409199816704,#iHeartCountry  KelseaBallerini  every girl thanks u for #peterpan cause unfortunately weve all had one. Every word is spot on.. Thank you
305,861044996111298560,One of my fav songs #PeterPan KelseaBallerini
306,861044959713034240,KelseaBallerini is #romper that stage tonight.
307,861042165551693824,"PowerMusicTeam #Dreamcasters #PeterPan \""Tinker Bell\"" plz RT"
308,861037312876175360,#LostBoy Response to kelseaballerini 's #PeterPan is on #iTunes #Spotify #AmazonMusic ... Where
309,861033904387612673,$/o to the manz tdollag5 fly like I'm
310,861028327808802816,#Disney #PeterPan and #Tinkerbell Framed Painting 18 x 14
311,861023409400037376,"#Poor #PeterPan, have #happy #thoughts, don't hate #stories of #WendyLady cause they are 9.99%"
312,861022954280374274,Finding Neverland with AliceFelch &amp; sobiwhoa
313,860998609332043777,Having a blast
314,860998596652675072,Want to catch an L?
315,860995926655152133,.MRAonBIG just found KelseaBallerini backstage and she approves of alabamaradio's #PeterPan nails!
316,860979161040654338,Look at his long squishy face +++++#poodle #miniaturepoodle #peterpan #disneydog #dog
317,860975727042338817,"Told y'all to stay tuned for my new tattoo, well here it is!!! #PeterPan #NeverGrowUp #PopsTattooParlor"
318,860969708253851652,Sending gifts to ones you love#peterpan
319,860968916180512769,"#FestivalofFantasy Parade Series \""Ladies and gentlemen, boys and girls, Welcome to the #MagicKingdom\"" WDWToday Off"
320,860965521017102336,"\""The moment you doubt whether you can fly...\"""
321,860962558416736259,RupertMoon boomerno6 official_parc scarlets_rugby TonyCopsey5 Thats Ang keeping him on his toes!
322,860929657327280129,"#Flashback 3 Years! chriscolfer wrote #Glee 5X19 \""Old Dog New Tricks\"" which aired on May 6, 2014 #KurtHummel"
323,860929039829090305,DisneyStudios can you please explain who this is... and why they are on my shirt? I'm so confused...  #Disney
324,860926037391065088,Grad cap!
325,860923470774902784,The final weekend to get your NewPeterWendy stuff!
326,860884262764945410,Honorary lost girl. ...#disneyland #peterpan #facecharacter #fantasyland  King Arthur's
327,860864886016020481,Love #PeterPan #ViewMaster #ToyStory at
328,860859098111324160,It's its.mystery1 on this new tune dubbed #PeterPan #newmusic #newvideo #love #africa #rnb
329,860857707225632768,Join us on Sat 10 Jun to watch a recorded performance of classic family tale #PeterPan screened dlwp auditorium.
330,860851501216002051,It's its.mystery1 on this new tune dubbed #PeterPan.. Video directed by Twittamogul #rock3sixty
331,860849377962844160,3 days to apply to for our #PeterPan supporting cast! Be a star on the TRwinchester stage this Christmas
332,860845040754724864,Once upon a time... Peter Pan natebuzz
333,860842938775031808,"You just think lovely wonderful thoughts, and they lift you up in the air. J.M. Barrie, Peter Pan#PeterPan"
334,860841763757543424,"The vast majority of our guests are in their early twenties, but some are just young in mind and attitude."
335,860819882073620480,Photos from the Mr crocodile photoshoot shot by Holly Brennan
336,860816915840761856,"Here are 12 #Disney classics to bring back the memories! #PeterPan, #Tarzan and #TheLionKing appear:"
337,860797542690435072,leewebber79 how are your 21 years old legs feeling this morning
338,860790815626588160,So when are we leaving Peter Pan??
339,860787930629120000,"Join us in Neverland!! Friday 12th May, 7:30pm"
340,860783312272535552,With the older ones from him. Que souleve un soupir d'amour.- The Picture of Peter Pan
341,860771814393425920,Interesting Facts About Peter Pan
342,860768006900768769,"\""Never say goodbye because goodbye means going away and going away means forgetting.\"" #PeterPan"
343,860743371249389569,Think of a happy thought. Any happy little thought.   ...........#peterpan #disney
344,860731418153959424,"New tattoo idea: \""second taco to the right, and straight on till morning\"" #"
345,860722320721235968,Wave coming in?  No problem...just fly away...#PeterPan #atthebeach #youcanfly #iwontgrowup
346,860697908861128705,"Check out Peter, exclusive to Wattpad!  #book #Wattpad #Wattys2017 #writing #peterpan #checkitout"
347,860696902089588737,"Some people cannot stand that youre moving on with your life, and so they will try to drag  #NetworkNumberOne.com"
348,860679906002206721,#HITSPLAY ladygaga - The Cure on #PETERPAN with Rudihidayaaat
349,860679839027744768,What an amazing night! #PeterPan #BFS BFS1794
350,860677549399191557,"Gretel,' she stood silent fellow, and bit of her face of Peter's answer.- Grimm's Peter Pan Tales"
351,860675479786856449,#HITSPLAY bobmarley FT iamlvndscape - Is This Love on
352,860670503098302467,#HITSPLAY jason_mraz - ColbieCaillat - Lucky on #PETERPAN with Rudihidayaaat
353,860669275002073088,#HITSPLAY edsheeran - Shape of You on #PETERPAN with Rudihidayaaat
354,860665142454796288,#HITSPLAY just_5sos_ - Amnesia on #PETERPAN with Rudihidayaaat
355,860664078947299328,CanningAndrea But of course...&amp; leave it 2me 2B autocorrect tweet victim. Just when I think I know where ur going
356,860662447807619074,Desmond is near me to oblige the day and not feel the inquiry all time.- The Hounds of Peter Pan
357,860657578056888321,#HITSPLAY maroon5 - Payphone on #PETERPAN with Rudihidayaaat
358,860653892375257088,#HITSPLAY Meghan_Trainor  FT owlcity - Thank You on #PETERPAN with Rudihidayaaat
359,860650250179977217,#HITSPLAY dawin - Jumpshot on #PETERPAN with Rudihidayaaat
360,860646613173157888,#HITSPLAY TheChainsmokers - Paris on #PETERPAN with Rudihidayaaat
361,860645195750273024,"\""You really act like a child for being 23\"" thanks for saying that girl"
362,860642194629283841,Teach them the classics! Peter Pan (1960 with Mary Martin as Peter) kaylacarrolljones #peterpan #familymovie #mov
363,860642157337747457,Teach them the classics! Peter Pan (1960 with Mary Martin as Peter) kcarrolljones #peterpan
364,860638658331688960,#HITSPLAY ddlovato - Made in The USA on #PETERPAN with Rudihidayaaat
365,860637199959810052,Rehearsal
366,860635529490055168,#HITSPLAY SOREband - SSSST on #PETERPAN with Rudihidayaaat
367,860634565571956737,All those guys just got washed
368,860633898975244288,#HITSPLAY davidguetta FT Sia - Titanium on #PETERPAN with Rudihidayaaat
369,860633583651889152,London's where it's at! Today's haul! #funkofriday #starwars #powerrangers #disney #peterpan #hansolo #chopper
370,860633014711099392,#HITSPLAY sayHIVI - Heartbeat on #PETERPAN with Rudihidayaaat
371,860623779030028288,a flying #PeterPan... an unmasked #Spiderman #PeterParker... a fork hanging out of his mouth
372,860610459690467328,I still cant quite understand people who dont look back at school with general fondness. Maybe i just dont want to grow up
373,860605606918598656,"An article with my final #illustration for the atcsg Project Neverland #ArtShow exhibiting today, May 5th!"
374,860603834292424705,#PeterPan was on the radio KelseaBallerini  See you in 51 days!!
375,860600311869710336,Check out Brown Floral print Fabric 44 inches by 33 inches Peter Pan #PeterPan  via eBay
376,860596625542184960,Live action reference shots for Peter and Wendy scenes.
377,860596370448764930,Unique Rare #PeterPan Brass Bell Pre Walt #Disney??? #Disney
378,860593947802038272,Life sounds so boring and dull. Nope.
379,860577693783527425,"Time hop on Facebook just depresses me even more, still trying to live in the past"
380,860573586960117763,AFI are you wearing leggings and shorts #PeterPan
381,860566137838473217,When my brother's (erjboy123) Apple ATT iPhone 7S decided to drop the signal and he went all #PeterPan and
382,860560346846593025,Only 1 show left! Tonight is sold out. Purchase tickets for the last Gr. 6-8 performance of #PeterPan this Sat. at
383,860556024192917505,"#OutdoorTheatre #Peterpan BosworthLCC on 29th July - visit  for times, prices and tickets"
384,860551819973582849,"#hook \""When the first baby laughed for the first time the laugh broke into a thousand pieces and they all went skip"
385,860541060614733825,I MISS YOU DAD ..........#peterpan #father
386,860540902389014528,Our Neverland inspired charm bracelet is now online with the new stainless steel chain design.  #PeterPan
387,860524529608609800,Mermaid Print:   via Etsy
388,860521778094985218,#CaptainAndTennille keeping me company during the #rainy ride on #PeterPan #Greyhound #bus to
389,860513288714629121,"I definitely am more of a Tiger Lily than a Wendy; stubborn, and I look great in feathers! Who are you most like?"
390,860505763374145536,"Published in 1911, explore this delightful adaptation of J.M. Barrie's famous play"
391,860496823777206272,Attraction Peter Pan's Flight is back open and has a current queue time of 55 minutes.
392,860495062412574725,Is #peterpan one of your favourite Disney movies? Grab my print!
393,860494404326436865,Our Neverland inspired charm bracelet is now online with the new stainless steel chain design.  #PeterPan
394,860494092400242690,Feeling the power of happiness
395,860493048526123010,Attraction Peter Pan's Flight is temporarily closed while there is a current queue time of 55 minutes.
396,860486859708923905,Brisk walk to #PeterPan in Kensington Gardens
397,860476662118576131,Currently playing KelseaBallerini #PETERPAN
398,860463721734447104,Interesting Facts About Peter Pan
399,860454016953745408,#goodmorningmanhattan #peterpan #bagels &amp; #flagels looking good #greenpoint #brooklyneats
400,860452789851484160,Attraction Peter Pan's Flight is back open and has a current queue time of 45 minutes.
401,860450270848929792,Attraction Peter Pan's Flight is temporarily closed while there is a current queue time of 45 minutes.
402,860439017028026368,"Tickets are selling fast for #PeterPan 7 Adult, 5 Concessions. Available from both Lutterworth College..."
403,860438442605510656,"Tickets are selling fast for #PeterPan 7 Adult, 5 Concessions. Available from both LuttColl receptions or by pho"
404,860432043506900992,#maryblair study of the mermaid lagoon from Peter Pan #mermay #mermaid #lagoon #peterpan
405,860431061293174784,"Tink, that's my interlocutor with intelligent help, as much in his secret.- Peter Pan's Great Expectations"
406,860422903090876421,carolineboden Thanks xx
407,860409799564902406,The Force Is Strong With This Haul! #disney #marvel #piratesofthecaribean #peterpan #maleficent
408,860400855593439232,"Mr. Darling found in a way, was an important piece of people began lapping it.- Alice in Peter Pan"
409,860355545198473216,Warring his nearest the basement of tea endow their will. Ginger Ale Aromatic .- Ulysses and Peter Pan
410,860339557824421888,Peter Pan Flying with Tinker Bell case
411,860336302402584576,Small Golden Feather Green Hair Comb  via Etsy
412,860336170353311744,Beautiful dinner theater evening with Rainbow Company Youth Theatre #PeterPan &amp; unlvcoe unlvcoeaa nctlv_ #nctlv_
413,860332876302360577,"New painting looks like shit, whoops."
414,860307890825031680,Couldn't be any prouder of all the students and staff who pulled off this fantastic performance! HolyRosaryM
415,860307789851140097,Great performance by the wonderful cast of #peterpan at ctgreensboro followed by cocktails
416,860306930832621568,My daughter as Tinkerbell in FrostigCenter prod of
417,860303763394895872,Just read J.M Barrie's Peter Pan: Here are three things that I learnt from his masterpiece!
418,860279220848574464,Second star on the right and straight on til morning... talltalesproductions #peterpan #tinkerbell #animation
419,860275748405469189,Thanks #PETERPAN NewPeterWendy that is exactly what we are going to have to do after today's vote #STOPTrumpCare i
420,860258742880927744,Is #peterpan one of your favourite Disney movies? Grab my print!
421,860253797628739585,"oh, happy day"
422,860241388943925248,Here's my OriginalFunko haul from yesterday!
423,860230621821632513,Peter Pan from Once Upon a Time#peterpanRt if you want itMust be following us!-Toni
424,860226077574221824,A #bookmark is an awesome little extra when you're gifting to those readers in your life
425,860222656796397568,"Ramsay Macdonald and J M Barrie of #PeterPan  had the same teacher, Mr Howie. Within the Scottish #diaspora , we all know everyone else."
426,860220243842654208,A fairy so tiny she could sit on a coffee bean! Made her at the weekend. caromfw #peterpan
427,860204825761460224,"So smiley today  #godchild #godmother #godsonlove #peterpan #lostboy  Tiffin, Iowa"
428,860203835779928064,Hate the people who say grow up ffs shut up you grumpy twats! Stay young as long as you can !
429,860203686471106560,Interesting Facts About Peter Pan
430,860202968129429504,"#PeterPan (Blu-ray/DVD, 2013, 3-Disc Set, Diamond Edition Includes Digital Copy) #Disney"
431,860202681033510914,Interesting Facts About Peter Pan
432,860201526719074304,Interesting Facts About Peter Pan
433,860201165216264192,Interesting Facts About Peter Pan
434,860200490998616064,Interesting Facts About Peter Pan
435,860199720119136256,Interesting Facts About Peter Pan
436,860199628322615296,So blessed to have this little man in my life  #godchild #godmother #godsonlove #peterpan
437,860198519067611136,Interesting Facts About Peter Pan
438,860198359038033920,Interesting Facts About Peter Pan
439,860198242608451586,Interesting Facts About Peter Pan
440,860197948562575360,Interesting Facts About Peter Pan
441,860177192768163842,Soul food - booked NTLive #PeterPan and RoyalOperaHouse #DreamSymphonicMarguerite Saffronscreen - gearing up to book #angelsinamerica
442,860169854199881728,"NEVERLANDIANS, #maythe4th be with you!"
443,860169807907307520,"NEVERLANDIANS, #maythe4th be with you!"
444,860169702043033600,"NEVERLANDIANS, #maythe4th be with you!"
445,860167355967655936,I am a #LostBoy from #Neverland probably hanging out with
446,860153876447612928,#peterpan  #imflying  #skydiving  iFLY
447,860153607492177920,Any potential Lost Boys and Girls out there for #PeterPan...? HampshireHCYC
448,860148348078235649,The ultimate #ThrowbackThursday Why did you have to grow up Wendy?!
449,860147908641001472,"Because, if it by election from its effects but little.- Authobiography of Peter Pan"
450,860147020471967744,#JuniorUniversity seeks talent for #PeterPan this summer! Young actors may audition 5/6 or 5/13 from 9am-1pm! Info:
451,860145653531508736,I don't know why I'd never noticed b4 but it amuses so much now...We're off to Never Never land..is there a thing BTW Metallica #PeterPan ?
452,860132804570558464,"Greenwich, and the right the profession! Tuesday morning after as ever.- Peter Pan in Great Expectations"
453,860132764489789441,"All children grow up, except one NationalTheatres #PeterPan is flying into theatres June 10th &amp; 11th! Tickets:"
454,860128050360590342,Walt #Disney Presents #PeterPan - 1952 Original Hardcopy Whitman ENDS SOON        via eBay
455,860125121071259649,Is #peterpan one of your favourite Disney movies? Grab my print!
456,860124025250607105,I love a good quote. One of my favorites from #peterpan this sign and more like it are now
457,860120606150406144,Why do they always make the cool shirts for dudes?
458,860120602723573760,"NEVERLANDIANS, #maythe4th be with you!"
459,860120557433405441,"NEVERLANDIANS, #maythe4th be with you!"
460,860120513204559872,"NEVERLANDIANS, #maythe4th be with you!"
461,860118064108580865,"Good to meet with ACCRobinSmith today. Worked together when he was a  #GurneyFund Trustee. He never ages, he's the"
462,860116309425569793,#HidePark easter egg??? #peterpan #bestoftheday #gramoftheday #igaddict
463,860112914447040512,Interesting Facts About Peter Pan
464,860104157356855296,Just realised I'm verified on Spotify follow me I'm dropping a new banger soon  #PeterPan out now
465,860102595666432002,"Pastor or else, but make warre forraign, and be deduced. Hoop la!- Peter Pan in Leviathan"
466,860072795186888704,"Year 3 have been flying today with a bit of...'trust, faith and pixie dust'!"
467,860063039252570112,We are looking forward to welcoming back the team at PointRadiusUk this evening! Remember to grab your tickets for
468,860054951086755840,This is adorable
469,860050134813609986,Going out today!
470,860041242628939778,Good night!
471,860030016129818625,Peter Pan Flying with Tinker Bell case
472,860020037771567104,Production is coming...#PETERPAN Centralprimary
473,859998680308482048,Only with #wendy #peterpan #disney #disneylandparis #disneyfreak #disneyadictos #disneyfan
474,859997381429014530,Neverland looks like the coolest place to be forever young
475,859993384919994368,"KelseaBallerini's #PeterPan, now playing on the #AllGirlPowerHour on"
476,859993375159746561,#PeterPan by KelseaBallerini is playing on the #AllGirlPowerHour right now KFROGRadio. This song makes me so emotional.
477,859977291815845888,Official #Disney #PeterPan pirate ship heroes Figures X 13 Toys
478,859972835392933888,I love it when my favorite quotes pop up on my calendar.
479,859968924431069184,JOHN DARLING #cosmay #peterpan #johndarling #disney #casualcosplay #girl #style #closetcosplay #challenge #
480,859954330551635968,Let's go to #neverland flying with #peterpan &amp; #tinkerbell ... ~ #secondstartotheright
481,859927499492409344,#Never #growup &amp; always have #fun
482,859918744071671809,Also anyone notice the KelseaBallerini tribute in there for the iHeartCountry Festival?! #PeterPan iHeartRadio
483,859914593728163841,Somewhere in Neverland #alltimelow #peterpan #neverland #dontpanic
484,859883130743791616,Day 120 on the Unintentional Fashion Blog#Disney #Disneyland #Peterpan #neverland #hottopic #forever21 #oldnavy
485,859865922206666753,Loved the #PeterPan episode ghosthatnetwork! Keep up the great work! We recently talked about #disney as well:
486,859864314886443008,Saddest death?
487,859852313376301057,At least photoshop out the horizontal towerblock NationalTheatre
488,859831631007420416,Forever #young with #PeterPanLeave your window open tonight and pretend to be in #London!#FoodontheRoad #Disney
489,859827239722024960,Guess who's flying into The Fox Theatre on May 16-21? That's right...it's #PeterPan in Finding Neverland - The...
490,859825004497842176,Gotta have faith trust and pixie dust. #tbt Youmacon! Meiko Vocaloid! #cosplay #meiko #Vocaloid #peterpan
491,859816001524957184,ABD Productions present: 'Peter Pan' Thurs 3rd Aug - Sat 5th Aug 2017Read more...
492,859815760532844544,"Day 13- A movie I used to love, but now hate: Well, I don't hate the movie, but I don't like it as much as I used t"
493,859814728322998272,From tomorrow - _QueenOfHoxton_ 's summer #rooftop bar opens - with a #PeterPan #Neverland theme
494,859814446973177856,That was a great game. out London! On to Dublin! #peterpan #hook #favoritemovie #DubLon2017
495,859812314199068673,Attraction Peter Pan's Flight is back open and has a current queue time of 30 minutes.
496,859808536779517953,Attraction Peter Pan's Flight is temporarily closed while there is a current queue time of 30 minutes.
497,859800805389418496,Now this bow I love.  Meet Tinkerbell.#tinkerbell #disney #disneyfan #peterpan #fairies #fairy
498,859791913662152704,For the first time.... I feel.... Wicked!#PeterPan #Megara #Disney #Cosplay
499,859787952465072129,"Coming up Friday May 19th-Sunday May 21st, there will be an amazing performance of #peterpan courtesy of"
500,859760242741194757,Set painting!!
501,859760194821255168,Set painting!!
502,859760120657522689,Set painting!!
503,859748808472776706,Peter Pan is live exclusively on #hottopic. #neverland #peterpan #funko #gottahavemypops
504,859735341632303105,"\""Second star to the right\""  #redbubble.com #peterpan #painting"
505,859734496987549697,"Bad, he shied at which was dead against clouds and stood aloof.- A Christmas Carol for Peter Pan"
506,859731773240074240,Is #peterpan one of your favourite Disney movies? Grab my print!
507,859722606328590336,Interesting Facts About Peter Pan
