,tweet_id,text
213,861113455587323904,ReadersGazette: Latest Book News... Hollywood's Last Icon: The inner demons of Ben Hur star Charlton Heston  #books\u2026
214,861113377099304960,Latest Book News... Hollywood's Last Icon: The inner demons of Ben Hur star Charlton Heston
215,861100805360844800,The Movie Preview Review Eps 222 - Ben - Hur
216,861100803951603713,The Movie Preview Review Eps 222 - Ben - Hur
217,861100101393154048,Ben-Hur; a tale of the Christ - Lewis Wallace | #History |500436402
218,861047297769062400,Achievement unlocked #3  Ben Hur free game  via YouTube
219,861042984703471616,1950s MGM Movie Prop - Roman Soldier's Cornu Horn War Trumpet Ben Hur Quo Vadis
220,861039837805248516,Review | Ben-Hur (2016)
221,861038597356617729,SnoopDogg come to 910 ben Hur road in Baton Rouge for a lit party #worththedrive \ud83d\ude18
222,861018337844842498,"Is This a Chariot or a Mini Cooper? No, Its The Ben Hur Armchair!"
223,861015299151331328,Outstanding teachers in Indiana history  Samuel K. Hoshour
224,861002979289309185,Ben Hur 2016 Hindi Dubbed Full Movie Watch\u00a0online
225,861000132573241344,"peliculita Oooo, Ben Hur is on my list."
226,860997410960441346,"SkiBum79 The English Patient, Atonement, Ben Hur, Braveheart, Julius Caesar (with Brando)..."
227,860993212973961217,"WBPicturesCan More public domain effects driven shit guaranteed to flop like Pan, Ben Hur, Gods of Egypt, Hansel&amp;G\u2026"
228,860989571554848768,TezLocke Ben Hur was the biggest disappointment! Absolute trash!
229,860979688025579520,"TrumpDefined Ben Hur finds his mother in a leper colony and sings \""To life, to life, le-chaim.\"" \n"
230,860970731428917248,RT Thefinnigans: Bigger than Ben Hur and more intriguing than
231,860970525534732289,Bigger than Ben Hur and more intriguing than
232,860965766765494276,"#ThingsJesusNeverSaid\n\""Ten dollars on Ben Hur to Win\""\n"
233,860964403751137280,Watch BEN-HUR Official Trailer (2016) Jack Huston Biblical Movie Remake\u00a0HD
234,860929378670317572,Join us Tuesday for a #CivilWarLecture about Quakers in the Civil War!  Book discussion at 5\u2026
235,860928626421882882,"#RadioGame #SmartMindz now live on WazobiaFMPH Answer 3 Ques, get 5k, (30sec/Que)\nQues 1. Author of 'Ben Hur'"
236,860928530707865600,"#RadioGame #SmartMindz now live on WazobiaFMPH Answer 3 Ques, get 5k, (30sec/Que)\nQues 1. Author of 'Ben Hur'"
237,860928184191156229,RT Rapagena: paulmac708 Day 28 - Ben Hur\nDay 29 - Interview With The Vampire (I did not believe Tom Cruise could play Lestat)
238,860927346626396160,paulmac708 Day 28 - Ben Hur\nDay 29 - Interview With The Vampire (I did not believe Tom Cruise could play Lestat)
239,860921573351489536,I just published \u201cAFI Number 100: Ben-Hur\u201d
240,860916331499188224,RT ReadersGazette: Latest Book News... Hollywood's Last Icon: The inner demons of Ben Hur star Charlton Heston  #bo\u2026
241,860915662356697092,ReadersGazette: Latest Book News... Hollywood's Last Icon: The inner demons of Ben Hur star Charlton Heston  #books\u2026
242,860914562530500608,Latest Book News... Hollywood's Last Icon: The inner demons of Ben Hur star Charlton Heston
243,860913061351346176,"Ben-Hur Official Trailer #1 (2016) Jack Huston, Morgan Freeman Biblical Movie HD\nWatch:"
244,860902765601730561,The lady who drives Purple route has made her round the second time on campus and the Ben Hur bus still ain't here!
245,860902622320046086,These guys at the bus stop are getting on my nerves. Where is the Ben Hur bus at?
246,860902181502930944,Ben Hur bus be the last bus to get here!
247,860902026229764097,"Every fucking bus but the Ben Hur bus! Hurry the fuck up im trying to get high af! I have a weekend fill with pills, booze and weed!"
248,860887079877791745,"Notification: 5th Annual Day of Tango Festival, Ben Hur Shrine Hall 781...  Sat May 6 12pm - Sun May 7, 2017 1am \u2026"
249,860874924952608769,The Brexit Ben Hur
250,860788292056305664,"RT romepilgrimages: Cinecitta Studio now open to the public,tours \u20ac20. Rome mini series and Ben Hur filmed here.  h\u2026"
251,860774238311116800,#Deals #Movies #DVD #Bluray #Deal #ebay #Bargain The Last of the Mohicans + All Dogs Go to Heaven + Ben Hur (DVDs \u2026
252,860738414848749568,The Movie Preview Review Eps 222 - Ben - Hur
253,860738414739681281,The Movie Preview Review Eps 222 - Ben - Hur
254,860736458038149121,I added a video to a YouTube playlist  SCTV - Ben Hur
255,860716787662553088,ReadersGazette: Latest Book News... Hollywood's Last Icon: The inner demons of Ben Hur star Charlton Heston  #books\u2026
256,860715757524709376,Latest Book News... Hollywood's Last Icon: The inner demons of Ben Hur star Charlton Heston
257,860711469293248514,Nw: Ben Hur
258,860693177359101953,"Ben Hur - Trailer 2, Dublado:  via YouTube"
259,860681780327837696,"bryce554 Ben Hur I have watched over and over- 10 commandments not so much, couldn't listen to Mr De Mille doing his thing narrating..."
260,860674569908232193,"Ben-Hur [Blu-ray] Jack Huston, Toby Kebbell \u00a0 | \u00a0 Rated: \u00a0PG-13 \u00a0 | \u00a0 Format: Blu-ray"
261,860665439566909442,# Ben Hur Lobby Card Movie Poster Charlton Heston
262,860665341105496064,Ben Hur/Him/It/They/Z
263,860665261694660609,# Ben Hur Lobby Card Movie Poster Charlton Heston
264,860659201147797504,The Best Selection:\nBen Hur Featuring Jocelyn Brown - Friends Always\nRT &amp; Follow #House #Music\n
265,860620006366883840,I saw Ben Hur the remake this evening and it hit me.. The Romans also taught us NASCAR and Formula One racing!
266,860619097440219136,I added a video to a YouTube playlist  Andr\u00e9 Rieu - Parade Of The Charioteers (Ben Hur)
267,860619061226602498,I liked a YouTube video  Andr\u00e9 Rieu - Parade Of The Charioteers (Ben Hur)
268,860604362908893185,My \u2605\u2605 review of Ben-Hur (2016) on letterboxd:
269,860598499582386176,Fantastic opening night for YorkshireSilent Abbeydale_PH still lots to see tomorrow and the epic Ben Hur on Sunda\u2026
270,860595341548277760,Top 10 Box...  #ben-hur #IT #Mechanic:Resurrection #Ratchet&amp;amp;Clanck
271,860593625587122179,RT flaviapedatella: Day 2. Personagem favorito\nCasuality - Tony \nOpen grave - Nathan\nBen hur - Judah \nTVD/TO - Klaus Mikaelson\n\n#BirthdayM\u2026
272,860585383272345601,Just finished watching 2016 remake of 'Ben Hur' not sure if old Epic with Charlton Heston was better or not?
273,860584877401493506,RT flaviapedatella: Day 2. Personagem favorito\nCasuality - Tony \nOpen grave - Nathan\nBen hur - Judah \nTVD/TO - Klaus Mikaelson\n\n#BirthdayM\u2026
274,860581820441796608,"StephenDixonTV ChrisMasonBBC We keep you alive to serve this ship. Row well, and live.\nQuintus Arrius, Ben Hur."
275,860579995651104768,"As if the Cheetahs weren't bad enuff, I'm now watching the remake of Ben Hur."
276,860577677446717441,Ben Hur really was the worst
277,860572364601536513,Friday Night Movie at Living Water Church - Ben-Hur - 7:30pm -
278,860571172651642884,Do you have a Civil War buff for a mom? Check out our online gift shop here!
279,860563226253299712,RT YESVS: there's a guy in a pair of jeans in Ben Hur
280,860562387715358720,RT YESVS: there's a guy in a pair of jeans in Ben Hur
281,860561875897069569,RT davi70374243: Ben Hur...t  himself
282,860561809278894082,Ben Hur...t  himself
283,860560149978677250,there's a guy in a pair of jeans in Ben Hur
284,860553344967876608,"Is This a Chariot or a Mini Cooper? No, Its The Ben Hur Armchair!"
285,860543441440317441,"erinefraser If I remember, Ben hur was remake of silent movie. New one completely bombed."
286,860542467380199424,iPGandhi Also it's a remake....I was about to ask if a remake has ever won big at the Oscars but then remembered BEN HUR.
287,860524993947545603,"Notification: 5th Annual Day of Tango Festival, Ben Hur Shrine Hall 781...  Fri May 5 12pm - Sat May 6, 2017 1am \u2026"
288,860521940263555073,RT WendyandCharles: ReadersGazette: Latest Book News... Hollywood's Last Icon: The inner demons of Ben Hur star Charlton Heston
289,860521708062724097,RT WendyandCharles: ReadersGazette: Latest Book News... Hollywood's Last Icon: The inner demons of Ben Hur star Charlton Heston
290,860519846336974848,ReadersGazette: Latest Book News... Hollywood's Last Icon: The inner demons of Ben Hur star Charlton Heston  #books\u2026
291,860519462172336128,Latest Book News... Hollywood's Last Icon: The inner demons of Ben Hur star Charlton Heston
292,860518941067665409,RT flaviapedatella: Day 2. Personagem favorito\nCasuality - Tony \nOpen grave - Nathan\nBen hur - Judah \nTVD/TO - Klaus Mikaelson\n\n#BirthdayM\u2026
293,860485262131867648,Just saw a short scene from the 1920s Ben Hur in this French movie that's on tv omfg
294,860480312006115330,"Ben-Hur (2016) on #Vidimovie\nTrailers, Clips &amp; Reviews:"
295,860479591068164096,"MissMovies Glad this list is growing in the Schmoeville Facebook page. I haven't seen Seven Samurai, Ben Hur, Spar\u2026"
296,860466325289934852,1950s MGM Movie Prop - Roman Soldier's Cornu Horn War Trumpet Ben Hur Quo Vadis
297,860458819582918656,MikePDaTruth Crackdown 3 on Scorpio. I was lucky &amp; got an early console &amp; game. Might also play Ben Hur in true 4k \ud83d\ude1c
298,860443966562594816,The Best Selection:\nBen Hur Featuring Jocelyn Brown - Friends Always\nRT &amp; Follow #House #Music\n
299,860439659935014914,"1034 Ben Hur Dr, Houston, TX 77055, $649,000 3 beds, 2 baths"
300,860439541970124800,"1034 Ben Hur Dr, Houston, TX 77055, $649,000 3 beds, 2 baths"
301,860422162368405504,1950s MGM Movie Prop - Roman Soldier's Cornu Horn War Trumpet Ben Hur Quo Vadis
302,860418318670467072,"Yes please. Plus flamethrower, rear mounted grenade launcher and Ben Hur style hubcap spikes"
303,860406858133241856,"RT YorkshireSilent: On Monday we're with HullIndieCinema at MidHallHull with BEN HUR - a massive, unforgettable epic!"
304,860406858070282240,"RT YorkshireSilent: On Monday we're with HullIndieCinema at MidHallHull with BEN HUR - a massive, unforgettable epic!"
305,860403274335358976,RT YorkshireSilent: hull_libraries OssettObserver It was a lovely night! Do come to our next HullIndieCinema show - BEN HUR on Mon 8 Ma\u2026
306,860400407872491520,RT YorkshireSilent: hull_libraries OssettObserver It was a lovely night! Do come to our next HullIndieCinema show - BEN HUR on Mon 8 Ma\u2026
307,860399995685658624,RT YorkshireSilent: hull_libraries OssettObserver It was a lovely night! Do come to our next HullIndieCinema show - BEN HUR on Mon 8 Ma\u2026
308,860399540284911616,RT YorkshireSilent: hull_libraries OssettObserver It was a lovely night! Do come to our next HullIndieCinema show - BEN HUR on Mon 8 Ma\u2026
309,860399221765177345,hull_libraries OssettObserver It was a lovely night! Do come to our next HullIndieCinema show - BEN HUR on Mon 8\u2026
310,860376039003967488,The Movie Preview Review Eps 222 - Ben - Hur
311,860376038915932162,The Movie Preview Review Eps 222 - Ben - Hur
312,860347075183214592,On How to train your dragon you can ask people questions about Ben Hur.
313,860329522230636545,"MissMovies Casablanca, gone with the wind, Ben Hur,  Chinatown, every fast and the furious movie after the second one."
314,860319407997898753,RT ReadersGazette: Latest Book News... Hollywood's Last Icon: The inner demons of Ben Hur star Charlton Heston  #bo\u2026
315,860318479924293632,ReadersGazette: Latest Book News... Hollywood's Last Icon: The inner demons of Ben Hur star Charlton Heston  #books\u2026
316,860318133747404801,Latest Book News... Hollywood's Last Icon: The inner demons of Ben Hur star Charlton Heston
317,860291613427470337,Ben-Hur (DVD 2016)
318,860283741205221376,#DidYouKnow During the chariot scene in 'Ben Hur' a small red car can be seen in the distance. \ud83e\udd14
319,860261161291350017,"Jesus' message on love your enemies being the central theme.\nWhich was also the theme of the movie, Ben Hur."
320,860260271063011328,For King and Country - Ceasefire.\n\nHeard this song in Ben Hur.\n\n
321,860260246874456064,"Single Family,$649000 3 beds 2.0 Baths,77055  Greenwood King Properties - Kirby Office"
322,860259482521055232,RT flaviapedatella: Day 2. Personagem favorito\nCasuality - Tony \nOpen grave - Nathan\nBen hur - Judah \nTVD/TO - Klaus Mikaelson\n\n#BirthdayM\u2026
323,860259247241801729,RT flaviapedatella: Day 2. Personagem favorito\nCasuality - Tony \nOpen grave - Nathan\nBen hur - Judah \nTVD/TO - Klaus Mikaelson\n\n#BirthdayM\u2026
324,860251721666363392,"RT YorkshireSilent: On Monday we're with HullIndieCinema at MidHallHull with BEN HUR - a massive, unforgettable epic!"
325,860251220149248001,"RT YorkshireSilent: On Monday we're with HullIndieCinema at MidHallHull with BEN HUR - a massive, unforgettable epic!"
326,860251110463987712,"On Monday we're with HullIndieCinema at MidHallHull with BEN HUR - a massive, unforgettable epic!\u2026"
327,860244764238729216,"RT professorvaness: So much to choose my Sheffield highlights Ben Hur Sunday 3pm Abbeydale_PH P Segundo du Chomon Sat 5,45"
328,860244406854717440,"RT professorvaness: So much to choose my Sheffield highlights Ben Hur Sunday 3pm Abbeydale_PH P Segundo du Chomon Sat 5,45"
329,860242353205936128,Day 2. Personagem favorito\nCasuality - Tony \nOpen grave - Nathan\nBen hur - Judah \nTVD/TO - Klaus Mikaelson\u2026
330,860242157034237953,Roubaram a blusa do Ben Hur\njkkkkkkkkkkkk
331,860238588914548736,Goobergunch instructions unclear; now imagining the ben hur chariot race but with wizards instead of horses
332,860238149389365248,New at the Lew: Book Club Cancelled May 4 - What's New at the Lew: Our Hoosier Authors Book Club meeting for Th...
333,860232202881204225,1950s MGM Movie Prop - Roman Soldier's Cornu Horn War Trumpet Ben Hur Quo Vadis
334,860227720898281472,Just finished watching the bastardization that was last year's remake of my all time favorite movie; Ben Hur. It...
335,860226306641973249,Book Club is CANCELLED for tonight (May 4) due to weather.
336,860204604352495616,This was exactly what I was thinking when saw #Bahubali 1st time.. gng soon to watch 2nd time... India's answer to\u2026
337,860188619327328258,anantha They were showing IMAX shows of Jurassic world and Interstellar because nobody was interested in IMAX of Ben Hur
338,860184429674733568,RGVzoomin No need of bb also you can get from Ben hur and Tenn commendements also.
339,860178580030017536,Join us at 7pm tonight to discuss Jessamyn West's novel THE FRIENDLY PERSUASION.  for more info.
340,860177730045980672,RT Variety: #BenHur could lose $100 million at the box office
341,860175046144176128,RT janinebucks: Ben-Hur; a tale of the Christ - Lewis Wallace | History...
342,860174989101645824,RT janinebucks: Ben-Hur; a tale of the Christ - Lewis Wallace | History...
343,860174964879572992,RT janinebucks: Ben-Hur; a tale of the Christ - Lewis Wallace | History...
344,860174945879552001,RT CorymanOX: Check out RARE ORIGINAL BITCH MAGNET LP BEN HUR PRIVATE USA PSYCH POWER POP GRUNGE PUNK   via eBay
345,860174491355369472,Check out RARE ORIGINAL BITCH MAGNET LP BEN HUR PRIVATE USA PSYCH POWER POP GRUNGE PUNK   via eBay
346,860172815751757824,Ben-Hur; a tale of the Christ - Lewis Wallace | History...
347,860170378005553156,RT janinebucks: Ben-Hur; a tale of the Christ - Lewis Wallace | History...
348,860167408975093765,Ben-Hur; a tale of the Christ - Lewis Wallace | History...
349,860165978373730305,"BEN HUR - 11\""x17\"" Original Promo Movie Poster 2016 Jack Huston"
350,860162313759883264,"Notification: 5th Annual Day of Tango Festival, Ben Hur Shrine Hall 781...  Thu May 4 12pm - Fri May 5, 2017 1am \u2026"
351,860134701817880576,"\""Wage Slaves who refuse to take-up( like:Ben Hur) Chariot racing.Will be refused:Tory/Madbullingdonsts sh*t&amp; vomited on \""Benefits\""."
352,860131991752028160,"To fight the good fight, to finish the race, to keep the faith \ud83d\udc93 NW: Ben Hur."
353,860130170149249025,Regarder Ben-Hur (2016) Gratuit en Ligne \nLink:  \n
354,860127268936593409,They should have pretended it was Christmas and stuck Gone with the Wind and Ben Hur on...
355,860124915684343808,Ben-Hur; a tale of the Christ - Lewis Wallace | History...
356,860118435958837251,ReadersGazette: Latest Book News... Hollywood's Last Icon: The inner demons of Ben Hur star Charlton Heston  #books\u2026
357,860117236308160512,Ben Hur has no hidden fees. Get your upfront moving quote here:
358,860116807860051968,Latest Book News... Hollywood's Last Icon: The inner demons of Ben Hur star Charlton Heston
359,860103569529286656,"Join us Friday night, May 5 for Pizza and the movie Ben Hur at 7pm. Short discussion to follow and 5-week bible study on begins Monday May 8"
360,860101042804973568,"najamsethi Sir, I want to say Thank You for betterment of Cricket in Pakistan... \nBen Hur = Najam Sethi... :) \nProud of You"
361,860099090394173441,"thepunter80 It is always wise to remember when having a bet, that the last good horseman of Mediterranean heritage, was Ben Hur."
362,860094327598526464,Ben-Hur; a tale of the Christ - Lewis Wallace | #History...
363,860076334361358336,TheCinegogue #7favfilmsofthe50s\nBen Hur\nStreetcar Named Desire\nHigh Noon\nSeven Samurai\nRear Window\nThe Ladykillers\nSome like it Hot
364,860064535805390849,"Ben-Hur Official Trailer #1 (2016) \u2013 Morgan Freeman, Jack Huston film HD by\u2026"
365,860037205737132032,RT: Watch Ben-Hur (2016) Online on #Flixano\nStart Free Trial:
366,860029173653491712,- #Serien.sale | Der #FAN #Shop\nBen Hur - Steelbook [Blu-ray] [Limited Edition] -  -\u2026
367,860016855255318529,Watch Ben-Hur (2016) Online on #Flixano\nStart Free Trial:
368,860013649804636160,The Movie Preview Review Eps 222 - Ben - Hur
369,860013649057939456,The Movie Preview Review Eps 222 - Ben - Hur
370,860013319419301888,I added a video to a YouTube playlist  Ben Hur (2016)-Full Movie Hindi Dubbed
371,860012736381693952,Ben Hur (2016)-Full Movie Hindi Dubbed:  via YouTube
372,859963112744603648,"Old, but awesome, NSW policemen recreate Ben Hur on bikes"
373,859945993168723969,AllbrightNFL A New Hope and Rogue One are the same film to me now. Like Ben Hur without the long break lol
374,859939051905961986,"I'm listening to \""If We're Honest\"" by francescamusic on PandoraMusic."
375,859935608843640832,Hollywood Studios Sued for Allegedly Failing to Pay Ben Hur Musicians\n StarlightPR1
376,859923340227747840,ReadersGazette: Latest Book News... Hollywood's Last Icon: The inner demons of Ben Hur star Charlton Heston  #books\u2026
377,859920513216413697,Latest Book News... Hollywood's Last Icon: The inner demons of Ben Hur star Charlton Heston
