,tweet_id,text
0,862350612977000448,Patricia is too much for me \ud83d\ude02\ud83d\ude02\ud83d\ude02\ud83d\ude02\ud83d\ude02\ud83d\ude02\ud83d\ude02 quiteperry too funny #jamaicans #comedian #titanic #parody\u2026
1,862349344225099776,"will perform \""My Heart Will Go On\"" in honor of #Titanic's 20th anniversary at the BBMAs"
2,862346490567684096,white sexy stockings #titanic nude scence
3,862345515211665410,"RT miryamsantander: Titanic Quarter _Belfast, Northern Ireland, UK_ #VisitBelfast #Titanic #photooftheday #photo\u2026"
4,862344613125918726,free xxx porn hot #titanic nude scence
5,862343164014850048,"RT stntalk: \""I 'll never let go\"""
6,862342888851619840,RT WORLDMUSICAWARD: #C\u00e9lineDion to Sing #MyHeartWillGoOn at 2017 Billboard Music Awards in Honor of #Titanic's 20th Anniversary!\ud83d\ude0d\n
7,862342714934910977,#titanic nude picture porni clips
8,862342616079364096,"Channel4 were can i find the #Documentary on #Titanic that you dod back in april,? \ud83d\ude01\ud83d\ude01\ud83d\udc4c\ud83c\udffc"
9,862342153531510784,RT SuzyPobble: Captivating diary entries from St Luke's CofE in #Salford based on the sinking of #Titanic  #edchat\u2026
10,862342103988416512,"RT stntalk: \""I 'll never let go\"""
11,862341946974629888,"RT stntalk: \""I 'll never let go\"""
12,862340984566407170,titanic__movieBeautiful scene \u2764\ud83d\ude0d\n[#titanic #titanicmovie #thebestmovie #jackdawson\u2026
13,862339520376614912,"Titanic Quarter _Belfast, Northern Ireland, UK_ #VisitBelfast #Titanic #photooftheday #photo\u2026"
14,862338966888079361,"RT TVGuide: C\u00e9line Dion will perform \""My Heart Will Go On\"" at the #BBMAs in honor of #Titanic's 20th anniversary  h\u2026"
15,862338281270255617,RT WORLDMUSICAWARD: #C\u00e9lineDion to Sing #MyHeartWillGoOn at 2017 Billboard Music Awards in Honor of #Titanic's 20th Anniversary!\ud83d\ude0d\n
16,862332822853480449,grandma having sex video #titanic nude painting
17,862327886644228097,"Never be afraid to try something new. Amateurs built the ark, professionals built the #Titanic."
18,862324707235946496,Watch Titanic (1997) HD Movie\nWatch Now:
19,862324196214321152,When you ship a sinkable ship. MAH HART MAH SOUL \ud83d\ude2d\ud83d\ude2d
20,862323588929658880,The modern day Titanic you can live on #travel #travelblogger #familytravel #Photography #history #ships #boats\u2026
21,862322806553550848,"you ever busta nut so hard that you sink the Titanic, yo ladies from the 1910's  you know what I am taking about. call me"
22,862320540274634752,"Life-size #Titanic replica under construction in #Sichuan, #China. Dazed and confused, but thanks, ChinaDailyAsia.\u2026"
23,862320120068268032,RT TitanicUSA: Bill Paxton will always be close to our hearts! &lt;3 This was one of his final interviews! He spoke of #Titanic.
24,862317771027128320,"I'm going to call SenateGOP and HouseGOP at random and play \""My Heart Will Go On\"" while laughing maniacally.\u2026"
25,862315840829628416,RT DudleyArchives: Join us and #Titanic expert and author Andrew Lound at 10am on Saturday 20th for a hands on event on archives and resea\u2026
26,862315713108873216,"When a corrupt,unstable individual is in a position of political power\ud83c\uddfa\ud83c\uddf8&amp; his party CONTINUES to stand w/him,they are in deep water"
27,862315633274494976,What if your spiritual journey took you back to a voyage aboard the RMS #Titanic? PaulAmirault1\u2026
28,862315631173042176,What if your spiritual journey took you back to a voyage aboard the RMS #Titanic? PaulAmirault1\u2026
29,862315493990027264,"The last known photo of the #Titanic,It was sunk by an iceberg. 1500 died,710 others saved.\n\nSource:\u2026"
30,862312351919472644,bettyporno #titanic naked pics
31,862309124343836672,"RT TitanicSayings: \""Where are you going? To him? To be a whore to a gutter rat?\"""
32,862309030424870912,"RT TitanicSayings: \""I can see the Statue of Liberty already; very small, of course!\"""
33,862304394834046977,Indyluck is running out
34,862302878999904256,RT Me_Is_Matt: #titanic {\n   float: none;\n}
35,862301825827053568,The suns shining on Commander Smiths shoulders this afternoon
36,862301192394862592,"RT TVGuide: C\u00e9line Dion will perform \""My Heart Will Go On\"" at the #BBMAs in honor of #Titanic's 20th anniversary  h\u2026"
37,862299483140501504,RT TitanicUSA: Bill Paxton will always be close to our hearts! &lt;3 This was one of his final interviews! He spoke of #Titanic.
38,862297051278737408,"rodryanshow My junior prom song was \u201dMy Heart Will Go On.\"" Apparently someone thought a #Titanic themed prom would be a good idea \ud83e\udd26"
39,862296591507619841,RT Classic_picx: #OnThisDay 1912 RMS #Titanic hits an iceberg. The ship's Captain E.J Smith is pictured here in the moments after the iceb\u2026
40,862294924355674114,My heart will go on #CelineDion #Titanic theme song #Piano cover
41,862294651604262913,Coill using #lego today in class to build #boats like the
42,862289385630310400,RT Maddiedintino4: Happy birthday anazavadil ilysm I hope today is perfect bff #ramos #recorder #titanic #helen \u2764\u2764\u2764\ud83d\udc96\ud83d\udc96\ud83d\udc96\ud83c\udf8a\ud83c\udf8a\ud83c\udf8a\ud83c\udf89\ud83c\udf89\ud83c\udf89\ud83c\udf89
43,862289164414451714,Bill Paxton will always be close to our hearts! &lt;3 This was one of his final interviews! He spoke of #Titanic.
44,862287311475621889,RT WORLDMUSICAWARD: #C\u00e9lineDion to Sing #MyHeartWillGoOn at 2017 Billboard Music Awards in Honor of #Titanic's 20th Anniversary!\ud83d\ude0d\n
45,862286136261185536,RT gillianwelch: Happy Ruination Day. Beware of icebergs and box seats.
46,862283408587837440,"RT Read_The_Dung: As my son get his lunch on the airplane, I can only think of the Titanic dataset :-)"
47,862282815727165440,Happy birthday anazavadil ilysm I hope today is perfect bff #ramos #recorder #titanic #helen \u2764\u2764\u2764\ud83d\udc96\ud83d\udc96\ud83d\udc96\ud83c\udf8a\ud83c\udf8a\ud83c\udf8a\ud83c\udf89\ud83c\udf89\ud83c\udf89\ud83c\udf89
48,862279850832396290,"RT iamn3ko: I'm such a pretty crier when I watch #Titanic, alone, while eating ice cream... New video out on my channel now. -"
49,862277198006427648,"As my son get his lunch on the airplane, I can only think of the Titanic dataset :-)"
50,862274531339227136,RT Me_Is_Matt: #titanic {\n   float: none;\n}
51,862274107320266752,RT Me_Is_Matt: #titanic {\n   float: none;\n}
52,862274053532520448,#titanic {\n   float: none;\n}
53,862269096968302593,"RT TitanicSayings: \""Where are you going? To him? To be a whore to a gutter rat?\"""
54,862267542320156672,First time sleeping in a boat last night! It was an awesome experience! I feel like I am in #Titanic of how it keeps rowing on the river! \ud83d\udee5
55,862267347473547264,RT WORLDMUSICAWARD: #C\u00e9lineDion to Sing #MyHeartWillGoOn at 2017 Billboard Music Awards in Honor of #Titanic's 20th Anniversary!\ud83d\ude0d\n
56,862262650926977024,trample sex #titanic rose nude
57,862262071853035520,"On a diverging track, I've also been reading about the tragedy of the #Titanic that sunk more than a century ago. Astonishing revelations!"
58,862259878903074817,RT abc_science: Why Didn\u2019t The Passengers Of The #Titanic Climb Aboard The #Iceberg To Save Themselves? :
59,862257395040485379,naked teen chixs #titanic rose nude
60,862256770533773312,#titanic rose nude hentia pokemon porn
61,862256017106649089,"WATCH: It was a #Titanic situation at #PrateekWisteria, #Noida, this morning!\n"
62,862254711294099456,He reminds me of the #Titanic. The guys who were playing 'Amazing Grace' on violins as the ship was capsizing.
63,862252969257050112,#Titanic #Startcartoon Spread the word!
64,862250227465674752,RT abc_science: Why Didn\u2019t The Passengers Of The #Titanic Climb Aboard The #Iceberg To Save Themselves? :
65,862249071875989505,Jack &amp; rose\ud83d\udc6b\ud83d\ude0d\ud83d\ude18\n#titanic\ud83d\udcc0
66,862240064713236481,RT KatyPrestedge: Most depressing part of #Titanic is the closing song
67,862239412570046464,"RT TitanicSayings: \""I can see the Statue of Liberty already; very small, of course!\"""
68,862236955295305728,There are people who survived when that boat was sinking. And we are some of them.
69,862234615267897345,RT WORLDMUSICAWARD: #C\u00e9lineDion to Sing #MyHeartWillGoOn at 2017 Billboard Music Awards in Honor of #Titanic's 20th Anniversary!\ud83d\ude0d\n
70,862233956737064960,Captivating diary entries from St Luke's CofE in #Salford based on the sinking of
71,862230975228645377,There is a variety of advertising for the #Titanic and #Olympic on display in our #Titanic exhibition
72,862226593674121217,RT WORLDMUSICAWARD: #C\u00e9lineDion to Sing #MyHeartWillGoOn at 2017 Billboard Music Awards in Honor of #Titanic's 20th Anniversary!\ud83d\ude0d\n
73,862224623185911809,"RT TitanicSayings: \""I can see the Statue of Liberty already; very small, of course!\"""
74,862210923200565248,Left: 2017 $ETH (no pop yet)\nRight: 2014 $BTC (popped from &gt;$1k to ~$200)\n\nNoobies didn't learn the first time it s\u2026
75,862209447040606209,Looking forward for the uk_ipn meeting today in #Titanic Belfast
76,862208748533796864,#titanic poster #travel #ship #liner #new york #trans atlantic #ocean #white star line
77,862206900544327680,Will you watch #YoonMin's version of #Titanic? This will be a #parody! \ud83d\ude05\ud83d\ude05 #BTS bts_twt
78,862205461910761474,"Do you think, if Jack knew that Rose was going to die on a ship anyways, he would have given up the door?"
79,862204826624643073,"RT TitanicSayings: \""I can see the Statue of Liberty already; very small, of course!\"""
80,862204802683596800,"RT TitanicSayings: \""Where are you going? To him? To be a whore to a gutter rat?\"""
81,862203950300356608,"POTUS realDonaldTrump knows he is aboard the #TITANIC! Watching #FIRED #WITNESS after another, GOP Save SELF is\u2026"
82,862195746174414848,I'm Crying watching #Titanic on cmt. But after this? Theres a Florida Georgia Line special.
83,862195210876592128,RT WORLDMUSICAWARD: #C\u00e9lineDion to Sing #MyHeartWillGoOn at 2017 Billboard Music Awards in Honor of #Titanic's 20th Anniversary!\ud83d\ude0d\n
84,862185625902075905,every night in my dreams I see you I feel you \ud83c\udfb6\ud83c\udfb6\u2764\ufe0f
85,862182011783524352,"RT Mikeygy: #DianeAbbot must be a #Tory plant, and we all thought it was #Corbyn."
86,862180208421593089,RT abc_science: Why Didn\u2019t The Passengers Of The #Titanic Climb Aboard The #Iceberg To Save Themselves? :
87,862179479505977344,RT abc_science: Why Didn\u2019t The Passengers Of The #Titanic Climb Aboard The #Iceberg To Save Themselves? :
88,862178360583237633,RT abc_science: Why Didn\u2019t The Passengers Of The #Titanic Climb Aboard The #Iceberg To Save Themselves? :
89,862178026968285185,RT abc_science: Why Didn\u2019t The Passengers Of The #Titanic Climb Aboard The #Iceberg To Save Themselves? :
90,862177905211842560,Why Didn\u2019t The Passengers Of The #Titanic Climb Aboard The #Iceberg To Save Themselves? :
91,862173990520934400,#titanic #hallway \n\nThe flood was strong with this one.....better call Noah XD
92,862169906619576321,"RT TitanicSayings: \""Where are you going? To him? To be a whore to a gutter rat?\"""
93,862169854052229120,"RT TitanicSayings: \""Where are you going? To him? To be a whore to a gutter rat?\"""
94,862169604688416769,"\""Where are you going? To him? To be a whore to a gutter rat?\"""
95,862169390912897024,"RT TitanicSayings: \""I can see the Statue of Liberty already; very small, of course!\"""
96,862168649079164928,"Robert Hitchins: \""You don't understand. If we go back, they'll swamp the boat, they'll pull us right down, I'm tellin' you!\"""
97,862168239056474112,What are the odds of me watching .ColtonLHaynes ' instagram story of him at .celinedion 's concert while #Titanic is playing on my t.v. \ud83d\ude2d
98,862167714462404609,"\""I can see the Statue of Liberty already; very small, of course!\"""
99,862163009770225665,RT ETCanada: .celinedion to perform 'My Heart Will Go On' at BBMAs for 20th Anniversary of
100,862159733964275712,GACfan_Rodge Is that the wrong word? LOL ex: I feel full &amp; emotional &amp; nothing else on TV can come close to how\u2026
101,862159205725163520,davidfrum That #titanic feeling
102,862158688643043328,That moment when you can't find anything to watch on TV because #Titanic fulfilled you \ud83d\ude0a\ud83d\udc99\ud83d\udea2
103,862158467683033088,I'm in love with this movie\nJust can't get over it !\n#Titanic \n
104,862156914762817542,I expect this tweet every month like I expect #Titanic trending every 6 months.
105,862156596947898368,bhaskar_k_ rohitsaigeetha Aamirian1 You never hear of James Cameron fans pulling down a #ShawshankRedemption or\u2026
106,862153010805395456,"Rose: I'll never let go Jack, I promise *she lets go* THIS WHY I HAVE TRUST ISSUES!"
107,862147142919630848,RT Darrin99: If the #Titanic sank TODAY!!!
108,862145704235589635,RT WORLDMUSICAWARD: #C\u00e9lineDion to Sing #MyHeartWillGoOn at 2017 Billboard Music Awards in Honor of #Titanic's 20th Anniversary!\ud83d\ude0d\n
109,862145317596254208,"RT Arg_TeenWolf: Shelley Hennig via Instagram, anoche: \""Met a fan tonight #Titanic\"" / \""Conoci a un fan esta noche\"""
110,862145119037923329,HiThisIsJen BrookeGACFAN2 Darrin99 Watching #Titanic it's on CMT right now
111,862142959327817729,"When the Mummy says \""I have a child! She's all I have in the world\"" with some random baby to get on the boat\u2026"
112,862142473258315776,"\""Your money can't save you anymore than it can save me.\""\n\n"
113,862141597428744192,This #runawaywithmeme edit is so iconic \ud83d\ude2d carlyraejepsen #titanic \n\n\ud83d\udcf9
114,862140759335686144,RT ladybucbball: What's better than a buzzer beater? A buzzer beater with TitanicHoops.
115,862137558939172866,KatrinaPierson Katrina the Shoplifter: you will go down with the
116,862137507781251076,He couldn't fit on the door. Let's move on.
117,862135278638706689,RT ladybucbball: What's better than a buzzer beater? A buzzer beater with TitanicHoops.
118,862133533535588352,What's better than a buzzer beater? A buzzer beater with TitanicHoops.
119,862129899183759360,RT WORLDMUSICAWARD: #C\u00e9lineDion to Sing #MyHeartWillGoOn at 2017 Billboard Music Awards in Honor of #Titanic's 20th Anniversary!\ud83d\ude0d\n
120,862129751963709443,"RT TitanicMovie: With 11 awards, #Titanic ties the record for the most #Oscars won by a single movie! What are you favorite TheAcademy Aw\u2026"
121,862129014919618560,Darrin99 DbskUSfan cant believe  that  #Titanic has been  down in the sea for  104 years now
122,862128594780401664,RT Darrin99: If the #Titanic sank TODAY!!!
123,862125818394402817,"Does anyone else see the foreshadowing when he just said \""don't worry I'll be alright?\"" . . . \ud83d\ude11\ud83d\ude15 #Titanic LeoDiCaprio"
124,862125653109460992,"MsSarahPaulson~Fyi, this is the scariest house in Denver. Ask MsKathyBates what house it is. Hint: #Titanic."
125,862125163248312322,#titanic naked scene nude indigenous people
126,862124868317347844,"Reenacting this May 21 at Lighthouse Recording in Del Ray, VA to finish our song, #Titanic, about\u2026"
127,862121996364251136,This movie has so many memories! My mom loved this movie. We would watch it on two VHS tapes #MissYouMom #Titanic \ud83d\ude1e
128,862121707619971072,I mean how can one not watch #Titanic when it's on tv?
129,862120212363042816,He is on a sinking ship.
130,862119437729767424,RT ljoyce12: Remembering Titanic TitanicBelfast TitanicUniverse TitanicSociety EnlightApp PicsArtStudio #titanicremembrance #Titanic\u2026
131,862119379101790209,Who's laughing now...all of D.C. must feel like those few moments just before the #Titanic his that fatal iceberg..\u2026
132,862118509869977600,#titanic research paper  research paper on stem cell therapy
133,862118247402962946,#titanic Cal is such a tool!
134,862118167983869952,For real though.
135,862117418898001920,I really hate Cal with all of my being
136,862116315053555713,"RT BrittanyClutter: I could hear Wesleywaltonrsa yelling \""ICEBERG RIGHT AHEAD!\"""
137,862115639149907969,. ldavidmarquet  And I have the DailyDilbert 's to attest to it....  too late to turn the #titanic around...
138,862115566433206272,"I could hear Wesleywaltonrsa yelling \""ICEBERG RIGHT AHEAD!\"""
139,862115249373282306,EBraeden Luv u on #YR &amp; now enjoying watching you w/my 10 yr old son who loves history of #Titanic on CMT now
140,862115209338658817,*swoon* \ud83d\udc9e
141,862114927988793346,RT RealMichelleT: Who else feels like they're on the #Titanic? Women &amp;children first! Oh sorry a bunch of old white dudes took the life bo\u2026
142,862113801906380800,I just read something about the #Titanic that reminded me that life is one wrong boat ride away from death...
143,862113513917075457,"realDonaldTrump U think u r untouchable....but guess what...they thought the #Titanic was unsinkable also, #Iceberg ahead"
144,862112749165215744,celinedion BBMAs Amazing heavenly voice \ud83d\ude07\ud83c\udfb6
145,862112535092350980,RT onepapab: The reason liberal federal Gov.is so #Huge.. Take all to launch liberal spin and all to hide the spun..#Titanic #SSSoScrewed\u2026
146,862112324508889088,Watching #Titanic.  This movie will always be one of my favorites. \u2764\ufe0f
147,862109729530818562,Practice.\n\u2022\n\u2022\n\u2022\n\u2022\n\u2022\n\n#savethekids #titanic #alternativerock #newmusic #band #emo #localmusic\u2026
148,862108367820644352,maddow MalcolmNance The #Titanic just hit the iceberg politically for #Trump administration. This #COMEY firing not to smart.
149,862107540951379968,"\""With all respect Miss, I'm not the one hanging off the back of a ship here.\"""
150,862106110869852161,RT JDooley21: FBI is investigating realDonaldTrump ? He'll just fire the head of the FBI. Because that's Trump's America.
151,862104960426815493,RT onepapab: The reason liberal federal Gov.is so #Huge.. Take all to launch liberal spin and all to hide the spun..#Titanic #SSSoScrewed\u2026
152,862104174720372736,The reason liberal federal Gov.is so #Huge.. Take all to launch liberal spin and all to hide the spun..#Titanic\u2026
153,862103578122571776,yashar Feels like 84 years.....
154,862102349220904960,RT nosaltplz: Amazing Arts Night TDSBForestManor!\nShout out to the Organizing Team and Ms. Passe Kaplan. #4thbewithyou #Titanic  #Intheju\u2026
155,862102143955869698,Who Would Win? Time\n\n #TheTitanic #Lettuce #Vegetables #Iceberg #IcebergLettuce\u2026
156,862102139224588288,Who Would Win? Time\n\n #TheTitanic #Lettuce #Vegetables #Iceberg #IcebergLettuce\u2026
157,862096256398540800,Of course they didn't. Same reason that #WhiteStarLines thought the #Titanic lifeboat sitch wasn't gonna be a thing\u2026
158,862096058003976192,PROPHETABLEihub benshapiro You must have been one of the 24% that approved of Nixon in 1974.
159,862094940188422144,ANALOGY TIP - Tilting an ice tray while filling it with water will show you exactly the reason why the #titanic sank !!
160,862094845208178688,Feeling some serious #titanic vibes coming from this photo by Christina Mob of #lafemmefashion style 24250!
161,862094594225340421,RT RealMichelleT: Who else feels like they're on the #Titanic? Women &amp;children first! Oh sorry a bunch of old white dudes took the life bo\u2026
162,862092937219497984,.celinedion to sing #myheartwillgoon  at #billboardawards  MorningsMaria
163,862090694441226248,RT etnow: .celinedion will perform #MyHeartWillGoOn at the BBMAs for the 20th anniversary of #Titanic.
164,862085291649138688,RT accesshollywood: .celinedion is set to make a #Titanic return to the BBMAs stage!
165,862078029098614785,NEW: #1912 #Sultana Cold Cream  #HandCream  Great For #SensitiveSkin  via Etsy
166,862075839776788481,That's what the #GOP hopes for but just like Nixon -the #Trumprussiacoverup is now an albatross around all of the n\u2026
167,862073949605289988,RT sjfostersound: Titanic Adventure Out of Time is a________point and click adventure game! #gamedev #Titanic #gamer #retrogaming #indiede\u2026
168,862073775466192896,RT sjfostersound: Titanic Adventure Out of Time is a________point and click adventure game! #gamedev #Titanic #gamer #retrogaming #indiede\u2026
169,862073213593014272,Titanic Adventure Out of Time is a________point and click adventure game! #gamedev #Titanic #gamer #retrogaming\u2026
170,862072222185377793,RT ClodaghLRice: Belfast looking well in the sunshine \u2600\ufe0f #belfast #titanic #h&amp;w
171,862071407303430145,"They could've both lived, if Jack paid back the money he owed  LeoDiCaprio"
172,862070295229870080,.CindyDayCTV Beautiful necklace on tonights broadcast. Is it The Heart of the Ocean from #Titanic ? \ud83d\ude09\ud83d\ude00
173,862070237360992256,RT ClodaghLRice: Belfast looking well in the sunshine \u2600\ufe0f #belfast #titanic #h&amp;w
174,862067198747127808,Belfast looking well in the sunshine \u2600\ufe0f #belfast #titanic #h&amp;w
175,862066908417241088,WhiteHouse realDonaldTrump #Titanic hits iceberg. #Comey fired for same reason Nixon tried to fire his way out of #impeachment #sad \ud83d\ude02
176,862065480114216960,FBI is investigating realDonaldTrump ? He'll just fire the head of the FBI. Because that's Trump's America.
177,862064031296888836,Lawrence Omg\ud83e\udd26\ud83c\udffb\u200d\u2640\ufe0f!! GOP r slime &amp; we're in trouble!! Iceberg meet #titanic \ud83d\ude44\ud83d\udd2b
178,862061526424932352,RT ETCanada: .celinedion to perform 'My Heart Will Go On' at BBMAs for 20th Anniversary of
179,862059106709975040,And did you know a survivor of the #Titanic lived in our area. Have a look at:
180,862058151125946368,RT etnow: .celinedion will perform #MyHeartWillGoOn at the BBMAs for the 20th anniversary of #Titanic.
181,862048224160305153,RT ETCanada: .celinedion to perform 'My Heart Will Go On' at BBMAs for 20th Anniversary of
182,862047518347100160,"Watching the #titanic, the greatest love story ever and my favorite movie by far. Just hearing the music brings me to tears."
183,862047222925582337,RT TitanicUSA: WHAT!!! Get your calendars out! We WONT be missing this!
184,862042772236378112,"RT TitanicFans: \""I'm flying, Jack.\"""
185,862042483282370560,RT ETCanada: .celinedion to perform 'My Heart Will Go On' at BBMAs for 20th Anniversary of
186,862041998412394497,Get ready to have 1997 flashbacks.
187,862040787156176897,RT etnow: .celinedion will perform #MyHeartWillGoOn at the BBMAs for the 20th anniversary of #Titanic.
188,862040522994716677,20 godina od My heart will go on celinedion
189,862038222272159744,RT ETCanada: .celinedion to perform 'My Heart Will Go On' at BBMAs for 20th Anniversary of
190,862035363229052932,Liz: CelineDion + #BBMAs Have Something AWESOME Planned For #Titanic's 20th Anniversary! TitanicMovie\u2026
191,862034817126469632,RT ETCanada: .celinedion to perform 'My Heart Will Go On' at BBMAs for 20th Anniversary of
192,862030952733790209,Have you survived the #BipolArte experience? #music #life #titanic #tour #love \ud83d\ude08\ud83d\ude07\ud83c\udfa4\ud83c\udfb6\ud83c\udfb8\ud83c\udfbc
193,862030937609166852,Have you survived the #BipolArte experience? #music #life #titanic #tour #love \ud83d\ude08\ud83d\ude07\ud83c\udfa4\ud83c\udfb6\ud83c\udfb8\ud83c\udfbc
194,862029435712798720,"Meet Stockton Rush, the man taking submarine trips to the"
195,862028188662235136,RT etnow: .celinedion will perform #MyHeartWillGoOn at the BBMAs for the 20th anniversary of #Titanic.
196,862026087307628545,"RT KLUV987: Inon of #BillPaxton's final interviews, he discusses the horrible alternative ending to #Titanic."
197,862025516890632192,Even worse: they told me some of their friends believed the #Titanic never existed nor did the tragedy actually happen
198,862025453913157632,RT Darrin99: If the #Titanic sank TODAY!!!
199,862024918199881728,When you tell your players you are so old that you saw #Titanic in theaters...
200,862024048116510720,#Monaco could have scores many goals this season but they're not competitions to this #Juvetus side
201,862023960095076352,Check out: Titanic by Wilhelm TitanicWilhelm #historical #romance #TITANIC   TitanicPassage
202,862022880707698689,Pray for this poor sap. He's a cabin boy on the
203,862021990101782528,Draw me like one of those French Monks.
204,862020934747791360,"PhathahWabwe WaQabi Had any black Pete been on #titanic, they wouldn't have allowed them on the rescue boats anyway."
205,862019043523514368,alison_wilkey ScholasticBooks MtDiabloUSD Enjoy Book 5 of #keyhunters I had SO MUCH FUN writing that book!
206,862017879256047616,RT blackhorsePR1: The sun's out time for a nice refreshing pint of pale ale
207,862016697279971328,"Jack Dawson: Where to, Miss?\nRose DeWitt Bukater: To the stars. | Ireland \ud83c\uddee\ud83c\uddea \n#titanic\u2026"
208,862016349362675714,MaryPhelanIFJ taselyom AislingHussey PeterVarley5 Bar has been raised...
209,862015623508893696,PressSec WhiteHouse realDonaldTrump This is your idea to #MAGA ?
210,862014394783420422,#TrumpTeam will sacrifice innocents like #SallyYates and spies like #Flynn just to rearrange deck chairs on\u2026
211,862013126237188096,LouiseMensch RepAdamSchiff #SallyYates saw #Flynn was just tip of #Trump's #Russian #Iceberg of #Collusion!\u2026
212,862012593136730112,"RT Arg_TeenWolf: Shelley Hennig via Instagram, anoche: \""Met a fan tonight #Titanic\"" / \""Conoci a un fan esta noche\"""
213,862011273675984897,The sun's out time for a nice refreshing pint of pale ale
214,862006649426288640,"RT Canada: Prompted by the #Titanic disaster, Canadian Reginald Fessenden developed the first experimental sonar in 1912"
215,862005176995065859,RT MDfineart: Titanic wreck painting WIP ART
