,tweet_id,text
517,860101024161443840,Good morning and Happy Thursday! #Thursday #waltdisney #mickeymouse #mickey #mouse #aladdin #dreams...
518,860086626436907008,#Aladdin Pants Boran
519,860086621974278145,#Aladdin Pants Boran
520,860052001387950080,Jasmine colors! Finishing up!! Have to mail commission soon!  #aladdin #princess #jasmine
521,860044171930939392,So looking forward to going to Agrabah later! #aladdin AladdinLondon
522,860033273124270081,It's #Aladdin day!!!! WimbledonHigh Head_WHS
523,860013945318502401,Year 8 on their magic carpet ride home after a spectacular trip to see Aladdin last nightKEGS_Chelmsford
524,859995134678749184,Aladdin: Diamond Edition (Blu-ray/DVD/Digital HD)
525,859995034954977280,Aladdin (1992) Download Full Movie HDDownload Link:
526,859951227446185988,Thank you Cadillac_Palace for a lovely night at #aladdin. the nicest and most efficient theatre staff I've encountered!
527,859950933794533380,"Got to steal to eat, got to eat to live, I'll tell you all about it if had the time!"
528,859942151916015616,#Aladdin from #Magi is an amazing character and I would highly recommend you to watch it.
529,859936070707814400,I want to speak with someone (Calmania Toby_Francis Hibstah ainsley_melham) about #13ReasonsWhy.
530,859934235477540873,"Love this #Aladdin mug. Not only keeps magsjpe coffee hot, but is great for keeping her"
531,859927806393761793,#Aladdin brings magic to the Chicago theater scene
532,859925658683797505,First of two shows in #Chicago ! #aladdin  Cadillac Palace Theatre
533,859923641877790720,7 practices left to the big show! Tuesday May 23.
534,859919686921846784,What a great day#art #agrabah #jasmine #disneyworld #aladdin  Agrabah
535,859910165168091138,#WillSmith for the role of Genie in the live action #remake of #Aladdin directed by #GuyRitchie ? #Disney
536,859908021694156803,1964 #GenePitney -  I'm Gonna #BeStrong / #Aladdin'sLamp 11.11 on Amazon  #vintage #vinyl
537,859889293048897538,"Completion of Aladdin before bed. Love this game but collision detection is pretty crap, nobody seems to talk about"
538,859887300230209537,Aladdin has no nipples. WHY? #Aladdin #Disney DisneyStudios
539,859879564113321987,"Annoyed at #Disney trying to use their #fairytales, like #Aladdin &amp; more, as cash grabs? Well, I'm not - here's why"
540,859875473488318464,#Ghana #Aladdin music production outdoors in #Accra#Africlivetv #tv3 #adomtv #joynews #euronews
541,859868707576840192,Getting my Jazz on AladdinLondon
542,859868456811978757,What a talented bunch! Give them your support and come along to a show in half-term #Aladdin
543,859867778228113408,Meet Matthew Croke: The dashing new star of Disneys #Aladdin
544,859863190720716800,Very excited to be joining the company this year! The_Garrick pantomimes #aladdin
545,859848179357024258,"A feast of mystery, colour and fun! Oh, and genies! #Aladdin Get your half-term tickets here"
546,859836268292734977,#Aladdin had it's #Chicago #Broadway premier and our inner child is ecstatic! Who plans to see it?
547,859832003235127297,Disney magic #tourist #aladdin #disney #disneylandparis #disneyland #dlp
548,859828796094132224,Who will be joing me for a quick #IGL pre
549,859825076568563716,Shoutout and big love to the all new #Aladdin Matthew_croke who'll be replacing me from June 5th!
550,859814320980467712,"\""Tell me, Princess, now when did you last let your heart decide?\"""
551,859803703213268992,Can't wait to see astonishingtrev tonight in aladdin  Going to pick up Godbaby now. Loge seats here we come
552,859799999932190720,These bad boys might just be putting in appearance during class tonight!!   #Aladdin #FriendLikeMe
553,859781647893499905,kitty pornstar bio #aladdin porn cartoon
554,859779726784835585,Have you seen these beautiful new photos of Matthew_croke as #Aladdin? We can't wait to see him debut next month..
555,859779046044868608,About last night. #aladdin #broadway #datenight  Aladdin - The Musical
556,859773648889982977,Be the Princess of Agrabah with this fantastical two-piece wedding dress  #aladdin
557,859770011610746881,Grant a wish for your entire family with Aladdin on #Broadway - Get Tickets Now!
558,859754221804990466,"ALADDIN: The Musical, WAS AWESOME!!!!  Definitely check it out!!!"
559,859748052545961984,Meet Matthew Croke: The dashing new star of Disneys #Aladdin
560,859745249320734723,"In Episode 50, we discussed casting for The Genie in Disney's #Aladdin remake. Who do you prefer?"
561,859743713035210755,Regarder Aladdin (1992) Gratuit en Ligne Link:
562,859743606013399040,Watch Aladdin (1992) Free Online Link:
563,859742699276173312,#aladdin fucking wet teen pussy fucking
564,859734573583826945,Matthew_croke we will be on that carpet with you May 19th!!!
565,859724232179240960,#Aladdin Pants Rayon oriental printed blue green
566,859724228555419649,#Aladdin Pants Rayon oriental printed red
567,859724225048961024,#Aladdin Pants Rayon oriental printed red magenta
568,859718162169950209,Meet Matthew Croke: The dashing new star of Disneys #Aladdin
569,859708174458376192,Aladdin: Diamond Edition (Blu-ray/DVD/Digital HD)
570,859698682018619393,#americans think #Aladdin's #agrabah is a real city and would approve travel in new survey.
571,859687582187352064,fuck 3d porn #aladdin hentai porn
572,859678093673463808,May/3 #Kindle US #eBook #DealA Whole New Worldby LizBraswell#Adaptations #FairyTale #Fantasy #Aladdin #books#ad
573,859674957156151296,And if anyone can fill #RobinWilliams massive shoes as Genie in #Aladdin It's
574,859664697884323840,One of my favorites. #aladdin  I need to finish my sleeve. There's so many more Disney classics to add!
575,859652464840122369,"You ain't never had a friend like me. #ALADDIN 25th Anniversary outdoors this Saturday, May 6th in Griffith Park!"
576,859638157683437568,I've decided that I'm going to decorate an #Aladdin cake. Photos will be up on my Instagram &amp; Twitter. iamMJScott Hibstah ainsley_melham
577,859623066296516608,johncampea realguyritchie Nice. Hopefully watching it next week. Hope he does well with #Aladdin.
578,859619757800255488,The_Batguy AstrosCounty Not right now...You're gettin your wishes so SIDDOWN!!!!
579,859619100745768963,"jakemkaplan That's it...THREE! (No substitutions, exchanges or refunds)"
580,859586382192398336,"Come out this Wed, Thurs &amp; Fri to see one of the last shows on the Theatre Graydon stage! #Aladdin ggmsstweets"
581,859559355712061440,"Prince Ali! Handsome is he, Ali AbabwaThat physique! How can I speakWeak at the knee"
582,859558353118392320,Watch Aladdin (1992) on #PrimeVideoUK (30-Day Free Trial)Here's the link:
583,859546284738400256,
584,859540295913947136,#Disney #VHS Illusion Journals Set including #BeautyandtheBeast #Aladdin and #TheLionKing f
585,859516163788877824,Handsome_Cheese and I talk our regularly scheduled Ramble for RambleOnMovies!
586,859491526442979331,Not obsessed honest.... from AladdinLondon on Thursday to OUAT #Aladdin on Saturday KarenDavid odedfehr
587,859490388616392704,Rehearsals in full swing for our younger group production of #Aladdin. Prepare to be amazed - get your tickets here
588,859488761901588480,"#America's NewStupid..So,#Trump is that #Fictional-character ruler of #Agrabah #FBI saz #Aladdin-Hackers.."
589,859485770373107712,Thanks to SF_DwayneRedd &amp; BrindleBrothers for teaching our K-2 Students about Dog Safety with #Aladdin.
590,859480199792033792,Make sure you get your tickets to see #Aladdin starring DeanJohnWilson &amp; stephenrahman_h before their last perfor
591,859475586749784069,#Aladdin #Theatre  Aladdin the Musical
592,859475410723246080,Musical time! #Aladdin #Musical #London #UK  Prince Edward Theatre
593,859472184552677379,#Movies that have stuck with me over decades
594,859467614577360898,Loving my birthday present from the fab dario_ccpp and all the #Aladdin cast CourtyardArts
595,859461910013501441,"LISTEN as EverythingBrian and sffcc's zakiscorner talk #Aladdin, #JurassicWorld2, #WorldWarZ and more!"
596,859461655578767360,KattChristofi1 Sweet! bring it in tomorrow!
597,859440898433728512,Abu! When will you learn! .:  jordynmccrazy12 .#stealingmonkey #aladdin #abu #dapperbound
598,859438307486220292,"New MovieFilm #Podcast! Listen as EverythingBrian and I talk #Aladdin, #JurassicWorld2, #WorldWarZ and more!"
599,859433338112798720,Jasmine and Aladdin (04/13/17) ..........{#aladdin #jasmine #aladdinandjasmine
600,859421343955251201,Aladdin: Diamond Edition (Blu-ray/DVD/Digital HD)
601,859420191742193664,The house was packed full to check out #Aladdin today AGCharter. Great #neighbors  in AvonGroveSD. TY
602,859417988394602496,Shout #Aladdin.
603,859407439757807617,Disney in Talks to Have Will Smith Playing Genie in Aladdin
604,859400567461990400,#Repost joselyn_dumas It's this weekend guys. May 6 2017 ... #ALADDIN #musicalproduction
605,859388656276168705,We are ready AGCharter for #Aladdin BrindleBrothers to show us why #KindnessIsPowerful.
606,859318073693790208,#aladdin porn game rachelle leah naked pics
607,859261181860728837,When you hear that the Broadway production of #Aladdin is coming to Cleveland next May &amp; you automatically freak out!!
608,859240606102466560,I'm so proud of this video - make me feel like I'm the star of Disney's Aladdin! #Disney #Aladdin #AWholeNewWorld
609,859205580988203008,"What's up Disney and realguyritchie ! I'm still your gal for #Aladdin ! Fierce, determined, and strong - just lik"
610,859199060372271104,#aladdin sex pics lebanese girl nude photo
611,859198257167122432,#Aladdin gets by on two key scenes but fails to satisfy overall.
612,859190215843368960,Abu doesn't know how to use a Telephone Booth .
613,859177021892685824,"When you find out that your first ever Aladdin will be your friend and amazing fave, biguglyjacob AAAHH."
614,859175045339521024,Very 'proud of this boy' tonight - flawless performance in #Aladdin - be sure to follow my #CATALYST co-star
615,859161612011413505,Having fun in the west end at Aladdin tonight
616,859150105185849344,"Ok, here goes: Im Infatuated w/lucapasqualino , Im IN  w/D'Artagnan, Im IN AWE  of Albert, &amp; Im HIGHLY ANTICIPATING #Aladdin ."
617,859146309558820864,All booked for brumhippodrome SirMattBourne #TheRedShoes and BRB #Aladdin later in the year #theatre #ballet #SupportTheArts
618,859136752195424258,Who remembers drinking out of these bad boys? #mug #throwback #aladdin #52ozLook at this on eBay
619,859134426332225537,Aladdin: Diamond Edition (Blu-ray/DVD/Digital HD)
620,859131667323256838,#Repost xryspaofficial with repostappAladdin #sneakpeek #newhit #aladdin #xryspa
621,859128386551246848,"theamzi Glad I visited the #Aladdin whilst you were in the show, good luck with your new adventure. Watch the when you fly out"
622,859104394515800065,"#JohnathanTaylorThomas, #OksanaBaiul, #Jasmine (from #Aladdin) and #DavidBowie"
623,859100096650149888,In the words of #Aladdin you were 'one jab ahead' of the fight anthonyfjoshua
624,859077922866462720,Night at the Theatre - like the true thespian I am
625,859067827545833473,Check out ALADDIN JUNIOR MISS LUNCH BOX and ORIGINAL BOTTLE 1978 #Aladdin  via eBay
