,tweet_id,text
1625,859961152490569729,RT Andy: FUN FACT: I loooooooooved #Titanic and watch it every time I'm flipping by it on TV.
1626,859961128545288197,OMG secretly my favorite movie!
1627,859961026661367808,FUN FACT: I loooooooooved #Titanic and watch it every time I'm flipping by it on TV.
1628,859959493450452995,When they start fucking up and loading the life boats incorrectly it gives me so much anxiety. Why do I watch this movie?!
1629,859958938921443329,RT kiwireportfeed: Rare and poignant #pictures of the RMS #Titanic // #history #rarephotos #RMSTitanic #tragedy //
1630,859953146164121600,KekePalmer please tell me you're watching #Titanic on spike right now!!!\n
1631,859952592176074752,"I'd like a romance like Rose and Jack: short, sweet, and he dies in the end saving my life."
1632,859951965916336128,"Not gonna let Rose drown me this time #jacksurvives #titanic #laketahoe  South Lake Tahoe,\u2026"
1633,859951838153629696,Love that SpikeTv which is the equilvilent of what lifetime is for woman that its a mens network is playing #Titanic lol this movies my shit
1634,859951469184897025,This immersive underwater #exhibit in Germany takes visitors below the surface of the Atlantic Ocean to discover th\u2026
1635,859944998569209857,"\""Of course it's unfair, we're women.\""\n\nSay what you will about Rose's mom but she was spilling some truth right there."
1636,859944691638435840,"Great, just turned the channel and #Titanic is on. I'm gonna be up for hours cause I always have to watch til the end"
1637,859943235409637376,"RT TitanicSayings: \""You're still my best girl, Cora.\"""
1638,859942082882002944,"Maybe is just me, but that old lady from the #Titanic the one that  drop the jewelry into the water and I was on..."
1639,859939432190836738,You shine up like a new penny
1640,859937182869573637,RT tayspirko: KekePalmer lexiposh  I found proof that Jack &amp; Rose would've survived on the door
1641,859936630320361472,guess i'll watch #Titanic before my show #UndergroundWGN comes on\ud83d\ude47\ud83c\udffd\u200d\u2640\ufe0f
1642,859933901829156864,Watching #Titanic \ud83d\udcfd\ud83d\udef3\u2764\ufe0f
1643,859930549661474816,Eating \ud83e\uddc0 \ud83c\udf5f shakeshack while watching Leo and Kate in #Titanic. Living my best life. \n
1644,859930046538153984,Update: I'm 30 minutes into #Titanic and I've already cried twice and the TalentiGelato is finished. \ud83d\ude33
1645,859927569566580738,RT Lisamar65096873: ROSE ILL ALWAYS LOVE U \n
1646,859924241432682496,I've watched #Titanic a ridiculous amount of times and only JUST noticed #BillPaxton is wearing an earring
1647,859924013002502144,RT WallaceReid_: from 1912 Dorothy Gibson a passenger &amp; survivor  on the ill fated #Titanic also starred in the 1st film about the disaste\u2026
1648,859923991158431745,#fact: I would rather watch a commercial-filled screening of #AFewGoodMen multiple times than watch #Titanic for the 1st time. \ud83d\udc69\ud83c\udffd\u200d\u2708\ufe0f\ud83d\udc78\ud83c\udffe
1649,859922667163582468,ROSE ILL ALWAYS LOVE U \n
1650,859921623016652800,"RT gracieepoo4: \""A woman's heart is a deep ocean of secrets\"" - Rose\u2764"
1651,859921590749847553,RT KMN735: #Titanic is in my top 10 movies of all time.  Don't  me.
1652,859920401501224960,from 1912 Dorothy Gibson a passenger &amp; survivor  on the ill fated #Titanic also starred in the 1st film about the d\u2026
1653,859920197536411648,Reflection: Rose&amp;Jack \u3030 Hilal&amp;Leon #Vatan\u0131mSensin #HiLeon #Titanic #RoseJack KanalD vatanimsensin burakkanbir\u2026
1654,859920173259796481,My favorite movie of all time. #titanic #jackandrose #goingback #grandstaircase #movies\u2026
1655,859917694413438976,WE MADE IT ON THE JUMBOTRON
1656,859917300304138244,Titanic ending makes me cry even more it's basic on a true story...
1657,859916681308753921,#Titanic is in my top 10 movies of all time.  Don't  me.
1658,859916513955938304,"\""A woman's heart is a deep ocean of secrets\"" - Rose\u2764"
1659,859916219062865924,I made this miniature replica of Rose's silk chiffon sinking dress from #Titanic. Crazy hobbies and such\u263a\ufe0f
1660,859915815721869313,RT TitanicSayings: When someone says Jack and Rose could've both fit on the door for the millionth time
1661,859915108042108933,neiltyson watching #titanic and couldn't help but chuckle at the sky scene \ud83d\ude1c
1662,859915080493920257,Currently crying because Jack died \ud83d\ude2d
1663,859909624824246272,RT TitanicSayings: When someone says Jack and Rose could've both fit on the door for the millionth time
1664,859908195376123905,"RT TitanicQuotes: Rose: \""Half the people on this ship are going to die.\"" - Cal: \""Not the better half.\"" &lt;/3"
1665,859908161582637056,"RT TitanicQuotes: Cal: \""Not now. We're busy.\"""
1666,859907962323783680,More minions - they had a time machine you know
1667,859906858294943746,iskatewinslet I'm watching this right now. 20 years later and it's still as powerful and brings me to tears in all\u2026
1668,859905419627679744,"Authors \""S\"" - The Rescuing of Jack Dawson by ScarletBelle87. #Crossover #Titanic #Twilight #angst #preTwilight..."
1669,859904696278011905,My kid is obsessed with #titanic but he's also 3 so my husband and I have to make the story toddler appropriate.\u2026
1670,859902980786495488,SenWarren all this can wait! demand an #independentinvestigation into #trumprussia now! this country is starting t\u2026
1671,859902961807380480,Never get tired of watching #Titanic \ud83d\udea2
1672,859901770004353025,watching Cameron Crowe's #Titanic ....this movie gets me \ud83d\ude2d\ud83d\ude2d\ud83d\ude2d\ud83d\ude2d everytime I watch it\ud83d\ude14
1673,859901720830324736,Fact about JTranR01 number 101: The #JamesHorner #Titanic score can still make me tear up almost 20 years later.
1674,859896790967087104,RT CatoCrane: An Unexpected Piece of #Titanic #WhiteStar #Memorabilia !! By the Sea in #Wirral !! #RoyalAlbertHall #London Concert !
1675,859895112968679426,I don't think I'll ever get tired of watching #Titanic great movie.
1676,859894907548422146,Still think Leo should have snatched Kate Winslet when he had the chance! \ud83d\ude14 #Titanic spike
1677,859891991215263744,shawn_elbert guess what's on Spike!
1678,859890425431298049,Rare and poignant #pictures of the RMS #Titanic // #history #rarephotos #RMSTitanic #tragedy //\u2026
1679,859888293034553344,Oh no! I can't look! Watching #Titanic again and really really hoping it's going to end differently.
1680,859886789871501316,"RT strongstableorg: Excited to bring you May's vision for UK\nMore details:  \""A #Titanic success\""\u2026"
1681,859886223145480194,The latest CelebSpeak!
1682,859881918141267970,"RT TitanicSayings: \""You jump, I jump, right?\"""
1683,859881751442862085,"RT TitanicSayings: \""To the stars.\"""
1684,859881609624997890,RT TitanicSayings: When you haven't watched #Titanic for a few days
1685,859881565039595523,RT TitanicSayings: To making it count
1686,859880410142179328,RT peterfrankopan: Strong and stable leadership. The same qualities Capt Smith showed on the #Titanic #Iceberg #DeadAhead.
1687,859880269880246272,RT greatwriteshark: 83% of third class male passengers died on #Titanic. Why do we know so little about their story on that night?
1688,859879045542146048,Comparrisons between #Brexit + #Titanic unfair.  Titanic's Captain Sharp didn't deliberately steer his ship into the iceberg... May however!
1689,859874284419862533,Cal is the alt-right of #Titanic. Discuss.
1690,859874036893044737,"RT bsb5ivefan97: #AFactAbout Scottlarock5:\nHis #FavoriteMovie is #Titanic\n\""#DontLetGoRose! #DontLetGo!\""\n#ScottDay #5iveDay 5iveday"
1691,859869235522273282,Classic parody - #ANC #Zuma #titANiC It is about to go down !
1692,859868654334357504,BillyZane was absolutely on point in #Titanic. Just a joy to watch over the years.
1693,859867913469276161,Taiwan Titanic - An Epic Prank \u21baRT\u2764\ufe0f\ufe0f
1694,859865819127402500,Rose was trouble from the damn start. Jack shoulda let her ass jump.
1695,859865788504604672,The builder of #Titanic or taking a sword for #KingCharlesI - #whichancestorismoreimpressive?  via wordpressdotcom
1696,859865242955853824,"#Titanic\nAlso, I'm still working on the sketch~. \ud83d\ude05 Alex_Dupras"
1697,859863726463365120,"Ok, how badass would this be!?!"
1698,859860804820246533,RT peterfrankopan: Strong and stable leadership. The same qualities Capt Smith showed on the #Titanic #Iceberg #DeadAhead.
1699,859859450781368320,"I have the high ground, Jack!"
1700,859858380491567106,"RT jennycolgan: ... you get hit by one of the falling smokestacks of the #Titanic, is my recollection"
1701,859858174173511680,chappie_cat is that ewer home?\nThe #Titanic?
1702,859854450839650304,We know you would...\n\n
1703,859854271780712448,RT TrusteeSam: They're all just polishing brass on the #Titanic And good riddance when this scow finally sinks. #TOpoli #ONpoli #CDNpoli #\u2026
1704,859853700323565574,Amazing photos of the Titanic.\n#titanic #4-12-12 #shipwreck #northatlanticseabed \n\n
1705,859853418340417538,Tune into Spike if you're wanting to see the best movie of all time.
1706,859839578420781064,RT CatoCrane: An Unexpected Piece of #Titanic #WhiteStar #Memorabilia !! By the Sea in #Wirral !! #RoyalAlbertHall #London Concert !
1707,859839198173569036,mamsy77 BillyNtaote kmohloboli Lestimes Ntebo_Tsehla   the #Titanic is headed to Lesotho #DC #LCD tumisole \ud83d\ude02\ud83d\ude02\u2026
1708,859837930222825474,RT stntalk: Sweet dreams
1709,859837864414203905,RT stntalk: Sweet dreams
1710,859835904201867264,You jump \nI jump \n
1711,859834623081238528,An Unexpected Piece of #Titanic #WhiteStar #Memorabilia !! By the Sea in #Wirral !! #RoyalAlbertHall #London Concer\u2026
1712,859833835835580417,SMvintage that next challenge looks
1713,859833631921115136,RT annemariebrear: A New Dawn \n#Titanic #shortstory\nAmazon UK  USA  AUST
1714,859833572328435712,Where is my jack
1715,859832496640466945,When your watching #Titanic and realise that two people are called Olaf and Sven #Disney was obviously a fan #Frozen \ud83d\udea2
1716,859828907570339841,A New Dawn \n#Titanic #shortstory\nAmazon UK  USA  AUST\u2026
1717,859825685539561478,The latest CelebSpeak!  Thanks to drivebytruckers
1718,859822930611621888,"RT HollywoodVineLA: RIP to the legend #BillPaxton. We loved you in #WeirdScience, #Twister, #Titanic and many more! You will be greatly mi\u2026"
1719,859821195268673536,"#Titanic shooting, 1996."
1720,859820938065571840,Brexit iKenStuff jp morgan the great #titanic insurance con.....who cares...corrupt feckers..morgan made hemp illegal
1721,859820389463195649,RT TitanicSayings: When someone says Jack and Rose could've both fit on the door for the millionth time
1722,859818590643658753,"RT bsb5ivefan97: #AFactAbout Scottlarock5:\nHis #FavoriteMovie is #Titanic\n\""#DontLetGoRose! #DontLetGo!\""\n#ScottDay #5iveDay 5iveday"
1723,859817120959315968,"RT HeatherRankinMe: #DYK According to Daniel Allen Butler \""#Titanic\"" is the most recognized word in the world after \""God\"" and \""Coca-Cola\""\u2026"
1724,859815583952629760,RT TitanicSayings: When someone says Jack and Rose could've both fit on the door for the millionth time
1725,859812973962985472,RT HeatherRankinMe: Dave Tyson and I visited ns_mma today &amp; learned lots about the #Titanic. I did a little tour on Facebook Live.
1726,859812883013697536,83% of third class male passengers died on #Titanic. Why do we know so little about their story on that night?\u2026
1727,859809844429303808,RT TitanicSayings: When someone says Jack and Rose could've both fit on the door for the millionth time
1728,859807880731664384,RT dire_pug_Sam: I think Andrew Jackson also refused to buy tickets to the maiden voyage of the #Titanic since he was allergic to icebergs\u2026
1729,859806716992598017,I think Andrew Jackson also refused to buy tickets to the maiden voyage of the #Titanic since he was allergic to ic\u2026
1730,859805919579971585,"when louis is explaining the sinking.... \""and that's a big ass we're talking 20-30 thousand tons\"""
1731,859805656290930688,"\""ah, that's typical, first class dogs come down here to take a shite\"""
1732,859805554373537792,I love tommy the irish guy though haha
1733,859804686693675011,RT thenjiwecomedy: \ud83d\ude02\ud83d\ude02\ud83d\ude02\ud83d\ude02 ngiyekeleni ngihambe kule cowntry \ud83d\ude02\ud83d\ude02\ud83d\ude02\ud83d\ude02 #titANiC #ANC \nPS: Why is this person not designing my posters already? htt\u2026
1734,859802590749614080,"... you get hit by one of the falling smokestacks of the #Titanic, is my recollection"
1735,859802493185908741,OMG \ud83d\ude02\ud83d\ude02\ud83d\ude02 Crying \ud83d\ude02\ud83d\ude02\ud83d\ude02\n\u266b Every night in my dreams I see you I feel you \u266b . . . #Zuma #DlaminiZuma #Guptas #Titanic\u2026
1736,859802099063939073,RT TitanicSayings: When someone says Jack and Rose could've both fit on the door for the millionth time
1737,859801313634390018,100 best nude scenes #titanic xxx
1738,859800866186043393,RT TitanicSayings: When someone says Jack and Rose could've both fit on the door for the millionth time
1739,859800138889519104,RT TitanicSayings: When someone says Jack and Rose could've both fit on the door for the millionth time
1740,859796919748612097,Welcome BostonGlobe to club B.p! #Spotlight #ABeautifulMind TIME POTC #AlbertEinstein MOI #Braveheart SophieMarceau #Titanic LeoDiCaprio
1741,859796750281977857,RT titanicswfc: Steven Fletcher goal and celebration against Newcastle made better with Titanic music #swfc #wawaw #titanic helenwheels h\u2026
1742,859796147778596864,I\u2019m #Jewish and I just became an #EU citizen. It feels a little like boarding the #Titanic.
1743,859795407731212289,RT TitanicSayings: When someone says Jack and Rose could've both fit on the door for the millionth time
1744,859795319835553792,.TheAcademy Awards. Global?nat'l preserved best. The #Statueofliberty recognized in #Titanic. Global top .0000001% ABC HISTORY BBC CBS
1745,859795319428702208,"RT TitanicSayings: \""Hello Jack. I changed my mind.\"""
1746,859794683089870849,RT TitanicSayings: When someone says Jack and Rose could've both fit on the door for the millionth time
1747,859794569503920129,When someone says Jack and Rose could've both fit on the door for the millionth time
1748,859794532124282880,RT ampmfun: Events #spotlight #CapeCod's #role in #saving #Titanic #survivors (  ) #AMpmFUN #usnews #worldnews #new\u2026
1749,859792071670067202,RT ampmfun: Events #spotlight #CapeCod's #role in #saving #Titanic #survivors (  ) #AMpmFUN #usnews #worldnews #new\u2026
1750,859790902243577856,RT ampmfun: Events #spotlight #CapeCod's #role in #saving #Titanic #survivors (  ) #AMpmFUN #usnews #worldnews #new\u2026
1751,859789794007818241,\ud83d\ude02\ud83d\ude02\ud83d\ude02\ud83d\ude02 ngiyekeleni ngihambe kule cowntry \ud83d\ude02\ud83d\ude02\ud83d\ude02\ud83d\ude02 #titANiC #ANC \nPS: Why is this person not designing my posters already?
1752,859789388225683456,RT ampmfun: Events #spotlight #CapeCod's #role in #saving #Titanic #survivors (  ) #AMpmFUN #usnews #worldnews #new\u2026
1753,859787033597935619,RT ampmfun: Events #spotlight #CapeCod's #role in #saving #Titanic #survivors (  ) #AMpmFUN #usnews #worldnews #new\u2026
1754,859786312492224512,The latest The Robert Tollen Daily!  Thanks to MikeMongo TrueCharter CathyEngMD
1755,859785247260585989,RT ampmfun: Events #spotlight #CapeCod's #role in #saving #Titanic #survivors (  ) #AMpmFUN #usnews #worldnews #new\u2026
1756,859785078318051328,Used #Hotwire to get the cheapest rates on a mystery hotel in #Portland. Ended up with a first class ticket on the\u2026
1757,859784242502541312,nude women tennis players #titanic nude scence
1758,859782036894216193,holand sexy girls #titanic nude scence
1759,859780463036116992,RT NorfolkMuseums: Hear the stories of the five #Norfolk survivors of the #Titanic in a special talk timetidemuseum this Friday -
1760,859780038157365248,What if your spiritual journey took you back to a voyage aboard the RMS #Titanic? PaulAmirault1\u2026
1761,859780036995547136,What if your spiritual journey took you back to a voyage aboard the RMS #Titanic? PaulAmirault1\u2026
1762,859776987518443520,#titanic nude picture porno uploads
1763,859774929344094208,lesbian asian sex #titanic nude scence
1764,859774676352081923,They're all just polishing brass on the #Titanic And good riddance when this scow finally sinks. #TOpoli #ONpoli\u2026
1765,859770778904080384,Hear the stories of the five #Norfolk survivors of the #Titanic in a special talk timetidemuseum this Friday -\u2026
1766,859768993959337984,Check out this item in my Etsy shop  #OnceUponATime #belle #BeforeIFall #BeautyAndTheBeast #Titanic #Mother'sDay
1767,859766886447427584,naked girls excersising #titanic nude painting
1768,859765071320276992,#titanic #southafrican version
1769,859761288511184899,RT annemariebrear: A New Dawn \n#Titanic #shortstory\nAmazon UK  USA  AUST
1770,859758210969997312,My heart will go on #CelineDion #Titanic theme song #Piano cover
1771,859757415931289603,"GOP #Trump shld have been Cap'n of the #Titanic.\""Don't panic folks, we're just having a life boat drill\""."
1772,859753612603523072,"Jack, ill NEVER let go. I still havnt \ud83d\ude2d \n\n"
1773,859750962721894400,"RT strongstableorg: Excited to bring you May's vision for UK\nMore details:  \""A #Titanic success\""\u2026"
1774,859747516455297024,RT DudleyArchives: Join us and #Titanic expert and author Andrew Lound at 10am on Saturday 20th for a hands on event on archives and resea\u2026
1775,859743133231456259,#titanic naked pics over 80 porn
1776,859742004284149760,RT Classic_picx: #OnThisDay 1912 RMS #Titanic hits an iceberg. The ship's Captain E.J Smith is pictured here in the moments after the iceb\u2026
1777,859740681425879040,Nice #titanic mural in
1778,859738659226091522,Whoever did this deserves a high5\n\ud83d\ude06\ud83d\ude06\ud83d\ude06\ud83d\ude06\n
1779,859731916819484672,"RT strongstableorg: Excited to bring you May's vision for UK\nMore details:  \""A #Titanic success\""\u2026"
1780,859724769360355328,RT allyson3rdgrade: Iceberg! Straight Ahead!! #titanic #walearns #waprimary sarahenggelerWA
1781,859712328048234496,The latest The JES Daily!
1782,859703955953156096,RT Karabolegae: #WorkersDay #CosatuMayDay #myanc they want to sink our country like
1783,859702686479863808,You Jump I jump Remember \u2753\u2754\u2753 These emotional words still works \n#Titanic \u2693\ufe0f\ud83d\udea2
1784,859701036617011201,"RT bsb5ivefan97: #AFactAbout Scottlarock5:\nHis #FavoriteMovie is #Titanic\n\""#DontLetGoRose! #DontLetGo!\""\n#ScottDay #5iveDay 5iveday"
1785,859696536523075584,Check out the latest episode of Juvenalia_Pod with special guest Stacy Grouden
1786,859694251868815360,The glasses and pin badge of first class passenger William Edward Hipkins are some of personal items to be seen in\u2026
1787,859693317038145536,iskatewinslet My favourite actress from
1788,859691346503839745,teenmegaworld porn stars names #titanic rose nude
1789,859689408584396800,RT ghaziriman: #Titanic #NDU # REVITALIZING  THE  #LOVE OF
1790,859688380145123328,"RT SilverSkySP: For my #reylo #titanic au fic, pic by Lookpear Everlark. I appreciate this piece of artwork. Thx, you guys R great."
1791,859687296999862273,black lesbains porn #titanic rose nude
1792,859686185203052545,sri lankan fukking women naked #titanic rose nude
1793,859684342372515840,"For my #reylo #titanic au fic, pic by Lookpear Everlark. I appreciate this piece of artwork. Thx, you guys R great."
1794,859681395962249216,Back to the year #Titanic was in cinemas... but where in the 90s are we going back to on today's #TimeTunnel? Tweet\u2026
1795,859680764916633601,This morning's #TimeTunnel comes from the year that #Titanic was in cinemas. Music from AllSaintsOffic &amp;\u2026
1796,859678932148387840,"RT bsb5ivefan97: #AFactAbout Scottlarock5:\nHis #FavoriteMovie is #Titanic\n\""#DontLetGoRose! #DontLetGo!\""\n#ScottDay #5iveDay 5iveday"
1797,859678896782004224,"RT bsb5ivefan97: #AFactAbout Scottlarock5:\nHis #FavoriteMovie is #Titanic\n\""#DontLetGoRose! #DontLetGo!\""\n#ScottDay #5iveDay 5iveday"
1798,859678896777768960,"RT bsb5ivefan97: #AFactAbout Scottlarock5:\nHis #FavoriteMovie is #Titanic\n\""#DontLetGoRose! #DontLetGo!\""\n#ScottDay #5iveDay 5iveday"
1799,859678896664477696,"RT bsb5ivefan97: #AFactAbout Scottlarock5:\nHis #FavoriteMovie is #Titanic\n\""#DontLetGoRose! #DontLetGo!\""\n#ScottDay #5iveDay 5iveday"
1800,859678687662407681,RT TheMADJoker1: #WEFAfrica2017 coming soon in 2019 #titANiC It's about to go down staring #JacobZuma &amp; #NkosanaDlaminiZuma\n\n#ANC #Mugabe\u2026
1801,859677314929508353,"#AFactAbout Scottlarock5:\nHis #FavoriteMovie is #Titanic\n\""#DontLetGoRose! #DontLetGo!\""\n#ScottDay #5iveDay 5iveday"
1802,859669481039290368,RT annemariebrear: A New Dawn \n#Titanic #shortstory\nAmazon UK  USA  AUST
1803,859669381525241856,Titanic Rhapsody on KU &amp; Amazon Kindle! A sexy gambler in love with two women... who will survive?\u2026
1804,859666245377044480,Did Zuma take a seventh wife on a sea Cruise I didn't know about?
1805,859666165811077120,RT Karabolegae: #WorkersDay #CosatuMayDay #myanc they want to sink our country like
1806,859665117100744704,"DeeeEeeep underwater, is where I left my loveeee. \ud83e\udd40 #ATLANTIS\nbridgitmendler tunjiige Kaiydo"
1807,859659925634641920,blacksheep63 LiarMPs gooner145 #BorisJohnson leaves a trail of #titanic blunder but because he's liked by his me\u2026
1808,859657513536507904,RT timetidemuseum: We hope all who attended our #Titanic #Endeavour viewing enjoyed it! A special thanks to those who travelled all the wa\u2026
1809,859656485231628288,#WEFAfrica2017 coming soon in 2019 #titANiC It's about to go down staring #JacobZuma &amp; #NkosanaDlaminiZuma\n\n#ANC\u2026
1810,859656002207195136,"RT katiecouric: When Sherry Lansing worked on #Titanic, she thought they didn't need \""My Heart Will Go On\"" because it was too corny"
1811,859655821373865984,RT KieronOC: Cobh \u2618\ufe0f Ireland Titanic #Cobh #Ireland #Titanic hellocork_ PictureIreland CorkHarbourWX PhotosCork GoToIrelandUS Cork__\u2026
1812,859655380644876288,RT ghaziriman: #Titanic #NDU # REVITALIZING  THE  #LOVE OF
1813,859655021826252800,"Just watched Titanic, why does no one ever talk about Jack's bff Fabrizio? He's the one I wish survived ;-;\u2026"
1814,859653399415074818,RT peterfrankopan: Strong and stable leadership. The same qualities Capt Smith showed on the #Titanic #Iceberg #DeadAhead.
1815,859652118940188672,"Recent work visit to #belfast.. A harsh, hard working City. #brexit is hitting them hard .."
1816,859651842577399809,The latest The JES Daily!  Thanks to CleverKatyK
1817,859651007034396673,#Titanic #NDU # REVITALIZING  THE  #LOVE OF
1818,859650577734742016,RT timetidemuseum: We hope all who attended our #Titanic #Endeavour viewing enjoyed it! A special thanks to those who travelled all the wa\u2026
1819,859648938617470976,MirrorPolitics #Mays interview with #Marr RichardGrahamMP disgraceful comments about #disability #Gloucester\u2026
1820,859647459617718272,A New Dawn \n#Titanic #shortstory\nAmazon UK  USA  AUST\u2026
1821,859644120620572672,RT timetidemuseum: We hope all who attended our #Titanic #Endeavour viewing enjoyed it! A special thanks to those who travelled all the wa\u2026
1822,859641886776143873,MagpiesView #borisjohnson is hidden because his gaffes are of #titanic proportions or is it just not to answer\u2026
1823,859640054490247170,"Excited to bring you May's vision for UK\nMore details:  \""A #Titanic succes\u2026"
1824,859631824565391361,RT peterfrankopan: Strong and stable leadership. The same qualities Capt Smith showed on the #Titanic #Iceberg #DeadAhead.
1825,859629544248139777,RT TitanicSayings: To making it count
1826,859628814770601985,RT Karabolegae: #WorkersDay #CosatuMayDay #myanc they want to sink our country like
1827,859625637522309120,RT KieronOC: Ireland \ud83c\uddee\ud83c\uddea Titanic \u2618\ufe0f Cobh #ireland #Titanic #Cobh #Cork PictureIreland RandomCorkStuff PhotosCork Cork__Today TitanicCo\u2026
1828,859625576730165248,RT Ani_Anitha10: #RajaRani  Remix / #Titanic Tamil\nDedicated to my dear \ud83d\udc93\ud83d\udc93 arya_offl \nAtlee_dir \n
1829,859624016604262400,RT Classic_picx: #OnThisDay 1912 RMS #Titanic hits an iceberg. The ship's Captain E.J Smith is pictured here in the moments after the iceb\u2026
1830,859618585722925057,RT TitanicSayings: To making it count
1831,859611041168322560,Check out: Titanic by Wilhelm TitanicWilhelm #historical #romance #TITANIC   TitanicPassage
1832,859610733448908808,"\""#TITANIC\"" movie hero LEONARDO DE CAPRIO has joined fight against #ClimateChange &amp; #Environment disasters due to..."
1833,859608375658770432,The latest The Celebrity Capricorn Daily!
1834,859607916512497664,RT Karabolegae: #WorkersDay #CosatuMayDay #myanc they want to sink our country like
1835,859603658056585217,RT Karabolegae: #WorkersDay #CosatuMayDay #myanc they want to sink our country like
1836,859591484206723072,RT bradweza: #Coup_plotter Who did this \ud83d\ude02\ud83d\ude02\ud83d\ude02\ud83d\ude02\ud83d\ude02\ud83d\ude02\ud83d\ude02\ud83d\ude02 #Itsabouttogodown \ud83d\ude02\ud83d\ude02\ud83d\ude02\ud83d\ude02\ud83d\ude02 #titANiC #ANC \ud83d\ude02\ud83d\ude02\ud83d\ude02\ud83d\ude02 never a dull moment in this Country \ud83d\ude02\ud83d\ude02\ud83d\ude02\ud83d\ude02\ud83d\ude02\ud83d\ude02\ud83d\ude02 Da\u2026
1837,859585485307617280,"Some days you're the #Titanic, Some days you're the #Iceberg."
