,tweet_id,text
247,860948312651726848,"If you haven't noticed, I've been on a HUGE #DoctorWho kick lately. Love this mashup. #doctorwho #backtothefuture"
248,860947866495234048,"TONIGHT! Experience #BackToTheFuture outdoors at HancePark with music by DJ Melissa Marie, food trucks &amp; more!"
249,860941478759026688,Definition of next level
250,860939838572331008,".JasonBradbury - Great scott! The DeLorean is looking good, front &amp; centre in LincsCathedral at SparkLincoln"
251,860938915938791430,Back to the Future (1985) Download Full Movie HDDownload Link:
252,860937649607127040,Happy Saturday! Here's a #throwback photo from 2014 taken by Kim Marra. #JenniferParker #ClaudiaWells
253,860933525662572544,"Kate from LOST, Doc, and Marty find a tardis. #lost #backtothefuture #doctorwho #katefromlost"
254,860933099302993921,"Your future is whatever you make it, so make it a good one. ."
255,860929531837911040,"I made a new video, The Delorean Time Machine  via YouTube"
256,860927694493466625,Sitting in the 4x4 and seeing the DeLorean in the mirror. Way too cool. #backtothefuture #bttf #delorean #toyota
257,860922620333744129,We have a glitch in the time-space continuum... #doublemartys #martymcfly #backtothefuture
258,860919914663526402,When Doc found Rick at the Ren Faire... #rickandmorty #docbrown #backtothefuture #renfaire
259,860918490693349376,"\""If my calculations are correct, when this baby hits 88 MPH, you're gonna see some serious shit.\"" - Doc Brown"
260,860911049607757824,the Living proof that something went wrong on #BackToTheFuture is that #Bifftanen turned out to become POTUS of the
261,860903283828948992,"So freaking cool, my absolute favourite - #delorean #backtothefuture #martymcfly #dmc"
262,860897892474777600,Twitter Likes and followers hack #PSGSCB#puresugar
263,860884108687364097,#BackToTheFuture en FOX Family
264,860883760811831297,A dream come true!
265,860879412069191680,Back to the Future Flux Capacitor Wristwatch
266,860878585728466944,4 Days Left to order the Brick to the Future Brick Loot Box! #backtothefuture #bttf #LEGO #subscriptionbox #kidceo
267,860874665966919681,"\""Back To The Future\"" en clave #playmobil  --&gt;   #backtothefuture #volveralfuturo"
268,860857444523810817,Using a #flux capacitor to prevent data theft -
269,860856689121210368,1.21 Dongwatts!
270,860856260694073345,I love my job.
271,860855958242816001,Back to the Future (1985) Full Movie HDDownload Now:
272,860849213130911744,"I'll take the DeLorean to sainsburys to do the weekly shop, as you do. Seems practical for the job."
273,860848150822637568,My #favoritemovies part 6! (franchise version!)#HarryPotter#LordOfTheRings #Superman
274,860844957011234816,Go back to the future with this time machine. Come to Touch-a-Truck today! 10am-5pm #halifax #touchatruck
275,860840446834204672,Have you ever attended/participated in the #GreatDockCanoeRace?
276,860838562723508229,Gonna start the weekend off with all of my fave #GreysAnatomy episodes and then #backtothefuture
277,860833275421618178,Uber claims it will have flying cars in Texas and Dubai by 2020.
278,860833269105008641,ColeLopez77 No. He needs to build a time machine with Doc Brown and go back in time and beat Jordan and the Bulls.
279,860828358623596544,LincsCathedral TomFletcher what a setting!
280,860823020251873280,VOTEZ RED THOMAS !
281,860821528903958528,ken_wheeler mxstbr StoiberNiki Would rather be Marty McFly #fly #BackToTheFuture #nike
282,860809501225701376,#delorean #backtothefuture  Lincoln Cathedral
283,860809029785878533,"Yes, that is a flux capacitor. #backtothefuture #greatscott"
284,860795413439410176,Thanks askmen for featuring our jacket!
285,860794481385369600,So fast to go in the #future NurburgLapTimes?
286,860791149426094081,We're going #backtothefuture at #SparkLincoln with Lincoln Steampunk Society
287,860781850532425730,"Two weeks to go, have you got your tickets yet?"
288,860770703200714753,yourpal_alex kenzie_haarlow I'm still going with 3.
289,860764139467177985,"This is worth 3 mins of your time today, superb creativity"
290,860764072052232193,"Without a #hitch, how will you to bring your #Delorean in for repairs? Schedule an install &amp; get #backtothefuture:"
291,860759714312990721,Futuristic Focus!#MrGrimezPoetWarrior #CyberPunk #ScienceFiction #BackToTheFuture #SkiGoggles #Vauxhall #JamesBond
292,860753670429921280,idahocafe thejournal_ie Now election info will be written down and stored in filing cabinets under lock and key...
293,860750796547403776,MrJohnNicolson simonrug Scots keen for Independence now at least have the advantage of foresight as they watch th
294,860735237516603392,Gym again.
295,860713410987556865,The hot new Millennial housing trend is a repeat of the Middle Ages  via TheAtlantic
296,860705122615267328,Last day with this beast #dynmc #radmediaworx #delorean #shootlyfe #backtothefuture
297,860694840819933184,Back to future 4 trailer is a cruel tease!
298,860671798727372801,Saw this crazy DeLorean in our lot today!
299,860657009233997824,__Asimo__ You've been watching to much #BackToTheFuture mate
300,860647932185522176,VICELAND Ronald Regan was an actor....
301,860641114835099648,It doesn't take a lot of strength to hang on. It takes a lot of strength to let go.#team_Martin #backtothefuture
302,860640911440715776,Thank you rfespta for spoiling us all week! #backtothefuture #clarkburgers #sweets
303,860639790642933760,TejaArboleda zdulli Love it when Cortez discovered the Aztec and Mexico was born. #HappyCincodeMayo#happyNov5th too
304,860638917330165760,"Also: just like #BackToTheFuture, Tombstone's script does a great job of setting all the future plot points up in its first act. I like it!"
305,860628016841490436,"The \""Future\"" looks bright with you! Happy 2 Months babe #BackToTheFuture #AirMags #TheOne"
306,860618855319830528,#TheBestAdventuresAlwaysStart With TIME MACHINES!!!! #BillAndTedsExcellentAdventure #BackToTheFuture
307,860614359721975808,TurnbullMalcolm  hows them  #grown adults with their #schoolYARDtAunts ...its like being
308,860612690162716673,#FlashBackFriday to 2015 w/ mrchristopherll being interviewed - #FBF #ChristopherLloyd #DocBrown #JenniferParker
309,860607880453607426,Is #BacktotheFuture actually going to happen? Flying cars may be a thing in China.
310,860595955846062080,Thank You gobe_ziojordan for this Amazing nike air jordan accessories og. #backtothefuture Shop
311,860595823389921284,Followed by the always epic #BacktotheFuture w/ DJMetroGnome. Presented by TitosVodka &amp; oldsoulent Doors: 11PM. FREE before midnight.
312,860593896593788928,Back to The Days of racial abuse and gripping your nothing
313,860592091214348288,Rick to the Future  Steemit
314,860589057151180801,Doc's got the right idea. He won't be having any head to head contact with that contraption covering his dome!
315,860584249149313024,"VonFogel, JIadarola and KimScorcher pitch ideas to BrettErlich about rebooting \""#BackToTheFuture\"":  va YouTube"
316,860570147441885184,"For Guardians Vol. 2, have some Marty McStarFlord! prattprattpratt JamesGunn #backtothefuture #bttf #GotGVol2"
317,860567713919512577,"Where we are going, we don't need roads.Rachel can fly.....sans wheels."
318,860562338382053376,#TOBT My blog post: Train Or Be Trained - The Flux Capacitor
319,860558771847876612,Today we playtested this #BackToTheFuture #pinball machine. #gamesroom #arcade #mancaveView all our recon pins:
320,860557319196770304,#backtothefuture ... #PrintworksLondon ... #paulkalkbrenner giving up some lessons for us
321,860546792517025793,On set with #christopherlloyd #setlife #dremmettbrown #backtothefuture #bts #producer #director
322,860546383551635456,Just had an e-mail from TheRFL telling me England_RL v Samoa kicks off in one hour. #backtothefuture #fail
323,860537704576155649,"BBCNews Prof John \""Doc\"" Curtice deserves a medal for stamina after an all nighter and an all dayer! Intravenous caffeine?"
324,860536500932444160,"Life is what you make it... Accept your decisions, and do your thing."
325,860530429694267393,Back to the Future (1985) Watch Full Movie HDWatch Now:
326,860527226114068481,#BackToTheFuture if you haven't seen it fuck you.
327,860526443188543489,What's your message? #BackToTheFuture #EdTechTeam markwagner
328,860526189387145216,"Not #backtothefuture, back on the"
329,860521891727015937,We Felt it but never Comprehended it...
330,860510786367574016,Super blown away! First time to ride a Tesla car!
331,860509613749350401,Behind the scenes filming the train/DeLorean sequence on #BackToTheFuture Part III (1990).
332,860501894342561792,Heritage auctions to host first-ever sale of rare sneakers #Auction #Sneakers #Kanye
333,860501717527314432,"GOTS DA GIFT!\"":This week's blog post features my #MartyMcFly &amp; #DeLorean pop!"
334,860496508671709184,"Los personajes de \""Back To The Future\"" en clave #playmobil  --&gt;  #backtothefuture"
335,860489419131932672,Watch Back to the Future (1985) on #nowtv (14-Day Free Trial)Go watch it:
336,860482595498283009,love the #backtothefuturepart4 trailer
337,860467573854535680,I am ready to
338,860465646387310592,Great Scot! Loving the vibe at Soarks engineering festival!! 5th-7th May at LincsCathedral #backtothefuture
339,860463459196170240,Mornin' !!! It's Friday... woohoo #friday #backtothefuture #martymcfly #docbrown #goodmorning Bom dia! Hoje...
340,860458059088441344,Go #BackToTheFuture at #SPARKLincoln! SparkLincoln
341,860455355628740608,Rory Lobb is a dead ringer of George McFly
342,860442310508765184,#listex2017 Summer Session #backtothefuture #forum - looking back over 5 years meriski dynastarskis InTheSnowMag
343,860442265185079296,FriaryMill Tell us about it...
344,860435048335630336,#BackToTheFuture #CarryOn #MontyPython and #ToddSolondz mentioned as source of #inspiration for starting their care
345,860432313271947264,angliastorage LincsConnect visitlincoln McLarenAuto Will be going over tomorrow!  #backtothefuture
346,860432308352012289,Having a clean and a charge. #backtothefuture #nikemags #derbyuk #blastfromthepastderby  Blast
347,860418316850130945,#StarWarsTaughtMe nothing really but #BackToTheFuture taught me a lot.
348,860411570098130944,LincolnCathedral Filmonafarm 27th May at Revesby Estate
349,860406777191559168,"PhillMunn LincolnMedia NikkiGoldblatt lincolncouncil Love the date mix-up- date email sent 5/4/17, date of viol"
350,860388036646973440,He is #BacktotheFuture #Marc McClurer to #C32017#Apollo13 #SuperManMay 12-14#ComicCon #CosplayTickets on Sale N
351,860377125244854272,"Emmavieceli BacktotheFuture IDWPublishing TheJohnBarber TomWaltz Hi! I'm Ester, my copy arrived too!  I'm very"
352,860371019545985024,"Travel #BackToTheFuture at Margaret T. Hance Park this Saturday, May 6th with live music, food trucks &amp; more!"
353,860343847653486593,My favorite movie when I was a kid.
354,860335994561847297,GOING BACK TO THE 90's
355,860314299457261569,One sing for all Lovers. #EarthAngel #Backtothefuture#Loveforall #LoveforUs #goodnight
356,860313870837186561,Classic movie type night
357,860311423158808577,I am Listening #Soundtracks #BackToTheFuture The Power of Love Huey Lewis &amp; The News TTA90sPodcast willfriedle
358,860307926162051072,"Michael J Fox is on the cover of AARP. #backtothefuture part 2 IRL.  Southern Gables, Lakewood,"
359,860300556203692032,TheEyeOfGibson Hoot! I couldn't figure it out but he looks just like Biff!
360,860284037495173120,metrowinnipeg Haha no thanks
361,860283668492820480,You guys! This is the coolest! Autonomous transit!
362,860282249798987776,Didn't care a bit.
363,860270264302657536,neorise_ KneWKeeD It takes courage indeed. Takes us back to the days of our forbears
364,860261939552940032,"#Guitar #CoverSong of #ChuckBerry's (RIP) Johnny B. Goode by 10yr old girl, Salem!!"
365,860252155537739776,Watching #backtothefuture &amp; feeling sad we never got the musical we were promised from LloydJamie! There's brilliance in there that sings!
366,860238594220470272,From Marty McFly to Darth Vader
367,860231628802490368,Look at this on eBay
368,860228658925113345,The DeLorean is in Lincoln &amp; so are we at Revesby_Estate on 27 May with #BackToTheFuture! I wonder if JasonBradbury fancies a night out
369,860226759794536448,White Plains Mall is hurt!!!  Eesshh!  I feel like I'm in the 80's. Lol   #backtothefuture
370,860213899530047488,sportscar365 kamui_kobayashi Toyota_Hybrid Friday?? What you runnin a delorean??
371,860212498913402880,May the 4th be with you! #StarWarsDay #backtothefuture #bttf #martymcfly #cosplay #crossover #MayThe4thBeWithYou
372,860211159898697728,-2 days paulkalkbrenner #backtothefuture
373,860210770386223106,I guess I should plan a trip to Boston this summer
374,860197857378357248,#TBT to 2014 - #JenniferParker in a #Batmobile? Smile! #ClaudiaWells #BacktotheFuture #Batman #ThrowbackThursday
375,860196455029649408,When LASTEXITshirts have a sale and you have a wishlist and a credit card #Jaws #Alien3 #BackToTheFuture
376,860196135251718145,"In an age where science is falling into disbelief... perhaps we just need 1.2GW, and at 88mph.... #BackToTheFuture"
377,860195948424810501,Great to see the JasonBradbury  #backtothefuture car SparkLincoln preview LincsCathedral
378,860192757985427456,Happy
379,860183549013524480,#backtothefuture #1977 #SWEDM40th Revisiting 1977: Discovery of the Carina Dwarf galaxy by the UK Schmidt Telescope
380,860183324656099329,I challenge anybody to come up with a better TRILOGY than the #BackToTheFuture trilogy.
381,860165995813629953,Is alternate 1985 in #BacktotheFuture Part II also the #Watchmen universe? What do you all think?
382,860161940898758657,"Back to the future #delorean #backtothefuture #wien  Meidling, Wien, Austria"
383,860161928060170241,#TBT to 2014 - #JenniferParker in a #Batmobile? :)  Smile! #ClaudiaWells #BacktotheFuture
384,860161097734795264,CharlesPPierce i could loan you his book if you want
385,860158504656666626,#maythe4thbewithyou can suck it. #BackToTheFuture is where it's at.
386,860153711817101313,CB Scooter with optional Bumper Guards
387,860153352491028480,Hey netflix can you put all the #Scream and #BacktotheFuture movies on there?
388,860144405596049411,Ok. Biff totally must have stolen the Delorean to get more than just the sports record book... #backtothefuture
389,860143876312616960,Regrann from popuptee  -  #backtothefuture with #mcfly #skateboard #hoverboard #delorean #doc #flux.  Shop now...
390,860143853206155264,regrann from popuptee  -  #backtothefuture with #mcfly #skateboard #hoverboard #delorean #doc
391,860129582078447616,"FIGO772 The Legends of Tomorrow dragged me into the plot, because I love the time travel show. Fan of"
392,860128315969073154,Happy #starwarsday everybody. #maytheforcebewithyou #maythe4thbewithyou #backtothefuture
393,860126383565131776,"#backtothefuture I'm so glad that all of the Back To The Future movies are still rewatchable, that is rare for trilogies."
394,860120437388431360,CarRenFest My favorite time travelers' sighting is always Doc Brown &amp; Marty McFly from #backtothefuture
395,860109205189128192,Marty made a quick stop in vienna today. #backtothefuture #delorean
396,860107423134220288,Everyone talks about getting a hoverboard from #backtothefuture &amp; I've always wanted 1 of those speeder bikes
397,860102002805747712,"\""Back to the Future\"" by Bad Boys Blue"
398,860101826896703492,"\""Back to the Future\"" by Bad Boys Blue"
399,860094356325363712,Was Biff there?
400,860092904496398336,BacktotheFuture looks like Marty might be stuck in 2017!!!
401,860084837939630080,"IF NOT FOR THE FEW WHO MAKE UP FOR THE NEXT #BACKTOTHEFUTURE DAY ON SEPTEMBER 2, 1885!"
402,860080534285946881,Can't wait to see this in real life at SparkLincoln festival!
403,860079614932258816,I have some visitors they came from the past.. from 1985..
404,860064451977936896,Great Scott! A #DeLorean being loaded into LincsCathedral for #SparkLincoln! Join us this weekend and go
405,860063008516481025,"New logo, new theme, new speakers and a new location! Save the date Thursday September 7th! #wimmera"
406,860048878929948672,Do you think humans can achieve time travel? Share your view:  #humans #scifi
407,860044661842300929,Men's South Pole Vest Size XXL-2XL #Southpole #Vest #BackToTheFuture #1980s #80s #80's #Warm #Travel  via eBay
408,860041586650087424,"\""How fast was I going...?\"""
409,860041357406199809,I saw on the road this crazy invention... it looks like #backtothefuture is finally here. #urban #mobility look her
410,860024117717630976,2015 had #BackToTheFuture Part II. These were the #predictions for 2017.
411,860023868756336640,Feeling Original. OriginalGrain #og100k / #originalGrain
412,860010134621302784,#backtothefuture stuff kinda thing
413,860002981726572545,"Theresa May, Jeremy Corbyn and an election trapped in the past  FT #backtothefuture trapped in 50s and 70s"
414,859996038890889216,#maythe4th  ...Bring You #backtothefuture #DeLorean #maythe4thbewithyou #starwars #r2d2  Rent
415,859993505858330624,California OUTATIME #lego #backtothefuture #legobacktothefuture #delorean #legodelorean #timemachine #outatime
416,859991021698117633,Work from #Home! You don't have to be #BackToTheFuture to earn 100% commissions!
417,859981048385597441,Back To The Future - Chicken Tri-Blend T-Shirt Only $25.00 #BACKTOTHEFUTURE #BuyAShirtChangeTheWorld
418,859969109521518595,ldemarcofox5 The future of technology. I'm still waiting for #DeLoreans that fly. Ha!
419,859960909627887616,#ICouldHaveBeen mayor of hill valley
420,859959233386774529,Marty McFly's rig in 2017. From HiwattampsUK #geartalk.
421,859959182807707648,Marty McFly's rig in 2017. From HiwattampsUK #geartalk.
422,859956055882825729,Back to the Future? #timessquare #nyc #cars #future #backtothefuture #lights #onlyinnyc #film
423,859949207381307392,Fun at the Forge Continues! #TeacherAppreciationWeek #backtothefuture rfespta
424,859937149306773504,Recalling a picture at #universalorlando in February. He does look like Doc Brown!
425,859928772379721729,Surprise present from my spouse. I'm so lucky.
426,859923441746677760,"Chatted with girlbossnetflix director ChristianDitter about #backtothefuture, vintage clothes, Kay &amp; Britt."
427,859922296038936581,got_goxed zlando JL02048628 #BackToTheFuture=88=#HH=#HeilHitler=#NaZi #NWO+the 14 words=#Podesta=#NeoNaZi
428,859917034972426241,Sometimes I think that I live in the world where Biff Tannen has the sports almanaque.
429,859912003514662912,scans_daily | #BifftotheFuture #4  IDWpublishing
430,859906096156246018,MODERNHIFI meets the 80s. bangolufsen #backtothefuture #beogram 6002 #beomaster 4500 #beovox s75 #bangolufsen #
431,859903907358756864,I have surrendered my future to the universe. I am Marty McFly. #backtothefuture realmikefox thesecret
432,859899041840332800,"No need to go back in time. Live for the future, here at SKYHOUSE MAIN"
433,859898186927943680,Back to the Future | Mondo Vinyl
434,859888253004115968,"After all these years, I still don't understand what Marty McFly has against Peanut Brittle."
435,859884960018313218,#Back to the #Future -#flashback #Time.  #thelittledj #backtoschool
436,859881807394852864,"#Throwback #headline My buddy, #JamesTolkan #MichaelJFox + I #MrStrickland #MartyMcFly #JenniferParker"
437,859879869164867584,LukeEndsHere My friend is going as BacktotheFuture #MartyMcFly #BackToTheFuture from movie #1 ... Just thought that'd make you happyish
438,859876124611891200,What's ahead for #foodservice design? One fcsiamericas member says start by going #backtothefuture:
439,859872575043883008,From material.girl.83  Hey McFly!  #delorean  #fluxcapacitor #backtothefuture #bedfordhighway #carsofhalifax
440,859870151075868672,#rollcall on sending h170 back to human services committee.
441,859867555111911424,"SeaSparks21 I used to like #WellsFargo, they reminded me of #Western movies and #BackToTheFuture. No more, closed"
442,859864783230783489,From witch hunts to bitch hunts.
443,859864000053555200,I saw a damn delorean speeding down 183!!! Please take me to 1985 Mcfly!
444,859863933557112836,Just saw Marty McFly driving his DeLorean on I 80W
445,859859570839179264,Ive got it! Im always happy of seeing the comic in paper! Thank you #IDW! :)
446,859857694823514117,Swiss cows will now get acupuncture instead of antibiotics
447,859856377941868544,Back to the Future Flux Capacitor Wristwatch
448,859852612539219968,BAD PUN TIME! It's May 4th and I went with a #backtothefuture joke instead.4 hours till our #SEO basics training!
449,859845024669851648,Roads? Where we're going we don't need roads.
450,859844866494406657,One songtherealstylesp johnboye2 BLACKICETHEPOET Classic hit
451,859836207601246211,"April,what the fuck?"
452,859822731109519360,I Would Like This To Happen!
453,859816895746330625,Inking 3D!.
454,859810025212137472,plihalespn Kkkk parece o McFly
455,859805626322571264,#backtothefuture #livestream #show #djeclass #may25 #tunein  Purple Tape Room
456,859804873771974656,Pre-Sale tickets are now available UTR!! Get in early!!!!  #27thJuly #TribalStateLive
457,859799367489859584,What inspires me to make my posters...these!#inspired #inspiration #mondo #backtothefuture #posterdesign #p
458,859791675723575296,Me if I made movies.
459,859787381045510144,KAzubuike7 must have jumped in the Delorean n grabbed the Almanac 957thegame.
460,859778783733305345,He's on a Hoverboard!! #blastfromthepastderby #derbyuk #movieprop #filmprop #backtothefuture
461,859778367322820610,The future is now the past! #backtothefuture #backtothefuture2 #nikemags #blastfromthepastderby
462,859778083561328640,DeLorean T-Shirt Design. Drawing/Vector #delorean #deloreans #dmc #dmc12 #bttf #backtothefuture
463,859777167651196928,"\""Future Surfer\"" by B-Fan is $13 today  #bifftannen #comics #docbrown"
464,859775206818238467,Blast from The Past carrier bag! 10 #backtothefuture #backtothefuture2 #martymcfly
465,859772776319787008,Who could resist #BacktotheFuture at RevesbyEstate? Our #LayersofHistory volunteers love it there filmonafarm
466,859767580776681473,This seems interesting for our Engineering students :) #Engineering #BackToTheFuture #LincsCathedral
467,859767463298445313,Back to the #Future -#flashback #Time.How remember this??? #thelittledj (#Backtothefuture #flashbacktime
468,859763016736411649,Back to the #Future #flashback #Time.How remember this? #thelittledj (#Backtothefuture #flashbacktime
469,859762010631831553,"\""Awesome 80s\"" by letter_q is $13 today  #backtothefuture #et #ghostbusters"
470,859761043328970754,"Yeah, I have some pretty awesome students!"
471,859754245742055424,It's a cracking livery! Would be great to see McLaren's #F1 cars follow suit next year
472,859754017924292608,Some of the awesome props we have!! #backtothefuture #bttf #nikemags #blastfromthepastderby
473,859746984940404736,Comic Reviews: Back to the Future: Biff to the Future #4 (IDW) IDWPublishing BobGale88 alanrobinsonr
474,859741563223670785,Parking lot of my store ArmaniWells - My new friend #AkosLetray - a song writer from #Hungary + a #DeLorean
475,859741025589485569,What a Trilogy!Great scott!!#80's #backtothefuture #steelbook They look stunning!
476,859740692834381824,"Genuinely, so happy. So happy. The little things, eh?"
477,859736025467375616,Back in time playing in the union
478,859733124418326528,Back To The Future II &amp; III for Sega Master System #BackToTheFuture #BTTF #Sega #SMS #UK #Europe #BTTFWednesday
479,859724607217049600,Back to future Mr. Strickland#backtothefuture #dolarein #strickland #jamestolken  Ego Grup
480,859717071411826688,#CONCOURS Gagne ta figurine Marty McFly en #FunkoPop sur FunkoPOPFr #backtothefuture RT + Like + F
481,859716611682353152,back to the future :)
482,859691721155780608,Wish a Siri like command is invented for PowerPoint and Excel - Siri align row width. Siri paste like in earlier doc.
483,859689958424096769,Spotted on Imgur :)
484,859663280922656769,"Journalism is a career where paper and face to face communication is looking more, not less, important."
485,859654791818915840,"Travel #BackToTheFuture at Margaret T. Hance Park this Saturday, May 6th with live music, food trucks &amp; more!"
486,859649751918272512,Preview of #BacktotheFuture: Biff to the Future
487,859643982456008704,Checkout the most exciting Hoverboards you can buy in 2017
488,859635645991591937,TrthSeeker funder What does any of that have to do with the current administration in power? Do you have a time m
489,859624337401401346,WillieGeist pimpin the pumas on FallonTonight
490,859588906177757184,ZZ Top - DoublebackFavorite song from all of the #BacktotheFuture films
491,859582660800335874,Watch Back to the Future (1985) Free Online Link:
492,859580042468347904,"Speaking with Emmett Lathrop \""Doc\"" Brown Ph.D."
493,859571862103138304,.Uber People are leaving comments for me from waaaay in the future.The year 49028 huh? #BackToTheFuture
494,859569572822765568,I love it when I get these framed. #bttf #80s #movieprop #backtothefuture #movies BacktotheFuture
495,859566775251238912,#BackToTheFuture made the year 2015 seem so much more hi-tech
496,859559385894277120,"Stanford engineers created a self-driving, electrified, drifting DeLorean named Marty! #BackToTheFuture..."
497,859556713099173889,iMeagan91 A must #BacktotheFuture
498,859553002629210112,"It's the ultimate picnic with local food trucks at #BackToTheFuture at Margaret T. Hance Park this Sat, May 6th!"
499,859552205736734720,"How 'bout a ride, mister?"
500,859549677578063873,"If you gonna hold some books and DVDs, why not do it with some style? #backtothefuture #delorean #docbrown..."
