,tweet_id,text
0,862362402645581824,#rehearseling #peterpan and #darling #family before the show in #Brest #peterpanleballet
1,862346183884386305,Interesting Facts About Peter Pan
2,862343493284507648,Peter Pan by barisyesilbas. Email infobarisyesilbas.com to schedule an appointment.#peterpan
3,862342617337651201,Link and #PeterPan.
4,862332729857380352,Structure of the spine and
5,862328602205069314,Living again the fairytale#returntoneverland #peterpan #Disneylife  watching Disneylife
6,862325689479049216,xantulis I knew you'd say that! #hesnotthebestbuthesprettycool #tryandwinit
7,862323659817529346,Ultimate #FunkoPop Peter Pan Figures Checklist and Gallery
8,862322128020025344,Is #peterpan one of your favourite Disney movies? Grab my print!
9,862317154657595392,Next on my list!
10,862306601209745408,2 weeks until #PeterPan #StudioOneAzDanceCo  Message me for details!
11,862305208856186880,"#DisneySide #Cosplay #Series \""Don't you understand, #Tink? You mean more to me than anything in this whole world!\"""
12,862301203325235200,The initial #writer of this #horror #film said he was inspired by the story of #PeterPan -
13,862284350007783424,RobbieKay_ what do you think?!
14,862281607616634883,The Lost boys and girls are den building and whittling spears! We even made some bunk beds! #peterpan #denbuilding
15,862280120102465537,Good Morning Neverland!!!!!
16,862280082634792960,Lost boys hideout? The girls have created their own Lost girls hideout!
17,862273988491452417,Off to Neverland! #peterpansflight #peterpan #tinkerbell #wendy #michael #john #nana
18,862271911656660992,and fake news...
19,862261148023967748,Super #hyped for all the #ballet and #Opera at LightThetford! Can't wait to book!
20,862257205831241729,Fancy being a 'lost boy' or a 'mermaid' come to our auditions on Saturday #PeterPan TheBrindley
21,862253961629315072,LizzieW19 rocking that stage! Love the cover of KelseaBallerini!
22,862253022860029952,Only Jah knows Mi Destiny\r
23,862243311553216512,"#pedogate #opdeatheaters Catholic Church Scandal #Vatican Op #PeterPan rafficking 14,000 kids:  via YouTube"
24,862239701419384832,We're screening a family matinee of #PeterPan on Saturday 10 June!
25,862234190535897088,Interesting Facts About Peter Pan
26,862224991672250368,"Lovely, darling house, once that her pace towards me will see out of the moor.- Peter Pan in Baskerville"
27,862214703946358784,Fun day at Disney &amp; Robert's first time on most of the rides!   #Disneyland #peterpan
28,862200582253182976,"#HarryPotter #PeterPan, do these names sound familiar? #London is the birthplace of incredible childhood characters"
29,862196306684653569,clouseofbristol I said exactly the same thing. I called it out as soon as the person said it. Seems it's true
30,862193862936100864,"\""If you cannot teach me to fly, teach me to sing.\"" #Wisewords #PeterPan #HappyBirthday #Author #Playwright James Barrie (born May 9,1860) :)"
31,862193128379371520,"Review Breakdown\"" to live would be an awfully big adventure\""#Hook #PeterPan #RobinWilliams #StevenSpielberg"
32,862188672006758400,"To die will be an awfully big adventure.\""-- Peter Pan by J.M. Barrie"
33,862185256253837313,MATTINA - MORNING  modelling gorgeous tees by #noonoobits #peterpan #nevergrowup
34,862178302940766208,"Alright, Peter. I'm ready..."
35,862173192504213504,Skull Island from Disney Paris!  DisneyParis_EN is such a beautiful park! #Disneyland #VisitParis#PeterPan
36,862164239288545280,Because I will meet u again
37,862152526975692800,Come see the St. Joseph Middle School production of Peter Pan this Friday at St. Joseph L.O. Message me for details.
38,862143751808045056,Happy Birthday to authors JM Barrie &amp; Richard Adams!! #literarybirthday #jmbarrie #peterpan #richardadams
39,862141548997337088,Interesting Facts About Peter Pan
40,862122731034345472,Inking peter yesterday finally ready to scan :)
41,862121861529952261,Having a blast
42,862121836280111104,Tinkerbell Quotes Pixie Dust - Samsung Galaxy S7 S6 S5 Note 7 Cases &amp; Covers
43,862121429659201537,More animating of peter the other week
44,862113783220764672,J.M.Barrie 157 B-Day#peterborough
45,862112069847527424,"I'm super late, I know! But omg I'm so digging season 3 of Once Upon a Time!!! It's so good!! #OnceUponATime #Neverland #PeterPan OnceABC"
46,862093465722683396,"May Book Challenge Number 9, #peterpan #peterpanandwendy #captainhook #bookstagram"
47,862091325516038144,Our little Tinker bel! #performance #peterpan #june4th #hariyamaballet
48,862087794310742016,Travel to #Neverland for #tea with #PeterPan with this fun #booklovers necklace -
49,862087530673565703,"Happy Birthday to JM Barrie, author of the classic tale that never gets old, Peter Pan! #Pittsburgh #bn"
50,862087240763138048,Mermaid Print:     via Etsy
51,862081678172446720,As it was J.M.Barrie's 157th Birthday it's a good time2mention one of his works I'll b in this #Panto #PeterPan
52,862081057344167937,"J M Barrie, creator of #PeterPan, was #botd in 1860. In their honor, some adult books featuring the stubbornly you"
53,862078171616653313,"Nevada Ballet Theatre presents Peter Pan, 5/13 &amp; 5/14 Tickets at"
54,862076231092776960,Even Captain Hook thinks this #PeterPan bracelet is good form! Check it out at:  #BookLovers
55,862075967916957699,HBD author #jamesbarrie! Find your #nevergrowup attitude &amp; share a childhood classic w/ the kids.
56,862070123011690496,".NewPeterWendy People of the internet, this is what you've been missing out on:  wonderfu"
57,862069088725725185,Sir James Barrie was born #onthisday in 1860. #jamesbarrie #peterpan #illustration #history
58,862066708902793217,"Did you know? The creator of #PeterPan, James Barrie, was born #onthisday in 1860."
59,862065954104238080,"The moment you doubt whether you can fly, you cease forever to be able to do it'.  Happy Birthday #JMBarrie ."
60,862065927445241856,"Happy Birthday, JM Barrie."
61,862060930909298690,"#HappyBirthday to J.M. Barrie, author of Peter Pan. Thank you for teaching us the power of faith, trust and pixie d"
62,862055093851627520,To live would be an awfully big adventure - Peter Pan. #peterpan #childrensmurals
63,862053319606513665,Day 9: Peter Pan #bnbookchallengeHappy birthday to #JMBarrie! Illustration and paper engineering by Agnese Baruzzi
64,862053259334340611,Meet the shows in our new #BroadwayAtTheBass season! The untold story of #PeterPan is revealed in #FindingNeverland
65,862053181479628800,Day 9: Peter Pan #bnbookchallengeHappy birthday to #JMBarrie! Illustration and paper engineering by Agnese Baruzzi
66,862045111101870080,Sound boarding ideas for Panto!
67,862041656043814914,Just watched Peter Pan from 2003. jeremysumpter will always be my kind of Peter Pan. #longtimenosee #PETERPAN
68,862039321339191300,I loved Nana!!
69,862030510494756865,"blandine_pixie and I with Peter Pan and Wendy #peterpan #disneylandparis25  Disneyland Parc,"
70,862029409750044672,"Happy 157th Birthday J.M. Barrie! Thank you for teaching us to believe in faith, trust, and pixie dust #bnvancouver"
71,862029020766109696,I Wont Grow Up! Seven adult books featuring the stubbornly young... #PeterPan
72,862028182094008321,J.M. Barrie was born today in 1860! #PeterPan #AdmirableCrichton #LittleWhiteBird #Neverland
73,862026529777352706,"\""You can have anything in life if you will sacrifice everything else for it.\""J M Barrie, Scottish #writer and"
74,862021882836643841,"J M Barrie, creator of #PeterPan, was #botd in 1860. In their honor, some adult books featuring the stubbornly youn"
75,862020366826393600,It's #JMBarrie's birthday today! Celebrate by giving a #PeterPan fan a kiss with this #bookish bracelet -
76,862015652457963520,Ruth B. live in Young Hollywood studio
77,862015439668469760,J.M.Barries 157 B-Day#DigitalMarketing#socialmediamarketing#Marketingonline#peterpan #topmarketingpeople
78,862013896202240000,Oh putain .... delph_harchin why?????? #danse #dance #mrdarling #peterpan
79,862013461743546368,"Happy Birthday to J.M. Barrie, author and creator of Peter Pan, and also our Quote of the Month pick! #JMBarrie"
80,862004652312858624,Happy Birthday J.M. Barrie
81,861998168237457408,"If you haven't made it to CSG Gallery to see my Project Neverland piece, here it is. Yes, it's for sale too."
82,861997436465586176,Just voted for KelseaBallerini CMT #CMTawards #FemaleVideoOfTheYear #KelseaBallerini #PeterPan
83,861993307869597702,Happy Birthday J.M. Barrie!!
84,861992685774811136,Never grow old with BMD's scenic projections for
85,861991638524186624,"Shall we make a new rule of life: always try to be a little kinder than is necessary?  J.M. Barrie, born #OTD in"
86,861990629202644995,Hello #PeterPan fans! Please join me in raising a #teacup to #writer  and #playwright
87,861988384499269632,Today is the Birthday of #JMBarrie - author of
88,861985634524823556,Ugh so cute. #tinkerbell #peterpan #art #woodburning #neverland #ArtLovers #artwork #artblog #flowerart #leaves
89,861982858898006017,"[Day 9: #PeterPan] \""You know that place between sleep and awake, the place where you can still remember dreaming?\"""
90,861981093372809220,"#PeterPan fans and #booklovers are invited to join me for #tea in honor of #JMBarrie, who was born #OTD in 1860"
91,861977851343622144,Revisiting the books I loved as a child is one of my favourite things to do.#PeterPan is one of those!My perspect
92,861975061468762113,"J.M. Barrie, creator of #PeterPan, was born #onthisday in 1860."
93,861974152475013120,"Nevada Ballet Theatre presents Peter Pan, 5/13 &amp; 5/14 Tickets at"
94,861971355453059074,#JMBarrie #PETERPAN The first unfairness..
95,861967973942210561,#OTD 09MAY1860  This fellow Sir #JamesMBarrie had a  He became a #Baronet/Was born in #Scotland. You may know him
96,861966501716172800,"\""Always be a little kinder than necessary.\""James M. Barrie #quote  born #OnThisDay"
97,861962894426165248,"#HappyBirthday to the creator of #PeterPan, Great #Scot JM Barrie!"
98,861961079974395907,"Against such insubordination, whereupon Peter flung themselves on again.- Peter Pan in A Ghost Story"
99,861960898352631809,"1860: Dramatist Sir James Barrie, the creator of #PeterPan, was born in Kirriemuir, Angus, Scotland."
100,861957719951069184,"HappyBday #JMBarrie, cre8r #PETERPan! Gives #Disney+ #Theatre fans yrs of JOY+ all its profits 2"
101,861956849012273153,"Happy birthday, J M Barrie!"
102,861951438313926656,"#PeterPan author, James M. Barrie, was born on this day in 1860.  Happy #BirthAnniversary to him!"
103,861949594896355329,"Yes, this double #peterpan collar is asymmetric. We think 2 as well that this collar looks royal and at the same ti"
104,861940106952835073,#PeterPan author J.M Barrie was born #OTD 1860. This image is from a 1907 production of the play
105,861938797361205253,"Why, Wendy, of course!  britishmuseum"
106,861936917549658112,"\""All the world is made of faith, and trust, and pixie dust\"""
107,861936591983583234,Happy birthday to #PeterPan #author J.M Barrie.I'll always clap for fairies.#amwriting #librarylife
108,861934579028029441,#OnThisDay 1860 #PeterPan #author J.M. Barrie was born.A man who forged a hundred million childhoods &amp; gave us
109,861934410895065088,Sitting in class listening to KelseaBallerini I love her so much. #peterpan is one of my favorite songs.
110,861934079851323392,May 9th #1860 - #OnThisDay #jmbarrie #peterpan #scottishauthor -
111,861930594510438402,.theartsfuse The Arts on the Stamps of the World  May 9
112,861928903018983425,"Happy Birthday to \""Peter Pan\"" author J.M. Barrie born #OnThisDay in 1860. #bnov #authorbirthdays jmbarrie"
113,861928378265481216,Watching #hook the movie toddler boy gave up after 10min but im still hooked i forgot how amazing it is!
114,861925047065341952,"The older I become, the more I realize that I'll always be a kid who just pretends to be an adult."
115,861920444739448833,Did you know that #PeterPan author J. M. Barrie was born #onthisday in 1860? A source of our #TuesdayMotivation eve
116,861910532160315392,"Dear Peter Pan,I've left my window open. Please come and rescue me ...#peterpan #maywish"
117,861906727503110144,It's J. M. Barrie's birthday! Let's pay homage to his hometown - #Kirriemuir!
118,861900281537318912,We need a lot of
119,861898856648368128,#J.MBarrie was born today in 1860. In 1929 he gifted all proceeds of the much loved story #PeterPan to
120,861898785299025920,J.M Barrie Top 10 #PeterPan Quotes to share with your class
121,861898706353782784,SarahMillican75 I'm here for the #PeterPan auditions
122,861897139751972864,Excellente Interview de remyoudghiri
123,861895045934448643,"A classic! Happy birthday king of Neverland, Jim Barrie, sleep soundly guarded by the Never Fairies... born in 1860"
124,861894103537201152,TheRealNickJury I hear #KateBush as I read that - 'In Search of Peter Pan' from 'Lionheart'What a lady. And she loves #PeterPan
125,861890270761295872,"May 9, 1860, the great author JM #Barrie was born. In his honour I give you a little confused #crocodile!"
126,861887067869126660,"#PositivePosting How much joy has #JMBarrie (b. 05/09/1860) brought to your life? I dare say, lost girl rules as we"
127,861884719880974337,Attraction Peter Pan's Flight is back open and has a current queue time of 35 minutes.
128,861884498849521665,'Peter Pan' author born #onthisday in 1860!
129,861883592762249221,Today is the birthday of the #writers of the childrens classics #PeterPan (JM Barrie - 1860) and #WatershipDown (R
130,861883466702622720,Attraction Peter Pan's Flight is temporarily closed while there is a current queue time of 35 minutes.
131,861883410394091520,'Second star to the right and straight on 'til morning.'J.M. Barrie author of #PeterPan born #OTD in 1860
132,861880548125540353,Happy Birthday J M Barrie #PETERPAN britishlibrary 'faith and trust'
133,861873821774688256,"UpTheGrinner egtfcwasps Don't, poor Marcus hasn't recovered from when we played up front together at Redhill  he"
134,861867326676901888,ABD Productions present: 'Peter Pan' Thurs 3rd Aug - Sat 5th Aug 2017Read more...
135,861867129284558848,#TipTuesday on #PeterPan creator J M Barrie's birthday - always be a little kinder than necessary &lt;3
136,861865216904228864,#Roadtrip to  #PeterPan land! #Kirriemuir - bound ELIZFRAT
137,861864820760395776,"JM Barrie, #author of #PeterPan, was born #OTD in 1860 in Kirriemuir"
138,861864596700897280,Attraction Peter Pan's Flight is back open and has a current queue time of 5 minutes.
139,861862867905204224,Models  Fashion  Las Vegas just published!  Vielen Dank an sincitygallery Brindille_
140,861860822691323904,Attraction Peter Pan's Flight is temporarily closed while there is a current queue time of 5 minutes.
141,861860673474760704,"#onthisday J.M Barrie was born, 9th May 1860 #peter&amp;wendy"
142,861858598569340928,On this day in 1860 the famous Scottish novelist #JMBarrie was born &amp; gave us #PeterPan #pixiedust &amp; #secondstars
143,861855768383037441,"Tinkerbell has always been there for Peter, And Peter? He choose Wendy...#tinkerbell #peterpan #quote #rosemciver"
144,861853142157328386,happy birthday to my main man J.M. Barrie#peterpan #jmbarrie #birthday #bookworm #bookblogger
145,861851999771512833,Just imagine !
146,861850285508919296,Who said they cant perform live?
147,861849513186779136,"Happy Birthday to James M. Barrie (1860), who taught us that \""all children, except one, grow up."
148,861845809121435650,"\""Second star to the right and straight on 'til morning.\"" #bestdirectionsever #PeterPan JM Barrie born on this day 1860"
149,861845773050368000,Happy Birthday to #JMBarrie! What is your favourite #PeterPan quote?
150,861845772484128768,Happy Birthday to #JMBarrie! What is your favourite #PeterPan quote?
151,861845770961551360,Happy Birthday to #JMBarrie! What is your favourite #PeterPan quote?
152,861845770512846848,Happy Birthday to #JMBarrie! What is your favourite #PeterPan quote?
153,861841161161392129,Can we all just take a moment for Harry_Styles  #SignOfTheTimesMusicVideo ?Some srs #PeterPan jealousy rn
154,861840161142976512,"#OTD JM Barrie was born (1860-1937), novelist &amp; playwright. All the world is made of faith, and trust, and pixie d"
155,861838394460176385,Peter Pan Flying with Tinker Bell case
156,861810015828660225,ADAPTIVENESS--Let each act. CARDS OF ROSES.--Take- Peter Pan in Etiquette
157,861806015217532928,"Never was into this #PeterPan thing, sorry ): At least, he is properly shaved in the movies"
158,861804013842563072,This Month's Stories are Journeys - 'Flying'
159,861802261718200320,"Happy bday to a long time bff laurynroszak love u forever &amp; I hope you had the best day, hang soon"
160,861790802716086272,May 9 1860 - Scottish Author James Barrie is Born . He is the  author of #Peterpan -
161,861786535364108289,Harry_Styles is the #PETERPAN the world needs right now.
162,861768464360517634,"Happy 157th birthday, J.M Barrie!Thanks for giving us Peter PanPeter Pan Monument, #KensingtonGardens#PeterPan"
163,861760022103162880,Mornings are for coffee and contemplation. #peterpan #tinkerbell #disney #disneyworld #tweegram
164,861755722446626816,#PeterPan.   He dissed me on the Gatorade run today.
165,861749670904823808,Listening to #peterpan  powerjournalist KelseaBallerini
166,861740479523717120,Finally graduating!...maybe....stay tuned...#peterpan #graduation #lastdayofschool #lastday
167,861728662017589248,Our research indicates #Pirates like churros. A #PiratesLife is a wonderful life #CaptainHook #PeterPan
168,861723175796830209,"Happy 157th birthday, J.M Barrie!Peter Pan Monument, Kensington Gardens#PeterPan #KensingtonGardens #JMBarrie"
169,861716108025442304,CarolinaDurham is hosting the Durham Ballet Theatre this weekend
170,861715522798329856,Having an off day...trying to keep up the faith just need some pixie dust#pixiedust #peterpan
171,861713324450381825,"Don't want to grow up? Audition for our #2017 summer play, #PeterPan! We've got roles for kids + adults. Details at"
172,861710749512617984,my second by second reaction to Harry_Styles #SignOfTheTimesMusicVideo #PeterPan
173,861703848351715328,Your Peter Pan vs. My Peter Pan
174,861703237375713280,.NVBallet closes the season with a classic tale: #PeterPan
175,861696816420720642,my first crush ladies and gentlemen
176,861696723307163649,#PaletteChallenge requests:
177,861695597056839680,Seen my #PeterPan collection? There's a blog post coming soon about it along with the relaunch of Fayebeline
178,861694783177150464,Treat Your Mom To The #PeterPan Show At The #SmithCenter For #MothersDay Message Me For Your Tickets #VegasBaby
179,861692710666817536,"#PeterPan to live, wold be an awfully big adventure"
180,861689836448747520,"\""This belongs to you, Peter, and always will\"""
181,861689554608283649,Interesting Facts About Peter Pan
182,861684195684474884,"Also, one of the best movie soundtracks ever"
183,861682998571397120,Interesting Facts About Peter Pan
184,861682190895247360,#peterpan is the boss! ......#mickeymouse #minniemouse #minnie  #mickey #waltdisneyworld
185,861680618433900544,PETER PAN E WENDY: SHIP INDISCUSSA
186,861680027116634117,TheSnowSpirit Have a beautiful night!
187,861678332617924609,BEST SCENE EVER
188,861676201936654336,aleexga_ Gotta love those creepy statues lol! First time at #peterpan or is it one of your favorite spots?
189,861674054507520001,"ROGER, lay, low hill, that the intrusion of bed, and they will repay you?- Peter Pan's Frankenstein"
190,861673378100465664,#peterpan porn asian hardcore xxx
191,861670478473187328,#PeterPan Small Coffee or Tea Cup Mug JSNY Taiwan
192,861670102516871168,"\""15 YEARS LATER\"" ehm"
193,861668879470350341,"Trends: #report, #CHEMID, #striscialanotizia, #PeterPan, #TikiTaka, #J3SRadio e"
194,861667945180790787,Fantastic day of rehearsals for #PeterPan
195,861667061260570626,Fancy being in #PeterPan TheBrindley ? Auditions are on Saturday. Why not try out?
196,861657908970389504,Lovely modern 2011 #leatherbound Barnes and noble #firstedition edition of #peterpan new in our
197,861633176317415424,#BAMA2017DiamondEdition_EXO #Bama2017 #USA #EXO #PeterPan both sad and happy song. Like the story. Oh my god i love my boys
198,861632972730052609,#BAMA2017DiamondEdition_EXO #Bama2017 #USA #EXO especially #PeterPan song
199,861630533322911744,You thought you knew about #PeterPan and Captain Hook. But C_Henry_Author is going to prove you wrong on July 4th.
200,861626038790479873,Custom Made to order child's John Darling complete costume  2-7yrs #babydisney
201,861625540415016960,Illustration from the #firstedition of #Rackhams #PeterPan #ArthurRackham #illustration #rarebooks
202,861624687532625922,World : #PETERPAN doesn't existMe :
203,861622167640752128,#CaptainHook is warning me! #Disney #DisneylandResort #DLR #Disneyland #disneycharacters #PeterPan #Disneygram
204,861621493377015809,"Hi friends, I have just enough fabric for one costume size 2T-about 7X.  #mrsmee"
205,861621018921709575,What in the #PeterPankendricklamar #AlrightVideo#HarryPotterflying fuck is this?  #SignOfTheTimesMusicVideo
206,861615304966787072,I caught #PeterPan before he goes to
207,861615196443471880,Now mermaids are not like they are in the storybooks  Toothy #peterpan #horror (kind of)
208,861601079628312576,Back in Neverland time to research never growing up. #hemsworth #actor #actorslife #theatre #theatrelife #PeterPan
209,861600430056513536,#captaingook #smee #peterpan #villians #dancing #disney #magic #disneymagiccruise  Disney Magic
210,861600246442414081,"Think if the happiest things, it's the same as having wings."
211,861599184541155328,"Think if the happiest things, it's the same as having wings."
212,861592881013952513,nyc_johnson can we please appreciate Wendy's face?
213,861592864790282240,"Lost boys, pirates and fairies... explore our reissued version of #PeterPan - complete with delightful illustration"
214,861592037505863680,#MondayMorning got you down? Run off to Neverland for #tea with #PeterPan instead!
215,861588693458366464,#PeterPan am I miss'n the point
216,861586280894812160,With my Toy's I'd make a good #PeterPan 4 some
217,861582793742090240,"Wow, just wow. You must have been  yourself  amazing scenes though #PeterPan #Neverland #SOTT #Harry"
218,861582409111805952,Keeping Austin Weird #peterpan #minigolf #austin #atx #keepaustinweird #texas #nature
219,861576380403920896,Something a bit different from the usual beautiful Skye scenery.  #harrystyles does his best #peterpan...
220,861574312393940992,"flexidisc of the day : Introducing The Cliff Richard Story (UK SFI/WRC one sided 7\"" 1972) #50s #60s #70s #pop"
221,861574311987081218,"flexidisc of the day : Introducing The Cliff Richard Story (UK SFI/WRC one sided 7\"" 1972) #50s #60s #70s #pop"
222,861560565918867456,"Feeling like a baby bird just out of the egg? The world is so big, but that just means more to explore! #JMBarrie"
223,861557959138181121,"Before we get to the PreaknessStakes in 2 weeks, we have the #PeterPan Stk this weekend BelmontStakes!"
224,861533658850709504,Attraction Peter Pan's Flight is back open and has a current queue time of 30 minutes.
225,861529882802737152,Attraction Peter Pan's Flight is temporarily closed while there is a current queue time of 30 minutes.
226,861529452861427712,"Smee's eager enough and exchange twopence, a fait accompli? Indeed.- The Adventures of Peter Pan"
227,861528694766133248,Peter Pan Flying with Tinker Bell case
228,861527590296842241,"One of our students, James Taggar is working hands on with the pointradiusuk team videoing"
229,861526603020591104,"Aww, my first review in French! #peterpan #bunting #banner #forkids..."
230,861520942274670592,aberlourbear Some of us never grow up
231,861518626871885824,Final episode#peterpan
232,861514786051428352,"\""Just Think of Happy Thoughts and You'll Fly\"" #PeterPan #MondayMotivation #QOTD"
233,861509450309521408,#Tartan of the Week...Peter Pan
234,861503145083637760,"Hey guys do you ship \""Peter Pan with Wendy ?\"" in any Pan movie/Disney Disney OnceABC"
235,861479856592359424,"#springblog-seasonal thought of the day - Faith, trust and pixie dust #PETERPAN #kidlitart #kidlit #Fairies"
236,861466697793929216,The Window: Once upon a time/Wind sparkled in the tree tops  #peterpan #poetry
237,861465430627450880,"\""I'll get you for this, Pan, if it's the last thing I do\""  ...#peterpan #captainhook"
238,861429418207719425,"\""Never say goodbye because goodbye means going away and going away means forgetting.\"" tattify"
239,861426769508872192,Interesting Facts About Peter Pan
240,861419638185271296,#AFLDeesHawks mcg Luke Hodge looks into the stands after hearing 'come on Hodgey' from HawthornFC fans
241,861418410126655488,WeedFeed Standing in a 55minute line to ride #peterpan wouldn't be so bad I guess
242,861414328095969280,This #store is my #mecca!!!#disneydork #worldofdisney #disneysprings #peterpan #youcanfly #disneymagic #disney #v
243,861413513377533952,Here we goooooo
244,861404040512512001,NEW Minnie Mouse short pink polkadot dress XS-M #minniedress #Disneyland
245,861402564184682497,The Lost Boys#griz #grizandnorm #gouache #gouachepainting #winsorandnewton #peterpan
246,861386333129986048,Happy bday ex co worker. Gotta love the ppl that come in last minute  #peterpan #marymar ben_pocos
247,861386224568856577,"Never say goodbye, because goodbye means going away, and going away means forgetting"
248,861378044451225600,My old #PeterPan book I wanna reread after watching the 2003 movie. Fun fact. It was a birthday
249,861377634453815296,I have never over analyzed Disney movies until I had kids... the dad in Peter Pan is a jerk!
