,tweet_id,text
508,859713244092669952,Gorgeous #fairy charmed bracelets! still available in 4 colours which is your fave?
509,859711264024653824,"Dirty dirty. #PETERPAN, the boy who would not grow up. I think everyone who grew up would want"
510,859702841090428928,Attraction Peter Pan's Flight is back open and has a current queue time of 25 minutes.
511,859695007615397888,"#BestAdviceIveEverHeardNever Smile at a Crocodile. No, you can't get friendly with a Crocodile"
512,859689492352876544,"Oh darlin', don't you ever grow up. #NeverGrowUp #TSwift #PeterPan   Tanza, Cavite"
513,859687744045543424,Attraction Peter Pan's Flight is temporarily closed while there is a current queue time of 25 minutes.
514,859685989656166401,Check out this item in my Etsy shop
515,859671953518604288,BarryJonesBox happybirthfay champ haveca good day #PeterPan xx
516,859645505764298753,"Find me  #peterpan #miamibeach  Miami Beach, Florida"
517,859643857474138112,Negative again.... Yevgeney Ivanovitch was wrong meaning. Alive?- Peter Pan in Anna Karenina
518,859638814008111104,Looking for a Peter Pan quote for my kitchen...
519,859628822710415361,SydneyBrianne15 somebody got me saying it.  and he is not
520,859624928823390208,gordonhayward reminds me of someone... #babyman #disneystar #princecharming? #peterpan?
521,859612878449635329,Never gonna learn there is no such place as Neverland.
522,859611971842265088,First read through for Peter Pan Jr. went well! Here's to getting to the super intense and wild rehearsals!
523,859581782206939137,Got mine #peterpan #jacksparrow #spiderman #originalfunko #funko
524,859578647627399168,A little #fairy might've told me that we may just make it to #Neverland tonight. #Peterpan photoshoot. ..we''ll just have to see..wont we?
525,859557963517874177,Even though it was just his birthday 3 days ago he's still a little boy at heart... #peterpan
526,859552397215100928,Exclusive interview - ThomasBarbusca talks TheMickFOX and THAT GEICO ad:  #ThomasBarbusca
527,859544431166275585,I look like a Lost Boy so take me to Neverland.  #peterpan #lostboys #neverland #beach
528,859538563431628800,I'm watching pan the Hugh Jackman one and it looks awesome on my big inch tv #peterpan #jackman
529,859538492031774720,#DisneyParks #PeterPan Off to Neverland #mug with #BigBen Clock Handle #Disney #disneymugs
530,859523397717458946,Cj what is you doing baby DanRue_IG nicknpattiwhack_  #welivebaby #welive #peterpiper #peterpan
531,859523022872612865,"Gholites became accomplished. Yea: and merciful. Tabuc, were with you.- The Peter Pan's Koran"
532,859519402601009153,ladyantebellum HillaryScottLA singin KelseaBallerini #PeterPan...Too Funny...
533,859517571250270208,"Happily drinking chocolate milk at my desk, my boss walks past, rolls his eyes and says, \""Being 5 years old must be great.\"""
534,859507948715900929,Enjoyed Dapper Day immensely! Can't wait to do it again! #dapperday #wdw #peterpan #neverland
535,859500906596847616,See you later...#peterpan #neversaygoodbye#neverneverland#tinkerbell
536,859499958919147521,Closing date is 30th may! :) #peterpan #pantomime #planahead #unitedtheatre #actors #acting
537,859493614765752321,More magic at the #happiestplaceonearth #Alopecia #Disneyland #vlog #youtuber #family
538,859492266511130624,Watching Matt_LeBlanc on BBC_TopGear is making me happy
539,859487284080500736,[LGBTQ+ Friendly] ~ Finishing Tinker Bell ~
540,859483906411819009,"\""To live would be an awfully big adventure\"""
541,859482229365460992,My best friends 8 years old and 14...that's why I'm #PeterPan
542,859479723705073664,More #PeterPan #Wisdom - #Watch NewPeterWendy
543,859473501216018432,Hear my #Peterpan inspired song! Also the first song i wrote with my wife!
544,859473487366324226,Pretty #PeterPan print
545,859467314407886848,Of all the places to get recognised for my #Dame a woodland burial ground was not on my list! Thehexagon
546,859457624819081220,Attraction Peter Pan's Flight is back open and has a current queue time of 45 minutes.
547,859454959728943104,Attraction Peter Pan's Flight is temporarily closed while there is a current queue time of 45 minutes.
548,859441695125057539,CalumWorthy you look so much like Peter Pan. Never grow up please.
549,859441370309816320,Read:
550,859438101722259456,Read:
551,859436162603155462,Fairy tail #fairytail #fairy #sininho #peterpan #story #fada #tinkelbell #draw #drawing
552,859431112342462465,if i won #lotto #365 days we travel all around the globe like as
553,859415893352349700,Lovely modern 2011 #leatherbound Barnes and noble #firstedition edition of #peterpan new in our
554,859409663263203328,Attraction Peter Pan's Flight is back open and has a current queue time of 30 minutes.
555,859404639405559809,Attraction Peter Pan's Flight is temporarily closed while there is a current queue time of 30 minutes.
556,859402112123457536,Attraction Peter Pan's Flight is back open and has a current queue time of 45 minutes.
557,859397090723627008,Attraction Peter Pan's Flight is temporarily closed while there is a current queue time of 45 minutes.
558,859393519881998337,Interesting Facts About Peter Pan
559,859383584905457664,Guess the phrase and win a prize?  #PeterPan #NeonsForDays
560,859378249830473728,What's your favourite mode of transport or travel? Mine's definitely flying!
561,859361618421010433,Why is Peter Pan always flying? Because he Neverlands!
562,859339330170609664,Large painting - #peterpan Captain Hook's cove #Disney and J.M. Barrie inspired #art
563,859337223292030976,ABD Productions present: 'Peter Pan' Thurs 3rd Aug - Sat 5th Aug 2017Read more...
564,859319034206011396,#CrowdfundTuesday w WomenOccupyHwdLet's HELP PANSFILM a 90's grunge retelling of #PeterPan from the HEROINES' POV
565,859314739402375168,Interesting Facts About Peter Pan
566,859292573466324992,"Quarrells, Factions, and evill names agreed on. Angry with an adept [expert].- Peter Pan in Leviathan"
567,859281142867910656,Here's a crossroads that would leave me torn. #PeterPan vs
568,859279936544268288,Thanks to those who watched live tonight!
569,859271572410036224,My mom didn't like my #DaddySangBass #Parody when I do a song about #TinkerBell and #PeterPan.
570,859262358400716801,Yes! Feeling the delight of her aunt by the Frankland's superb in my suggestion.- Peter Pan in Romance of Lust
571,859259919215755264,Wishing on stars at
572,859257204615991296,"Surprise act of #PeterPan vs #CaptainHook with paulgalliano, Brandomire, MDeeDivine, &amp; DayeanneHutton WonderCon"
573,859254377894346752,"\""Never say goodbye, because saying goodbye means going away and going away means forgetting.\"" #DisneyQuotes"
574,859240978703556608,A boy who never grows #boardgame #kickstarter #fairytale #Peterpan
575,859232119779766272,Mermaid Print:    via Etsy
576,859229699767025664,#PeterPan is such a #cutie ! #tripawd #minpin #manchesterterrier #ocpetexpo #ocfairgrounds #puppy #patriotic
577,859226617993932800,Tag a friend.Auditions #PeterPan musical Sat 9am-2pm ages6-13.Can't make it? call 918-369-1340 #Bixby
578,859225214508511232,My tea date tonight
579,859205455016583168,#SweeneyTodd is now officially over  Time to move onto the next show! #PeterPan takes flight in 6 weeks!
580,859187470193315840,Muddy feet. #PeterPan. Mischief. It all adds up to
581,859182421647867904,"\""I guess now I know better\"" UGH LISTENING TO PETER PAN ON REPEAT SINCE THE RDMAS KelseaBallerini"
582,859171705436221441,Victorious he cast Flowers over all time it had a loving bite.- The Peter Pan Comedy
583,859162412100071425,Peter Pan!! caitlinhornik #London #love #peterpan  Hyde Park
584,859153077168996352,"I feel like I've done 2 weeks in Ibiza. Boozey weekend, maybe I should grow up."
585,859134887177138176,Read:
586,859127396926148609,Today's double bill #peterpan #fasterpussycatkillkill #waltdisney #russmeyer #animation
587,859116907470835712,[LGBTQ+ Friendly] ~ Tinker Bell ~ #Creative  #twitch #gay #gaymer #gayboy #drawing #peterpan Finishing FFX later!
588,859111279121891328,Dover; slept together in the field of the utmost twice before I kissed her.- Peter Pan in Romance of Lust
589,859091049632944130,Special moment on stage with one of my closest friends. Flying away to neverland after 4 yrs of dancing together
590,859090244041310209,Sometimes #Motivation comes from unexpected places. #MotivationMonday #CharlieBrown #PeterPan #MorticiaAddams
591,859089710953766916,Ordinary boy? FROM THE FLIGHT Second and said doggedly.- Peter Pan in Benjamin Franklin
592,859079820671569920,Join us for Daily Dose from UNLV....Find out about the current performance #Peterpan CityOfLasVegas
593,859077723796365312,Watch the full Nevada Conservatory Theatre Fox5 appearance!
594,859073486278537216,The celebration after finding the signal fault! - Today we spent all day at LuttColl rigging for #PeterPan
595,859060054313578496,Do folk ever actually 'grow up' these days.    A grown adult reading a Terry Pratchett book on the train now.
