,tweet_id,text
501,859542613099069440,Chillin' between my two favorite rides. #backtothefuture #bttf #martymcfly #cosplay #svcc #siliconvalleycomiccon
502,859539423779749888,Yes yes it is!
503,859537909636096004,"\""Ness! You've gotta' come back with me!\"""
504,859528495910850560,"\""Back to the Future\"" by Dru Hill  #BacktotheFuture #DruHill Lyrics RT"
505,859520442280935424,"\""Roads? Where we're going, we don't need roads.\"" -Doc Brown"
506,859514762857787396,If d_rock856 and jmendte merged. #backtothefuture #mashup #art #awesome #amazing #wow #cool #masterpiece #creati
507,859510209294872577,cdusher71 fabulous! I saw the #BackToTheFuture one years ago
508,859507247423946752,Convos with friends.
509,859499360987512834,The very talented paulkalkbrenner raising the roof at Printworks_LDN #BackToTheFuture #London #classic #clublife
510,859495978675601411,Would you like to go to the future baby?#delorean #backtothefuture
511,859487330486366209,LeePeakHeating Installer_2017 deantorris IanPlumbing I've met Lee before
512,859486472713449474,"I read \""Epilogue\"" of 1977 Berger Inquiry report. #Insight, #foresight &amp; #backtothefuture (in PDF):"
513,859486099613167616,fan_bigbro The kind that requires 1.21 Gigawatts
514,859482260936032256,Always want to go back in time #backtothefuture #backtothefuturetrilogy #martymcfly  #michaeljfox BTTF_bot
515,859480309238300672,Was I the only one looking forward to seein my daddy take out an old bully with a left hook?
516,859479627852414976,"The #BackToTheFuture inspired SDJ-02, coming this Friday to #kickstarter, will be available in 3 colors: silver, bl"
517,859476290658861056,I know for sure that someone from the future recorded me lmao
518,859469762031759361,Brand new experiment/series called Movie Sync. #backtothefuture is the first movie.
519,859464352113590272,"Since nike already made self-lacing sneakers, we just need #flyingcars to fulfill the #backtothefuture prophecy"
520,859462874489540608,This :')
521,859458527441678336,"No need to gas up, let's just plug up."
522,859457348498186240,Driverless DeLoreans from my alma mater! #backtothefuture Will it reach 88mph?
523,859449931060441088,Save the clock tower #volveralfuturo #backtothefuture  Gracias gmsole_ruiz #remerascononda #remerasoriginales...
524,859449071131611137,Barista visa plan does the UK hospitality sector a disservice
525,859444270184505345,#BacktotheFuture remake would be A mistake.
526,859441533728247808,Back to the Future (1985) Download Full Movie HDDownload Link:
527,859437073928929280,Delorean in need of repairs? #McFly &amp; Brown are probably the best Blacksmiths of all time!
528,859434293973712898,"In the latest #backtothefuture No Concept of Time, Part II star RickyDeanLogan talks hoverboard stunts:"
529,859427700607418368,"Guess who else will be at CanadasNAC in June for GovGPAA? realmikefox! We've been fans since #BacktotheFuture, h"
530,859425942405566465,#Bifftothefuture4 onsale tomrow! BobGale88 &amp;DerekFridolfs alanrobinsonr MSantaolallart BiffTTF3 finished like th
531,859420140517117954,"Look, I don't think a fourth #backtothefuture film will/should be made. But this fan trailer is pretty well done."
532,859416844368662529,On a flight back to 1994...
533,859415914005114882,#GamePickups #JamesBond #007Legends #BackToTheFuture: The Game #TheSimpsonsGame #WiiSports #Wii #WiiU #Nintendo #EA
534,859411170280837120,These 5 #ITSystems from the past are still used by the #ITPros of the Future:
535,859400720419782656,"Find Donald Trump's Father, and give him a condom!#BackToTheFuture or \""Past\""!"
536,859400112648462336,Watch Back to the Future (1985) on #nowtv (14-Day Free Trial)Watch it now:
537,859386815572258816,Where we are going we do need roads
538,859381897092362240,"What a show this was by paulkalkbrenner  on Saturday in Printworks_LD   Amazing venue,sound and set up"
539,859376761594707968,Let's go back to the future!
540,859373047295467520,EmmanuelMacron enmarchefr #EnMarcheArriere #Valls #backtothefuture manuelvalls#MaFranceMoi
541,859365952374353922,"AmericanStudier Get Delorean and phone booth, but not a Tardis, I'd get Bill Ted Marty. Great guys. We'd get AJ an"
542,859361969505218561,Michael J. Fox as Marty McFly in #BackToTheFuture Part II (1989).
543,859341281373204480,Hunt Valley Mall in Maryland for early morning run. Half expect a VW psycho van to pull up and shoot Doctor Emmett
544,859340247741681664,#AndrewJacksonWouldHave sent #Lincoln a telegram 16yrs early 2let him know that he was very angry about the civil war #BackToTheFuture style
545,859299453756428288,Why did #spewer think he's disappearing?  what's his name?!  he went
546,859291849219088385,People are spending so much time creating self tying shoes when we could have had a teleportation machine by now.
547,859271975797174273,Hoversurf just created the world's first rideable
548,859266777271996416,hanging out with the delorean again..#backtothefuture #bttf #delorean #movie #movies #epic
549,859259865881038848,"Also, kudos to Dean Cundey for the great camerawork, and to the choreographer for the top-notch dance work!"
550,859245867307376640,The future of rendering!!
551,859243060466733058,Remember when ketchup was a vegetable?
552,859238201587904512,KellyRippin Do not walk toward the Philly  Cheese it's a trap!
553,859237517060648965,eleid I wish I could be transported back to those days. Where's the DeLorean when I need it?
554,859237299602817024,Back To The Future - Poster Tall T-Shirt Only $25.00 #BACKTOTHEFUTURE #BuyAShirtChangeTheWorld
555,859231435785355264,Look at this on eBay
556,859228935212736512,I'm you're density
557,859225564548354048,KIDD KEO - #BACKTOTHEFUTURE FT. MADBASS (AUDIO)
558,859213397732331521,Happy Monday! Smile! This is a photo from the #Daytona Speedway in 2014. #JenniferParker #ClaudiaWells
559,859209469456199680,Shocking
560,859190107621924866,Let us freeze the time... \r\r
561,859185151569412096,Cleaning out the closet has advantages. More #BTTF goodies.
562,859183529212743680,"Huey_Lewis_News  Found these two at the store today, I just had to get them both!  #HueyLewis  #80s  #Music"
563,859169418592628736,How about the hoverboard chase from #BackToTheFuture Part II?
564,859166130103037953,Best movie Michael you ever did. #BackToTheFuture As Marty McFly
565,859152793185255426,iwantmyvhs Thats Doc Brown
566,859150733383524353,"#BacktotheFuture 4!? This fan trailer could be from an an alternate timeline. Hollywood, don't get any big ideas!"
567,859150573517643777,"\""But but but he built the club you know...\"""
568,859145533704876033,It would be amazing  #samuraijack #backtothefuture #photoshop #givecredit phillamarr AkuOfficialAcct
569,859138469997690880,Today's find:A #BackToTheFuture 1:24 scale diecast metal Delorean Time Machine!
570,859138382852743170,Just spotted in Warsaw! #DeLorean on the way to workshop? ;)
571,859135010699390976,I wonder if the wife will let me keep it here.... #probablynot #nerd #nerdculture #backtothefuture #drwho #pencil
572,859126604974481408,1.21 Jigga ... What ? #BackToTheFuture 2015 date was October 21st Or 10-21 &lt; 1 point/zero two one
573,859126562297393152,#BackToTheFuture Part III (1990)  #MichaelJFox #ChristopherLloyd #BTTF 3
574,859121480625532928,Add a little loose fitting #twitterdisco space to it  #BackToTheFuture
575,859118018995073024,Could this be a concept picture from an up coming movie?
576,859113479512444929,"#BacktotheFuture is banned in China cos time travel \""disrespects history.\""This means, potentially, 1/2 of the world has never seen it."
577,859103620687593475,Mase was just totally mesmerised watching #backtothefuture it was hilarious! At least I've finally seen it now though
578,859100035384057864,Getting back in time with Doc and Marty!
579,859098819987992579,"nat_bur Perhaps \""you are my density\"""
580,859096758634328064,CB Scooter with optional Bumper Guards
581,859090862847950849,"Independent At the tender age of 48, I remember buying this as a child. No #timetravel involved."
582,859089363887673345,"#backtothefuture tribute! #FluxDestiny hit 20,000 fans on Facebook this week - join our community at"
583,859085014990032897,Back To Japan T-Shirt
584,859079716401278976,"I have always been with you in my dreams of past now, Back to the future."
585,859076117394853888,Watch Back to the Future (1985) on FlixanoStart Free Trial:
