,tweet_id,text
0,862343242217607168,#AgentsofSHIELD Fitz! Don't talk about your feelings with the side-chick!!\n
1,862253509269499904,RT jeffreyshaw1: What I Learned From
2,862182378629976064,RT GeoffreyColo: Oh hell no.  Aida gone fatal MalloryJansen Marvel
3,862180300222332928,"RT bakerlarry84: AgentsofSHIELD ^YUP, WE HAVE A FULL  #FatalAttraction ALERT."
4,862180259822743552,"AgentsofSHIELD ^YUP, WE HAVE A FULL  #FatalAttraction ALERT."
5,862179083156938752,"MalloryJansen YEAH I WENT LIKE \""HOLY CRAP\"""
6,862175343049834496,RT bakerlarry84: Marvel ^AFTER SEEING HER REACTION I BE LIKE (BELOW) DAMN! SHE WEN'T FULL
7,862175305120854017,Marvel ^AFTER SEEING HER REACTION I BE LIKE (BELOW) DAMN! SHE WEN'T FULL
8,862173533329395712,RT bakerlarry84: spott3d YEAH SHE WENT FULL #FatalAttraction OMG.
9,862173509308514304,spott3d YEAH SHE WENT FULL #FatalAttraction OMG.
10,862173036333727744,"AgentsofSHIELD ^YEAH, JUST DONT TELL HER YOUR IN LOVE WITH SOMEONE ELSE, OTHERWISE, RAAAAAAAAAAAAAAAAAAHHHHHH"
11,862141273569886209,RT GeoffreyColo: Oh hell no.  Aida gone fatal MalloryJansen Marvel
12,862140797084413952,RT GeoffreyColo: Oh hell no.  Aida gone fatal MalloryJansen Marvel
13,862140386558566400,RT GeoffreyColo: Oh hell no.  Aida gone fatal MalloryJansen Marvel
14,862140360222527490,RT GeoffreyColo: Oh hell no.  Aida gone fatal MalloryJansen Marvel
15,862139768104202240,RT GeoffreyColo: Oh hell no.  Aida gone fatal MalloryJansen Marvel
16,862138398357585921,RT GeoffreyColo: Oh hell no.  Aida gone fatal MalloryJansen Marvel
17,862138052029886464,Ada went full Glenn Close on Fitz.
18,862137331020640256,la_engineraa With Inhuman powers. This echoes Dark Willow from #Buffy and #FatalAttraction. But worse.
19,862137256454344704,RT GeoffreyColo: Oh hell no.  Aida gone fatal MalloryJansen Marvel
20,862137211927580674,RT GeoffreyColo: Oh hell no.  Aida gone fatal MalloryJansen Marvel
21,862137156541853696,RT GeoffreyColo: Oh hell no.  Aida gone fatal MalloryJansen Marvel
22,862137140364414977,"That was an epic shriek \""WHAT\""!   #Aida just went #FatalAttraction.#LOVEME #FITZ ,"
23,862136822171873280,RT GeoffreyColo: Oh hell no.  Aida gone fatal MalloryJansen Marvel
24,862136645071638529,RT GeoffreyColo: Oh hell no.  Aida gone fatal MalloryJansen Marvel
25,862136530126745600,RT GeoffreyColo: Oh hell no.  Aida gone fatal MalloryJansen Marvel
26,862136471679094786,RT GeoffreyColo: Oh hell no.  Aida gone fatal MalloryJansen Marvel
27,862136467564490752,RT GeoffreyColo: Oh hell no.  Aida gone fatal MalloryJansen Marvel
28,862136355668807680,RT GeoffreyColo: Oh hell no.  Aida gone fatal MalloryJansen Marvel
29,862136178807631873,RT GeoffreyColo: Oh hell no.  Aida gone fatal MalloryJansen Marvel
30,862136129109331968,RT GeoffreyColo: Oh hell no.  Aida gone fatal MalloryJansen Marvel
31,862136108972298240,RT GeoffreyColo: Oh hell no.  Aida gone fatal MalloryJansen Marvel
32,862136070443499520,RT GeoffreyColo: Oh hell no.  Aida gone fatal MalloryJansen Marvel
33,862135960431083520,Oh hell no.  Aida gone fatal MalloryJansen Marvel
34,862040990357389312,"signduptosay She had/has no sense of self, #jodiarias could only morph into what she thought the boyfriend du jour\u2026"
35,862020259771027456,"I lead #FatalAttraction in the three way dance for the ARWPRO Tag Team Championships. Bell Time 7pm. Lake Station,\u2026"
36,861994055764410368,"#FatalAttraction loves Flamingo Park...3 wins from 3 starts for Braam, Fito &amp; Rob since relocating to Kmb. Congrats\u2026"
37,861887617335304194,troy_79 We may have some jealousy creeping in #FatalAttraction \ud83d\ude1c
38,861804903748050946,When you see Quanell X on #TVOne #FatalAttraction \ud83d\ude0f
39,861802142767644672,"I know that this \""Texas tragedy\"" episode is old, 6/2/2014 still gives me chills so HORRIBLE!"
40,861741096807911424,Hol' up \u270b.... wait'a minute tvonetv\ud83d\udcfa\u261d don' put some #FatalAttraction\ud83d\udd2b\ud83d\udd2a\ud83d\udc8a in it..... #ForMyMan\ud83d\udc72\ud83d\udc6e\ud83d\udc77.... #trueCrimeMondays\ud83d\udd0d\ud83d\udcc6....
41,861697252703821825,#FatalAttraction gets me everytime but the worst shit I seen was an episode on first 48. So sad
42,861642393409511429,"When polyamerous man calls off relationship, ex tries to win him over with tasty stew. Classic cooking thriller\u2026"
43,861610133377482752,I wanna go smoke a cig but I'm tryna figure out who killed Leslie smh...
44,861555899529383937,Where can I submit a story? My aunt's bff was killed by her fianc\u00e9 and everyone was shocked it was him #TvOne\u2026
45,861555374771642368,RT tvonetv: Tune in to the #FatalAttraction marathon on
46,861552685669134336,Tune in to the #FatalAttraction marathon on
47,861266075693924352,#Role: Alex Forrest\r#Movie: Fatal Attraction (1987)\r#Actress: Glenn Close\r
48,861239256773251072,What I Learned From
49,861141493326774273,you know damn well you have the ability to hang up the phone when they snoring in your ear.. but you just cant \ud83d\ude2d
50,861053761501921280,Who in their right mind would ever look #glenclose in the eye &amp; not know she's crazy. Watching
51,860983604075270145,"I have this potentially amazing thing that has begun to bloom in my life, but I am terrified to let it happen.\n\n#toosoon\n"
52,860785344173789186,"\""No, were not watching Glenn Close boil a rabbit!\""  \""We're watching THE RULES OF ATTRACTION.\"" #TheRulesofAttraction\u2026"
53,860614511153209344,KellyannePolls Your obsession with HillaryClinton is down right #boilingbunnyish &amp; #fatalattraction &amp; ur a\u2026
54,860580465727733762,#Corrie that wasn't a rush for curfew it was a #fatalattraction moment
55,860564214972284928,"RT patriciapliang: Tomorrow on #FatalAttraction, Patricia learns about praying mantises, positive affirmations and the art of WAR!! WOAH!!\u2026"
56,860438367967870976,The gift that keeps on giving\nAlex Forrest of politics #FatalAttraction #Trump #tcot\n\n
57,860352057282318336,After a #fatalattraction kind of #session at NickGindre one can #enjoy a #fiftyshadesofgrey\u2026
58,860217922593189888,#OnSet of a #Commercial and reunited with this fun #Actress from a #FatalAttraction episode\u2026
59,860156055082414091,RT StephenAlley64: #FatalAttraction Part 2!!!
60,860155052761243648,my boo thang don't like me watching #fatalattraction -- he thinks i'm going to get some idea(s) \ud83d\ude44
61,860154713110700034,Tune into #FatalAttraction at Noon to hear patriciapliang watch weird videos &amp; give bad advice - Listen online her\u2026
62,860146598319464448,#FatalAttraction Part 2!!!
63,860143235221606400,Why are men like buses though?
64,860085295794053120,#JohnSamuelHise charged in
65,859980311584808960,"A night with this film, possibly one of my all time favorites #fatalattraction #michaeldouglas\u2026"
66,859978264412131328,"RT patriciapliang: Tomorrow on #FatalAttraction, Patricia learns about praying mantises, positive affirmations and the art of WAR!! WOAH!!\u2026"
67,859962217101393920,"Tomorrow on #FatalAttraction, Patricia learns about praying mantises, positive affirmations and the art of WAR!! WO\u2026"
68,859884223842459650,"It was beautiful, it was powerful, but now it's so bitterful... aynurofficial #FatalAttraction #GoodSong \n"
69,859829862076493824,Mattresswatch Winterbourne cul de sac #ThorntonHeath again. Two were removed from here yesterday. #FatalAttraction\u2026
70,859681959831842820,TheresaMayPM sounding increasingly like Alex from #FatalAttraction #delusional #brexit SexyUkip jeremycorbyn
71,859599776853053440,ChavezA0823 Javimarroquin9 How obsessed do you have to be to save old videos of Javi working out?
72,859576389594476544,RT AdrianMBond: #FlashbackFriday to my shorter hair days playing Bobby Hoffman on #FatalAttraction tvonetv
73,859549675854147584,Ex-Paramount boss Sherry Lansing explains why she identifies with Glenn Close's #FatalAttraction character.\n
74,859549611777818624,Ex-Paramount boss Sherry Lansing explains why she identifies with Glenn Close's #FatalAttraction character.\n
75,859548386369970176,Ex-Paramount boss Sherry Lansing explains why she identifies with Glenn Close's #FatalAttraction character.\n
76,859543045062225920,Go Download That New #FatalAttraction Now \u2728
77,859534681016074241,Uverse ATTCares Are the telecom equivalent of united \nAT&amp;T just called to say they were coming over to kill my p\u2026
78,859475542990565376,"#6 On That Mixtape \ud83d\ude09 , #FatalAttraction \ud83d\udda4 ( Link In Bio) .."
79,859454624478052353,harryetcraig Gawd can't BrandiGlanville do ANYTHING without her sons psycho #bonuscunt copying her? .leannrimes\u2026
80,859268203826081796,RT AdrianMBond: #FlashbackFriday to my shorter hair days playing Bobby Hoffman on #FatalAttraction tvonetv
81,859191673519095808,Why is Claire Danes giving me Alex Forrest vibes?
